twitter_id;twitter_handle;tweet_id;tweet_text;tweet_author_id;tweet_conversation_id;tweet_created_at;tweet_in_reply_to_user_id;tweet_lang;tweet_possibly_sensitive;tweet_retweet_count;tweet_reply_count;tweet_like_count;tweet_quote_count;tweet_reply_settings;tweet_source;tweet_referenced_tweet_id;tweet_referenced_tweet_type;api_call
717077328669646849;Jochen_Haug;1395000895184809986;Ich bedanke mich für euer Vertrauen und freue mich auf den Wahlkampf! @AfDimBundestag #AfD https://t.co/B04pcXWUlm;717077328669646849;1395000895184809986;2021-05-19 12:58:25+00:00;;de;False;5;9;23;1;everyone;Twitter for iPhone;;;2022-05-28 16:43:39.384962
717077328669646849;Jochen_Haug;1392452172487528454;RT @AfD: Linksextreme Gewalttaten steigen auf Rekordstand - https://t.co/jqhkr9IqHu;717077328669646849;1392452172487528454;2021-05-12 12:10:43+00:00;;de;False;28;0;0;0;everyone;Twitter for iPhone;1392118702078939142;retweeted;2022-05-28 16:43:39.387940
717077328669646849;Jochen_Haug;1392437238630391812;RT @AfD: Der Rechtsanwalt @Jochen_Haug ist Bundestagsabgeordneter und Mitglied des AfD-Bundesvorstands. Haugs zentrales politisches Motiv:…;717077328669646849;1392437238630391812;2021-05-12 11:11:22+00:00;;de;False;15;0;0;0;everyone;Twitter for iPhone;1392429867988398080;retweeted;2022-05-28 16:43:39.390876
717077328669646849;Jochen_Haug;1350500069766819846;"‼️ Paradox! Wir führen eine Versammlung durch, um zu beschließen, dass Versammlungen nicht möglich sind! 

Die Regierung spielt Gesundheitsschutz und demokratische Verfahren gegeneinander aus. Nicht mit uns! @AfDimBundestag #AfD 

https://t.co/647BMvel4V";717077328669646849;1350500069766819846;2021-01-16 17:48:02+00:00;;de;False;32;12;181;2;everyone;Twitter for iPhone;;;2022-05-28 16:43:39.393816
717077328669646849;Jochen_Haug;1304439395815223303;"Meine jüngste Plenarrede zur geplanten Änderung des #Bundeswahlgesetz|es. Demokratie lebt von Präsenz! Dieses fundamentale Prinzip darf auch in #Corona-Zeiten nicht außer Kraft gesetzt werden. #AfD #JochenHaug @AfDimBundestag 

https://t.co/QCJhdWNcyi";717077328669646849;1304439395815223303;2020-09-11 15:19:21+00:00;;de;False;13;4;51;0;everyone;Twitter for iPhone;;;2022-05-28 16:43:39.396492
717077328669646849;Jochen_Haug;1252275709256613889;In einem freiheitlichen Rechtsstaat hat sich der Einzelne grundsätzlich nicht für die Ausübung seiner Freiheit, sondern der Staat für deren Beschränkung zu rechtfertigen. Dieses fundamentale Prinzip hat die Kanzlerin offensichtlich nicht verstanden. #Öffnungsdiskussionsorgien https://t.co/BxMPZyv0WS;717077328669646849;1252275709256613889;2020-04-20 16:39:29+00:00;;de;False;17;10;70;1;everyone;Twitter Web App;1252222502094413824;quoted;2022-05-28 16:43:39.399971
717077328669646849;Jochen_Haug;1236293854556491777;Meine gestrige Plenarrede zum neuen #THW-Gesetz. Die ⁦@AfDimBundestag⁩ bedankt sich bei allen ehrenamtlichen Helfern der ⁦@THWLeitung⁩! 🤝 #AfD #JochenHaug #THWGesetz #AfDimBundestag  https://t.co/7E1vieGBhg;717077328669646849;1236293854556491777;2020-03-07 14:13:18+00:00;;de;False;12;0;27;0;everyone;Twitter for iPhone;;;2022-05-28 16:43:39.402760
717077328669646849;Jochen_Haug;1220320399818469376;Vortrag bei der #AfD Rhein-Berg über #DirekteDemokratie. Anschließend lebendige Diskussion über die gelebte Praxis in der Schweiz, Möglichkeiten von Bürgerbeteiligungen in den Bundesländern und Fragen innerparteilicher Demokratie. Vollbesetzter Saal! #JochenHaug https://t.co/lo4DbAUTfe;717077328669646849;1220320399818469376;2020-01-23 12:20:30+00:00;;de;False;35;13;136;0;everyone;Twitter for iPhone;;;2022-05-28 16:43:39.405287
717077328669646849;Jochen_Haug;1214162256499544065;"RT @Jacobi_AfD: Parlamentarische Demokratie als MdB in Köln 2020 in fünf einfachen Schritten.
1. WDR baut Mist. 
2. Kritik am WDR.
3.  WDR-…";717077328669646849;1214162256499544065;2020-01-06 12:30:14+00:00;;de;False;33;0;0;0;everyone;Twitter Web App;1214126851972616193;retweeted;2022-05-28 16:43:39.408115
717077328669646849;Jochen_Haug;1201204923398074370;Ich freue mich über meine Wahl in den Bundesvorstand und bedanke mich für Ihr Vertrauen! #AfDBpt19 #AfD https://t.co/kevjD0a8q8;717077328669646849;1201204923398074370;2019-12-01 18:22:25+00:00;;de;False;6;5;87;1;everyone;Twitter for iPhone;;;2022-05-28 16:43:39.410900
717077328669646849;Jochen_Haug;1196480398156546048;Vortrag mit anschließender Kegelpartie bei der @AfDUnna. Vielen Dank an @M_Schild_AfD_UN für die Einladung. Gut Holz! 🎳 #AfD #AfDUnna #AfDimBundestag #JochenHaug https://t.co/Ko4YOn0ILP;717077328669646849;1196480398156546048;2019-11-18 17:28:51+00:00;;de;False;1;5;18;0;everyone;Twitter for iPhone;;;2022-05-28 16:43:39.413624
717077328669646849;Jochen_Haug;1184815095488098304;"RT @Jacobi_AfD: Traurig, daß so etwas nötig ist. 
@AfDimBundestag @AfDKoeln @ksta_koeln https://t.co/6cE4zTCZwa";717077328669646849;1184815095488098304;2019-10-17 12:55:06+00:00;;de;False;24;0;0;0;everyone;Twitter for iPhone;1184731032190377985;retweeted;2022-05-28 16:43:39.416104
717077328669646849;Jochen_Haug;1181265458495922179;Weiter geht’s auf meiner Basis-Tour! Heute beim Stammtisch der #AfD im Kreisverband #Höxter. Urig! #AfDimBundestag #JochenHaug https://t.co/MMiZLr6Lka;717077328669646849;1181265458495922179;2019-10-07 17:50:06+00:00;;de;False;6;1;37;0;everyone;Twitter for iPhone;;;2022-05-28 16:43:39.419064
717077328669646849;Jochen_Haug;1179367775271297026;Erfolgreicher Bürgerdialog der @AfDimBundestag in der Stadthalle #Soest, gemeinsam mit den Kollegen @UdoHemmelgarn und @ElsnervonGronow. Keine Störer, viele Interessenten. 😊 #AfD #JochenHaug #AfDimBundestag https://t.co/XcN1HaOeLS;717077328669646849;1179367775271297026;2019-10-02 12:09:23+00:00;;de;False;14;3;47;0;everyone;Twitter for iPhone;;;2022-05-28 16:43:39.421789
717077328669646849;Jochen_Haug;1176189745925414914;"Mein Vortrag zum Thema #DirekteDemokratie beim #AfD-Bürgerdialog in #Dorsten am 17.09. Unsere Partei setzt sich auf allen Ebenen für mehr Volksentscheide ein! #JochenHaug #AfDimBundestag

https://t.co/1Y40m0tSV3";717077328669646849;1176189745925414914;2019-09-23 17:41:02+00:00;;de;False;3;1;14;0;everyone;Twitter Web App;;;2022-05-28 16:43:39.424456
717077328669646849;Jochen_Haug;1175732518496219139;Heute darf ich in Bottrop die Versammlungsleitung der @jafuernrw übernehmen. Unsere Parteijugend macht wirklich Hoffnung für die Zukunft! 😊 #AfD #JungeAlternative #JANRW https://t.co/f8DYZH4pYy;717077328669646849;1175732518496219139;2019-09-22 11:24:11+00:00;;de;False;11;2;42;0;everyone;Twitter for iPhone;;;2022-05-28 16:43:39.426906
717077328669646849;Jochen_Haug;1175102773597265921;Erneut stößt der Bericht aus #Berlin von @Jacobi_AfD und mir in unserem Wahlkreisbüro auf großes Interesse. Viele Nicht-Parteimitglieder! #AfD #AfDKöln #JochenHaug https://t.co/EyzLP661Cu;717077328669646849;1175102773597265921;2019-09-20 17:41:48+00:00;;de;False;6;0;33;1;everyone;Twitter for iPhone;;;2022-05-28 16:43:39.429968
717077328669646849;Jochen_Haug;1170008676763152386;Kleiner Eindruck meines gestrigen Vortrages über #direkteDemokratie auf Bundesebene bei der @AfD_Duisburg. Vielen Dank für die tolle Diskussion! 🙏 #AfD #AfDDuisburg #AfDimBundestag https://t.co/zZAhVOti8z;717077328669646849;1170008676763152386;2019-09-06 16:19:40+00:00;;de;False;11;10;44;2;everyone;Twitter for iPhone;;;2022-05-28 16:43:39.432597
717077328669646849;Jochen_Haug;1168842582266392578;Es war mir ein großes Vergnügen, erneut eine Besuchergruppe aus dem Wahlkreis bei der @AfDimBundestag in #Berlin begrüßen zu dürfen! #AfD #Reichstag #JochenHaug https://t.co/wTLHVuRWu6;717077328669646849;1168842582266392578;2019-09-03 11:06:02+00:00;;de;False;1;0;10;0;everyone;Twitter Web App;;;2022-05-28 16:43:39.435332
717077328669646849;Jochen_Haug;1168634017341759489;"RT @Alice_Weidel: Ein herzliches Dankeschön an unsere Wähler und Wahlkämpfer! Im Osten geht die Sonne auf! ;-) #ltwsn19 #ltw19 #ltwbb https…";717077328669646849;1168634017341759489;2019-09-02 21:17:16+00:00;;de;False;329;0;0;0;everyone;Twitter Web App;1168210025963278336;retweeted;2022-05-28 16:43:39.438043
717077328669646849;Jochen_Haug;1165997297936883712;Ist das unsere Zukunft? Gruselig! https://t.co/yMTR9mDN9D;717077328669646849;1165997297936883712;2019-08-26 14:39:53+00:00;;de;False;5;5;33;0;everyone;Twitter Web App;1165938311862587392;quoted;2022-05-28 16:43:39.440952
717077328669646849;Jochen_Haug;1159878682451828736;Bericht aus Berlin, zusammen mit @Jacobi_AfD in unserem Wahlkreisbüro in #Köln! #AfD #AfDimBundestag #AfDKöln https://t.co/nGBZLXwuEf;717077328669646849;1159878682451828736;2019-08-09 17:26:42+00:00;;de;False;7;3;33;1;everyone;Twitter for iPhone;;;2022-05-28 16:43:39.443940
717077328669646849;Jochen_Haug;1157262753083600896;"RT @JoanaCotar: Sie wollen das #Klima retten. Unbedingt. Dafür trifft sich die ""Elite"" zur Klimakonferenz auf Sizilien. Der Flughafen „Falc…";717077328669646849;1157262753083600896;2019-08-02 12:11:55+00:00;;de;False;125;0;0;0;everyone;Twitter Web App;1157202167973011456;retweeted;2022-05-28 16:43:39.446478
717077328669646849;Jochen_Haug;1149054657605623810;@jutta_ditfurth 🇩🇪🇩🇪🇩🇪;717077328669646849;1147104550769319936;2019-07-10 20:35:53+00:00;4714711828;und;False;2;0;6;0;everyone;Twitter for iPhone;1147104550769319936;replied_to;2022-05-28 16:43:39.449755
717077328669646849;Jochen_Haug;1146761696993861632;Besuch beim #Deichverband Bislich-Landesgrenze auf Einladung des #AfD-Stadtverbandes #Emmerich am Rhein. Thema war u.a. #Hochwasserschutz, Regulierung des Wasserstands Fluss/Binnenland etc. Danach noch Abstecher zur Freiwilligen Feuerwehr. Sehr informativ! #Katastrophenschutz https://t.co/IFEC5eoPid;717077328669646849;1146761696993861632;2019-07-04 12:44:29+00:00;;de;False;5;1;14;0;everyone;Twitter Web Client;;;2022-05-28 16:43:39.453656
717077328669646849;Jochen_Haug;1145371752010342402;Viele Grüße vom Bezirksparteitag der #AfD im BV Köln! 👋🏼 Hier zusammen mit dem Kölner MdL @twittschler (links) und dem neu gewählten Bezirkschef Wolfgang Kochs (@AfD_Dueren). Frohes Schaffen! 🍀 https://t.co/Y6qJh1WhPF;717077328669646849;1145371752010342402;2019-06-30 16:41:20+00:00;;de;False;7;1;22;0;everyone;Twitter for iPhone;;;2022-05-28 16:43:39.457583
717077328669646849;Jochen_Haug;1136692397197484032;Meine Besuchergruppe macht sich heute Abend wieder auf den Heimweg nach #Köln. Schön war’s! ➡️ Interesse, das nächste Mal dabei zu sein? Schreiben Sie an jochen.haug.wk@bundestag.de. #AfD #JochenHaug https://t.co/NNuzQCn3u8;717077328669646849;1136692397197484032;2019-06-06 17:52:40+00:00;;de;False;2;1;13;0;everyone;Twitter for iPhone;;;2022-05-28 16:43:39.460975
717077328669646849;Jochen_Haug;1136604639942627328;Besuch meiner heutigen Besuchergruppe aus dem Wahlkreis im Deutschen Bundestag in #Berlin! #AfD #AfDimBundestag https://t.co/bc8gNSsT83;717077328669646849;1136604639942627328;2019-06-06 12:03:57+00:00;;de;False;2;0;11;0;everyone;Twitter for iPhone;;;2022-05-28 16:43:39.464586
717077328669646849;Jochen_Haug;1118866458929520640;RT @JoanaCotar: Die deutsche Regierung gibt im EU-Rat grünes Licht für die #Urheberrechtsreform und #Uploadfilter. Der Wille der Bürger, ih…;717077328669646849;1118866458929520640;2019-04-18 13:18:45+00:00;;de;False;93;0;0;0;everyone;Twitter Web Client;1117705071146541056;retweeted;2022-05-28 16:43:39.468540
717077328669646849;Jochen_Haug;1115248660324016130;Stellvertretend leite ich heute den letzten Teil der Anhörung im #Innenausschuss. Thema: #ITSicherheit. #AfD #Bundestag https://t.co/cPuoHxGKgn;717077328669646849;1115248660324016130;2019-04-08 13:42:55+00:00;;de;False;3;2;16;0;everyone;Twitter for iPhone;;;2022-05-28 16:43:39.472379
717077328669646849;Jochen_Haug;1114124141941133313;"RT @AfDimBundestag: »Volksabstimmungen auf Bundesebene einführen!«
Der #AfD-Abgeordnete @Jochen_Haug stellt unseren Antrag ""Enquete-Kommiss…";717077328669646849;1114124141941133313;2019-04-05 11:14:29+00:00;;de;False;21;0;0;0;everyone;Twitter for iPhone;1114078480952692738;retweeted;2022-05-28 16:43:39.476152
717077328669646849;Jochen_Haug;1114120143934824449;"Gestern Nacht hielt ich im Plenum erneut eine Rede zum Antrag der @AfDimBundestag, eine Enquete-Kommission für die Einführung direkter Demokratie auf Bundesebene einzurichten. Dieser Antrag wurde leider endgültig abgelehnt. #direkteDemokratie #AfD 
 
https://t.co/XyvYuOjUDL";717077328669646849;1114120143934824449;2019-04-05 10:58:36+00:00;;de;False;2;1;13;1;everyone;Twitter Web Client;;;2022-05-28 16:43:39.482546
717077328669646849;Jochen_Haug;1091794412080975873;Auf ein #Kölsch mit der Parteijugend der @JA_Koeln. 🍻#Köln #AfD https://t.co/WVKtHX0BCN;717077328669646849;1091794412080975873;2019-02-02 20:24:07+00:00;;de;False;3;5;19;0;everyone;Twitter for iPhone;;;2022-05-28 16:43:39.486690
717077328669646849;Jochen_Haug;1088516599236227073;Auf demNeujahrsempfang der @AfDKoelnerRat zusammen mit dem Kölner Fraktionsvorsitzenden @sboyens! #AfD #Köln #KölnerRat https://t.co/WzsWrwLfuE;717077328669646849;1088516599236227073;2019-01-24 19:19:15+00:00;;de;False;11;2;31;0;everyone;Twitter for iPhone;;;2022-05-28 16:43:39.489396
717077328669646849;Jochen_Haug;1082525369608138752;Welch vergiftete Worte. Meinem Kollegen @Frank_Magnitz wünsche ich eine baldige Genesung. Hoffentlich werden die Gewalttäter schnell gefasst. #Linksextremismus muss bekämpft werden. #Magnitz #Bremen #AfD https://t.co/6OUehqtlhR;717077328669646849;1082525369608138752;2019-01-08 06:32:15+00:00;;de;False;28;17;168;2;everyone;Twitter for iPhone;1082415700109598721;quoted;2022-05-28 16:43:39.493300
717077328669646849;Jochen_Haug;1077231686910464001;"RT @AlternativeNRW: Frohe Weihnachten wünschen Ihnen beide Landessprecher der #AfD #NRW, Thomas #Röckemann, MdL &amp; Helmut #Seifen, MdL! 

An…";717077328669646849;1077231686910464001;2018-12-24 15:57:02+00:00;;de;False;35;0;0;0;everyone;Twitter for iPhone;1077203175973752832;retweeted;2022-05-28 16:43:39.497697
717077328669646849;Jochen_Haug;1076589942711701511;"Es gibt Artikel, da denkt man beim Lesen der Überschrift zunächst an Satire. Dann liest man den kompletten Artikel und stellt betroffen fest: Die meinen das ernst! 
https://t.co/kKjZAb0fSR";717077328669646849;1076589942711701511;2018-12-22 21:26:59+00:00;;de;False;17;8;47;2;everyone;Twitter Web Client;;;2022-05-28 16:43:39.501282
717077328669646849;Jochen_Haug;1076578232210726913;RT @Jacobi_AfD: Ach? Was nicht gar. „Wesentliches Argument für die Unzulässigkeit der #AfD-Klage ... kann nicht überzeugen und entspricht j…;717077328669646849;1076578232210726913;2018-12-22 20:40:27+00:00;;de;False;11;0;0;0;everyone;Twitter Web Client;1075484199245754369;retweeted;2022-05-28 16:43:39.506445
717077328669646849;Jochen_Haug;1076577672292167680;RT @maxotte_says: Ich habe weder: #Abstiegsangst, noch #Wut, noch bin oder fühle ich mich angehängt. Ich bin #vermögend und gehöre zur glob…;717077328669646849;1076577672292167680;2018-12-22 20:38:13+00:00;;de;False;377;0;0;0;everyone;Twitter Web Client;1075438744109543428;retweeted;2022-05-28 16:43:39.509768
717077328669646849;Jochen_Haug;1076572414400712709;RT @Jacobi_AfD: Durch Berichte der Lokalpresse konnte der Eindruck entstehen, daß der Kölner Stadtrat die Öffentlichkeitsarbeit von Mitglie…;717077328669646849;1076572414400712709;2018-12-22 20:17:19+00:00;;de;False;5;0;0;0;everyone;Twitter for iPhone;1076141759300800513;retweeted;2022-05-28 16:43:39.513074
717077328669646849;Jochen_Haug;1076512193368211456;@wmoebius @StBrandner @Jacobi_AfD @HenrietteReker @EspendillerM Antworten Sie doch mal auf meine Frage. Im Übrigen: Freiheit ist immer auch die Freiheit des anderen. Wir haben ein Recht auf diesen städtischen Raum.;717077328669646849;1076112504743432197;2018-12-22 16:18:02+00:00;347149586;de;False;0;4;1;0;everyone;Twitter for iPhone;1076506401193816066;replied_to;2022-05-28 16:43:39.517565
717077328669646849;Jochen_Haug;1076501951574130690;@frankdomahs @reportkoeln Wir haben uns keinen Raum „angeeignet“, sondern völlig normal angemietet.;717077328669646849;1076454352515203072;2018-12-22 15:37:20+00:00;320465399;de;False;0;1;1;0;everyone;Twitter for iPhone;1076501192258342912;replied_to;2022-05-28 16:43:39.520896
717077328669646849;Jochen_Haug;1076490091781079043;@wmoebius @StBrandner @Jacobi_AfD @HenrietteReker Erläutern Sie bitte mal konkret, wo und wie @EspendillerM, @Jacobi_AfD oder ich an diesem Abend „gehetzt“ haben sollen. Oder könnte es sein, dass Sie einfach generell ein Toleranz-Problem mit anderen Meinungen haben?;717077328669646849;1076112504743432197;2018-12-22 14:50:12+00:00;347149586;de;False;0;4;2;0;everyone;Twitter for iPhone;1076140393652256768;replied_to;2022-05-28 16:43:39.525203
717077328669646849;Jochen_Haug;1076489120262819847;@Thelargetruth @Jacobi_AfD @HenrietteReker Was hat denn die Tumulte ausgelöst, in deren Bedrängnis er gestürzt ist? Doch nicht etwa das unrechtmäßige Stürmen der Bühne durch die Linksextremisten? Oder ist er völlig aus heiterem Himmel gestürzt?;717077328669646849;1076112504743432197;2018-12-22 14:46:21+00:00;2269104805;de;False;0;0;2;0;everyone;Twitter for iPhone;1076383462888820736;replied_to;2022-05-28 16:43:39.528264
717077328669646849;Jochen_Haug;1076485022939529216;@har41637914 @reportkoeln Was hat denn die Tumulte ausgelöst, in deren Bedrängnis er gestürzt ist? Doch nicht etwa das unrechtmäßige Stürmen der Bühne durch die Linksextremisten? Oder ist er völlig aus heiterem Himmel gestürzt?;717077328669646849;1076454352515203072;2018-12-22 14:30:04+00:00;2969732127;de;False;0;0;0;0;everyone;Twitter for iPhone;1076470054915657728;replied_to;2022-05-28 16:43:39.533138
717077328669646849;Jochen_Haug;1076454352515203072;Auch in diesem Video von @reportkoeln sieht man die Aneignung der Bühne durch die Linksextremisten, die uns temporär an der Abhaltung unserer Veranstaltung hinderten und in deren Folge ein Polizist erheblich verletzt wurde: https://t.co/hABuZBpMgg #koeln2012 #Bürgerdialog #AfD;717077328669646849;1076454352515203072;2018-12-22 12:28:11+00:00;;de;False;7;7;24;1;everyone;Twitter for iPhone;;;2022-05-28 16:43:39.538169
717077328669646849;Jochen_Haug;1076424407554445312;Ausschreitung in Köln: Demonstranten stürmen #AfD-Veranstaltung - Polizist verletzt https://t.co/LRtMRd7ERS via @SPIEGELONLINE #koeln2012 #Bürgerdialog #Köln;717077328669646849;1076424407554445312;2018-12-22 10:29:12+00:00;;de;False;12;10;39;3;everyone;Twitter for iPhone;;;2022-05-28 16:43:39.541520
717077328669646849;Jochen_Haug;1076423327563083776;Noch einmal, liebe @dpa, der #Bürgerdialog war keine Veranstaltung der @AfDKoelnerRat, sondern der @AfDimBundestag. Erst recherchieren, dann schreiben, evtl. auch mal nachfragen. #koeln2012 #AfD https://t.co/FwCKPbnxgX via @faznet;717077328669646849;1076423327563083776;2018-12-22 10:24:54+00:00;;de;False;29;16;103;1;everyone;Twitter for iPhone;;;2022-05-28 16:43:39.544110
717077328669646849;Jochen_Haug;1076421915005341696;"RT @UdoHemmelgarn: .@AfDimBundestag-Landesgruppe #NRW: Wir danken Security &amp; Polizei für ihren Einsatz. Ebenso danken wir den vielen Teilne…";717077328669646849;1076421915005341696;2018-12-22 10:19:18+00:00;;de;False;30;0;0;0;everyone;Twitter for iPhone;1076283323721363456;retweeted;2022-05-28 16:43:39.549024
717077328669646849;Jochen_Haug;1076172164141862913;Machen Sie sich ein eigenes Bild der ach so „friedlichen“ und „bunten Aktivisten“. Dialogbereitschaft? Fehlanzeige! #koeln2012 #AfD #Bürgerdialog #Köln https://t.co/LgDgIeSQcR;717077328669646849;1076172164141862913;2018-12-21 17:46:52+00:00;;de;False;11;0;29;0;everyone;Twitter for iPhone;;;2022-05-28 16:43:39.553621
717077328669646849;Jochen_Haug;1076170322003587072;RT @AfDKoeln: Wir konnten, dank der Polizei und unserer Security, gestern einen erfolgreichen Bürgerdialog in Köln abhalten. Hier kann man…;717077328669646849;1076170322003587072;2018-12-21 17:39:33+00:00;;de;False;28;0;0;0;everyone;Twitter for iPhone;1076165420858650624;retweeted;2022-05-28 16:43:39.558004
717077328669646849;Jochen_Haug;1076170057586274305;RT @RogerBeckamp: Gute Besserung dem Polizisten, der seine Gesundheit für die Meinungsfreiheit eingesetzt hat. Die nächste Veranstaltung am…;717077328669646849;1076170057586274305;2018-12-21 17:38:30+00:00;;de;False;196;0;0;0;everyone;Twitter for iPhone;1076020213798318081;retweeted;2022-05-28 16:43:39.562523
717077328669646849;Jochen_Haug;1076154548841037824;RT @maxotte_says: #Linksextreme #Gewalt in meinem #Köln. #Terror #Meinungsterror. Frau #Oberbürgermeisterin, schützen Sie den #Rechtsstaat!…;717077328669646849;1076154548841037824;2018-12-21 16:36:53+00:00;;de;False;86;0;0;0;everyone;Twitter for iPhone;1076152883614240770;retweeted;2022-05-28 16:43:39.568281
717077328669646849;Jochen_Haug;1076130446726086662;"RT @EspendillerM: Das war ein turbulenter Abend gestern. Ich möchte mich an dieser Stelle ganz herzlich bei allen Gästen &amp; Interessierten b…";717077328669646849;1076130446726086662;2018-12-21 15:01:06+00:00;;de;False;31;0;0;0;everyone;Twitter for iPhone;1076123292946309121;retweeted;2022-05-28 16:43:39.571432
717077328669646849;Jochen_Haug;1076130331437207553;RT @Jacobi_AfD: Demokratie in Deutschland 2018: Öffentlichkeitsarbeit als Abgeordneter des Deutschen Bundestags. Wir danken einmal mehr der…;717077328669646849;1076130331437207553;2018-12-21 15:00:39+00:00;;de;False;25;0;0;0;everyone;Twitter for iPhone;1075916033477787648;retweeted;2022-05-28 16:43:39.574058
717077328669646849;Jochen_Haug;1076112504743432197;„Wir erwarten ein klares Wort der Oberbürgermeisterin!“ Offizielle Pressemitteilung von @Jacobi_AfD und mir zum gestrigen #Bürgerdialog. @HenrietteReker #koeln2012 #AfD #Köln #HenrietteReker https://t.co/OuAqxBWN9r https://t.co/chlHOu06WW;717077328669646849;1076112504743432197;2018-12-21 13:49:48+00:00;;de;False;75;33;202;5;everyone;Twitter Web Client;;;2022-05-28 16:43:39.576786
717077328669646849;Jochen_Haug;1076095423700484096;@Graf_Fencheltee Fakt ist, es ging weiter. Bis zum geplanten Ende.;717077328669646849;1076034743051919360;2018-12-21 12:41:56+00:00;4188956584;de;False;0;1;3;0;everyone;Twitter for iPhone;1076067227349237760;replied_to;2022-05-28 16:43:39.579819
717077328669646849;Jochen_Haug;1076095154816208896;@Martin514337541 @StBrandner Und damit lagen sie falsch.;717077328669646849;1076034743051919360;2018-12-21 12:40:52+00:00;1017876355516719104;de;False;0;0;2;0;everyone;Twitter for iPhone;1076094347916050432;replied_to;2022-05-28 16:43:39.583786
717077328669646849;Jochen_Haug;1076072756431777792;RT @JA_Koeln: Wir sind stolz auf unsere Kölner MdB Fabian Jacobi MdB und Jochen Haug, die zusammen mit Dr. Michael Espendiller dem linksext…;717077328669646849;1076072756431777792;2018-12-21 11:11:52+00:00;;de;False;8;0;0;0;everyone;Twitter for iPhone;1076049221126623233;retweeted;2022-05-28 16:43:39.586932
717077328669646849;Jochen_Haug;1076034743051919360;Es blieb beim Versuch. #koeln2012 #AfD #Bürgerdialog https://t.co/nDg4TYfyuY;717077328669646849;1076034743051919360;2018-12-21 08:40:49+00:00;;de;False;7;17;53;4;everyone;Twitter for iPhone;1076033555640315904;quoted;2022-05-28 16:43:39.589779
717077328669646849;Jochen_Haug;1076029345012035584;Auch die Berichterstattung des @express24 ist irreführend. Es wird nicht klar benannt, von wem die „Tumulte“ ausgingen. Jeder, der vor Ort war, hat miterlebt, dass diese von Linksextremisten ausging. Fragen Sie auch mal die Gegenseite! #koeln2012 #Köln https://t.co/z7sTs5FRHo;717077328669646849;1076029345012035584;2018-12-21 08:19:22+00:00;;de;False;25;4;51;3;everyone;Twitter for iPhone;;;2022-05-28 16:43:39.592475
717077328669646849;Jochen_Haug;1076021016558739456;Es waren sicherlich mehr als nur 30 gewaltsame Störer aus dem linksextremen Spektrum. Liebe @KoelnischeR, wir stehen Ihnen und Ihren Kollegen von @ksta_koeln und @express24 gern für Statements zur Verfügung. Kontakt: jochen.haug@bundestag.de. #koeln2012 https://t.co/CHY7EEAVKf;717077328669646849;1076021016558739456;2018-12-21 07:46:16+00:00;;de;False;25;10;58;3;everyone;Twitter for iPhone;;;2022-05-28 16:43:39.595474
717077328669646849;Jochen_Haug;1076019766622605314;Nicht die @AfDKoelnerRat, sondern die Landesgruppe NRW der @AfDimBundestag veranstaltete den gestrigen #Bürgerdialog in #Köln. So viel Recherche muss sein. #koeln2012 #AfD https://t.co/MvCuJawlc2;717077328669646849;1076019766622605314;2018-12-21 07:41:18+00:00;;de;False;10;3;31;0;everyone;Twitter for iPhone;;;2022-05-28 16:43:39.598185
717077328669646849;Jochen_Haug;1075896118435856384;RT @polizei_nrw_k: #PolizeiNRW #Köln #Leverkusen : Tumulte bei öffentlicher Saalveranstaltung – Polizei führt Störergruppe von Podium  – Ei…;717077328669646849;1075896118435856384;2018-12-20 23:29:58+00:00;;de;False;19;0;0;0;everyone;Twitter for Android;1075869001996271618;retweeted;2022-05-28 16:43:39.600703
717077328669646849;Jochen_Haug;1075894955263049728;@s_ghts Wieso denn? 😅😃;717077328669646849;1075883912465924097;2018-12-20 23:25:21+00:00;2327855270;de;False;0;1;5;0;everyone;Twitter for Android;1075886228409597957;replied_to;2022-05-28 16:43:39.603660
717077328669646849;Jochen_Haug;1075883912465924097;Dieser  Bericht ist irreführend. Der #Bürgerdialog fand bis zum Ende statt. Der linksextreme Versuch, unsere Veranstaltung zu verhindern, schlug fehl. Videobericht folgt in Kürze. #koeln2012 #AfD #Köln  https://t.co/bTOUeqUzU0;717077328669646849;1075883912465924097;2018-12-20 22:41:28+00:00;;de;False;39;7;104;2;everyone;Twitter for Android;;;2022-05-28 16:43:39.606927
