twitter_id;twitter_handle;tweet_id;tweet_text;tweet_author_id;tweet_conversation_id;tweet_created_at;tweet_in_reply_to_user_id;tweet_lang;tweet_possibly_sensitive;tweet_retweet_count;tweet_reply_count;tweet_like_count;tweet_quote_count;tweet_reply_settings;tweet_source;tweet_referenced_tweet_id;tweet_referenced_tweet_type;api_call
1469264387512979461;ABaerbock;1499743150109249540;Nach unzähligen Telefonaten in den letzten Wochen haben wir uns am Rande des #NATO-Treffens endlich persönlich sprechen können: vielen Dank, @MevlutCavusoglu, für unsere starke deutsch-türkische Partnerschaft! In der #Russland-Krise stehen wir zusammen. 🇹🇷🇩🇪 https://t.co/J7QyYRJzi2;1469264387512979461;1499743150109249540;2022-03-04 13:46:45+00:00;;de;False;418;1285;6134;515;everyone;Twitter for iPhone;;;2022-05-28 15:50:37.727291
1469264387512979461;ABaerbock;1499406121903271938;Der Krieg in der #Ukraine ist Putins Krieg. Wer Belaruss*innen oder Russ*innen in Deutschland anfeindet, der greift nicht nur unsere Mitbürger*innen an, sondern auch die Grundprinzipien unseres Zusammenlebens. Wir halten zusammen. Wir sind stärker als der Hass. https://t.co/r6NXkx7qqG;1469264387512979461;1499406121903271938;2022-03-03 15:27:31+00:00;;de;False;3438;1521;26366;249;everyone;Twitter for iPhone;;;2022-05-28 15:50:37.730114
1469264387512979461;ABaerbock;1499067714639626240;Thank you to all nations who voted for #UnitingForPeace. This is not only a historical result. This is the United Nations saying loud and clear: when our peaceful order is under attack, we stand together and act. #🇺🇳;1469264387512979461;1499067714639626240;2022-03-02 17:02:49+00:00;;en;False;1576;855;17081;112;everyone;Twitter for iPhone;;;2022-05-28 15:50:37.734434
1469264387512979461;ABaerbock;1498777698918883344;We face a choice. The world looks to the United Nations and will remember which side we were on today. It’s our responsibility to defend the values and principles that we all depend upon - to defend peace and justice. Now is the moment to stand up and be counted. #UnitingForPeace https://t.co/NtlXwJXXP2;1469264387512979461;1498777698918883344;2022-03-01 21:50:24+00:00;;en;False;2534;1327;22453;251;everyone;Twitter for iPhone;;;2022-05-28 15:50:37.737196
1469264387512979461;ABaerbock;1498622859299725323;In seinen schwersten Stunden steht #Europa am engsten zusammen. Nach Putins Angriffskrieg gegen die #Ukraine ist unsere Einigkeit in #Europa zu einer Überlebensfrage geworden. Vielen Dank, @JY_LeDrian und @RauZbigniew, für den Schulterschluss im Weimarer Dreieck heute in Łódź! https://t.co/Gtb4tFeasz;1469264387512979461;1498622859299725323;2022-03-01 11:35:07+00:00;;de;False;377;475;5037;42;everyone;Twitter for iPhone;;;2022-05-28 15:50:37.740597
1469264387512979461;ABaerbock;1498312983889465346;Danke, @AnzeLog, für Deinen Besuch in diesen Schicksalstagen für die #Ukraine und uns alle. Wir Europäer*innen stehen geschlossen an der Seite der Ukraine. Wir werden die Menschen, die durch Putins Krieg zur Flucht gezwungen sind, humanitär unterstützen und ihnen Schutz bieten. https://t.co/8UPwWSzLH1;1469264387512979461;1498312983889465346;2022-02-28 15:03:47+00:00;;de;False;249;436;3384;29;everyone;Twitter for iPhone;;;2022-05-28 15:50:37.743400
1469264387512979461;ABaerbock;1498001295017402371;Bei der Wahl zwischen Krieg und Frieden, zwischen Putin und Kindern, die sich in U-Bahnschächten vor seinen Bomben verstecken, kann niemand neutral sein. Wir lassen die #Ukraine nicht allein. Wir werden unsere Friedensordnung verteidigen - mit allen geeigneten Mitteln.;1469264387512979461;1498001292454772740;2022-02-27 18:25:14+00:00;1469264387512979461;de;False;374;373;5635;44;everyone;Twitter for iPhone;1498001292454772740;replied_to;2022-05-28 15:50:37.746540
1469264387512979461;ABaerbock;1498001292454772740;Ich habe gerade eine @G7-Schalte zwischen den Außenminister*innen und @DmytroKuleba zur aktuellen Lage einberufen. Während vor dem Fenster Hunderttausende in Berlin gegen #Putins Krieg protestieren, fahren @DmytroKuleba|s Berichte ins Mark. https://t.co/nWRmkq6Gwk;1469264387512979461;1498001292454772740;2022-02-27 18:25:14+00:00;;de;False;448;477;7731;30;everyone;Twitter for iPhone;;;2022-05-28 15:50:37.750819
1469264387512979461;ABaerbock;1497669137388257280;"Unsere Welt ist nach Putins Angriffskrieg eine andere. Wir sind zwar fassungslos angesichts dieses Bruchs des internationalen Rechts, aber nicht ohnmächtig. Darum werden wir den ukrainischen Soldat*innen, die um ihr Land kämpfen, mit Panzerabwehrwaffen &amp; Stinger-Raketen helfen.";1469264387512979461;1497669137388257280;2022-02-26 20:25:22+00:00;;de;False;2020;2457;25468;357;everyone;Twitter for iPhone;;;2022-05-28 15:50:37.753669
1469264387512979461;ABaerbock;1497271052724064261;Mit dem heutigen #Sanktionspaket machen wir #Putin klar: der von ihm eingeschlagene Weg der Gewalt führt #Russland in den wirtschaftlichen Ruin. Wir treffen Putin und seine Systemprofiteure, wir treffen den Banken- und Finanzsektor, wir treffen die Wirtschaft. https://t.co/S6lyPUpcSJ;1469264387512979461;1497271052724064261;2022-02-25 18:03:31+00:00;;de;False;482;2834;6074;162;everyone;Twitter for iPhone;;;2022-05-28 15:50:37.756410
1469264387512979461;ABaerbock;1496749671175401472;"RT @AuswaertigesAmt: In der #Ukraine finden Kampfhandlungen &amp; Raketenangriffe statt. Deutsche Staatsangehörige sind dringend aufgefordert,…";1469264387512979461;1496749671175401472;2022-02-24 07:31:44+00:00;;de;False;317;0;0;0;everyone;Twitter for iPhone;1496732418379821056;retweeted;2022-05-28 15:50:37.759189
1469264387512979461;ABaerbock;1496728646479921159;Mit dem Angriff auf die #Ukraine bricht #Russland mit den elementarsten Regeln der internationalen Ordnung. Die Weltgemeinschaft wird Russland diesen Tag der Schande nicht vergessen. Wir werden gemeinsam mit unseren Partnern reagieren. Unsere ganze Solidarität gilt der Ukraine.;1469264387512979461;1496728646479921159;2022-02-24 06:08:11+00:00;;de;False;2661;2206;25523;271;everyone;Twitter for iPhone;;;2022-05-28 15:50:37.763051
1469264387512979461;ABaerbock;1496522352313700352;"#Diplomatie: das sind auch unsere Kolleg*innen weltweit, ein Leben im Dienst für Menschen und die Überzeugung auch dann weiterzumachen, wenn es schwierig ist. Meinen ganzen Respekt &amp; Dank an @AnkaFeldhusen, das Team von @GermanyinUA und Eure Familien für Euren Dienst und Einsatz!";1469264387512979461;1496522352313700352;2022-02-23 16:28:27+00:00;;de;False;81;189;1204;10;everyone;Twitter for iPhone;;;2022-05-28 15:50:37.765964
1469264387512979461;ABaerbock;1496487285101056010;Vielen Dank, @JY_LeDrian für Deinen Besuch in Berlin! Deine Teilnahme an der Kabinettssitzung ist ein Zeichen für die tiefe Freundschaft und Partnerschaft unserer Länder und für unsere enge Zusammenarbeit im Interesse der europäischen Sicherheitsordnung. https://t.co/64Wf0Kd8si;1469264387512979461;1496487285101056010;2022-02-23 14:09:06+00:00;;de;False;69;126;964;12;everyone;Twitter for iPhone;;;2022-05-28 15:50:37.769303
1469264387512979461;ABaerbock;1496202407415537668;Ich habe @DmytroKuleba in einem Telefonat unsere unverbrüchliche Solidarität mit der #Ukraine versichert. Die Bundesregierung setzt mit dem sofortigen Stopp von Nord Stream 2 ein erstes deutliches Zeichen gegenüber #Russland. Wir werden nun in EU und G7 geschlossen reagieren.;1469264387512979461;1496202407415537668;2022-02-22 19:17:06+00:00;;de;False;322;937;3742;94;everyone;Twitter for iPhone;;;2022-05-28 15:50:37.772062
1469264387512979461;ABaerbock;1496170904610648069;#Russlands offene Verachtung für das Völkerrecht ist ein Bruch für die Verhältnisse in Europa. Drei Dinge sind jetzt wichtig: Einig in der EU und @G7 zu stehen. Ein deutliches Stopp-Schild mit Sanktionen aufzuzeigen. Alles zu tun, um eine weitere Eskalationen zu verhindern. https://t.co/zUe4ZwATpp;1469264387512979461;1496170904610648069;2022-02-22 17:11:55+00:00;;de;False;204;464;3005;55;everyone;Twitter for iPhone;;;2022-05-28 15:50:37.775432
1469264387512979461;ABaerbock;1496103190177140742;RT @DmytroKuleba: I welcome Germany’s move to suspend the certification of Nord Stream 2. This is a morally, politically and practically co…;1469264387512979461;1496103190177140742;2022-02-22 12:42:51+00:00;;en;False;1402;0;0;0;everyone;Twitter for iPhone;1496094461721550854;retweeted;2022-05-28 15:50:37.778349
1469264387512979461;ABaerbock;1495859981857566721;"Die Anerkennung der separatistischen „Volksrepubliken"" in der Ostukraine durch Präsident Putin macht jahrelange Bemühungen im Normandie-Format &amp; der OSZE willentlich zunichte. Wir werden auf diesen Völkerrechtsbruch reagieren &amp; stimmen uns mit Partnern ab. https://t.co/8uyLpb9WGF";1469264387512979461;1495859981857566721;2022-02-21 20:36:26+00:00;;de;False;964;1250;7969;174;everyone;Twitter for iPhone;;;2022-05-28 15:50:37.781144
1469264387512979461;ABaerbock;1495798900472569859;Die Bekämpfung der #Klimakrise ist eine Frage globaler Sicherheit. Wir haben im EU-Außenrat im Konsens beschlossen, #Klimadiplomatie mit Partnern in der ganzen Welt voranzutreiben. Es gibt keinen Weg zurück. Wir müssen alles daran setzen, dass die #COP27 ein Erfolg wird.;1469264387512979461;1495798900472569859;2022-02-21 16:33:43+00:00;;de;False;119;469;1370;44;everyone;Twitter for iPhone;;;2022-05-28 15:50:37.784455
1469264387512979461;ABaerbock;1495685097277829122;We are working closely with #Pakistan to help Afghans in need. Several thousand Afghans have been able to travel from #Afghanistan via Pakistan to Germany. This morning I spoke with @SMQureshiPTI to thank him for this enormous support. Looking forward to continuing our dialogue.;1469264387512979461;1495685097277829122;2022-02-21 09:01:30+00:00;;en;False;178;232;1000;36;everyone;Twitter for iPhone;;;2022-05-28 15:50:37.787551
1469264387512979461;ABaerbock;1495125994457415687;In difficult times, nothing is more important than good friends and strong partnerships. And we as Europeans have no stronger partner than the United States. Thank you, dear @VP Kamala Harris, for attaching such a high priority to our transatlantic relations! https://t.co/REU55m3cz9;1469264387512979461;1495125994457415687;2022-02-19 19:59:49+00:00;;en;False;524;367;3788;72;everyone;Twitter for iPhone;;;2022-05-28 15:50:37.791353
1469264387512979461;ABaerbock;1495092417632079881;"Ich habe mich sehr gefreut, heute meine Kolleg*innen @gervallaschwarz, @xhacka_olta, @BiseraTurkovic &amp; @Bujar_O kennen zu lernen! Für mich und die Bundesregierung ist klar, dass die Zukunft des #Westbalkans in der Europäischen Union liegt. https://t.co/VsTBKkd53o";1469264387512979461;1495092417632079881;2022-02-19 17:46:24+00:00;;de;False;82;145;753;14;everyone;Twitter for iPhone;;;2022-05-28 15:50:37.793999
1469264387512979461;ABaerbock;1494982249976147969;"Time is running out. We need to see action on the ground. Fighting the #climatecrisis is of the essence to maintain global security. 
Thank you @ClimateEnvoy #SamehShoukry @CarlosAlvQ @AlokSharma_RDG @mariammalmheiri @PEspinosaC for a lively debate! #MSC2022";1469264387512979461;1494982249976147969;2022-02-19 10:28:38+00:00;;en;False;81;124;677;17;everyone;Twitter for iPhone;;;2022-05-28 15:50:37.796939
1469264387512979461;ABaerbock;1494758328882413571;"Thank you for a delightful discussion, @DrSJaishankar. I am looking forward to continue our dialogue to strengthen German-Indian cooperation &amp; to join forces to fight #climatecrisis. #MSC2022";1469264387512979461;1494758328882413571;2022-02-18 19:38:51+00:00;;en;False;59;97;526;5;everyone;Twitter for iPhone;;;2022-05-28 15:50:37.803005
1469264387512979461;ABaerbock;1494705161553469442;What an honour and privilege to welcome you, @antonioguterres, to @MunSecConf today! I look forward to continuing the excellent cooperation between @UN and @GermanyDiplo #MSC2022 https://t.co/MnEUMZefHu;1469264387512979461;1494705161553469442;2022-02-18 16:07:35+00:00;;en;False;99;116;734;14;everyone;Twitter for iPhone;;;2022-05-28 15:50:37.809781
1469264387512979461;ABaerbock;1494374425264861190;Es kann nicht sein, dass wir in #Europa noch immer mit der Lupe suchen müssen, um Frauen in Aufsichtsräten und Vorständen zu finden. Mit einer Personalpolitik, die die gesellschaftliche Realität widerspiegelt, sind #Unternehmen erfolgreicher. #Diversität zahlt sich aus.;1469264387512979461;1494374422588936198;2022-02-17 18:13:21+00:00;1469264387512979461;de;False;63;220;1442;17;everyone;Twitter for iPhone;1494374422588936198;replied_to;2022-05-28 15:50:37.815161
1469264387512979461;ABaerbock;1494374422588936198;Solange Frauen nicht angemessen in Schlüsselpositionen vertreten sind, ist Demokratie nicht vollständig. Anne #Spiegel und ich setzen uns für #EU-Zielmarken für Frauen in Führungsetagen ein. Als Bundesregierung machen wir den Weg frei für die 🇪🇺-Richtlinie zu #Führungspositionen. https://t.co/8afz6YaJtH;1469264387512979461;1494374422588936198;2022-02-17 18:13:21+00:00;;de;False;472;1433;7821;253;everyone;Twitter for iPhone;;;2022-05-28 15:50:37.820389
1469264387512979461;ABaerbock;1494266551087865859;"Great talking to my #UAE colleague Sheikh Abdullah bin Zayed about regional security, our efforts towards a peaceful future for #Libya and about our partnership on energy and climate issues. Looking forward to meeting in person soon &amp; to UAE hosting #COP28 next year! @OFMUAE";1469264387512979461;1494266551087865859;2022-02-17 11:04:42+00:00;;en;False;34;71;272;10;everyone;Twitter for iPhone;;;2022-05-28 15:50:37.826130
1469264387512979461;ABaerbock;1493992226887811075;"Willkommen in Berlin, lieber @a_schallenberg, und vielen Dank für den engen &amp; nachbarschaftlichen Austausch zu #Klimaschutz, dem #Westbalkan und der #Ukraine. https://t.co/H4WPoSSqcX";1469264387512979461;1493992226887811075;2022-02-16 16:54:38+00:00;;de;False;50;129;639;7;everyone;Twitter for iPhone;;;2022-05-28 15:50:37.829604
1469264387512979461;ABaerbock;1493877619649036294;"#Rechtsstaatlichkeit ist das Fundament der #EU. Verstöße kosten nicht nur unsere Glaubwürdigkeit, sondern unseren Zusammenhalt. Das heutige #EuGH-Urteil bestätigt ein weiteres, wichtiges Instrument für 🇪🇺, um unsere Wertegemeinschaft zu schützen &amp; zu stärken.";1469264387512979461;1493877619649036294;2022-02-16 09:19:14+00:00;;de;False;120;256;1118;23;everyone;Twitter for iPhone;;;2022-05-28 15:50:37.835805
1469264387512979461;ABaerbock;1493671150345404421;"Thank you @melaniejoly for today’s call. Germany and Canada stand together in support of #Ukraine. We are working, bilaterally, in #NATO, #OSCE and #G7 towards a resolution of the ongoing crisis &amp; towards a diplomatic solution for Donbas. Looking forward to seeing you at #MSC!";1469264387512979461;1493671150345404421;2022-02-15 19:38:47+00:00;;en;False;57;131;699;10;everyone;Twitter for iPhone;;;2022-05-28 15:50:37.840264
1469264387512979461;ABaerbock;1492960548434100224;Now more than ever, the @OSCE’s Special Monitoring Mission @OSCE_SMM in #Ukraine plays a key role in de-escalation efforts and as the eyes and ears of the international community. We must ensure that it can carry out its full mandate without interruption.;1469264387512979461;1492960548434100224;2022-02-13 20:35:07+00:00;;en;False;111;164;679;19;everyone;Twitter for iPhone;;;2022-05-28 15:50:37.845195
1469264387512979461;ABaerbock;1492866708012511236;Herzliche Glückwünsche, Herr Bundespräsident, lieber Frank-Walter #Steinmeier, zur Wiederwahl - von mir und dem Team @AuswaertigesAmt! Alles Gute für die kommenden fünf Jahre und auf dass Sie unser Land weiterhin mit Herz und Hand vertreten.;1469264387512979461;1492866708012511236;2022-02-13 14:22:13+00:00;;de;False;77;193;1874;10;everyone;Twitter for iPhone;;;2022-05-28 15:50:37.850414
1469264387512979461;ABaerbock;1492128373786791940;Thank you @AymanHsafadi for your hospitality here in #Amman. We've known each other since my very first week in office. Today we focused on our joint efforts in caring for #refugees and possibilities to revitalize the #MEPP. Let’s continue the good work.;1469264387512979461;1492128373786791940;2022-02-11 13:28:21+00:00;;en;False;30;89;358;9;everyone;Twitter for iPhone;;;2022-05-28 15:50:37.855075
1469264387512979461;ABaerbock;1492112613106499587;"Ärztin oder Polizist! Das sind ihre Berufswünsche, erzählen mir Kinder im UNRWA-Flüchtlingscamp in #Jordanien. Kinder verdienen eine Perspektive &amp; dazu gehört Bildung. Als zweitgrößter humanitärer Geber werden wir Jordanien auch in Zukunft mit dieser Aufgabe nicht alleine lassen.";1469264387512979461;1492112613106499587;2022-02-11 12:25:43+00:00;;de;False;104;286;1779;19;everyone;Twitter for iPhone;;;2022-05-28 15:50:37.860122
1469264387512979461;ABaerbock;1491835810093707267;Thank you President Abbas for your warm welcome in #Ramallah. It is important to me, on my first visit to the Middle East, that we meet in person. You can be sure: the situation of the Palestinian people is high on our agenda. We remain at your side as a reliable partner. https://t.co/tEn86yBrUx;1469264387512979461;1491835810093707267;2022-02-10 18:05:48+00:00;;en;False;141;461;1917;125;everyone;Twitter for iPhone;;;2022-05-28 15:50:37.865236
1469264387512979461;ABaerbock;1491792114518163461;"Dear @yairlapid, what a pleasure to meet you in person today! Being able to start my first official trip to the Middle East in #Israel means a lot to me. Your country can continue to rely on Germany's #solidarity &amp; our commitment to Israel's #security.";1469264387512979461;1491792114518163461;2022-02-10 15:12:10+00:00;;en;False;77;93;706;21;everyone;Twitter for iPhone;;;2022-05-28 15:50:37.869419
1469264387512979461;ABaerbock;1491698087634653185;Es ist unsere Pflicht, die Erinnerung wachzuhalten und unsere Verantwortung, unsere Stimmen zu erheben: gegen Antisemitismus, Hass und Hetze, Ausgrenzung und Gewalt. Damit ein solches Menschheitsverbrechen sich nie wiederholt. Damit aller Kinder dieser Erde eine Zukunft haben.;1469264387512979461;1491698083876556800;2022-02-10 08:58:33+00:00;1469264387512979461;de;False;116;98;2297;9;everyone;Twitter for iPhone;1491698086271504384;replied_to;2022-05-28 15:50:37.873297
1469264387512979461;ABaerbock;1491698086271504384;"Aber #YadVashem, dieser schmerzvolle Ort, fordert von uns, gerade nicht zu verstummen, nicht zu verharren. Yad Vashem mahnt uns, die Stimmen jener, die das Grauen selbst erlebt haben, zu hören und ihre Worte
weiterzugeben.";1469264387512979461;1491698083876556800;2022-02-10 08:58:32+00:00;1469264387512979461;de;False;89;25;2128;4;everyone;Twitter for iPhone;1491698083876556800;replied_to;2022-05-28 15:50:37.878689
1469264387512979461;ABaerbock;1491698083876556800;"Als Mutter zweier Töchter stockt mir der Atem, wenn ich an die Millionen Kinder denke, die ermordet wurden, ihren Eltern entrissen, allein gelassen, voll Angst. Der Gedanke an den Schmerz jedes einzelnen Kindes, jeder einzelnen Mutter, jedes einzelnen Vaters ist kaum zu
ertragen https://t.co/XSriP9Oz1X";1469264387512979461;1491698083876556800;2022-02-10 08:58:32+00:00;;de;False;516;264;7392;55;everyone;Twitter for iPhone;;;2022-05-28 15:50:37.883230
1469264387512979461;ABaerbock;1491400662844084226;Wenn die Bekämpfung der #Klimakrise eines ist, dann Chefinnensache. Ich freue mich ungemein, dass die #Klimaaußenpolitik mit @climatemorgan als Sonderbeauftragte für int. Klimapolitik eine so starke Verfechterin bekommt. Es gibt viel zu tun - Jennifer, willkommen an Board! https://t.co/N7eTRJfVzX;1469264387512979461;1491400662844084226;2022-02-09 13:16:41+00:00;;de;False;353;1015;4480;145;everyone;Twitter for iPhone;;;2022-05-28 15:50:37.888685
1469264387512979461;ABaerbock;1491299485070200833;"Belarusian authorities try to silence independent media through searches of offices and homes, seizures of equipment, blocking of websites, labelling of media channels and organizations as „extremist"". They will fail. 🇩🇪 will continue to support independent Belarusian media. 3/3";1469264387512979461;1491299480058351616;2022-02-09 06:34:38+00:00;1469264387512979461;en;False;48;55;546;6;everyone;Twitter for iPhone;1491299483464118273;replied_to;2022-05-28 15:50:37.893434
1469264387512979461;ABaerbock;1491299483464118273;"In #Belarus, 33 journalists &amp; media workers are behind bars, simply for doing their jobs. Critical reporting is not a crime. It is a prerequisite for democracy. All those unjustly emprisoned must be freed. #StandWithBelarus 2/3";1469264387512979461;1491299480058351616;2022-02-09 06:34:38+00:00;1469264387512979461;en;False;59;52;579;9;everyone;Twitter for iPhone;1491299480058351616;replied_to;2022-05-28 15:50:37.904211
1469264387512979461;ABaerbock;1491299480058351616;Thank you @Tsihanouskaya, @by_kalesnikava, @PavelLatushka and many others for your relentless engagement and every-day courage in fighting for a free, democratic, safe and sovereign #Belarus. You are not alone in this. 1/3 https://t.co/T78pd2BHxK;1469264387512979461;1491299480058351616;2022-02-09 06:34:37+00:00;;en;False;222;179;2181;28;everyone;Twitter for iPhone;;;2022-05-28 15:50:37.914954
1469264387512979461;ABaerbock;1491090334729715713;Was ich heute in Schyrokyne gesehen habe, hat mich erschüttert. Kein Briefing ersetzt die eigenen Eindrücke. Mir ist es wichtig, die Menschen hier nicht zu vergessen. Wir sind es ihnen schuldig, alles für eine friedliche Lösung des Konflikts zu tun - sie können auf uns zählen. https://t.co/uYbFj9OhUn;1469264387512979461;1491090334729715713;2022-02-08 16:43:33+00:00;;de;False;467;584;5639;129;everyone;Twitter for iPhone;;;2022-05-28 15:50:37.920655
1469264387512979461;ABaerbock;1490631040339263492;Vielen Dank für das gute Gespräch vor meiner Abreise nach #Kiew, lieber @jensstoltenberg. Unsere gemeinsame Botschaft ist klar: wir sind auf jedes Szenario vorbereitet - die Souveränität der #Ukraine ist für uns nicht verhandelbar.;1469264387512979461;1490631040339263492;2022-02-07 10:18:29+00:00;;de;False;167;559;1772;55;everyone;Twitter for iPhone;;;2022-05-28 15:50:38.640625
1469264387512979461;ABaerbock;1489487781462167554;"Menschenrechte sind das Fundament des #Fairplay. Ich drücke den Athlet*innen beide Daumen für die #Olympia Wettkämpfe unter solch schwierigen Bedingungen. Vier Jahre Vorbereitung, harte Arbeit und Training: das ist Euer Moment – viel Glück &amp; faire Spiele!";1469264387512979461;1489487781462167554;2022-02-04 06:35:35+00:00;;de;False;94;271;1291;25;everyone;Twitter for iPhone;;;2022-05-28 15:50:38.646358
1469264387512979461;ABaerbock;1487443842378969089;"Diese Botschaft, lieber @DmytroKuleba, kann ich nur unterstreichen. Unser Bekenntnis zur Unverletzlichkeit der Ukraine &amp; die Solidarität mit ihren Menschen führen @JY_LeDrian und mich bald erneut nach #Kiew. Unsere Anstrengungen im N4-Format für eine Deeskalation setzen wir fort. https://t.co/UARcqD2REG";1469264387512979461;1487443842378969089;2022-01-29 15:13:42+00:00;;de;False;52;225;409;19;everyone;Twitter Web App;1487390052372070402;quoted;2022-05-28 15:50:38.650841
1469264387512979461;ABaerbock;1487096428623187979;Ich habe heute mit meinem russischen  Amtskollegen Sergej Lawrow telefoniert. Wir setzen den Dialog mit #Russland offen und prizipienfest fort: Zur Bedrohung der #Ukraine, zur Zukunft des Normandie-Formats, zur Sicherheit in Europa und zu bilateralen Fragen.;1469264387512979461;1487096428623187979;2022-01-28 16:13:12+00:00;;de;False;86;407;1463;28;everyone;Twitter for iPhone;;;2022-05-28 15:50:38.659283
1469264387512979461;ABaerbock;1487055546775650314;"Good to talk to my UK-counterpart @trussliz: We are united in our firm commitment &amp; strong support to #Ukraine. Also discussed #G7GER, the urgency for Iran to fully return to compliance with the #JCPoA, and UK/EU talks on the implementation of the Northern Ireland Protocol #NIP.";1469264387512979461;1487055546775650314;2022-01-28 13:30:45+00:00;;en;False;48;94;373;13;everyone;Twitter for iPhone;;;2022-05-28 15:50:38.665201
1469264387512979461;ABaerbock;1486733801279705094;"Moved &amp; grateful that you @MKMickeyLevy - as first speaker of the Knesset - addressed the @Bundestag on Int Holocaust Remembrance Day this morning. Your appeal to keep alive the memory of the victims &amp; transmit the events of the past to next generations stays with me. #WeRemember https://t.co/6E30gPlIsB";1469264387512979461;1486733801279705094;2022-01-27 16:12:15+00:00;;en;False;75;93;687;7;everyone;Twitter for iPhone;;;2022-05-28 15:50:38.669033
1469264387512979461;ABaerbock;1486630984858718214;Vielen Dank für das gute Gespräch, liebe @HelgaSchmid_SG! Für mich ist die Stärkung der #OSZE zentral. Besonders für den Dialogprozess in der #Ukraine. Aber auch für Frieden und Sicherheit weltweit, zum Beispiel bei der Bewältigung der #Klimakrise. https://t.co/u7mOUJnYdW;1469264387512979461;1486630984858718214;2022-01-27 09:23:41+00:00;;de;False;38;118;465;16;everyone;Twitter for iPhone;;;2022-05-28 15:50:38.671583
1469264387512979461;ABaerbock;1486367552238505985;Um die #Klimakrise in den Griff zu bekommen, müssen die größten Industrienationen vorangehen. Ich freue mich, morgen auf Einladung von @ClimateEnvoy am Major Economic Forum on Energy and Climate teilzunehmen. Im Fokus: die Umsetzung des #GlasgowClimatePact.;1469264387512979461;1486367552238505985;2022-01-26 15:56:54+00:00;;de;False;42;124;592;13;everyone;Twitter for iPhone;;;2022-05-28 15:50:38.675676
