twitter_id;twitter_handle;tweet_id;tweet_text;tweet_author_id;tweet_conversation_id;tweet_created_at;tweet_in_reply_to_user_id;tweet_lang;tweet_possibly_sensitive;tweet_retweet_count;tweet_reply_count;tweet_like_count;tweet_quote_count;tweet_reply_settings;tweet_source;tweet_referenced_tweet_id;tweet_referenced_tweet_type;api_call
1469264387512979461;ABaerbock;1529797598617473025;"Wir vergessen den Kampf der Menschen in #Belarus für Freiheit &amp; Demokratie nicht. Euer Mut lässt sich nicht wegsperren. Die Idee der Freiheit kann man nicht ins Exil treiben. Das ist die Botschaft vom #karlspreis2022 an @by_kalesnikava , @Tsihanouskaya &amp; @VTsepkalo. @KarlspreisAC https://t.co/V5Z299ugJv";1469264387512979461;1529797598617473025;2022-05-26 12:12:24+00:00;;de;False;238;382;1978;33;everyone;Twitter for iPhone;;;2022-05-28 15:50:37.541346
1469264387512979461;ABaerbock;1529141090707709953;Chère @MinColonna, c’est avec joie que je t’ai accueilli à Berlin! Deine erste Reise nach Berlin zu machen ist ein besonderes Zeichen für die beispiellose Freundschaft unserer Länder. Ich freue mich darauf, mit Dir unser gemeinsames Haus 🇪🇺 zu stärken - packen wir’s an! https://t.co/0f8yCLM0Qa;1469264387512979461;1529141090707709953;2022-05-24 16:43:40+00:00;;de;False;67;139;670;6;everyone;Twitter for iPhone;1529135507761938432;quoted;2022-05-28 15:50:37.543753
1469264387512979461;ABaerbock;1529111317306650625;Die Bilder aus #Xinjiang verstören. Sie untermauern, was schon lange im Raum stand: dass in Xinjiang schlimmste Menschenrechtsverletzungen begangen werden. Im Gespräch mit meinem chinesischen Kollegen Wang Yi habe ich Aufklärung gefordert.;1469264387512979461;1529111317306650625;2022-05-24 14:45:22+00:00;;de;False;847;1458;8963;174;everyone;Twitter for iPhone;;;2022-05-28 15:50:37.546876
1469264387512979461;ABaerbock;1527658919165939713;"Félicitations, liebe Catherine @AmbColonna! Ich weiß in Dir eine begeisterte Partnerin für ein starkes #Europa in der Welt. Je me réjouis d‘avance et à tres vite 🇫🇷🇩🇪
Cher @JY_LeDrian, vielen Dank für Deine Hingabe, Deinen Weitblick und unsere tolle Zusammenarbeit.";1469264387512979461;1527658919165939713;2022-05-20 14:34:03+00:00;;de;False;107;246;1151;10;everyone;Twitter for iPhone;;;2022-05-28 15:50:37.550329
1469264387512979461;ABaerbock;1527015244941369353;Russia’s ruthless war is also fought with #hunger, putting millions of lives at risk in the whole world. Germany will use its G7 presidency to lead this battle, we will only succeed if we stand united. Thank you @SecBlinken for bringing us all together today. #FoodSecurity;1469264387512979461;1527015244941369353;2022-05-18 19:56:19+00:00;;en;False;422;742;3308;63;everyone;Twitter for iPhone;;;2022-05-28 15:50:37.553114
1469264387512979461;ABaerbock;1526868523825475584;Mit #Schweden und #Finnland gewinnen wir eine echte Verstärkung für unsere gemeinsame Sicherheit und die #NATO starke Bündnispartner. Wir haben als Bundesregierung in 🇩🇪 alles für einen schnellen Beitritt vorbereitet. Auf ein baldiges Willkommen 🇸🇪🇫🇮 - wir stehen füreinander ein.;1469264387512979461;1526868523825475584;2022-05-18 10:13:18+00:00;;de;False;616;1118;10178;94;everyone;Twitter for iPhone;;;2022-05-28 15:50:37.556337
1469264387512979461;ABaerbock;1526812156074803200;Fantastic news indeed, @AnnLinde. And a warm welcome to the club, @WBHoekstra. Happy that it is getting less and less exclusive. #FeministForeignPolicy https://t.co/h1XxBV86Ur;1469264387512979461;1526812156074803200;2022-05-18 06:29:19+00:00;;en;False;73;91;934;14;everyone;Twitter for iPhone;1526489209657229312;quoted;2022-05-28 15:50:37.559336
1469264387512979461;ABaerbock;1525571551814463489;I am delighted to welcome all my counterparts to Berlin for the first ever informal @NATO Foreign Ministers’ meeting! Strengthening #NATO and deepening cohesion among all of us is essential in this time of crisis.;1469264387512979461;1525571551814463489;2022-05-14 20:19:36+00:00;;en;False;300;510;3681;19;everyone;Twitter for iPhone;;;2022-05-28 15:50:37.563395
1469264387512979461;ABaerbock;1525443013241094144;"Wir @G7 definieren uns nicht darüber, wogegen wir sind, sondern, wofür wir bereit sind, Verantwortung zu übernehmen: für eine faire, regelbasierte internationale Ordnung, Demokratie &amp; eine Politik, die die Menschen in den Blick nimmt. Vielen Dank für Eure starke Partnerschaft! https://t.co/wvJMyvx9PP";1469264387512979461;1525443013241094144;2022-05-14 11:48:50+00:00;;de;False;271;747;2995;78;everyone;Twitter for iPhone;;;2022-05-28 15:50:37.566453
1469264387512979461;ABaerbock;1524830617975726081;"Welcome to Weissenhaus!
Never since the end of the Cold War have we G7 partners been more profoundly challenged. Never before have we stood more united. Our common values are our strength. #G7GER https://t.co/zGjILb3EVN";1469264387512979461;1524830617975726081;2022-05-12 19:15:23+00:00;;en;False;262;380;2889;44;everyone;Twitter for iPhone;;;2022-05-28 15:50:37.570166
1469264387512979461;ABaerbock;1524038620860006400;Wir werden genauso da sein, wenn dieser Krieg vorbei ist, wenn Wladimir Putin sein Ziel verfehlt haben wird, wenn die #Ukraine ihre Zukunft in #Freiheit gestaltet. Danke @ZelenskyyUa für den herzlichen Empfang in Kiew!;1469264387512979461;1524038618599370755;2022-05-10 14:48:17+00:00;1469264387512979461;de;False;501;461;8171;41;everyone;Twitter for iPhone;1524038618599370755;replied_to;2022-05-28 15:50:37.572751
1469264387512979461;ABaerbock;1524038618599370755;Ich bin unfassbar froh, hier im freien #Kiew zu sein. Der dafür notwendige Mut der Ukrainer*innen ist ergreifend. Meine Botschaft ist klar: Die #Ukraine kann sich auf unsere Unterstützung verlassen - nicht nur militärisch, nicht nur heute. https://t.co/VtwEzEDJVI;1469264387512979461;1524038618599370755;2022-05-10 14:48:16+00:00;;de;False;2558;2320;33173;358;everyone;Twitter for iPhone;;;2022-05-28 15:50:37.575874
1469264387512979461;ABaerbock;1523975472023056385;Wir werden als internationale Gemeinschaft Beweise sammeln. Ich habe der ukrainischen Generalstaatsanwältin Iryna #Wenediktowa Deutschlands volle Unterstützung bei der Aufklärung der Kriegsverbrechen zugesichert: politisch, finanziell und personell.;1469264387512979461;1523975468365623296;2022-05-10 10:37:21+00:00;1469264387512979461;de;False;245;195;4132;25;everyone;Twitter for iPhone;1523975470575984640;replied_to;2022-05-28 15:50:37.578556
1469264387512979461;ABaerbock;1523975470575984640;Es hätte auch meine Familie, meine Nachbarn sein können. Die Willkür macht fassungslos. Wir können den Überlebenden den Schmerz nicht nehmen, aber wir können alles dafür tun, für Gerechtigkeit zu sorgen: Niemand darf glauben, Verbrechen ohne Konsequenzen begehen zu können.;1469264387512979461;1523975468365623296;2022-05-10 10:37:20+00:00;1469264387512979461;de;False;283;156;4475;20;everyone;Twitter for iPhone;1523975468365623296;replied_to;2022-05-28 15:50:37.581670
1469264387512979461;ABaerbock;1523975468365623296;#Butscha ist zum Symbol geworden. Für unvorstellbare Verbrechen, für Folter, Vergewaltigung, Mord. Die Unvorstellbarkeit lässt diesen Ort weit weg erscheinen. Und dann steht man hier und begreift: Butscha ist eine ganz normale, friedliche Vorstadt. Es hätte jeden treffen können. https://t.co/HFZzh5xEdk;1469264387512979461;1523975468365623296;2022-05-10 10:37:20+00:00;;de;False;1218;751;10429;108;everyone;Twitter for iPhone;;;2022-05-28 15:50:37.585095
1469264387512979461;ABaerbock;1523665959772639237;Das Herz Europas schlägt nicht in Ministerien, sondern im Alltag der Menschen. Ihre Ideen sind der Kompass für den Weg, den wir als Europäische Union einschlagen sollten. Die Konferenz zur Zukunft Europas hat wichtige Vorschläge geliefert – gehen wir an die Arbeit! #Europatag 2/2;1469264387512979461;1523665958249787392;2022-05-09 14:07:27+00:00;1469264387512979461;de;False;169;227;3051;11;everyone;Twitter for iPhone;1523665958249787392;replied_to;2022-05-28 15:50:37.588120
1469264387512979461;ABaerbock;1523665958249787392;Nie war #Europa wichtiger als heute. Der Krieg in der #Ukraine hat gezeigt, dass eine handlungsfähige Europäische Union kein Selbstzweck ist, sondern unsere Lebensversicherung. Damit das so bleibt, muss Europa noch enger zusammenrücken – mit Mut und Weitblick. 1/2;1469264387512979461;1523665958249787392;2022-05-09 14:07:27+00:00;;de;False;460;831;6678;44;everyone;Twitter for iPhone;;;2022-05-28 15:50:37.591159
1469264387512979461;ABaerbock;1523222940032114688;Der Kampf der Ukrainer*innen um ihr Leben und ihre Freiheit ist auch ein Kampf um unsere Friedensordnung, um europäische Werte. Deshalb stehen wir an ihrer Seite. Unser Europa des Friedens, der Freiheit und Demokratie ist stark - wenn wir es leben und dafür einstehen. 3/3;1469264387512979461;1523222936869556224;2022-05-08 08:47:03+00:00;1469264387512979461;de;False;291;354;5299;22;everyone;Twitter for iPhone;1523222938329444352;replied_to;2022-05-28 15:50:37.593730
1469264387512979461;ABaerbock;1523222938329444352;Das ist ein unglaubliches Glück, und es ist unsere Verantwortung und Pflicht, dieses Glück für unsere Kinder zu bewahren. Heute sind wir mit der bitteren Realität konfrontiert: Wir haben wieder Krieg auf unserem Kontinent. 2/3;1469264387512979461;1523222936869556224;2022-05-08 08:47:03+00:00;1469264387512979461;de;False;209;129;4484;9;everyone;Twitter for iPhone;1523222936869556224;replied_to;2022-05-28 15:50:37.597120
1469264387512979461;ABaerbock;1523222936869556224;Der heutige Jahrestag mahnt, im Ringen um Freiheit und Menschlichkeit #NieWieder auf der falschen Seite zu stehen. Seit 77 Jahren dürfen wir in Deutschland in Frieden leben. Und seit über 30 Jahren im wiedervereinten Deutschland in Freiheit. 1/3;1469264387512979461;1523222936869556224;2022-05-08 08:47:02+00:00;;de;False;753;1179;8539;94;everyone;Twitter for iPhone;;;2022-05-28 15:50:37.601753
1469264387512979461;ABaerbock;1521393513686052865;Sie leisten den entscheidenden Beitrag zur Dokumentation von Menschenrechtsverletzungen und Kriegsverbrechen und setzen den russischen Desinformationskampagnen #Fakten entgegen.;1469264387512979461;1521393510569889793;2022-05-03 07:37:34+00:00;1469264387512979461;de;False;70;185;1471;10;everyone;Twitter for iPhone;1521393512532566016;replied_to;2022-05-28 15:50:37.606194
1469264387512979461;ABaerbock;1521393512532566016;Der heutige #TagDerPressefreiheit steht für mich im Zeichen aller Journalisti*nnen, die in der #Ukraine im Einsatz sind - stellvertretend für so viele Medienschaffende in Konflikten weltweit. Mit ihrer Arbeit riskieren sie nicht nur ihr Leben - ihre Arbeit ist unersetzlich.;1469264387512979461;1521393510569889793;2022-05-03 07:37:34+00:00;1469264387512979461;de;False;79;175;1662;14;everyone;Twitter for iPhone;1521393510569889793;replied_to;2022-05-28 15:50:37.609416
1469264387512979461;ABaerbock;1521393510569889793;Freie, demokratische Gesellschaften kann es ohne freie und vielfältige Presse nicht geben. Sie ist nicht nur das Herz einer jeden Demokratie, sondern bildet auch, wenn nötig, ein lautstarkes Bollwerk zur Wahrung der Menschenrechte. #TagDerPressefreiheit;1469264387512979461;1521393510569889793;2022-05-03 07:37:33+00:00;;de;False;432;1342;5771;108;everyone;Twitter for iPhone;;;2022-05-28 15:50:37.612711
1469264387512979461;ABaerbock;1518594115314802690;Im Gegensatz zu ihnen waren die Angehörigen der 🇷🇺 Botschaft, die wir vor 3 Wochen ausgewiesen haben, keinen Tag im Dienst der Diplomatie tätig. Ihre Arbeit bedrohte alle, die bei uns Schutz suchen - das konnten wir nicht länger dulden und werden es auch in Zukunft nicht tun. 2/2;1469264387512979461;1518594113272168450;2022-04-25 14:13:45+00:00;1469264387512979461;de;False;287;559;5688;35;everyone;Twitter for iPhone;1518594113272168450;replied_to;2022-05-28 15:50:37.615806
1469264387512979461;ABaerbock;1518594113272168450;Die Ausweisung von 40 Diplomat*innen aus #Russland ist nicht gerechtfertigt. Unsere Kolleg*innen haben - trotz der immer widrigeren Umstände - mit Offenheit, ehrlichem Interesse und großem Einsatz in Russland gearbeitet. Russland schädigt sich damit weiter selbst. 1/2;1469264387512979461;1518594113272168450;2022-04-25 14:13:45+00:00;;de;False;523;2005;8399;139;everyone;Twitter for iPhone;;;2022-05-28 15:50:37.619303
1469264387512979461;ABaerbock;1514286790634573827;On est ensemble - Wir stehen zusammen. Und zwar vor einer Herausforderung, die uns alle angeht. Der #Klimawandel betrifft uns alle auf dieser Welt, aber er betrifft uns nicht überall gleichermaßen. Für mich ist entschiedenes Klimahandeln eine Frage globaler #Gerechtigkeit. 3/3;1469264387512979461;1514286784653447169;2022-04-13 16:57:59+00:00;1469264387512979461;de;False;115;276;2076;13;everyone;Twitter for iPhone;1514286788260597761;replied_to;2022-05-28 15:50:37.622244
1469264387512979461;ABaerbock;1514286788260597761;Eine Familie, die in #Niamey auf den Markt geht, muss doppelt so viel für einen Sack Hirse zahlen als vor einem Jahr. Zur Klimakrise kommt eine #Nahrungsmittelkrise hinzu, die Putins Angriffskrieg auf die Ukraine angeheizt hat. Wir müssen jetzt entschlossen handeln. 2/3;1469264387512979461;1514286784653447169;2022-04-13 16:57:59+00:00;1469264387512979461;de;False;135;391;2172;19;everyone;Twitter for iPhone;1514286784653447169;replied_to;2022-05-28 15:50:37.626937
1469264387512979461;ABaerbock;1514286784653447169;#Klimakrise - hier im #Sahel bedeutet das Konflikt, Hunger und Flucht. Klimakrise - das bedeutet für eine Mutter, dass sie nicht weiß, was sie ihren Kindern am Abend zu essen geben wird. Dass ein Vater sich darum sorgt, dass sein Sohn sich extremistischen Schergen anschließt. 1/3 https://t.co/QvNTWYnFcr;1469264387512979461;1514286784653447169;2022-04-13 16:57:58+00:00;;de;False;363;975;3737;44;everyone;Twitter for iPhone;;;2022-05-28 15:50:37.630962
1469264387512979461;ABaerbock;1512155922273083392;In yet another heinous #terrorist attack in #Israel, cowards attacked normal #TelAviv citizens enjoying the evening before Shabbat. We mourn those killed and grieve with their families. Our thoughts are with the injured and with the emergency responders who are caring for them.;1469264387512979461;1512155922273083392;2022-04-07 19:50:41+00:00;;en;False;446;779;4210;65;everyone;Twitter for iPhone;;;2022-05-28 15:50:37.635296
1469264387512979461;ABaerbock;1511319408463028228;"Gemeinsam für #Moldau: Über 30 Länder haben ihre Unterstützung bei der Aufnahme von ukrainischen Geflüchteten zugesagt. Wir wollen die Zusammenarbeit mit Moldau ausbauen, seine wirtschaftliche &amp; fossile Unabhängigkeit von #Russland stärken &amp; stellen dafür über 650 Mio Euro bereit https://t.co/Leovymg6Ro";1469264387512979461;1511319408463028228;2022-04-05 12:26:40+00:00;;de;False;289;1125;3037;68;everyone;Twitter for iPhone;;;2022-05-28 15:50:37.638621
1469264387512979461;ABaerbock;1511011389585989632;Wir werden die bestehenden #Sanktionen gegen #Russland weiter verschärfen, unsere Unterstützung der ukrainischen Streitkräfte entschieden ausbauen und auch die östliche Flanke der #NATO stärken. 2/2;1469264387512979461;1511011388197683202;2022-04-04 16:02:43+00:00;1469264387512979461;de;False;436;1120;7342;56;everyone;Twitter for iPhone;1511011388197683202;replied_to;2022-05-28 15:50:37.641673
1469264387512979461;ABaerbock;1511011388197683202;Die Bilder aus #Butscha zeugen von Vernichtungswillen, der über alle Grenzen hinweggeht. Wir haben daher eine erhebliche Zahl von Angehörigen der russischen Botschaft zu unerwünschten Personen erklärt. Weitere Reaktionen bringen wir gemeinsam mit unseren Partnern auf den Weg. 1/2;1469264387512979461;1511011388197683202;2022-04-04 16:02:42+00:00;;de;False;1167;2288;13224;219;everyone;Twitter for iPhone;;;2022-05-28 15:50:37.645026
1469264387512979461;ABaerbock;1510576260828868615;"Die Verantwortlichen für diese Kriegsverbrechen müssen zur Rechenschaft gezogen werden. Wir werden die Sanktionen gegen Russland verschärfen und
die #Ukraine noch stärker bei ihrer Verteidigung unterstützen. 2/2";1469264387512979461;1510576259541225474;2022-04-03 11:13:40+00:00;1469264387512979461;de;False;1687;2343;18152;263;everyone;Twitter for iPhone;1510576259541225474;replied_to;2022-05-28 15:50:37.648306
1469264387512979461;ABaerbock;1510576259541225474;Die Bilder aus #Butscha sind unerträglich. Putins hemmungslose Gewalt löscht unschuldige Familien aus und kennt keine Grenzen. 1/2;1469264387512979461;1510576259541225474;2022-04-03 11:13:40+00:00;;de;False;2918;3517;25057;361;everyone;Twitter for iPhone;;;2022-05-28 15:50:37.651451
1469264387512979461;ABaerbock;1510238295296552961;@HalynaYanchenko Thank you for your important visit. We stand united with you - for the peace and sovereignty of #Ukraine.;1469264387512979461;1509994925441572869;2022-04-02 12:50:43+00:00;371156355;en;False;30;49;859;1;everyone;Twitter for iPhone;1509994925441572869;replied_to;2022-05-28 15:50:37.655374
1469264387512979461;ABaerbock;1509183953168703493;In nur einer Woche sind in #Israel 11 Menschen von islamistischen Terroristen ermordet worden. Gerade in diesen traurigen Tagen ist klar: unsere Freundschaft ist unverbrüchlich - unsere volle Solidarität gilt Israel. Meine Gedanken sind bei allen, die um ihre Liebsten trauern.;1469264387512979461;1509183950702395395;2022-03-30 15:01:08+00:00;1469264387512979461;de;False;117;223;1403;16;everyone;Twitter for iPhone;1509183950702395395;replied_to;2022-05-28 15:50:37.658565
1469264387512979461;ABaerbock;1509183950702395395;"Vielen Dank für Ihre Freundschaft zu Deutschland und Ihren unermüdlichen Einsatz für die 🇩🇪-🇮🇱 Beziehungen in den letzten 5 Jahren, @JIssacharoff! 
Ich hätte mir sehr gewünscht, Sie fröhlicher verabschieden zu dürfen. https://t.co/pmcDXcJbST";1469264387512979461;1509183950702395395;2022-03-30 15:01:07+00:00;;de;False;95;364;2148;16;everyone;Twitter for iPhone;;;2022-05-28 15:50:37.662746
1469264387512979461;ABaerbock;1508743111534694406;"Wir bereiten einen nationalen #Komplettausstieg aus fossilen Energien aus Russland vor, beginnend bei Öl. Dabei dürfen wir unsere Energiekrise nicht in andere Länder exportieren: Wir müssen global denken, in #ErneuerbareEnergien investieren &amp; Energiepartnerschaften aufbauen.";1469264387512979461;1508743110330925062;2022-03-29 09:49:23+00:00;1469264387512979461;de;False;147;318;2102;25;everyone;Twitter for iPhone;1508743110330925062;replied_to;2022-05-28 15:50:37.667554
1469264387512979461;ABaerbock;1508743110330925062;"Klimapolitik ist die geopolitische Aufgabe unserer Zeit. Der Aufstieg der Erneuerbaren Energien ist Realität &amp; absolute Notwendigkeit - er wird das internationale Machtgewicht verschieben. Investitionen in Erneuerbare sind Investitionen in unsere #Sicherheit &amp; #Freiheit. #betd22";1469264387512979461;1508743110330925062;2022-03-29 09:49:23+00:00;;de;False;357;568;3758;52;everyone;Twitter for iPhone;;;2022-05-28 15:50:37.671604
1469264387512979461;ABaerbock;1507433188402114562;"Unsere wichtigste Antwort auf die brutale und sinnlose Gewalt ist Menschlichkeit &amp; Solidarität: Heute sind die ersten Ukrainer*innen aus Moldau in Frankfurt angekommen. Neben der EU werden auch USA &amp; Kanada Geflüchtete aufnehmen. 
Vielen Dank an alle, die dabei unterstützen!";1469264387512979461;1507433188402114562;2022-03-25 19:04:13+00:00;;de;False;367;839;6408;50;everyone;Twitter Web App;;;2022-05-28 15:50:37.674803
1469264387512979461;ABaerbock;1506729101830197249;Mit Haltung, Klarheit und Mut stand Madeleine Albright als erste US-Außenministerin ein für Freiheit und die Stärke von Demokratien. Mit ihr verlieren wir eine streitbare Kämpferin, wahre Transantlantikerin und Vorreiterin. Auch ich stehe heute auf ihren Schultern.;1469264387512979461;1506729101830197249;2022-03-23 20:26:26+00:00;;de;False;488;1495;9276;259;everyone;Twitter for iPhone;;;2022-05-28 15:50:37.677413
1469264387512979461;ABaerbock;1504775544797384705;Denn wann, wenn nicht jetzt, müssen wir beginnen, unsere Sicherheit für die #Zukunft zu denken: Besonnen und pragmatisch, mit klarem Wertekompass in der Hand.;1469264387512979461;1504775542356295680;2022-03-18 11:03:41+00:00;1469264387512979461;de;False;100;379;2134;16;everyone;Twitter for iPhone;1504775543622934528;replied_to;2022-05-28 15:50:37.680487
1469264387512979461;ABaerbock;1504775543622934528;"Die Sicherheit der Unverletzlichkeit unseres Lebens, zuvorderst vor Gewalt und Krieg.

Die Sicherheit unserer #Freiheit, der Resilienz unserer #Demokratie.

Die Sicherheit unserer Lebensgrundlagen.";1469264387512979461;1504775542356295680;2022-03-18 11:03:41+00:00;1469264387512979461;de;False;101;303;2108;13;everyone;Twitter for iPhone;1504775542356295680;replied_to;2022-05-28 15:50:37.684642
1469264387512979461;ABaerbock;1504775542356295680;Die #Sicherheit der Freiheit unseres Lebens ist mehr als die Abwesenheit von Krieg. Auf dem Weg zu einer Nationalen #Sicherheitsstrategie geht es daher um drei essentielle Punkte:;1469264387512979461;1504775542356295680;2022-03-18 11:03:41+00:00;;de;False;238;849;3019;56;everyone;Twitter for iPhone;;;2022-05-28 15:50:37.688258
1469264387512979461;ABaerbock;1503712868792995841;@JY_LeDrian Bon rétablissement!;1469264387512979461;1503699392372555779;2022-03-15 12:41:00+00:00;1055021191;fr;False;4;11;48;0;everyone;Twitter for iPhone;1503699392372555779;replied_to;2022-05-28 15:50:37.691021
1469264387512979461;ABaerbock;1501660327473201152;"The security and integrity of all nuclear installations in #Ukraine is of vital importance. For all of us. They should never be targeted. 
Full support to @rafaelmgrossi and @iaeaorg for their hard work under dire circumstances.";1469264387512979461;1501660327473201152;2022-03-09 20:44:56+00:00;;en;False;165;1545;1411;26;everyone;Twitter Web App;;;2022-05-28 15:50:37.694178
1469264387512979461;ABaerbock;1501660115400810496;Die Sicherheit und Integrität der AKWs in der #Ukraine sind enorm wichtig. Für uns alle. Sie dürfen niemals Ziel von Kampfhandlungen sein. Ich bin @rafaelmgrossi und der @iaeaorg sehr dankbar für ihre Arbeit unter schwierigsten Bedingungen.;1469264387512979461;1501660115400810496;2022-03-09 20:44:05+00:00;;de;False;158;670;2425;11;everyone;Twitter Web App;;;2022-05-28 15:50:37.696721
1469264387512979461;ABaerbock;1501619085951606790;Die Organisationen haben eine unglaubliche Arbeit geleistet. Ich danke allen, die in Deutschland oder vor Ort in Afghanistan mithelfen, von Herzen für ihren couragierten Einsatz!;1469264387512979461;1501619081258184707;2022-03-09 18:01:03+00:00;1469264387512979461;de;False;86;245;1183;7;everyone;Twitter for iPhone;1501619083770580995;replied_to;2022-05-28 15:50:37.700976
1469264387512979461;ABaerbock;1501619083770580995;"Es hat sich viel getan: mehr als 14.000 Visa wurden zB an Ortskräfte &amp; besonders Schutzbedürftige vergeben. Aber noch immer sind Menschen in Not &amp; warten auf Ausreise. Wichtig ist, Verfahren zu vereinfachen, Prozesse zu beschleunigen &amp; mit voller Kraft gemeinsam dran zu bleiben.";1469264387512979461;1501619081258184707;2022-03-09 18:01:02+00:00;1469264387512979461;de;False;116;321;1409;19;everyone;Twitter for iPhone;1501619081258184707;replied_to;2022-05-28 15:50:37.704505
1469264387512979461;ABaerbock;1501619081258184707;Auch wenn alle Augen der Welt im Moment auf die Ukraine gerichtet sind: #Afghanistan ist weiter in unserem Blick. Heute haben @NancyFaeser und ich uns in großer Runde mit Organisationen getroffen, die sich für die Menschen in Afghanistan einsetzen. https://t.co/ie3BNPoxq6;1469264387512979461;1501619081258184707;2022-03-09 18:01:02+00:00;;de;False;373;777;4374;57;everyone;Twitter for iPhone;;;2022-05-28 15:50:37.707668
1469264387512979461;ABaerbock;1501279631508443141;"RT @melaniejoly: Thank you for welcoming me to Germany @ABaerbock.
In these dire times it is precious to be with you in Berlin— not only as…";1469264387512979461;1501279631508443141;2022-03-08 19:32:11+00:00;;en;False;164;0;0;0;everyone;Twitter for iPhone;1501270432808423433;retweeted;2022-05-28 15:50:37.710747
1469264387512979461;ABaerbock;1501273503957454850;Thank you for the call this evening, dear @DmytroKuleba. We will keep standing by your side – be it with means for self-defense, with humanitarian assistance for those seeking refuge, or through intense international pressure and isolation of #Russia.;1469264387512979461;1501273503957454850;2022-03-08 19:07:50+00:00;;en;False;272;585;2756;29;everyone;Twitter for iPhone;;;2022-05-28 15:50:37.713390
1469264387512979461;ABaerbock;1499818158487748611;Wir müssen einen kühlen Kopf bewahren. So sehr es uns das Herz zerreißt. 3/3;1469264387512979461;1499818155622940672;2022-03-04 18:44:48+00:00;1469264387512979461;de;False;895;1015;20634;127;everyone;Twitter for iPhone;1499818157053255684;replied_to;2022-05-28 15:50:37.718336
1469264387512979461;ABaerbock;1499818157053255684;Aber – das sage ich genauso deutlich: Die NATO wird nicht in diesen Krieg eingreifen können. Denn: Die daraus folgende Gefahr grenzenloser Eskalation in ganz Europa kann niemand wollen. Darin sind wir uns mit unseren Partnern einig. 2/3;1469264387512979461;1499818155622940672;2022-03-04 18:44:48+00:00;1469264387512979461;de;False;720;785;17766;110;everyone;Twitter for iPhone;1499818155622940672;replied_to;2022-05-28 15:50:37.721303
1469264387512979461;ABaerbock;1499818155622940672;Es gab keinen Grund für diesen Krieg – außer dem aggressiven Machtstreben eines Mannes. Aber es ist keine Größe, wenn man Schwächere überfällt, Städte bombardiert, Kinder sterben lässt. Unsere Verantwortung ist es, dem entschieden entgegenzutreten. 1/3;1469264387512979461;1499818155622940672;2022-03-04 18:44:48+00:00;;de;False;3162;2623;35615;309;everyone;Twitter for iPhone;;;2022-05-28 15:50:37.724536
