twitter_id;twitter_handle;tweet_id;tweet_text;tweet_author_id;tweet_conversation_id;tweet_created_at;tweet_in_reply_to_user_id;tweet_lang;tweet_possibly_sensitive;tweet_retweet_count;tweet_reply_count;tweet_like_count;tweet_quote_count;tweet_reply_settings;tweet_source;tweet_referenced_tweet_id;tweet_referenced_tweet_type;api_call
825019912083038208;katrin_staffler;1257703009586421764;Der #Europarat wurde vor genau 71 Jahren gegründet und setzt sich bis heute für #Menschenrechte, #Demokratie und #Rechtsstaatlichkeit ein. Diese internationale Zusammenarbeit war damals eine Vision, heute ist sie nicht mehr wegzudenken!;825019912083038208;1257703009586421764;2020-05-05 16:05:39+00:00;;de;False;3;0;14;0;everyone;Twitter Web App;;;2022-05-28 17:25:49.223261
825019912083038208;katrin_staffler;1255078365217816576;Ab dieser Woche gilt in Bayern die #Maskenpflicht in Geschäften und öffentlichen Verkehrsmitteln. Auch ein Schal oder selbst angefertigter Mundschutz hilft weiter. Ganz wichtig ist aber: Wir müssen vorsichtig bleiben und vor allem weiterhin Abstände einhalten.;825019912083038208;1255078365217816576;2020-04-28 10:16:15+00:00;;de;False;0;1;1;0;everyone;Twitter Web App;;;2022-05-28 17:25:49.226474
825019912083038208;katrin_staffler;1243527417383223302;Ausdrücklicher Lesetipp: Die Ad-hoc-Empfehlung des @ethikrat zur #COVID19 leistet ethische Orientierungshilfe und macht noch einmal mehr deutlich wie wichtig demokratisch legitimiertes Handeln in der jetzigen Situation ist! https://t.co/l7ug5KEwRs;825019912083038208;1243527417383223302;2020-03-27 13:16:54+00:00;;de;False;6;1;10;1;everyone;Twitter for iPad;;;2022-05-28 17:25:49.229463
825019912083038208;katrin_staffler;1235529796324601856;Im Bundestag debattieren wir heute über das Arbeitsprogramm 2020 der Europäischen #Kommission. Gerade mit Blick auf #Zukunftsthemen wie #Digitalisierung, #Sicherheit und #Umweltschutz ein gutes Programm von Ursula @vonderleyen !;825019912083038208;1235529796324601856;2020-03-05 11:37:13+00:00;;de;False;1;0;3;0;everyone;Twitter Web App;;;2022-05-28 17:25:49.232438
825019912083038208;katrin_staffler;1227264535993647105;Wir können es uns nicht leisten, auf das #Talent und die #Innovationskraft von Frauen zu verzichten! 👩‍🔬 Das wird auch am Internationalen Tag von #WomenInScience wieder einmal mehr deutlich! ➡ #WissenschaftbrauchtFrauen https://t.co/VsrZrHHg31;825019912083038208;1227264535993647105;2020-02-11 16:14:01+00:00;;de;False;0;0;8;0;everyone;Twitter Web App;1227141508240957441;quoted;2022-05-28 17:25:49.235436
825019912083038208;katrin_staffler;1222885953800409088;@TilRoquette @FePeCDU @MGrosseBroemer Ich akzeptiere natürlich Ihre Meinung zu diesem Thema und würde mich freuen, wenn Sie meine Meinung ebenso akzeptieren. Herzliche Grüße;825019912083038208;1222608877373599745;2020-01-30 14:15:06+00:00;1185103378927493121;de;False;0;2;1;0;everyone;Twitter Web App;1222800092484317184;replied_to;2022-05-28 17:25:49.238443
825019912083038208;katrin_staffler;1222885898137763841;@TilRoquette @FePeCDU @MGrosseBroemer Lieber @TilRoquette, auf Ihr Schreiben habe ich umfassend geantwortet und mich für einen Klimaschutz ausgesprochen, der die Gesellschaft nicht spaltet und alle Dimensionen adressiert.;825019912083038208;1222608877373599745;2020-01-30 14:14:52+00:00;1185103378927493121;de;False;0;5;1;0;everyone;Twitter Web App;1222800092484317184;replied_to;2022-05-28 17:25:49.241669
825019912083038208;katrin_staffler;1222885597020291081;@TilRoquette Ich akzeptiere natürlich Ihre Meinung zu diesem Thema und würde mich freuen, wenn Sie meine Meinung ebenso akzeptieren. Herzliche Grüße;825019912083038208;1222473284417212421;2020-01-30 14:13:41+00:00;1185103378927493121;de;False;0;0;0;0;everyone;Twitter Web App;1222473284417212421;replied_to;2022-05-28 17:25:49.244434
825019912083038208;katrin_staffler;1222885551092707328;@TilRoquette Lieber @TilRoquette, auf Ihr Schreiben habe ich umfassend geantwortet und mich für einen Klimaschutz ausgesprochen, der die Gesellschaft nicht spaltet und alle Dimensionen adressiert.;825019912083038208;1222473284417212421;2020-01-30 14:13:30+00:00;1185103378927493121;de;False;0;0;0;0;everyone;Twitter Web App;1222473284417212421;replied_to;2022-05-28 17:25:49.247080
825019912083038208;katrin_staffler;1220287608871362562;I couldn’t agree more! Thanks for the great discussion @evamaydell! https://t.co/b9sCVtXp8E;825019912083038208;1220287608871362562;2020-01-23 10:10:12+00:00;;en;False;0;0;2;0;everyone;Twitter Web App;1219903295277486080;quoted;2022-05-28 17:25:49.250406
825019912083038208;katrin_staffler;1217719049670533121;Wir stimmen heute über eine neue Regelung zur Organspende ab. Es ist unsere Aufgabe als Politiker Lösungen zu finden, um schwerstkranken Menschen zu helfen. Wie ich abstimmen werde? Siehe Video... https://t.co/KGNO3rbCaQ;825019912083038208;1217719049670533121;2020-01-16 08:03:40+00:00;;de;False;0;0;2;0;everyone;Twitter Web App;1217712704833585153;quoted;2022-05-28 17:25:49.253213
825019912083038208;katrin_staffler;1217432757795684353;Heute wurde die nationale Strategie zu #Bioökonomie im Kabinett beschlossen. Ein wichtiger Beitrag zu Umwelt- und #Klimaschutz und Innovationen made in Germany! https://t.co/78nXjgAAQZ;825019912083038208;1217432757795684353;2020-01-15 13:06:02+00:00;;de;False;2;1;10;0;everyone;Twitter Web App;1217406309265526784;quoted;2022-05-28 17:25:49.256069
825019912083038208;katrin_staffler;1205168055652954112;Heute im #Bundestag beschlossen: Die #Meisterpflicht wird in 12 Gewerken wieder eingeführt. Eine gute Nachricht für die Qualität in den Betrieben und das #Handwerk allgemein!;825019912083038208;1205168055652954112;2019-12-12 16:50:30+00:00;;de;False;6;14;35;1;everyone;Twitter Web App;;;2022-05-28 17:25:49.259107
825019912083038208;katrin_staffler;1199654113941872640;"Das Europäische Parlament hat gerade mit breiter
Mehrheit die Europäische Kommission gewählt. 
Herzlichen Glückwunsch an @vonderleyen  und die 
neu gewählte Kommission!";825019912083038208;1199654113941872640;2019-11-27 11:40:03+00:00;;de;False;0;0;2;0;everyone;Twitter Web App;;;2022-05-28 17:25:49.261890
825019912083038208;katrin_staffler;1194633523497357312;Internationale #Zusammenarbeit ist genau das, was wir in den Bereichen #Bildung, #Wissenschaft und #Forschung brauchen! https://t.co/2BQL1EJ7dw;825019912083038208;1194633523497357312;2019-11-13 15:10:01+00:00;;de;False;0;0;4;0;everyone;Twitter Web App;1194608429349982210;quoted;2022-05-28 17:25:49.265052
825019912083038208;katrin_staffler;1185085130932662272;Ich distanziere mich klar von Bernd #Lucke und seinen politischen Standpunkten. Trotzdem ist eine Verhinderung eines Fachvortrages nicht im Sinne der Freiheit von Forschung und Lehre, wie sie in unserem Grundgesetz verankert ist. https://t.co/DhN0CQDPD0;825019912083038208;1185085130932662272;2019-10-18 06:48:07+00:00;;de;False;0;0;5;0;everyone;Twitter Web App;1185077085225869312;quoted;2022-05-28 17:25:49.269599
825019912083038208;katrin_staffler;1136199851958579201;RT @TspVerlag: „Der Schutz und die Würde des Menschen müssen die oberste Richtschnur sein, wenn wir über diese Themen diskutieren“, sagt Ka…;825019912083038208;1136199851958579201;2019-06-05 09:15:28+00:00;;de;False;1;0;0;0;everyone;Twitter for iPad;1136165982718894080;retweeted;2022-05-28 17:25:49.272551
825019912083038208;katrin_staffler;1136199755728674817;RT @KastriotisM: Wichtiger Aspekt von @katrin_staffler beim Thema Biotechnologie: Wir brauchen eine offene gesellschaftliche Diskussion mit…;825019912083038208;1136199755728674817;2019-06-05 09:15:05+00:00;;de;False;3;0;0;0;everyone;Twitter for iPad;1136168088737669120;retweeted;2022-05-28 17:25:49.275616
825019912083038208;katrin_staffler;1126463062079410176;Heute feiern wir den #Europatag - Europa heißt für mich Sicherheit, Frieden und Wohlstand! Dies gilt es auch am 26. Mai zu verteidigen! #Europawahl2019 #Up2EU #Europafeiern #UnserEuropa #26MaiCSU;825019912083038208;1126463062079410176;2019-05-09 12:24:57+00:00;;de;False;0;0;2;0;everyone;Twitter for iPad;;;2022-05-28 17:25:49.278893
825019912083038208;katrin_staffler;1115897090046083073;RT @Kiessling_MdB: Erschwingliches Wohnen gibt es nur, wenn auch gebaut wird. Enteignungen, wie in Berlin im Gespräch, bringt keine einzige…;825019912083038208;1115897090046083073;2019-04-10 08:39:33+00:00;;de;False;15;0;0;0;everyone;Twitter for iPad;1114536153196240898;retweeted;2022-05-28 17:25:49.281792
825019912083038208;katrin_staffler;1115896884294451200;"RT @CDU_CSU_EP: ""Der No-Deal-#Brexit ist keine sinnvolle Alternative. Die britische Premierministerin May muss jetzt verbindlich erklären,…";825019912083038208;1115896884294451200;2019-04-10 08:38:44+00:00;;de;False;5;0;0;0;everyone;Twitter for iPad;1115895357379162113;retweeted;2022-05-28 17:25:49.284742
825019912083038208;katrin_staffler;1114125991125843970;RT @TSchipanski: Heute Morgen Kaffee u IT(ee) der @cducsubt auf Einladung von @NadineSchoen u mir. Thema heute: Digitalisierung in der Fina…;825019912083038208;1114125991125843970;2019-04-05 11:21:50+00:00;;de;False;3;0;0;0;everyone;Twitter for iPad;1114058951199473664;retweeted;2022-05-28 17:25:49.288855
825019912083038208;katrin_staffler;1114125927011815424;"RT @cducsubt: ▶ Bessere Perspektiven für junge Menschen: ""Wir gestalten das #BAföG, statt es nur zu verwalten"", so @katrin_staffler im #Bun…";825019912083038208;1114125927011815424;2019-04-05 11:21:35+00:00;;de;False;3;0;0;0;everyone;Twitter for iPad;1114078269899444225;retweeted;2022-05-28 17:25:49.291876
825019912083038208;katrin_staffler;1113429237736800257;Wir dürfen die Augen nicht vor dem verschließen, was derzeit in #Rumänien passiert! Die #EuropäischeUnion ist eine #Wertegemeinschaft, die den Menschen #Grundwerte wie #Rechtsstaatlichkeit garantiert. Wenn Regierungen diese Grundwerte einschränken, müssen wir dagegen vorgehen. https://t.co/1g2i8ivTR3;825019912083038208;1113429237736800257;2019-04-03 13:13:11+00:00;;de;False;7;3;22;0;everyone;Twitter for iPad;1113084537158987776;quoted;2022-05-28 17:25:49.295341
825019912083038208;katrin_staffler;1113010286020190208;Die Liebe zu Büchern habe ich mir aus dem Kindes- ins Erwachsenenalter bewahrt und ich profitiere davon noch heute - Diese Liebe müssen wir an #zukünftigeGenerationen weitergeben, wenn wir sie #fitfürdieZukunft machen wollen! #Leseratte #Bücher #lesen https://t.co/YBOGHu6dKI;825019912083038208;1113010286020190208;2019-04-02 09:28:25+00:00;;de;False;1;2;6;0;everyone;Twitter for iPad;1112973057411420160;quoted;2022-05-28 17:25:49.298487
825019912083038208;katrin_staffler;1112714763656749056;"Spannende Erkenntnisse in der heutigen Kommissionssitzung!
#beruflicheBildung #EnqueteKommission #jungeGeneration https://t.co/Di8EwGKXqI";825019912083038208;1112714763656749056;2019-04-01 13:54:07+00:00;;de;False;0;0;1;0;everyone;Twitter for iPad;1112675642909343744;quoted;2022-05-28 17:25:49.301947
825019912083038208;katrin_staffler;1109082493595148293;RT @Kiessling_MdB: Grundsteuer ist eine Infrastrukturabgabe und keine Ertragssteuer - liebe SPD. Der Wert eines Grundstücks kommt erst bei…;825019912083038208;1109082493595148293;2019-03-22 13:20:46+00:00;;de;False;11;0;0;0;everyone;Twitter for iPad;1108699977780527104;retweeted;2022-05-28 17:25:49.305767
825019912083038208;katrin_staffler;1109082331359469568;Wir hoffen bis zum letzten Tag, dass #Großbritannien Teil der Europäischen Union bleibt, oder zumindest mit Abkommen aus der #EU austritt. Egal was passieren wird, die Vorbereitungen sind getroffen, weil die Menschen verlässliche Antworten brauchen. #Brexit #Bildung #Forschung https://t.co/sBd33GfofX;825019912083038208;1109082331359469568;2019-03-22 13:20:08+00:00;;de;False;0;0;2;0;everyone;Twitter for iPad;1109069787588714496;quoted;2022-05-28 17:25:49.309611
825019912083038208;katrin_staffler;1108714299567075330;"RT @cducsubt: Es war gerade die junge Generation in Großbritannien, die für einen Verbleib in der 🇪🇺 und gegen den #Brexit gestimmt hat. ""A…";825019912083038208;1108714299567075330;2019-03-21 12:57:42+00:00;;de;False;8;0;0;0;everyone;Twitter for iPad;1108669492719165440;retweeted;2022-05-28 17:25:49.312593
825019912083038208;katrin_staffler;1108303266918658048;RT @ManfredWeber: Die Politik in London muss sich für einen Weg entscheiden. Wenn das britische Unterhaus dazu nicht in der Lage ist, ist e…;825019912083038208;1108303266918658048;2019-03-20 09:44:24+00:00;;de;False;27;0;0;0;everyone;Twitter for iPad;1108057700041195522;retweeted;2022-05-28 17:25:49.317000
825019912083038208;katrin_staffler;1108303045899796480;Die #europäischeunion wird #forschung und #entwicklung mit dem größten Programm weltweit (100 Mrd Euro im Zeitraum 2021 bis 2027) unterstützen. Eine gute Nachricht für die Menschen in ganz Europa und gerade auch für den #forschungsstandortdeutschland! #horizoneurope https://t.co/u7i1Xcjr12;825019912083038208;1108303045899796480;2019-03-20 09:43:32+00:00;;de;False;0;0;3;0;everyone;Twitter for iPad;1108287399539470336;quoted;2022-05-28 17:25:49.321218
825019912083038208;katrin_staffler;1107720365667684352;Nicht meine Auffassung von Familie! https://t.co/1Y90SsWxFs;825019912083038208;1107720365667684352;2019-03-18 19:08:10+00:00;;de;False;0;0;6;0;everyone;Twitter for iPad;1107686105728593920;quoted;2022-05-28 17:25:49.324744
825019912083038208;katrin_staffler;1106544274068439041;Vielen Dank! 😊 https://t.co/v433ZLgahP;825019912083038208;1106544274068439041;2019-03-15 13:14:48+00:00;;de;False;0;0;0;0;everyone;Twitter for iPad;;;2022-05-28 17:25:49.327845
825019912083038208;katrin_staffler;1106543800627982336;Eine gute Entscheidung für die Zukunft unserer Schülerinnen und Schüler!! https://t.co/WehvGq7PQL;825019912083038208;1106543800627982336;2019-03-15 13:12:55+00:00;;de;False;0;0;1;0;everyone;Twitter for iPad;1106497286325104640;quoted;2022-05-28 17:25:49.330919
825019912083038208;katrin_staffler;1105918965195464706;Das britische Parlament will keinen #Brexit ohne #Abkommen - so weit, so gut! Tragisch aus meiner Sicht aber die knappe Entscheidung. Ein No-Deal Brexit wäre die schlechteste aller möglicher Varianten - für die Briten genau wie für alle anderen Europäer! https://t.co/V49VUhfGfD;825019912083038208;1105918965195464706;2019-03-13 19:50:02+00:00;;de;False;1;1;2;0;everyone;Twitter for iPad;1105912287179800576;quoted;2022-05-28 17:25:49.334268
825019912083038208;katrin_staffler;1105911655232389120;RT @ManfredWeber: Klare Fakten heute im @Europarl_DE: SPD und Grüne stimmen gegen die Beendigung der Beitrittsverhandlungen der EU mit der…;825019912083038208;1105911655232389120;2019-03-13 19:21:00+00:00;;de;False;45;0;0;0;everyone;Twitter for iPad;1105895926084890624;retweeted;2022-05-28 17:25:49.337674
825019912083038208;katrin_staffler;1105131418177490946;Unsere #Gesetze und Regeln müssen für alle Menschen in Deutschland gleichermaßen gelten! Das ist unverhandelbar und es darf keine Toleranz denjenigen gegenüber geben, die meinen, dieses Prinzip aushöhlen zu können!  #StarkerStaat https://t.co/KdVMFEDnXR;825019912083038208;1105131418177490946;2019-03-11 15:40:37+00:00;;de;False;6;11;27;1;everyone;Twitter for iPad;1104999461892300801;quoted;2022-05-28 17:25:49.342192
825019912083038208;katrin_staffler;1103339952216072192;RT @CSU: .@ManfredWeber: Wenn die USA einen Handelskrieg beginnen wollen, müssen sie wissen, das wir wehrhaft sind. Wir sind bereit zu Verh…;825019912083038208;1103339952216072192;2019-03-06 17:01:58+00:00;;de;False;8;0;0;0;everyone;Twitter for iPad;1103234485179613184;retweeted;2022-05-28 17:25:49.346174
825019912083038208;katrin_staffler;1098909471504519168;RT @BMBF_Bund: BM @AnjaKarliczek hat heute das Rahmenprogramm #Gesundheitsforschung im Bundestag vorgestellt. Wie sie Deutschland in der Ge…;825019912083038208;1098909471504519168;2019-02-22 11:36:49+00:00;;de;False;4;0;0;0;everyone;Twitter for iPad;1098904582971891712;retweeted;2022-05-28 17:25:49.350599
825019912083038208;katrin_staffler;1098585100864901120;RT @BMBF_Bund: BM @AnjaKarliczek will, dass der #DigitalPakt schnellstmöglich umgesetzt wird. 574 Stimmen dafür, 74 dagegen – so stimmte de…;825019912083038208;1098585100864901120;2019-02-21 14:07:53+00:00;;de;False;4;0;0;0;everyone;Twitter for iPad;1098582383668940801;retweeted;2022-05-28 17:25:49.355035
825019912083038208;katrin_staffler;1098148792795303936;Vorstellung der #KIStrategie im #Forschungsausschuss. Kernpunkte: Köpfe, Struktur und Transfer. „Daten sind das Gold der #Digitalisierung. Investitionen in Köpfe sind genauso wichtig!“ Ich bin überzeugt: Unsere #Entwicklungen müssen wir noch stärker in die Praxis umsetzen.;825019912083038208;1098148792795303936;2019-02-20 09:14:09+00:00;;de;False;0;0;7;0;everyone;Twitter for iPad;;;2022-05-28 17:25:49.359565
825019912083038208;katrin_staffler;1098139963324092422;Den Glückwünschen kann ich mich nur anschließen... https://t.co/BZwKJfbJl8;825019912083038208;1098139963324092422;2019-02-20 08:39:04+00:00;;de;False;0;0;2;0;everyone;Twitter for iPad;1098130216487211008;quoted;2022-05-28 17:25:49.362486
825019912083038208;katrin_staffler;1098139587979984896;RT @ManfredWeber: Ich möchte ein neues Kapitel aufschlagen: Schluss mit der Schwarzmalerei. Euro-Krise, Migrationskrise, Brexit - wir brauc…;825019912083038208;1098139587979984896;2019-02-20 08:37:34+00:00;;de;False;41;0;0;0;everyone;Twitter for iPad;1097948995618508802;retweeted;2022-05-28 17:25:49.366124
825019912083038208;katrin_staffler;1095261114739306496;Das #Talent und die #Innovationskraft von Frauen sind unverzichtbar! Meine Erfahrung in der Wissenschaft nutze ich dafür, mehr Frauen für Berufe in der Wissenschaft zu begeistern. #InternationalerTag #WomenInScience #WissenschaftbrauchtFrauen https://t.co/iJiWbxgfVG;825019912083038208;1095261114739306496;2019-02-12 09:59:33+00:00;;de;False;3;3;16;0;everyone;Twitter for iPad;1045216476439998464;quoted;2022-05-28 17:25:49.370780
825019912083038208;katrin_staffler;1091316176087642112;Ich begrüße ausdrücklich, dass nun wirkungsvolle Maßnahmen zur Enspannung der Situation in der Unterkunfts-Dependance Fürstenfeldbruck ergriffen wurden. Um Verbesserungen gerade im… https://t.co/kc3A4V1ZHg;825019912083038208;1091316176087642112;2019-02-01 12:43:46+00:00;;de;False;0;0;1;0;everyone;Instagram;;;2022-05-28 17:25:49.374408
825019912083038208;katrin_staffler;1087056301920784384;Auch wenn das neue Jahr schon mehr als einen halben Monat auf dem Buckel hat: Der gestrige Abend hat gezeigt, dass „Neujahrsempfänge“ ein Podium für Zukunftsthemen und den inhaltlichen Austausch bieten können.... https://t.co/ycG7XBkwne;825019912083038208;1087056301920784384;2019-01-20 18:36:33+00:00;;de;False;0;0;0;0;everyone;Facebook;;;2022-05-28 17:25:49.378255
825019912083038208;katrin_staffler;1086579863404855296;Fakt ist: Wir müssen weiter intensiv daran arbeiten, unser  Bildungswesen – über alle ihre einzelnen Bestandteile hinweg – zu verbessern. Mit einer vielfältigen Palette an Maßnahmen, wird uns dies in dieser... https://t.co/JqQ3udyPU1;825019912083038208;1086579863404855296;2019-01-19 11:03:21+00:00;;de;False;1;0;3;0;everyone;Facebook;;;2022-05-28 17:25:49.381562
825019912083038208;katrin_staffler;1086376055861100549;Lieber spät als nie. Trotz saftiger Flug-Verspätung bin ich gerne noch nach Maisach gekommen. 250 Interessierte waren gekommen, um unserer Landtagspräsidentin zuzuhören. #dahoam #maisach #imgespräch  @ Maisach — in Maisach https://t.co/FVliHUmeuI;825019912083038208;1086376055861100549;2019-01-18 21:33:30+00:00;;de;False;0;0;1;0;everyone;Facebook;;;2022-05-28 17:25:49.385261
825019912083038208;katrin_staffler;1085570393228931072;"Es ist wieder Sitzungswoche...
#bundestag #brückenbauen #imgespräch #europa #greatbritain #engezusammenarbeit https://t.co/MUnXPHcOBD";825019912083038208;1085570393228931072;2019-01-16 16:12:05+00:00;;de;False;0;0;2;0;everyone;Facebook;;;2022-05-28 17:25:49.388872
825019912083038208;katrin_staffler;1084532456357875712;„Heimat für viele Heimaten“ soll Europa sein. Mit diesem Zitat hat Bernd Posselt heute seine Rede in Gröbenzell beendet. Es war nicht weniger als ein mit viel Leidenschaft und Herzblut... https://t.co/KDHd1hSAMS;825019912083038208;1084532456357875712;2019-01-13 19:27:41+00:00;;de;False;0;0;4;0;everyone;Facebook;;;2022-05-28 17:25:49.392123
825019912083038208;katrin_staffler;1083054463726825472;Gute Vorsätze fürs neue Jahr - und was wir davon schon auf den Weg gebracht haben... #wirhandeln #neuesjahr #esgehtumdiezukunft https://t.co/6wP4ds62QJ;825019912083038208;1083054463726825472;2019-01-09 17:34:40+00:00;;de;False;3;1;10;0;everyone;Facebook;;;2022-05-28 17:25:49.395110
825019912083038208;katrin_staffler;1081613281653968897;"Ein herausragendes Ende der Klausur in #seeon19 bei der Diskussion mit @krampkarrenbauer - so macht Politik Freude!
Jetzt wieder daheim im verschneiten #türkenfeld
#imgespräch #schneetreiben #schneemann #wasmanalstantesomacht #womeninpolitics  @... https://t.co/SW9vyIsj1t";825019912083038208;1081613281653968897;2019-01-05 18:07:56+00:00;;de;False;1;0;12;0;everyone;Facebook;;;2022-05-28 17:25:49.397818
825019912083038208;katrin_staffler;1079770923517890561;Silvesterritt mit langer Tradition - schon zum 211. Mal hat sich der traditionsreiche Festzug in Bewegung gesetzt.  Erst durch Türkenfeld, bevor er vor der Pfarrkirche Mariä Himmelfahrt mit der Pferdesegnung... https://t.co/ZK3D2hv2LJ;825019912083038208;1079770923517890561;2018-12-31 16:07:03+00:00;;de;False;0;0;1;0;everyone;Facebook;;;2022-05-28 17:25:49.400886
825019912083038208;katrin_staffler;1079770193637842949;Silvesterritt mit langer Tradition - schon zum 211. Mal hat sich der traditionsreiche Festzug in Bewegung gesetzt.  Erst durch Türkenfeld, bevor er vor der Pfarrkirche Mariä Himmelfahrt mit der Pferdesegnung... https://t.co/gsSyeDmfx7;825019912083038208;1079770193637842949;2018-12-31 16:04:09+00:00;;de;False;0;0;1;0;everyone;Facebook;;;2022-05-28 17:25:49.404732
825019912083038208;katrin_staffler;1077180189111668736;Benjamin Miskowitsch, Bernhard Seidenath und ich waren heute im Wahlkreis unterwegs, um DANKE zu sagen. Danke denjenigen, die am Heiligen Abend und an den bevorstehenden Feiertagen für die... https://t.co/s8jwJLvlnF;825019912083038208;1077180189111668736;2018-12-24 12:32:24+00:00;;de;False;0;0;3;0;everyone;Facebook;;;2022-05-28 17:25:49.407701
825019912083038208;katrin_staffler;1076821465096306688;Neu und jung 😊 https://t.co/jORYS9jsfZ;825019912083038208;1076821465096306688;2018-12-23 12:46:58+00:00;;de;False;0;0;3;0;everyone;Facebook;;;2022-05-28 17:25:49.410506
825019912083038208;katrin_staffler;1075865766526967813;Bevor wir heute im Fürstenfeldbrucker Kreistag den Haushalt für das Jahr 2019 verabschiedet haben, ging‘s zu den Medienmachern im Landkreis. https://t.co/UHWk3eQmIx;825019912083038208;1075865766526967813;2018-12-20 21:29:22+00:00;;de;False;0;0;1;0;everyone;Facebook;;;2022-05-28 17:25:49.413492
825019912083038208;katrin_staffler;1075294191935197184;Ein echter Meilenstein für Maisach und darüber hinaus: Gestern wurde die Südumfahrung offiziell freigegeben. Danke an alle Beteiligten für die Hartnäckig. Hans Seidl, Du kannst als Bürgermeister zu Recht stolz auf die Entwicklung Deiner Gemeinde sein! https://t.co/rBtbgt9Kg0;825019912083038208;1075294191935197184;2018-12-19 07:38:08+00:00;;de;False;0;0;3;0;everyone;Facebook;;;2022-05-28 17:25:49.416496
825019912083038208;katrin_staffler;1073586575198601217;Die heutige Debatte hat deutlich gemacht, dass wir uns alle über eine entscheidende Tatsache einig sind: Unsere Wissenschaftler und Wissenschaftlerinnen sind essentiell für die Innovations- und Leistungsfähigkeit... https://t.co/e5xibt6ksY;825019912083038208;1073586575198601217;2018-12-14 14:32:40+00:00;;de;False;1;0;5;0;everyone;Facebook;;;2022-05-28 17:25:49.419743
825019912083038208;katrin_staffler;1073235509701423105;"„Das beste für alle Beteiligten wäre der Exit von Brexit!“ Vielen Dank für diese klaren Worte Florian Peter Hahn
Für uns ist klar: Es kann keine Nachverhandlungen mit Großbritannien geben. https://t.co/U8vMNMnOpz";825019912083038208;1073235509701423105;2018-12-13 15:17:39+00:00;;de;False;0;1;9;0;everyone;Facebook;;;2022-05-28 17:25:49.422777
825019912083038208;katrin_staffler;1071375266763694081;"Ein für unsere Region besonders wichtiges Thema!

#Grundsteuer #Wohnraum #nochmalnachdenken #Zukunft https://t.co/0RTxXQ0bnR";825019912083038208;1071375266763694081;2018-12-08 12:05:43+00:00;;de;False;0;1;1;0;everyone;Facebook;;;2022-05-28 17:25:49.425628
825019912083038208;katrin_staffler;1070926618229702658;"Gespannt schauen wir heute nach #Hamburg. Die CDU trifft eine wegweisende Entscheidung, die auch für uns als Schwesterpartei große Bedeutung hat!
#MoinMoin #guteWahl #Zukunft https://t.co/9DeHl8BoNc";825019912083038208;1070926618229702658;2018-12-07 06:22:57+00:00;;de;False;0;0;0;0;everyone;Facebook;;;2022-05-28 17:25:49.429474
825019912083038208;katrin_staffler;1070063033513209856;Tolle Eindrücke von der Forschungslandschaft in #Frankreich ! Neben #gehirnen beschäftigen wir uns hauptsächlich mit #künstlicherintelligenz 😉 @ Paris, France — in Paris, Frankreich https://t.co/WXs3aILHgP;825019912083038208;1070063033513209856;2018-12-04 21:11:22+00:00;;de;False;0;0;2;0;everyone;Facebook;;;2022-05-28 17:25:49.432060
825019912083038208;katrin_staffler;1069683393984630785;Eine gute Nachricht! Ich freue mich sehr für die CSU Dachau, die mit Peter Strauch einen großartigen OB-Kandidaten auf den Schild heben will. Lieber Peter,... https://t.co/naPgccL7S3;825019912083038208;1069683393984630785;2018-12-03 20:02:49+00:00;;de;False;1;0;2;0;everyone;Facebook;;;2022-05-28 17:25:49.435626
