twitter_id;twitter_handle;tweet_id;tweet_text;tweet_author_id;tweet_conversation_id;tweet_created_at;tweet_in_reply_to_user_id;tweet_lang;tweet_possibly_sensitive;tweet_retweet_count;tweet_reply_count;tweet_like_count;tweet_quote_count;tweet_reply_settings;tweet_source;tweet_referenced_tweet_id;tweet_referenced_tweet_type;api_call
17535941;christianduerr;1530514846441250821;RT @MarcoBuschmann: Es ist erschreckend, mit welchen Vokabeln manch einer um sich wirft. Freiheit ist kein Fetisch, sondern Fundamentalwert…;17535941;1530514846441250821;2022-05-28 11:42:29+00:00;;de;False;594;0;0;0;everyone;Twitter for iPhone;1530478343803523073;retweeted;2022-05-28 16:35:40.198886
17535941;christianduerr;1529458809684512768;Endlich haben wir die 3G-Pflichten bei der Einreise auslaufen lassen. Das war ein weiterer, richtiger Schritt in Richtung #Normalität. Wir nehmen damit endlich Abstand von Freiheitsbeschränkungen auf Vorrat. Sollten neue Virusvariantengebiete erkannt werden, sind wir vorbereitet.;17535941;1529458809684512768;2022-05-25 13:46:10+00:00;;de;False;21;113;187;2;everyone;Twitter for iPhone;;;2022-05-28 16:35:40.201422
17535941;christianduerr;1529372061860339713;Der Amoklauf in #Texas erschüttert uns bis ins Mark. Schulen sollten ein sicherer Ort des Lernens, Entwickelns und Wachsens sein. Aber nicht der Angst, weder für Kinder noch für Eltern oder Lehrerinnen und Lehrer. Meine Gedanken sind in #Uvalde.;17535941;1529372061860339713;2022-05-25 08:01:28+00:00;;de;False;4;11;69;2;everyone;Twitter for iPhone;;;2022-05-28 16:35:40.204439
17535941;christianduerr;1529065476449570817;Der Bericht zu den #XinjiangPoliceFiles ist erschütternd. Die Unterdrückung der #Uiguren ist grauenvoll und inakzeptabel. Wir brauchen jetzt eine einheitliche europäische und transatlantische Abstimmung im Umgang mit #China. Zur Menschenrechtslage darf nicht geschwiegen werden.;17535941;1529065476449570817;2022-05-24 11:43:12+00:00;;de;False;20;31;153;3;everyone;Twitter for iPhone;;;2022-05-28 16:35:40.207883
17535941;christianduerr;1529041138635743238;Wir müssen auch an die Generationen unserer #Kinder denken: Solide Finanzen sind die Grundlage für den Wohlstand von morgen. Eine Politik wie zu Zeiten der #GroKo, in der alle Unstimmigkeiten mit Geld zugeschüttet werden, wird es mit der #FDP nicht geben. (3/3);17535941;1529041135448035329;2022-05-24 10:06:30+00:00;17535941;de;False;4;19;24;4;everyone;Twitter for iPhone;1529041136903405568;replied_to;2022-05-28 16:35:40.210894
17535941;christianduerr;1529041136903405568;Es war ein Anliegen der FDP, die #Schuldenbremse als harte Budget-Regel zu stärken und in dieser Frage gibt es in der #Ampel auch keine zwei Meinungen mehr. (2/3);17535941;1529041135448035329;2022-05-24 10:06:29+00:00;17535941;de;False;4;4;21;0;everyone;Twitter for iPhone;1529041135448035329;replied_to;2022-05-28 16:35:40.213810
17535941;christianduerr;1529041135448035329;Wir werden nicht tricksen, um #Milliardenhilfen für die Bundeswehr zu finanzieren. Uns allen ist klar, dass das Sondervermögen eine Verankerung im Grundgesetz braucht. Es ist ausgeschlossen, dass wir die #Schuldenbremse mit einfacher Mehrheit aufweichen. (1/3);17535941;1529041135448035329;2022-05-24 10:06:29+00:00;;de;False;5;8;31;1;everyone;Twitter for iPhone;;;2022-05-28 16:35:40.216646
17535941;christianduerr;1528799621685837826;RT @DasErste: Tank und Einkaufswagen voll: Können sich das nur noch die Reichen leisten? @Hartaberfair mit @ChristianDuerr (@FDP), Anja Koh…;17535941;1528799621685837826;2022-05-23 18:06:48+00:00;;de;False;8;0;0;0;everyone;Twitter for iPhone;1528780301387833352;retweeted;2022-05-28 16:35:40.219381
17535941;christianduerr;1528651180422873090;Heute vor 73 Jahren wurde das #Grundgesetz verkündet. Wir können stolz sein, auf diese starke Basis unserer rechtsstaatlichen #Demokratie. Eine #Werteordnung, für die sich nach wie vor ein unermüdlicher Einsatz lohnt. Happy birthday, liebes #GG!;17535941;1528651180422873090;2022-05-23 08:16:57+00:00;;de;False;5;9;35;0;everyone;Twitter for iPhone;;;2022-05-28 16:35:40.222283
17535941;christianduerr;1528636526707580929;RT @AZ_Augsburg: Seit Dezember steht @christianduerr an der Spitze der @fdp-Fraktion. Warum er die #Corona-Politik seiner Partei verteidigt…;17535941;1528636526707580929;2022-05-23 07:18:43+00:00;;de;False;10;0;0;0;everyone;Twitter for iPhone;1528616766179516421;retweeted;2022-05-28 16:35:40.224992
17535941;christianduerr;1527666025247940609;Danke @th_sattelberger, für deinen unermüdlichen Einsatz für Bildung und Forschung im @BMBF_Bund und @fdpbt. Ich habe den größten Respekt vor dieser persönlichen Entscheidung. Wir werden dich in der Fraktion sehr vermissen.;17535941;1527666025247940609;2022-05-20 15:02:17+00:00;;de;False;7;7;110;3;everyone;Twitter for iPhone;;;2022-05-28 16:35:40.227606
17535941;christianduerr;1527622803310133248;Soeben hat nach dem #Bundestag auch der @bundesrat dem #9EuroTicket zugestimmt. 💪Gemeinsam mit dem #Tankrabatt ist das eine wichtige Entlastung für die hart arbeitende Mitte!;17535941;1527622803310133248;2022-05-20 12:10:32+00:00;;de;False;10;170;63;21;everyone;Twitter for iPhone;;;2022-05-28 16:35:40.230937
17535941;christianduerr;1527243416131850240;"Erschütternde Nachrichten aus #Bremerhaven. Meine Gedanken sind bei der Verletzten, den Betroffenen in der Schule &amp; den Einsatzkräften. Jegliche Infos bitte an die #Polizei, verbreitet keine ungesicherten Informationen. Ich hoffe, dass diese schreckliche Tat bald aufgeklärt wird. https://t.co/DAL0tBCe4E";17535941;1527243416131850240;2022-05-19 11:02:59+00:00;;de;False;3;0;11;0;everyone;Twitter for iPhone;1527222226294022146;quoted;2022-05-28 16:35:40.236103
17535941;christianduerr;1527218552519917568;Die Auswirkungen des Krieges gehen über #Europa hinaus. Es ist die Verantwortung der #EU, jetzt insbesondere das Thema Nahrungsmittelknappheit zu adressieren. Wir beobachten eine starke Inflation - anderswo bedeutet dieser #Krieg eine existenzielle Ernährungskrise. #Bundestag https://t.co/l5dfs3Ttco;17535941;1527218552519917568;2022-05-19 09:24:11+00:00;;de;False;4;6;23;1;everyone;Twitter for iPhone;;;2022-05-28 16:35:40.240092
17535941;christianduerr;1527202464918913024;Was @_FriedrichMerz heute im #Bundestag gesagt hat, war in Wahrheit keine Abrechnung mit der Bundesregierung, sondern mit der eigenen Regierungsverantwortung von CDU und CSU in den letzten 16 Jahren.;17535941;1527202464918913024;2022-05-19 08:20:16+00:00;;de;False;90;108;646;15;everyone;Twitter Web App;;;2022-05-28 16:35:40.243092
17535941;christianduerr;1527199630328483840;Der Beschluss des europäischen Ausstiegs und die Unabhängigkeit von russischen Rohstoffimporten ist ein Meilenstein! Wir müssen diesen Beschluss jetzt schnellstmöglich umsetzen. #Bundestag;17535941;1527199630328483840;2022-05-19 08:09:00+00:00;;de;False;6;4;24;0;everyone;Twitter for iPhone;;;2022-05-28 16:35:40.245987
17535941;christianduerr;1527199496404336640;Wir stehen als westliche Verbündete zusammen - das, was Russland immer verhindern wollte. Dass Schweden und Finnland den #NATO-Beitritt beantragt haben, ist ein gutes Zeichen. Tervetullut #Finnland, Välkommen #Schweden. #Bundestag;17535941;1527199496404336640;2022-05-19 08:08:28+00:00;;de;False;4;0;13;0;everyone;Twitter for iPhone;;;2022-05-28 16:35:40.250469
17535941;christianduerr;1527198388059623424;Die Konsequenzen des Krieges in der #Ukraine für die internationale Ordnung sind dramatisch. Denn das Alte kommt nicht wieder. Die alte Welt wird so nicht wiederkommen. #Bundestag;17535941;1527198388059623424;2022-05-19 08:04:04+00:00;;de;False;1;1;13;0;everyone;Twitter for iPhone;;;2022-05-28 16:35:40.254053
17535941;christianduerr;1526927079954165767;RT @starkwatzinger: Aus dem Nebenjob gekündigt, aufs #BAföG keinen Anspruch: in der Pandemie fielen viele junge Menschen durchs Raster. Doc…;17535941;1526927079954165767;2022-05-18 14:05:59+00:00;;de;False;15;0;0;0;everyone;Twitter for iPhone;1526905498532032512;retweeted;2022-05-28 16:35:40.258750
17535941;christianduerr;1526886748843823105;Dass #Finnland und #Schweden den #NATO-Beitritt beantragen, ist der richtige Schritt. Der Angriff auf die #Ukraine ist ein Angriff auf alle westlichen Demokratien und auf unsere freiheitlichen Werte. Jetzt gilt es, gemeinsam als Bündnis entschieden zusammenzuhalten.;17535941;1526886748843823105;2022-05-18 11:25:43+00:00;;de;False;5;1;44;0;everyone;Twitter Web App;;;2022-05-28 16:35:40.262046
17535941;christianduerr;1526576577668079616;Angesichts der steigenden #Inflation muss die Ampel über zusätzliche Entlastung sprechen. Entlastung bedeutet für uns, dass der Staat den Menschen weniger wegnimmt - nicht, dass er mehr #Zuschüsse zahlt. Eine Möglichkeit wären steuerliche #Entlastungen bei der kalten Progression.;17535941;1526576577668079616;2022-05-17 14:53:13+00:00;;de;False;18;52;188;5;everyone;Twitter Web App;;;2022-05-28 16:35:40.267083
17535941;christianduerr;1525947843734867973;„Ich halte die Schuldenbremse für richtig.“ #AnneWill;17535941;1525947843734867973;2022-05-15 21:14:51+00:00;;de;False;6;4;30;1;everyone;Twitter for iPhone;;;2022-05-28 16:35:40.271978
17535941;christianduerr;1525942163489665024;„Dass wir in dieser schwierigen Situation Entlastungen in Höhe von 37 Milliarden Euro auf den Weg bringen, damit hätte ich zu Beginn dieser Koalition nicht gerechnet. Das haben wir aber in kürzester Zeit entschieden.“ #AnneWill;17535941;1525942163489665024;2022-05-15 20:52:17+00:00;;de;False;4;8;41;3;everyone;Twitter for iPhone;;;2022-05-28 16:35:40.274999
17535941;christianduerr;1525938052484542464;„Richtig ist: Wir stehen vor dramatischen Entscheidungen: Das Alte kommt nicht wieder zurück. Die gesamte geopolitische Situation wird sich komplett ändern. Davor habe ich auch als Regierungsabgeordneter großen Respekt. Aber wir gehen es an.“ #AnneWill;17535941;1525938052484542464;2022-05-15 20:35:56+00:00;;de;False;3;6;33;0;everyone;Twitter for iPhone;;;2022-05-28 16:35:40.277567
17535941;christianduerr;1525936322321465345;„Wir haben hier drei sehr unterschiedliche Parteien, da machen wir auch kein Geheimnis draus. Wir haben aber gleichzeitig zentrale Projekte definiert, die in der CDU-geführten Bundesregierung liegen geblieben sind. Und das hält zusammen!“ #AnneWill;17535941;1525936322321465345;2022-05-15 20:29:04+00:00;;de;False;5;6;53;2;everyone;Twitter for iPhone;;;2022-05-28 16:35:40.280729
17535941;christianduerr;1525911111018721280;Das Wahlergebnis in NRW ist eine herbe Enttäuschung für uns. Wie @c_lindner gesagt hat: Wir gewinnen zusammen - und wir verlieren zusammen. Wir werden das Ergebnis jetzt aufarbeiten. #NRW2022;17535941;1525911111018721280;2022-05-15 18:48:53+00:00;;de;False;13;128;229;6;everyone;Twitter for iPhone;;;2022-05-28 16:35:40.285931
17535941;christianduerr;1525801551465435136;RT @fdp_nrw: Fortschritt oder Rückschritt - darum geht es heute bei der #ltwnrw! Wir wollen #vonhierausweiter in die Zukunft: Mit individue…;17535941;1525801551465435136;2022-05-15 11:33:32+00:00;;de;False;46;0;0;0;everyone;Twitter for iPhone;1525717110541889537;retweeted;2022-05-28 16:35:40.289834
17535941;christianduerr;1525780806739836930;NRW wählt heute! Mit @JoachimStamp an der Spitze hat die @fdp_nrw das Land freier, moderner und sozialer gemacht. Deswegen beide Stimmen für die #FDP! 💛 #nrwwahl2022;17535941;1525780806739836930;2022-05-15 10:11:06+00:00;;de;False;6;39;93;1;everyone;Twitter for iPhone;;;2022-05-28 16:35:40.293757
17535941;christianduerr;1525101923023691776;"RT @AnneWillTalk: Am Sonntag, den 15. Mai 2022 diskutiert 
@annewill mit @larsklingbeil, @Ricarda_Lang,
@christianduerr, @jensspahn und @Ma…";17535941;1525101923023691776;2022-05-13 13:13:28+00:00;;de;False;22;0;0;0;everyone;Twitter Web App;1525086452702494722;retweeted;2022-05-28 16:35:40.297526
17535941;christianduerr;1525032400622866432;RT @MAStrackZi: Ich freue mich, dass der @Bundeskanzler meiner Einladung gefolgt und heute in den #Verteidigungsausschuss gekommen ist. In…;17535941;1525032400622866432;2022-05-13 08:37:12+00:00;;de;False;153;0;0;0;everyone;Twitter for iPhone;1525028661933613056;retweeted;2022-05-28 16:35:40.300849
17535941;christianduerr;1524785297086726144;RT @JoachimStamp: Offene Gesellschaft, Teilhabe, Talentförderung - das war ein richtig schönes gemeinsames Gespräch mit @EkoFreezy und @faz…;17535941;1524785297086726144;2022-05-12 16:15:18+00:00;;de;False;25;0;0;0;everyone;Twitter Web App;1524750172051234817;retweeted;2022-05-28 16:35:40.304166
17535941;christianduerr;1524760298753769472;Vielen Dank für den Besuch und das gute Gespräch, liebe @mariapapakyria2! https://t.co/VvXl8cX4Sd;17535941;1524760298753769472;2022-05-12 14:35:58+00:00;;de;False;3;0;9;0;everyone;Twitter for iPhone;1524757062609248256;quoted;2022-05-28 16:35:40.306815
17535941;christianduerr;1524736274799726592;Thank you, @DmytroKuleba, for your visit and the honest and truly remarkable conversation earlier today alongside our Minister of Finance @c_lindner. We will continue to do everything we can to support our friends in the Ukraine. https://t.co/HTb5Q44uCM;17535941;1524736274799726592;2022-05-12 13:00:30+00:00;;en;False;4;0;39;0;everyone;Twitter for iPhone;;;2022-05-28 16:35:40.310205
17535941;christianduerr;1524646249458286592;"Mit der #BAföG-Reform füllt die #Ampel das von der Union vernachlässigte Aufstiegsversprechen wieder mit Leben. 
1⃣ Beiträge und Wohnzuschläge werden angehoben, 
2⃣ Die Zuverdienstregelungen gelockert 
3⃣ Die Elternfreibeträge und Altersgrenze erhöht.
Ein wichtiges Signal!";17535941;1524646249458286592;2022-05-12 07:02:47+00:00;;de;False;18;17;146;0;everyone;Twitter for iPhone;;;2022-05-28 16:35:40.314793
17535941;christianduerr;1524351745903763458;"Eine volle #Sitzungswoche startet heute:
#BAföG-Reform, #Entlastungspaket, Energiesteuersenkung, Rentenerhöhung und Abschaffung #219a…Die-Ampelfraktionen packen den Reform-Stau an 🙌. Ich freue mich auf die Debatten. #Bundestag";17535941;1524351745903763458;2022-05-11 11:32:31+00:00;;de;False;7;6;46;0;everyone;Twitter for iPhone;;;2022-05-28 16:35:40.318594
17535941;christianduerr;1524019843602784257;"RT @fdpbt: #Ampel schafft 37 Mrd. Euro #Entlastungen: 
1⃣ #EEGUmlage wird früher abgeschafft.
2⃣ Anhebung AN-Pauschbetrag, Grundfreibetrag…";17535941;1524019843602784257;2022-05-10 13:33:40+00:00;;de;False;30;0;0;0;everyone;Twitter Web App;1524019735184257025;retweeted;2022-05-28 16:35:40.322959
17535941;christianduerr;1523222644283346944;An alle Schleswig-Holsteiner: Heute ist #Landtagswahl! Geht wählen 💪🏼 #ltwsh22 https://t.co/ishqaOpHuS;17535941;1523222644283346944;2022-05-08 08:45:53+00:00;;de;False;2;1;27;0;everyone;Twitter for iPhone;1523219611453382657;quoted;2022-05-28 16:35:40.326406
17535941;christianduerr;1522869615566770178;Macht mal 👌🏻freue mich über die Ergebnisse am Dienstag ☺️ @BriHasselmann und ich werden dann kritisch prüfen 😉 https://t.co/azLc7hxxsV;17535941;1522869615566770178;2022-05-07 09:23:04+00:00;;de;False;4;0;13;0;everyone;Twitter for iPhone;1522852080125419520;quoted;2022-05-28 16:35:40.330193
17535941;christianduerr;1522465120558931969;Danach darf man sich schließlich auch ohne #Nachweispflicht frei durchs Land bewegen. Sollte in Zukunft außerhalb von #Deutschland eine gefährliche Virusvariante auftreten, sind wir jederzeit in der Lage, für die Einreise aus bestimmten Ländern neue Regeln zu verhängen. (2/2);17535941;1522465119032197120;2022-05-06 06:35:45+00:00;17535941;de;False;12;18;150;1;everyone;Twitter for iPhone;1522465119032197120;replied_to;2022-05-28 16:35:40.334280
17535941;christianduerr;1522465119032197120;Die #Corona-Bestimmungen für die Einreise nach Deutschland sind überholt. Nachdem wir Maßnahmen bundesweit abgeschafft haben, sollten nun auch die strengen Einreisebestimmungen auslaufen. Die #3G-Regel bei der Ankunft ist wenig sinnvoll. (1/2);17535941;1522465119032197120;2022-05-06 06:35:45+00:00;;de;False;143;76;1249;3;everyone;Twitter for iPhone;;;2022-05-28 16:35:40.338457
17535941;christianduerr;1522176631560974336;Das 9-Euro-Ticket schafft jetzt eine sinnvolle Möglichkeit, alternative #Mobilitätsarten zum Auto zu testen, entlastet die Menschen (auch die, die bereits ein Abo haben) und hilft beim #Klimaschutz... Sylt wird sicher nicht das einzige Ausflugsziel der Menschen bleiben 😉;17535941;1522176631560974336;2022-05-05 11:29:24+00:00;;de;False;5;9;34;0;everyone;Twitter for iPhone;;;2022-05-28 16:35:40.341101
17535941;christianduerr;1521789353978126337;Positiv getestete, aber symptomfreie Personen, sollten mit #Maske und Abstand das Haus verlassen können. Ich bin davon überzeugt, dass die Menschen in dieser Frage eigenverantwortlich Entscheidungen treffen können. Dafür braucht es nicht länger eine staatliche Regulierung. (2/2);17535941;1521789352455684100;2022-05-04 09:50:30+00:00;17535941;de;False;22;57;243;4;everyone;Twitter for iPhone;1521789352455684100;replied_to;2022-05-28 16:35:40.344238
17535941;christianduerr;1521789352455684100;Wir sollten bei den Quarantäne-Regeln dem Beispiel Großbritanniens, der Niederlande und anderen europäischen Ländern folgen und auf #Freiwilligkeit setzen - weg von einer verpflichtenden Selbstisolation hin zur Empfehlung. (1/2);17535941;1521789352455684100;2022-05-04 09:50:29+00:00;;de;False;147;140;1447;22;everyone;Twitter for iPhone;;;2022-05-28 16:35:40.348723
17535941;christianduerr;1521413918090047489;Journalisten und Journalistinnen, die sich den staatlichen Verboten widersetzen, drohen Geld- und Haftstrafen. Unabhängige Berichterstattung darf niemanden die Freiheit kosten. Meine Anerkennung gilt allen, die für unabhängige Presse kämpfen und dabei große Opfer erbringen. (2/2);17535941;1521413916684869633;2022-05-03 08:58:39+00:00;17535941;de;False;1;2;8;0;everyone;Twitter for iPhone;1521413916684869633;replied_to;2022-05-28 16:35:40.353026
17535941;christianduerr;1521413916684869633;Die #Pressefreiheit ist ein hohes Gut. In vielen Ländern sind wir aber von einer freien Berichterstattung weit entfernt. In Russland etwa, wo die Regierung die völkerrechtswidrige Invasion der Ukraine angeordnet hat, aber den Begriff „Krieg“ in den Nachrichten verbietet. (1/2);17535941;1521413916684869633;2022-05-03 08:58:38+00:00;;de;False;1;2;13;1;everyone;Twitter for iPhone;;;2022-05-28 16:35:40.356217
17535941;christianduerr;1521239995771670528;RT @MarcoBuschmann: Die Union wollte Klarheit von der Koalition, wie wir zu Waffenlieferungen stehen. Die haben wir hergestellt: Die @fdp m…;17535941;1521239995771670528;2022-05-02 21:27:32+00:00;;de;False;52;0;0;0;everyone;Twitter for iPad;1521231195891249161;retweeted;2022-05-28 16:35:40.359321
17535941;christianduerr;1520056145179729921;"Ein wichtiges Thema, das wir als FDP im Bundestag unterstützen, @MarcoBuschmann &amp;  @JoachimStamp! https://t.co/uOuo2vJQXS";17535941;1520056145179729921;2022-04-29 15:03:20+00:00;;de;False;2;0;11;0;everyone;Twitter for iPhone;1519958722633732097;quoted;2022-05-28 16:35:40.362329
17535941;christianduerr;1520033397778886657;RT @c_lindner: Dem Kollegen Robert #Habeck wünsche ich gute Besserung und eine schnelle Genesung - hoffentlich ebenfalls nur ein milder Ver…;17535941;1520033397778886657;2022-04-29 13:32:57+00:00;;de;False;135;0;0;0;everyone;Twitter for iPhone;1520004779866472449;retweeted;2022-05-28 16:35:40.365518
17535941;christianduerr;1519949256982945792;Lieber @johannesvogel, meinen herzlichen Glückwunsch zu deinem runden Geburtstag! Ich freue mich auf die nächsten Jahre guter Zusammenarbeit im Team @fdpbt! Bleib wie du bist :-) https://t.co/irqwCf1Sa2;17535941;1519949256982945792;2022-04-29 07:58:36+00:00;;de;False;4;9;135;2;everyone;Twitter for iPhone;;;2022-05-28 16:35:40.371238
17535941;christianduerr;1519938318804434945;Seit vielen Jahren sind die Strompreise immer weiter angestiegen. Mit der Abschaffung der #EEG Umlage setzt die #Ampel dem ein Ende. Damit wird der Strom endlich günstiger! 💪;17535941;1519938318804434945;2022-04-29 07:15:08+00:00;;de;False;9;117;141;6;everyone;Twitter for iPhone;;;2022-05-28 16:35:40.373901
17535941;christianduerr;1519607901974896641;RT @fdpbt: „Wir liefern die Waffen, die auch Alliierte liefern. Wir liefern, was unsere Verteidigungsfähigkeit nicht gefährdet. Deshalb lie…;17535941;1519607901974896641;2022-04-28 09:22:11+00:00;;de;False;13;0;0;0;everyone;Twitter for iPhone;1519596377139040256;retweeted;2022-05-28 16:35:40.376752
17535941;christianduerr;1519600755715543043;"""Wir werden die wirtschaftlichen Beziehungen mit Putins Russland beenden und die Beziehungen zu liberalen Demokratien weltweit stärken. Deshalb ist es richtig, dass @Bundeskanzler nach Japan reist um genau das zu tun! Danke!"" #Bundestag https://t.co/fDeOGyn26T";17535941;1519600755715543043;2022-04-28 08:53:47+00:00;;de;False;5;1;32;0;everyone;Twitter for iPhone;;;2022-05-28 16:35:40.379493
17535941;christianduerr;1519590703394922496;RT @StephanThomae: „Wir werden als Deutschland, als Westen, die Kriegsverbrecher zur Rechenschaft ziehen.“ Starke Rede von @christianduerr…;17535941;1519590703394922496;2022-04-28 08:13:50+00:00;;de;False;2;0;0;0;everyone;Twitter for iPhone;1519588669883142144;retweeted;2022-05-28 16:35:40.382274
17535941;christianduerr;1519584057348263936;#Butscha ist kein Einzelfall. Jeder russische Vorstoß bedeutet, dass sich diese Verbrechen wiederholen. Die Lieferung schwerer Waffen ist keine Selbstverständlichkeit, aber sie ist jetzt eine Notwendigkeit.;17535941;1519584057348263936;2022-04-28 07:47:26+00:00;;de;False;13;23;127;2;everyone;Twitter Web App;;;2022-05-28 16:35:40.385623
17535941;christianduerr;1519583448549281792;"RT @carina_konrad: ""Dieser Krieg ist mit nichts zu rechtfertigen. Es ist ein Krieg gegen jede Humanität. Wir dürfen uns an die Bilder aus d…";17535941;1519583448549281792;2022-04-28 07:45:01+00:00;;de;False;2;0;0;0;everyone;Twitter Web App;1519581744827187200;retweeted;2022-05-28 16:35:40.388259
17535941;christianduerr;1519583351325270017;Es ist im sicherheitspolitischen Interesse Deutschlands, dass die Ukraine diesen Krieg nicht verliert. Deshalb müssen wir alles tun, um die Ukraine zu unterstützen. Dafür steht der Antrag aus der Mitte des Hauses. #Bundestag;17535941;1519583351325270017;2022-04-28 07:44:38+00:00;;de;False;12;68;153;1;everyone;Twitter Web App;;;2022-05-28 16:35:40.391030
17535941;christianduerr;1519581909772296194;Wir müssen den Krieg, den Russland führt, verurteilen - an jedem Tag, in jeder Stunde. Wir dürfen uns an die Bilder aus der #Ukraine nicht gewöhnen. #Bundestag;17535941;1519581909772296194;2022-04-28 07:38:54+00:00;;de;False;1;0;24;0;everyone;Twitter Web App;;;2022-05-28 16:35:40.393913
17535941;christianduerr;1519326273285279745;"Es ist gut, dass @cducsubt ihre Forderungen über Bord geworfen haben &amp; unseren Antrag unterstützen. Wir müssen alles in unserer Macht stehende tun, um der Ukraine zu helfen - es ist ein wichtiges Signal, dass sich die demokratische Mitte im #Bundestag in dieser Frage einig ist.";17535941;1519326273285279745;2022-04-27 14:43:05+00:00;;de;False;30;68;306;4;everyone;Twitter Web App;;;2022-05-28 16:35:40.396589
17535941;christianduerr;1519263523116826631;Gut, dass wir heute im #Bundestag die Weichen stellen für die Modernisierung der #Bundeswehr. Wir werden mit unserem Gesetzentwurf zum #Bundeswehr-Sondervermögen endlich das erneuern, was mit der #Union die letzten 16 Jahre auf Verschleiß gefahren worden ist!;17535941;1519263523116826631;2022-04-27 10:33:45+00:00;;de;False;26;149;329;9;everyone;Twitter for iPhone;;;2022-05-28 16:35:40.399060
17535941;christianduerr;1519242230795542528;RT @fdpbt: Im Angesicht des Ukraine-Krieges muss Deutschland noch schneller handeln. Daher bringen die Regierungsfraktionen diese Woche ein…;17535941;1519242230795542528;2022-04-27 09:09:08+00:00;;de;False;11;0;0;0;everyone;Twitter Web App;1519226928464637953;retweeted;2022-05-28 16:35:40.402710
17535941;christianduerr;1518981445188005889;RT @TatsianaKhomich: With representatives of parties @fdp @BDEU_SPD @GermanGreens @cducsubt discussed conditions of detention for political…;17535941;1518981445188005889;2022-04-26 15:52:52+00:00;;en;False;10;0;0;0;everyone;Twitter Web App;1518923578393120768;retweeted;2022-05-28 16:35:40.405660
17535941;christianduerr;1518946301072887808;@VCmilyte @fdpbt It was a pleasure to meet you, thank you for joining our meeting.;17535941;1518943416704540673;2022-04-26 13:33:13+00:00;1083334381;en;False;1;0;7;0;everyone;Twitter for iPhone;1518943416704540673;replied_to;2022-05-28 16:35:40.408240
17535941;christianduerr;1518945200835645441;RT @VCmilyte: At a time when freedom is under attack in Europe, the voice of Europe's political parties, which have freedom as a fundamenta…;17535941;1518945200835645441;2022-04-26 13:28:51+00:00;;en;False;13;0;0;0;everyone;Twitter for iPhone;1518943416704540673;retweeted;2022-05-28 16:35:40.411166
17535941;christianduerr;1518916615441727488;Die #Ampel ist sich einig: Die #Ukraine muss jetzt mit schweren Waffen bestmöglich unterstützt werden. Wir laden die #Union ein, sich unserem Antrag anzuschließen und ihrer staatspolitischen Verantwortung gerecht zu werden.;17535941;1518916615441727488;2022-04-26 11:35:15+00:00;;de;False;46;156;363;19;everyone;Twitter for iPhone;;;2022-05-28 16:35:40.415250
17535941;christianduerr;1518321748785180673;"RT @tagesthemen: ""Was die Politik in diesen Zeiten braucht, sind heißes Herz und kühler Kopf."" Die Meinung von @jahn_frank zum FDP-Bundespa…";17535941;1518321748785180673;2022-04-24 20:11:28+00:00;;de;False;41;0;0;0;everyone;Twitter for iPhone;1517985082144870400;retweeted;2022-05-28 16:35:40.419782
