twitter_id;twitter_handle;tweet_id;tweet_text;tweet_author_id;tweet_conversation_id;tweet_created_at;tweet_in_reply_to_user_id;tweet_lang;tweet_possibly_sensitive;tweet_retweet_count;tweet_reply_count;tweet_like_count;tweet_quote_count;tweet_reply_settings;tweet_source;tweet_referenced_tweet_id;tweet_referenced_tweet_type;api_call
1469264387512979461;ABaerbock;1486327106007146499;"Hartelijk welkom in Berlijn, @WBHoekstra! Deutschland und die #Niederlande stehen für dieselben Werte &amp; Ziele, nicht nur beim #Klimaschutz, sondern gerade auch an der Seite mit der #Ukraine bei der Verteidigung ihrer #Souveränität. Unsere stärkste Waffe ist unsere Einigkeit. https://t.co/H64suFxlRE";1469264387512979461;1486327106007146499;2022-01-26 13:16:11+00:00;;de;False;65;144;644;26;everyone;Twitter for iPhone;;;2022-05-28 15:50:38.680867
1469264387512979461;ABaerbock;1485345056290742274;"Gestern haben wir den deutsch-französischen Tag gefeiert. Heute Abend habe ich meinen 🇫🇷 Kollegen @JY_LeDrian in Brüssel getroffen, vor dem Treffen der #EU-Außenminister*innen morgen. 
Unsere enge 🇩🇪-🇫🇷 Freundschaft bleibt Antrieb für ein starkes Europa! 
#ViveLaFreundschaft";1469264387512979461;1485345056290742274;2022-01-23 20:13:52+00:00;;de;False;54;162;772;11;everyone;Twitter for iPhone;;;2022-05-28 15:50:38.684888
1469264387512979461;ABaerbock;1484786278155567105;"RT @AuswaertigesAmt: … aber die wahre deutsch-französische Freundschaft ist nicht zwischen Hauptstädten, sondern zwischen den Menschen! 

Z…";1469264387512979461;1484786278155567105;2022-01-22 07:13:29+00:00;;de;False;85;0;0;0;everyone;Twitter for iPhone;1484782888872812544;retweeted;2022-05-28 15:50:38.688724
1469264387512979461;ABaerbock;1484281716999081985;"My colleague @yairlapid and I welcome today’s adoption of the #UN-Resolution on Holocaust Denial &amp; Distortion. 80 years after the Wannsee-Conference on this day, this initiative was brought forward by our two countries. Together we will keep the memory of the victims alive.";1469264387512979461;1484281716999081985;2022-01-20 21:48:32+00:00;;en;False;73;109;721;11;everyone;Twitter for iPhone;;;2022-05-28 15:50:38.692197
1469264387512979461;ABaerbock;1484224962529570822;"Vielen Dank, Bundespräsident @ignaziocassis, für das gute Gespräch! Mit unserem Nachbarland #🇨🇭sind wir wirtschaftlich &amp; kulturell eng verflochten. Für die Menschen in den Grenzregionen wollen wir die grenzüberschreitende Zusammenarbeit &amp; EU-Schweiz Beziehungen weiter stärken.";1469264387512979461;1484224962529570822;2022-01-20 18:03:01+00:00;;de;False;60;96;914;8;everyone;Twitter for iPhone;;;2022-05-28 15:50:38.697572
1469264387512979461;ABaerbock;1484193251586416640;Thank you for your visit @SecBlinken! I really appreciated the opportunity to touch base with you on #russia and #ukraine and other pressing issues such as the #JCPoA. Close coordination and joint messaging remains crucial in our efforts to deescalate. https://t.co/64iVEccCly;1469264387512979461;1484193251586416640;2022-01-20 15:57:00+00:00;;en;False;209;235;1673;23;everyone;Twitter for iPhone;;;2022-05-28 15:50:38.701602
1469264387512979461;ABaerbock;1483479580321189891;"Congratulations @RobertaMetsola &amp; alles Gute an der Spitze des @Europarl_EN. Für ein starkes #Europa brauchen wir ein starkes Europäisches Parlament! #🇪🇺";1469264387512979461;1483479580321189891;2022-01-18 16:41:08+00:00;;de;False;61;218;884;12;everyone;Twitter for iPhone;;;2022-05-28 15:50:38.704376
1469264387512979461;ABaerbock;1483320630955188225;"Heute in #Moskau geht es mir um eine Positionsbestimmung: Wir wollen stabile Beziehungen &amp; sind bereit zu einem ernsthaften #Dialog über Schritte für mehr Sicherheit für alle in #Europa. Unser Maßstab bleiben dabei die Grundprinzipien unserer Friedens- und #Sicherheitsordnung.";1469264387512979461;1483320630955188225;2022-01-18 06:09:31+00:00;;de;False;154;577;2487;59;everyone;Twitter for iPhone;;;2022-05-28 15:50:38.710936
1469264387512979461;ABaerbock;1483085617869299716;"Vielen Dank @DmytroKuleba &amp; @ZelenskyyUa für den herzlichen Empfang in #Kiew! Nach meinen Gesprächen in Europa und den USA seit meinem Amtsantritt ist auch heute meine Botschaft dieselbe: Solidarität. In dieser schwierigen Lage reden wir nicht über die #Ukraine ohne die Ukraine. https://t.co/zIW9caW7ii";1469264387512979461;1483085617869299716;2022-01-17 14:35:40+00:00;;de;False;164;408;2090;74;everyone;Twitter for iPhone;;;2022-05-28 15:50:38.717514
1469264387512979461;ABaerbock;1482956749061738498;RT @AuswaertigesAmt: #DieZukunftGehörtDir: 100 zufällig ausgewählte Bürger*innen, 10 konkrete Empfehlungen, 1 Stunde Austausch zur Zukunft…;1469264387512979461;1482956749061738498;2022-01-17 06:03:35+00:00;;de;False;37;0;0;0;everyone;Twitter for iPhone;1482944656027619340;retweeted;2022-05-28 15:50:38.721490
1469264387512979461;ABaerbock;1481939255970643970;"Ich habe mich bei meinem ersten persönlichen Treffen mit meinem Kollegen aus #Litauen, @GLandsbergis, zu #Russland, der #Ukraine &amp; #China abgestimmt. Als Europäer stehen wir solidarisch zusammen. https://t.co/1Pso1pHeTD";1469264387512979461;1481939255970643970;2022-01-14 10:40:26+00:00;;de;False;79;241;972;21;everyone;Twitter for iPhone;;;2022-05-28 15:50:38.724378
1469264387512979461;ABaerbock;1480940038133329931;Die enge telefonische Abstimmung mit @JosepBorrellF vor unserem #EU-Ministertreffen in Brest ist mir sehr wichtig: Die Einigkeit aller 27 Mitgliedstaaten ist unser stärkster Trumpf für mehr Sicherheit in Europa, gerade jetzt vor den Gesprächen mit #Russland in #NATO und #OSZE.;1469264387512979461;1480940038133329931;2022-01-11 16:29:54+00:00;;de;False;44;142;545;11;everyone;Twitter for iPhone;;;2022-05-28 15:50:38.728709
1469264387512979461;ABaerbock;1480861745765924865;"Danke, liebe @HelgaSchmid_SG, für das Gespräch. Die #OSZE steht für Vertrauen &amp; ist das richtige Forum für den ehrlichen, prinzipienfesten Dialog mit Russland. Meine große Anerkennung für die Mitarbeitenden der OSZE-Missionen, besonders der #SMM für ihren aufopfernden Einsatz.";1469264387512979461;1480861745765924865;2022-01-11 11:18:47+00:00;;de;False;26;51;260;5;everyone;Twitter for iPhone;;;2022-05-28 15:50:38.733924
1469264387512979461;ABaerbock;1480831011097354241;Der Tod von David Maria #Sassoli macht mich sehr traurig. Als EP-Präsident gelang es ihm immer wieder, Gräben zu überwinden und so das Parlament als Ganzes zu stärken. Wir werden seinen überzeugten Einsatz für den menschlichen Umgang mit Geflüchteten nicht vergessen.;1469264387512979461;1480831011097354241;2022-01-11 09:16:40+00:00;;de;False;71;84;953;11;everyone;Twitter for iPhone;;;2022-05-28 15:50:38.737730
1469264387512979461;ABaerbock;1480644861736988680;Great to talk to my 🇨🇦 colleague @melaniejoly this evening on #Russia, ahead of talks in #NATO and #OSCE. There cannot be an alternative to principled, honest dialogue. Also talked about #G7 action on climate crisis and the pandemic and our commitment to help Afghans in need.;1469264387512979461;1480644861736988680;2022-01-10 20:56:58+00:00;;en;False;43;85;480;9;everyone;Twitter for iPhone;;;2022-05-28 15:50:38.741915
1469264387512979461;ABaerbock;1480529248528089098;"Danke und grazie mille, @luigidimaio, für den guten &amp; engen Austausch zu #Corona, #Klimaschutz und europ. Asylpolitik. Gemeinsam haben wir heute den Startschuss für unseren 🇩🇪-🇮🇹 Aktionsplan gegeben: Wir wollen Außenpolitik lebendig machen. https://t.co/zhv4b0KWwz";1469264387512979461;1480529248528089098;2022-01-10 13:17:34+00:00;;de;False;61;141;978;24;everyone;Twitter for iPhone;;;2022-05-28 15:50:38.778354
1469264387512979461;ABaerbock;1479477672396865540;Wir haben uns beim #NATO-Treffen der Außenminister*innen zu den anstehenden Dialogformaten mit #Russland abgestimmt und den NATO-Russland-Rat vorbereitet. Für uns ist klar: Dialog muss auf Grundlage der Kernprinzipien der europäischen #Sicherheitsordnung stattfinden.;1469264387512979461;1479477672396865540;2022-01-07 15:38:59+00:00;;de;False;58;223;901;15;everyone;Twitter for iPhone;;;2022-05-28 15:50:38.784396
1469264387512979461;ABaerbock;1479062703335424004;"Herzlichen Glückwunsch, liebe Luise Amtsberg, für Deine Berufung zur #Menschenrechtsbeauftragten! 
Es gibt viel zu tun und ich freue mich sehr, dass die #Menschenrechte mit Dir eine starke Verteidigerin und Stimme haben werden! https://t.co/sb7Dv4QS2Z";1469264387512979461;1479062703335424004;2022-01-06 12:10:02+00:00;;de;False;101;248;1657;39;everyone;Twitter for iPhone;;;2022-05-28 15:50:38.788199
1469264387512979461;ABaerbock;1478808616794796040;"Thank you @SecBlinken for the warm welcome in snowy #WashingtonDC! The #US is #EU|s closest partner, our transatlantic bond is key to peace &amp; security. We agreed to collaborate closely vis-à-vis #Russia. There’s no alternative to dialogue. https://t.co/v5T7nPtVqG";1469264387512979461;1478808616794796040;2022-01-05 19:20:23+00:00;;en;False;202;222;2393;44;everyone;Twitter for iPhone;;;2022-05-28 15:50:38.793393
1469264387512979461;ABaerbock;1478431442195693569;Ich habe mich zu Beginn der französischen EU-Ratspräsidentschaft mit @JY_LeDrian u.a. zu #Ukraine, #Iran und #Mali ausgetauscht. In diesen und anderen Themen wollen wir uns als Partner und Freunde weiter eng abstimmen und koordiniert vorgehen.;1469264387512979461;1478431442195693569;2022-01-04 18:21:38+00:00;;de;False;40;108;519;7;everyone;Twitter for iPhone;;;2022-05-28 15:50:38.802960
1469264387512979461;ABaerbock;1478408861262438403;"Ich habe @RauZbigniew telefonisch volle Unterstützung für den polnischen #OSZE-Vorsitz zugesagt. Vor meiner morgigen 🇺🇸-Reise haben wir über die Lage an der russisch-ukrainischen Grenze gesprochen. Wir wollen unseren Austausch &amp; die enge Zusammenarbeit weiter stärken &amp; vertiefen.";1469264387512979461;1478408861262438403;2022-01-04 16:51:54+00:00;;de;False;42;98;559;10;everyone;Twitter for iPhone;;;2022-05-28 15:50:38.821617
1469264387512979461;ABaerbock;1478394882838441988;"Vielen Dank, @EUSR_Weber, für den guten Austausch zum Horn von #Afrika. Wir wollen gemeinsam mit der #EU und unseren internationalen Partnern für #Frieden &amp; #Sicherheit in der Region arbeiten. https://t.co/CtwRsGBJxI";1469264387512979461;1478394882838441988;2022-01-04 15:56:21+00:00;;de;False;48;92;469;10;everyone;Twitter for iPhone;;;2022-05-28 15:50:38.826749
1469264387512979461;ABaerbock;1472229205941358592;Vielen Dank Maria @by_kalesnikava, Swetlana @Tsihanouskaya und Veronica @VTsepkalo für euer unermüdliches Engagement. Ich freue mich, dass diese drei starken Frauen 2022 den internationalen @KarlspreisAC erhalten. https://t.co/FqqFAXVXcf;1469264387512979461;1472229205941358592;2021-12-18 15:36:10+00:00;;de;False;212;310;2947;39;everyone;Twitter for iPhone;;;2022-05-28 15:50:38.830803
1469264387512979461;ABaerbock;1470669139891171329;RT @melaniejoly: There were 3 women ministers at the #G7 Foreign Ministers’ Meeting. The last time it happened was 15 years ago. We always…;1469264387512979461;1470669139891171329;2021-12-14 08:17:01+00:00;;en;False;330;0;0;0;everyone;Twitter for iPhone;1470184846412730378;retweeted;2022-05-28 15:50:38.834911
1469264387512979461;ABaerbock;1469597459777212417;"Great to meet in person with my US-counterpart @SecBlinken. Thanks for your kind congratulations. I look forward to build on the transatlantic partnership &amp; friendship to, among other things, tackling the climate crisis and strengthening the rules-based international order. #G7UK https://t.co/dMQsE2K3NQ https://t.co/kvX0nzOQ6P";1469264387512979461;1469597459777212417;2021-12-11 09:18:32+00:00;;en;False;154;565;1801;53;everyone;Twitter for iPhone;1469469480472383490;quoted;2022-05-28 15:50:38.840741
1469264387512979461;ABaerbock;1469337032803692548;Ab heute twittere ich in meinem Amt als Außenministerin von diesem Account. Auf diesem Wege ganz herzlichen Dank für die vielen Gratulationen und guten Wünsche, die mich seit der Amtsübernahme hier erreicht haben!;1469264387512979461;1469337032803692548;2021-12-10 16:03:42+00:00;;de;False;564;1577;26510;170;everyone;Twitter Web App;;;2022-05-28 15:50:38.844559
