twitter_id;twitter_handle;tweet_id;tweet_text;tweet_author_id;tweet_conversation_id;tweet_created_at;tweet_in_reply_to_user_id;tweet_lang;tweet_possibly_sensitive;tweet_retweet_count;tweet_reply_count;tweet_like_count;tweet_quote_count;tweet_reply_settings;tweet_source;tweet_referenced_tweet_id;tweet_referenced_tweet_type;api_call
23447001;AMattfeldt;1521881449271545857;RT @von_ammon: ⁦@AMattfeldt⁩ erläutert beim 16. #TDlRR22, worauf er sich bei der ⁦@ILA_Berlin⁩ am meisten freut-der ersten #aerospace-Messe…;23447001;1521881449271545857;2022-05-04 15:56:27+00:00;;de;False;2;0;0;0;everyone;Twitter for iPhone;1521507589011521536;retweeted;2022-05-28 15:36:58.627976
23447001;AMattfeldt;1518468246541848578;Ich stelle mir gerade vor, wie die gesamte SPD agieren würde, wenn ein ehemaliger Spitzenpolitiker der CDU sich zu Putin und seinem Angriffskrieg äußern würde wie Gerhard Schröder. Da würde vermutlich von Herrn SPD Vorsitzenden Klingbeil die gesamte Auflösung der CDU gefordert….;23447001;1518468246541848578;2022-04-25 05:53:36+00:00;;de;False;4;1;5;0;everyone;Twitter for iPhone;;;2022-05-28 15:36:58.630290
23447001;AMattfeldt;1466872316286095363;@yrow97 Und gerade erst frisch und voll geimpfte haben eine genauso hohe Antikörperdichte wie geboosterte. Ihr Sozis seid doch immer für Gleichheit, dann muss das da aus  juristischen Gründen auch für diese gelten!;23447001;1466867646289387525;2021-12-03 20:49:48+00:00;1887932360;de;False;0;1;2;0;everyone;Twitter for iPhone;1466871718748860418;replied_to;2022-05-28 15:36:58.633879
23447001;AMattfeldt;1466871725602525184;@BND_99 Mit 2 G kann Gastronomie wohl leben. Niedersachsen hat im Vergleich geringe Infektionen. Ab jetzt härteste Maßnahmen.;23447001;1466867646289387525;2021-12-03 20:47:27+00:00;77737024;de;False;0;1;1;0;everyone;Twitter for iPhone;1466870017463570433;replied_to;2022-05-28 15:36:58.637124
23447001;AMattfeldt;1466867646289387525;In Niedersachen gibt es jetzt Geimpfte Erster und Zweiter Klasse. Für geboosterte Mitbürger gelten ab morgen keine 2 G Plus Regelungen. Wir anderen müssen uns stundenlang in Testzentren anstellen. Haltet Ihr die Verordnung generell für klug liebe Landesregierung??? #corona;23447001;1466867646289387525;2021-12-03 20:31:14+00:00;;de;False;1;4;3;0;everyone;Twitter for iPhone;;;2022-05-28 15:36:58.641025
23447001;AMattfeldt;1454837805822136322;@marcusschmidtHH Ich bin seit vielen Jahren der haushaltspolitische  Hauptberichterstatter des  Wirtschaftsministerium, dass auch für Raumfahrt verantwortlich ist. Die Cosmic Kiss Mission habe ich natürlich von Beginn an aktiv begleitet.;23447001;1454208033471533064;2021-10-31 15:48:57+00:00;1245694975024693249;de;False;0;1;2;0;everyone;Twitter for iPhone;1454208033471533064;replied_to;2022-05-28 15:36:58.644731
23447001;AMattfeldt;1454833614512918535;"RT @DLR_SpaceAgency: Nah dran am Startplatz und SpaceX #Falcon9 mit der Dragon Kapsel von Matthias Maurer &amp; #Crew3: @AMattfeldt, @AKPyzalla…";23447001;1454833614512918535;2021-10-31 15:32:17+00:00;;de;False;7;0;0;0;everyone;Twitter for iPhone;1454833447357329408;retweeted;2022-05-28 15:36:58.648649
23447001;AMattfeldt;1454084738042507269;RT @DLR_SpaceAgency: Jetzt live auf @phoenix_de: Interviews mit @tj_tweets und @AMattfeldt im Vorfeld der Fragerunde zu #CosmicKiss mit @as…;23447001;1454084738042507269;2021-10-29 13:56:31+00:00;;de;False;2;0;0;0;everyone;Twitter for iPhone;1454066683543531521;retweeted;2022-05-28 15:36:58.653739
23447001;AMattfeldt;1454065781805916162;Zum Start der Cosmic Kiss Mission zur ISS unseres Astronauten Matthias Maurer nun ein kurzes Interview auf Phoenix Live. https://t.co/CnpRImpmJY;23447001;1454065781805916162;2021-10-29 12:41:12+00:00;;de;False;0;0;1;0;everyone;Twitter for iPhone;;;2022-05-28 15:36:58.657373
23447001;AMattfeldt;1403986339188678656;Es ist sowas von unverhältnismäßig, dass bei 0,8 Inzidenz die Servicekräfte in der Gastronomie im Aussenbereich noch immer Maske tragen müssen…..kannst keinem erklären….. Irre….#fürverhältnismässigkeit #mankannsauchübertreiben #impfenhilft;23447001;1403986339188678656;2021-06-13 08:03:22+00:00;;de;False;1;2;7;0;everyone;Twitter for iPhone;;;2022-05-28 15:36:58.661106
23447001;AMattfeldt;1391634747986694145;Ohne die Malocher wie z.B. Handwerker, Bauern, Industriearbeiter oder LKW Fahrer geht unser Land zu Grunde. Bin gespannt, wie unter grüner Kanzlerschaft das Personal im öffentlichen Dienst, bei Umwelt- und Sozialverbänden bezahlt werden soll. #denkenhilft #steuerzahler #sonicht;23447001;1391634747986694145;2021-05-10 06:02:33+00:00;;de;False;0;1;0;0;everyone;Twitter for iPhone;;;2022-05-28 15:36:58.664915
23447001;AMattfeldt;1390657011650605057;@marcusschmidtHH @BacktotheFuture @CDU Ich bin leider Apple Junkie....;23447001;1390650093494312963;2021-05-07 13:17:23+00:00;1245694975024693249;de;False;0;0;0;0;everyone;Twitter for iPhone;1390650093494312963;replied_to;2022-05-28 15:36:58.669041
23447001;AMattfeldt;1390569190222934016;Nachdem ich endlich ein neues Handy habe, konnte ich den Twitter Account reaktivieren. Freue mich, wieder da zu sein. #bundestag #berlin #informationen #politikkannspassmachen;23447001;1390569190222934016;2021-05-07 07:28:25+00:00;;de;False;0;1;11;1;everyone;Twitter for iPhone;;;2022-05-28 15:36:58.673132
23447001;AMattfeldt;365010292888969218;BM Altmaier in Völkersen am nächsten Donnerstag - mehr Infos auf meiner Homepage http://t.co/RGgVujXnuZ;23447001;365010292888969218;2013-08-07 07:23:30+00:00;;de;False;0;0;2;1;everyone;Hootsuite;;;2022-05-28 15:36:58.676635
23447001;AMattfeldt;334215276486860800;Ich war im Lilienthaler Golfclub. Bericht zu meinem Besuch auf meiner Homepage http://t.co/5tZcSTSaVt;23447001;334215276486860800;2013-05-14 07:55:05+00:00;;de;False;0;0;0;0;everyone;Hootsuite;;;2022-05-28 15:36:58.680646
23447001;AMattfeldt;332032902344892417;Das PPP geht in die nächste Runde: Mit dem Deutschen Bundestag 1 Jahr in die USA. Wer Lust darauf hat, sollte sich schnell bewerben!...;23447001;332032902344892417;2013-05-08 07:23:07+00:00;;de;False;0;0;1;0;everyone;Hootsuite;;;2022-05-28 15:36:58.683705
23447001;AMattfeldt;331402860145278978;Verschärfung der Rahmenbedignungen für eine sichere Erdgasförderung ist auf dem Weg. Mehr Informationen unter: http://t.co/y60EoLoW5i;23447001;331402860145278978;2013-05-06 13:39:33+00:00;;de;False;1;2;0;0;everyone;Hootsuite;;;2022-05-28 15:36:58.688536
23447001;AMattfeldt;330225923129495552;Bundestag hat zum 1.5. besseren Schutz von Kleinvermietern gegen Mietnomaden beschlossen. Mehr Infos: http://t.co/a4B7sN2SKg;23447001;330225923129495552;2013-05-03 07:42:50+00:00;;de;False;0;0;0;0;everyone;Hootsuite;;;2022-05-28 15:36:58.691612
23447001;AMattfeldt;329213957975973888;FAn hat über den Besuch von Minister Schäuble in Verden berichtet - auf meiner Homepage gibt es den Link zum Videobeitrag...;23447001;329213957975973888;2013-04-30 12:41:38+00:00;;de;False;0;0;0;0;everyone;Hootsuite;;;2022-05-28 15:36:58.695634
23447001;AMattfeldt;328823530894524416;Heute Abend gibt es wieder ein Treffen des Erdbebenstammtisches. Schäden müssen dringend ausgebessert werden. Daher hoffe ich, dass der...;23447001;328823530894524416;2013-04-29 10:50:13+00:00;;de;False;0;0;0;0;everyone;Hootsuite;;;2022-05-28 15:36:58.698537
23447001;AMattfeldt;327694327063117824;Der neue Bundestag aktuell ist online - in dieser Woche mit Steuerhinterziehung - Schäuble in Verden - Mittelstand - Wirtschaft...;23447001;327694327063117824;2013-04-26 08:03:10+00:00;;de;False;0;0;0;0;everyone;Hootsuite;;;2022-05-28 15:36:58.702749
23447001;AMattfeldt;327420653114376192;Am 29.4.2013 lade ich zum nächsten Erdbebenstammtisch in Völkersen ein. Wo und wann genau steht auf meiner Homepage: http://t.co/gAKEvFn4yG;23447001;327420653114376192;2013-04-25 13:55:41+00:00;;de;False;0;1;0;0;everyone;Hootsuite;;;2022-05-28 15:36:58.706501
23447001;AMattfeldt;327041780514189313;Minister Schäuble war am Montag in Verden zu Gast - Bericht gibt es online http://t.co/mXW0yS4xm4;23447001;327041780514189313;2013-04-24 12:50:11+00:00;;de;False;0;0;0;0;everyone;Hootsuite;;;2022-05-28 15:36:58.710101
23447001;AMattfeldt;326269354603868160;Die Diabetiker-Selbsthilfegruppe aus Dörverden habe ich in der letzten Woche in Berlin zum Gespräch getroffen http://t.co/0bhAesrz3C;23447001;326269354603868160;2013-04-22 09:40:50+00:00;;de;False;0;0;0;0;everyone;Hootsuite;;;2022-05-28 15:36:58.713913
23447001;AMattfeldt;325152512791416833;Der neue Bundestag aktuell ist online. Themen in dieser Woche: Schäuble-Vortrag, Lärmschutz, Erdgasförderung, Eurorettung, DDR-Flucht...;23447001;325152512791416833;2013-04-19 07:42:54+00:00;;de;False;0;0;0;0;everyone;Hootsuite;;;2022-05-28 15:36:58.717493
23447001;AMattfeldt;324878934892244992;Fortschritt beim Lärmschutz an der Bahnstrecke Hannover-Bremen. Schallgutachten werden erstellt. Mehr Infos dazu: http://t.co/Er6hzXWtCM;23447001;324878934892244992;2013-04-18 13:35:48+00:00;;de;False;0;0;0;0;everyone;Hootsuite;;;2022-05-28 15:36:58.722390
23447001;AMattfeldt;324055186505101313;Vor kurzem habe ich Alia Technik in Achim besucht. Ein spannendes Unternehmen. Mehr dazu auf meiner Internetseite: http://t.co/YzMI2uBOZQ;23447001;324055186505101313;2013-04-16 07:02:31+00:00;;de;False;0;0;0;0;everyone;Hootsuite;;;2022-05-28 15:36:58.725864
23447001;AMattfeldt;322650367903023104;Gegen das Vergessen - das Ehepaar Strelzyk berichtete bei uns von seiner Flucht aus der DDR im Heißluftballon: http://t.co/quMIe6Ewxu;23447001;322650367903023104;2013-04-12 10:00:16+00:00;;de;False;0;0;0;0;everyone;Hootsuite;;;2022-05-28 15:36:58.728917
23447001;AMattfeldt;322264237420462080;5 Mio. Euro sind seit meiner Wahl in den Bundestag zur Unterstützung von Familien in meinen Wahlkreis geflossen: http://t.co/Rr5Dhz1Vh8;23447001;322264237420462080;2013-04-11 08:25:56+00:00;;de;False;0;0;0;0;everyone;Hootsuite;;;2022-05-28 15:36:58.731972
23447001;AMattfeldt;321902234684252160;Ich freue mich auf die Veranstaltung mit Minister Schäuble am 22.4.Herzliche Einladung an alle Interessierten. Infos: http://t.co/a2qNqjjnNE;23447001;321902234684252160;2013-04-10 08:27:28+00:00;;de;False;0;0;0;0;everyone;Hootsuite;;;2022-05-28 15:36:58.735983
23447001;AMattfeldt;321523112476823553;Gastfamilien für amerikanische Austauschschüler gesucht http://t.co/HKpuA5BZ23;23447001;321523112476823553;2013-04-09 07:20:58+00:00;;de;False;0;0;0;0;everyone;Hootsuite;;;2022-05-28 15:36:58.739549
23447001;AMattfeldt;321196197140389888;In der letzten Woche habe ich wieder eine Gruppe aus dem Wahlkreis empfangen. Hat wie immer sehr viel Spaß gemacht! http://t.co/8K32Nwys9l;23447001;321196197140389888;2013-04-08 09:41:55+00:00;;de;False;0;0;0;0;everyone;Hootsuite;;;2022-05-28 15:36:58.743235
23447001;AMattfeldt;317187123457437696;Am 10.04. findet abends im Tivoli in OHZ eine ganz besondere Veranstaltung zur Flucht aus der DDR statt. Freu mich, wenn viele von Euch...;23447001;317187123457437696;2013-03-28 08:11:17+00:00;;de;False;0;0;0;0;everyone;Hootsuite;;;2022-05-28 15:36:58.746815
23447001;AMattfeldt;316174980817752064;Habe letzte Woche beim Abend der Feuerwehren in Berlin Delegation der niedersächsischen Feuerwehr getroffen. War ein super Abend!...;23447001;316174980817752064;2013-03-25 13:09:24+00:00;;de;False;0;0;0;0;everyone;Hootsuite;;;2022-05-28 15:36:58.753329
23447001;AMattfeldt;315049089974812672;Der neue Bundestag aktuell ist online mit vielen verschiedenen Themen - jetzt reinlesen http://t.co/iphtPMg4eg;23447001;315049089974812672;2013-03-22 10:35:31+00:00;;de;False;0;0;0;0;everyone;Hootsuite;;;2022-05-28 15:36:58.759016
23447001;AMattfeldt;314769284469510146;"Gute Nachrichten für Schwanewede: Truppenübungsplatz wird geschlossen &amp; eine Verwertung der Flächen möglich. Mehr Infos:...";23447001;314769284469510146;2013-03-21 16:03:40+00:00;;de;False;0;0;0;0;everyone;Hootsuite;;;2022-05-28 15:36:58.764445
23447001;AMattfeldt;312509460008534016;Der Bundestag aktuell in dieser Woche ist online. Themen: Lätare-Spende - Haushalt 2014 - Agenda 2010 - Armuts- und Reichtumsbericht -...;23447001;312509460008534016;2013-03-15 10:23:56+00:00;;de;False;0;0;0;0;everyone;Hootsuite;;;2022-05-28 15:36:58.770844
23447001;AMattfeldt;311880221869617154;Meine Rede zur Blockadehaltung des Bundesrates beim Fiskalpakt ist online http://t.co/PJXZh5egsb;23447001;311880221869617154;2013-03-13 16:43:34+00:00;;de;False;0;0;0;0;everyone;Hootsuite;;;2022-05-28 15:36:58.777406
23447001;AMattfeldt;311837099487801345;Gerade hat uns Minister Schäuble über die Eckwerte Haushalt 2014 informiert. Wir setzen den Konsolidierungskurs fort: http://t.co/QT05x7F2Dh;23447001;311837099487801345;2013-03-13 13:52:12+00:00;;de;False;0;0;0;0;everyone;Hootsuite;;;2022-05-28 15:36:58.781463
23447001;AMattfeldt;311806461502173185;Heute: Aktuelle Stunde zur Blockadehaltung des Bundesrates beim Fiskalpakt - ich werde reden - online auf http://t.co/qjY1zSF1rF...;23447001;311806461502173185;2013-03-13 11:50:28+00:00;;de;False;0;0;0;0;everyone;Hootsuite;;;2022-05-28 15:36:58.786410
23447001;AMattfeldt;309304284011438081;"Noch bis zum 24. März 2013 beim Wettbewerb ""Ideen für die Bildungsrepublik"" mitmachen! http://t.co/pQOgAU90Qs";23447001;309304284011438081;2013-03-06 14:07:42+00:00;;de;False;0;0;0;0;everyone;Hootsuite;;;2022-05-28 15:36:58.791786
23447001;AMattfeldt;308858280350994432;Erfreuliche Arbeitsmarktzahlen im Februar 2013 http://t.co/1IaIF93WIy;23447001;308858280350994432;2013-03-05 08:35:27+00:00;;de;False;0;0;0;0;everyone;Hootsuite;;;2022-05-28 15:36:58.796152
23447001;AMattfeldt;307417299239960577;Mit einem Bericht zum Gesetzentwurf zum Thema Fracking und Informationen zu meinem neuen Besuchergästebuch ist der neue Bundestag...;23447001;307417299239960577;2013-03-01 09:09:30+00:00;;de;False;0;0;0;0;everyone;Hootsuite;;;2022-05-28 15:36:58.799227
23447001;AMattfeldt;306330838407184384;Besucher können auf meiner Homepage von Ihren Berlineindrücke berichten. Würde mich über viele Einträge freuen! http://t.co/7UF7vSeTPq;23447001;306330838407184384;2013-02-26 09:12:17+00:00;;de;False;0;0;0;0;everyone;Hootsuite;;;2022-05-28 15:36:58.803970
23447001;AMattfeldt;304605550883254274;Meine Rede zur rot-grünen Landespolitik ist online für alle, die interessiert sind http://t.co/S798nnvcqa;23447001;304605550883254274;2013-02-21 14:56:37+00:00;;de;False;0;0;0;0;everyone;Hootsuite;;;2022-05-28 15:36:58.809379
23447001;AMattfeldt;304523949293838338;Zweite Besucherfahrt des Jahres fand in der letzten Woche statt - hat wieder viel Spaß gemacht http://t.co/7JhbCHu99y;23447001;304523949293838338;2013-02-21 09:32:21+00:00;;de;False;0;0;0;0;everyone;Hootsuite;;;2022-05-28 15:36:58.813409
23447001;AMattfeldt;302342234173489152;Bund gibt weitere Mittel und treibt trotz Blockadehaltung von rot-grün Kita-Ausbau voran. Mehr Infos: http://t.co/qNSbPtUp;23447001;302342234173489152;2013-02-15 09:03:00+00:00;;de;False;0;0;0;0;everyone;Hootsuite;;;2022-05-28 15:36:58.818993
23447001;AMattfeldt;299450967106125826;Toller Vortrag von Jan Fleischhauer am Montag - auf meiner Homepage ist ein Bericht für alle, die nicht dabei sein konnten...;23447001;299450967106125826;2013-02-07 09:34:08+00:00;;de;False;0;0;0;0;everyone;Hootsuite;;;2022-05-28 15:36:58.823645
23447001;AMattfeldt;296201942949060608;Die Zeugnisferien stehen vor der Tür - Dialog mit der Jugend pflegen http://t.co/0saeJJLS;23447001;296201942949060608;2013-01-29 10:23:41+00:00;;de;False;0;0;0;0;everyone;Hootsuite;;;2022-05-28 15:36:58.827539
23447001;AMattfeldt;293632784340226049;50 Jahre Élysée-Vertrag - meine persönlichen Erfahrungen mit der deutsch-französischen Freundschaft im Weser Kurier http://t.co/1DVoMVmV;23447001;293632784340226049;2013-01-22 08:14:45+00:00;;de;False;1;0;1;0;everyone;Hootsuite;;;2022-05-28 15:36:58.831574
23447001;AMattfeldt;292208534265942016;Am Sonntag dran denken - wählen gehen und Astrid Vockert, Adrian Mohr oder Axel Miesner wählen: http://t.co/2Tbk0S6e;23447001;292208534265942016;2013-01-18 09:55:18+00:00;;de;False;0;0;0;0;everyone;Hootsuite;;;2022-05-28 15:36:58.836424
23447001;AMattfeldt;291911329739046913;Kristina Schröder mit Landtagsabgeordnetem Axel Miesner und mir in der Kita Am Berg in Oyten. Mehr Infos dazu: http://t.co/CW6N4Cng;23447001;291911329739046913;2013-01-17 14:14:19+00:00;;de;False;0;0;0;0;everyone;Hootsuite;;;2022-05-28 15:36:58.839944
23447001;AMattfeldt;291554691131797506;Andreas Mattfeldt - Eine Folge der deutsch-französischen Freundschaft http://t.co/H8wrRKav via @welt;23447001;291554691131797506;2013-01-16 14:37:09+00:00;;de;False;0;0;0;0;everyone;Twitter for Websites;;;2022-05-28 15:36:58.843519
23447001;AMattfeldt;291546652341325824;Meine Rede von heute mittag ist online: http://t.co/DvLuBjjS;23447001;291546652341325824;2013-01-16 14:05:13+00:00;;de;False;0;0;0;0;everyone;Hootsuite;;;2022-05-28 15:36:58.847165
23447001;AMattfeldt;291463902569586688;Am 21.1. um 19 Uhr lade ich ein zum Erdbeben-Stammtisch im Alten Krug in Völkersen: http://t.co/yQRfiKic;23447001;291463902569586688;2013-01-16 08:36:24+00:00;;de;False;0;0;0;0;everyone;Hootsuite;;;2022-05-28 15:36:58.850281
23447001;AMattfeldt;291218966347665409;Morgen spreche ich in der Élysée-Vertrags-Debatte ab elf Uhr http://t.co/QASoDUXh;23447001;291218966347665409;2013-01-15 16:23:06+00:00;;de;False;0;0;0;0;everyone;Hootsuite;;;2022-05-28 15:36:58.854752
23447001;AMattfeldt;291148651856809984;Positiver Jahresabschluss 2012: Schuldenbremse wird schneller eingehalten: http://t.co/BejqNvTh;23447001;291148651856809984;2013-01-15 11:43:42+00:00;;de;False;0;0;0;0;everyone;Hootsuite;;;2022-05-28 15:36:58.858276
23447001;AMattfeldt;289304050422411264;Kürzlich habe ich mich mit Arbeitnehmervertretern von Mars getroffen. Mehr Infos dazu gibt es hier: http://t.co/w73SFX4M;23447001;289304050422411264;2013-01-10 09:33:55+00:00;;de;False;0;0;0;0;everyone;Hootsuite;;;2022-05-28 15:36:58.862409
23447001;AMattfeldt;288967318673952769;Baufortschritt bei der Verlängerung der Linie 4 in Lilienthal: http://t.co/Rp2FVnfc;23447001;288967318673952769;2013-01-09 11:15:52+00:00;;de;False;0;0;0;0;everyone;Hootsuite;;;2022-05-28 15:36:58.865631
23447001;AMattfeldt;288565512076673024;Ursachenforschung: Falls noch nicht geschehen - bitte Fragebogen der Uni Köln zum Erdbeben ausfüllen. Mehr Infos: http://t.co/JzDK2xKb;23447001;288565512076673024;2013-01-08 08:39:14+00:00;;de;False;0;0;0;0;everyone;Hootsuite;;;2022-05-28 15:36:58.870370
23447001;AMattfeldt;284313638985166848;Lilienthaler Verein kümmert sich um Geschwister von Kindern mit Behinderungen. Bund honoriert die Arbeit mit 7.500 Euro:...;23447001;284313638985166848;2012-12-27 15:03:48+00:00;;de;False;0;0;0;0;everyone;Hootsuite;;;2022-05-28 15:36:58.873579
23447001;AMattfeldt;281436616927608832;Jetzt bewerben für den Jugendmedienworkshop des Bundestags. Mehr Infos gibt es hier: http://t.co/zKM8jOZL;23447001;281436616927608832;2012-12-19 16:31:32+00:00;;de;False;0;0;0;0;everyone;Hootsuite;;;2022-05-28 15:36:58.877153
23447001;AMattfeldt;279573408310755329;Der neue Bunedstag aktuell ist online. Themen diese Woche sind die Erdgasförderung und die Politik der Union http://t.co/CBloszRX;23447001;279573408310755329;2012-12-14 13:07:49+00:00;;de;False;0;0;0;0;everyone;Hootsuite;;;2022-05-28 15:36:58.880772
23447001;AMattfeldt;279206923323191296;Gestern habe ich gegen den Gesetzentwurf der Bundesregierung zur Beschneidung gestimmt http://t.co/McU1t9KB;23447001;279206923323191296;2012-12-13 12:51:32+00:00;;de;False;0;1;3;0;everyone;Hootsuite;;;2022-05-28 15:36:58.885142
23447001;AMattfeldt;276686361099120640;Eine Gruppe der Likedeeler Schule kam zum Schmücken des Weihnachtsbaumes im Reichstag nach Berlin. Das Ergebnis gibt's auf meiner...;23447001;276686361099120640;2012-12-06 13:55:43+00:00;;de;False;0;0;0;0;everyone;Hootsuite;;;2022-05-28 15:36:58.889030
23447001;AMattfeldt;275890217637007363;Gute Nachrichten für Pferde- und Geflügelzüchter http://t.co/O0VuNo3s;23447001;275890217637007363;2012-12-04 09:12:08+00:00;;de;False;0;0;0;0;everyone;Hootsuite;;;2022-05-28 15:36:58.893129
23447001;AMattfeldt;275550911642890241;Ich möchte nochmal alle Betroffenen aufrufen, evtl. Erdbeben-Schäden an die zuständigen Behörden zu melden! http://t.co/3bshgHIS;23447001;275550911642890241;2012-12-03 10:43:51+00:00;;de;False;0;0;0;0;everyone;Hootsuite;;;2022-05-28 15:36:58.896217
23447001;AMattfeldt;274471091592896513;Bundestag aktuell ist online - Themen in dieser Woche unter anderem: Erdbeben - Griechenland- Schenkelbrand http://t.co/ucKWTdfR;23447001;274471091592896513;2012-11-30 11:13:02+00:00;;de;False;0;0;0;0;everyone;Hootsuite;;;2022-05-28 15:36:58.899286
23447001;AMattfeldt;274449966888529921;Heinrich Müller aus Völkersen ist verstorben. Mein Beileid an seine Lieben. http://t.co/AfV7wKoX;23447001;274449966888529921;2012-11-30 09:49:05+00:00;;de;False;0;0;0;0;everyone;Hootsuite;;;2022-05-28 15:36:58.903670
23447001;AMattfeldt;274104880304648192;Erdbeben in Langwedel und umzu: Erste Antworten von BGR und Landesbergamt eingetroffen: http://t.co/TYvJzhZU;23447001;274104880304648192;2012-11-29 10:57:50+00:00;;de;False;0;0;0;0;everyone;Hootsuite;;;2022-05-28 15:36:58.907056
23447001;AMattfeldt;273795889011765250;Gestern war ich mit der Gruppe der 09er bei unserer Bundeskanzlerin zu Gast - war eine tolle Runde! http://t.co/Y07yJrds;23447001;273795889011765250;2012-11-28 14:30:01+00:00;;de;False;0;0;0;0;everyone;Hootsuite;;;2022-05-28 15:36:58.910165
23447001;AMattfeldt;273457812074528768;Besucher von mir hatten heute die einmalige Chance, unsere Bundeskanzlerin am Rande der Fraktionssitzung zu treffen http://t.co/2kMQkE4W;23447001;273457812074528768;2012-11-27 16:06:37+00:00;;de;False;0;0;0;0;everyone;Hootsuite;;;2022-05-28 15:36:58.913762
23447001;AMattfeldt;271957112886800384;Bundestag aktuell ist u.a. mit dem Haushalt 2013 und Beschneidung ab sofort online http://t.co/NBccju4A;23447001;271957112886800384;2012-11-23 12:43:23+00:00;;de;False;0;0;0;0;everyone;Hootsuite;;;2022-05-28 15:36:58.917261
23447001;AMattfeldt;271635386411929600;Heiner Rebentisch aus Ottersberg ist verstorben. Mein Mitgefühl gilt seiner Familie. http://t.co/uWvMaZjV;23447001;271635386411929600;2012-11-22 15:24:57+00:00;;de;False;0;0;0;0;everyone;Hootsuite;;;2022-05-28 15:36:58.921149
23447001;AMattfeldt;271609108019425280;In der Debatte zum Haushalt des Bundesfamilienministeriums habe ich heute gesprochen - jetzt online für Interessierte http://t.co/miw87BPM;23447001;271609108019425280;2012-11-22 13:40:32+00:00;;de;False;0;0;0;0;everyone;Hootsuite;;;2022-05-28 15:36:58.924565
23447001;AMattfeldt;271522677708185601;Heute spreche ich zum Etat des Bundesfamilienministeriums. Live im Parlamentsfernsehen und auf Phoenix ab 13:15 Uhr http://t.co/R1MuzW5A;23447001;271522677708185601;2012-11-22 07:57:05+00:00;;de;False;0;0;0;0;everyone;Hootsuite;;;2022-05-28 15:36:58.928028
23447001;AMattfeldt;270872218949521409;Ich habe heute zum Kitaausbau gesprochen - die Rede ist für Interessierte ab sofort auf meiner Homepage abrufbar. http://t.co/fssOEEYr;23447001;270872218949521409;2012-11-20 12:52:24+00:00;;de;False;0;0;0;0;everyone;Hootsuite;;;2022-05-28 15:36:58.931352
23447001;AMattfeldt;269015586829393920;Möbel Meyerhoff kommt jetzt größer und schöner daher: http://t.co/00q8NBAK;23447001;269015586829393920;2012-11-15 09:54:48+00:00;;de;False;0;0;0;0;everyone;Hootsuite;;;2022-05-28 15:36:58.934881
23447001;AMattfeldt;266838551356915712;Der Newsletter beschäftigt sich dieses Mal mit der Grundsicherung und dem Kita-Ausbau - jetzt unter Bundestag aktuell http://t.co/fvgRfhKo;23447001;266838551356915712;2012-11-09 09:44:02+00:00;;de;False;0;0;0;0;everyone;Hootsuite;;;2022-05-28 15:36:58.938447
23447001;AMattfeldt;266819389729415168;Verhandlungen mit den Ländern über den Kita-Ausbau. Mehr dazu: http://t.co/qjJVe6IC;23447001;266819389729415168;2012-11-09 08:27:54+00:00;;de;False;0;0;0;0;everyone;Hootsuite;;;2022-05-28 15:36:58.941451
23447001;AMattfeldt;266226088903053312;"Die glücklichen Gewinner der Sonderbriefmarke ""Helmut Kohl"" stehen fest! http://t.co/d7HLOwPX";23447001;266226088903053312;2012-11-07 17:10:20+00:00;;de;False;0;0;0;0;everyone;Hootsuite;;;2022-05-28 15:36:58.944956
23447001;AMattfeldt;266160191236620289;Die Beschlüsse des Koalitionsausschusses auf einen Blick http://t.co/1HsOvNTt;23447001;266160191236620289;2012-11-07 12:48:29+00:00;;de;False;0;0;0;0;everyone;Hootsuite;;;2022-05-28 15:36:58.948441
23447001;AMattfeldt;264279151798796288;Der Haushaltsausschuss hat  zwei zusätzliche Millionen für das THW bereitgestellt. Mehr dazu gibt es hier: http://t.co/1t5LrBbz;23447001;264279151798796288;2012-11-02 08:13:54+00:00;;de;False;0;0;0;0;everyone;Hootsuite;;;2022-05-28 15:36:58.952627
23447001;AMattfeldt;263911416245915648;Herbstbelebung am Arbeitsmarkt setzt sich fort - Erfreuliche Neuigkeiten im Verdener SGBII-Rechtskreis http://t.co/EpeGFmRJ;23447001;263911416245915648;2012-11-01 07:52:39+00:00;;de;False;0;0;0;0;everyone;Hootsuite;;;2022-05-28 15:36:58.956455
23447001;AMattfeldt;263620409822429184;Aufsichtsrat und Vorstand der neuen Volksbank Aller-Weser waren zu Besuch in Berlin http://t.co/cW4ZEQ7H;23447001;263620409822429184;2012-10-31 12:36:18+00:00;;de;False;0;0;0;0;everyone;Hootsuite;;;2022-05-28 15:36:58.959599
23447001;AMattfeldt;263227599474540544;Einigung zu Schenkelbrand und Rassegeflügelausstellungen in Sicht. Voraussichtlich können wir Schenkelbrand erhalten: http://t.co/ZqcifeV5;23447001;263227599474540544;2012-10-30 10:35:24+00:00;;de;False;0;0;0;0;everyone;Hootsuite;;;2022-05-28 15:36:58.963121
23447001;AMattfeldt;261735397200105472;Bundestag aktuell ist online - diese Woche: Landwirtschaft - Ehrenamt - Erdgasförderung - Kohl-Sonderbriefmarke http://t.co/IeeyIizY;23447001;261735397200105472;2012-10-26 07:45:56+00:00;;de;False;0;0;0;0;everyone;Hootsuite;;;2022-05-28 15:36:58.966013
