twitter_id;twitter_handle;tweet_id;tweet_text;tweet_author_id;tweet_conversation_id;tweet_created_at;tweet_in_reply_to_user_id;tweet_lang;tweet_possibly_sensitive;tweet_retweet_count;tweet_reply_count;tweet_like_count;tweet_quote_count;tweet_reply_settings;tweet_source;tweet_referenced_tweet_id;tweet_referenced_tweet_type;api_call
454981027;helgelindh;1395381530348949504;@der_Kater Weil zum einen die Familien von Hanau sich persönlich den NSU-Opfer eng verbunden fühlen, klar für die Aufklärung des NSU plädieren und endlich Einblick in mögliche Kontinuitäten bei den hessischen Sicherheitsbehörden in beiden Fällen erbitten.;454981027;1395379317971030019;2021-05-20 14:10:56+00:00;1104528116;de;False;0;4;16;0;everyone;Twitter for Android;1395380678192156680;replied_to;2022-05-28 17:03:07.821997
454981027;helgelindh;1395379317971030019;"Dass #Grüne &amp; #CDU als Koalition zusammen stimmen, ist normal. Dass sie aber zusammen gegen #nsuaktenfreigeben stimmen, das ist zutiefst falsch. Wo es um die Würde der toten &amp; lebenden Opfer von NSU &amp; Hanau geht, da dürfen Haltung und Handlung nicht so würdelos auseinanderfallen.";454981027;1395379317971030019;2021-05-20 14:02:08+00:00;;de;False;37;24;439;1;everyone;Twitter for Android;;;2022-05-28 17:03:07.825542
454981027;helgelindh;1395031831121219586;"Hallo Frau Weidel,
Danke für die Blumen!
Sowohl @Karl_Lauterbach als auch meine Wenigkeit wurden von den Menschen in unseren Wahlkreisen per Direktmandat gewählt.
Ein Genuss, zu dem Sie noch nie gekommen sind und - zum Glück für unser Land - auch niemals kommen werden. https://t.co/wYBdGT6tPv";454981027;1395031831121219586;2021-05-19 15:01:21+00:00;;de;False;177;187;2604;35;everyone;Twitter Web App;1394609764034912258;quoted;2022-05-28 17:03:07.829681
454981027;helgelindh;1394684496658710536;"Antisemitismus ist also ein importiertes Problem? In einem Land, zu dessen Staatsräson das Gedenken an die Shoa gehört? Mit einem ehem. Verfassungschef, der antisemit. Verschwörungsmythen verbreitet? Mit Coronaleugnern, die sich auf Demos mit Judenstern zur Schau stellen?
Achso.";454981027;1394684496658710536;2021-05-18 16:01:10+00:00;;de;False;616;1216;4814;181;everyone;Twitter Web App;;;2022-05-28 17:03:07.833507
454981027;helgelindh;1393255377794441224;"Twitter hat in den letzten Tagen gelernt &amp; gelehrt: Die Kommentierung des Nahost-Konflikts passt nicht in einen Tweet.
Aber eines muss klar sein: Flaggenverbrennungen &amp; antisemitische Kundgebungen vor Synagogen darf es nicht geben, nirgendwo, und am allerwenigsten in diesem Land! https://t.co/L1wOn9Q6Z6";454981027;1393255377794441224;2021-05-14 17:22:22+00:00;;de;False;26;150;114;12;everyone;Twitter Web App;1393126299795927044;quoted;2022-05-28 17:03:07.837058
454981027;helgelindh;1393160858788847616;"Liebe @gruenehessen, ja, Regierungskoalitionen sind nicht immer leicht (ich spreche aus Erfahrung). Aber hier habt ihr für die Anbiederung an die @cduhessen all eure Überzeugungen über Bord geworfen.
Die Angehörigen der NSU-Opfer haben ein Recht auf Aufklärung! #nsuaktenfreigeben https://t.co/snWe750QZk";454981027;1393160858788847616;2021-05-14 11:06:47+00:00;;de;False;40;27;164;5;everyone;Twitter Web App;1392522460789153795;quoted;2022-05-28 17:03:07.840833
454981027;helgelindh;1391441444154617856;"Heute vor 100 Jahren wurde #SophieScholl geboren. Als Mensch hat sie jenseits aller Verklärung unfassbaren Mut bewiesen. Allen von #Querdenken &amp; rechten Schwurblern, die sich auf Scholl berufen, sage ich: Ihr seid das Gegenteil: feige, antidemokratisch, reaktionär, autoritär.";454981027;1391441444154617856;2021-05-09 17:14:26+00:00;;de;False;41;177;408;16;everyone;Twitter for Android;;;2022-05-28 17:03:07.844651
454981027;helgelindh;1390259099443544065;"RT @phoenix_de: ""Hass lässt sich leichter grölen als Mitgefühl"", so @helgelindh @spdbt zum #AfD-Antrag. Die AfD betreibe #Identitätstäuschu…";454981027;1390259099443544065;2021-05-06 10:56:13+00:00;;de;False;41;0;0;0;everyone;Twitter Web App;1390249639396347911;retweeted;2022-05-28 17:03:07.848861
454981027;helgelindh;1389528769921179649;"#Tsokos zu Zensur beim @WDR: ""...damit die GEZ-finanzierten Sender nicht endgültig zu einer Art Staatsfernsehen verkommen - was wir bekanntlich schon einmal in einem deutschen Staat hatten - halte ich so ein Agieren für gefährlich"". Sorry. So verhöhnt man Opfer echter Diktaturen";454981027;1389528769921179649;2021-05-04 10:34:09+00:00;;de;False;6;41;111;3;everyone;Twitter for Android;;;2022-05-28 17:03:07.852422
454981027;helgelindh;1389233248539234304;"Welches Statement meinen Sie, Herr @JanJosefLiefers?
Interpretieren Sie die guten Einschaltquoten etwa als Zustimmung zu #allesdichtmachen?
Die Menschen lassen sich doch ihr Grundrecht auf den sonntäglichen #Tatort nicht nehmen, nur weil einer der Schauspieler Unfug erzählt. https://t.co/FRO1zSsY1s";454981027;1389233248539234304;2021-05-03 14:59:51+00:00;;de;False;40;191;437;27;everyone;Twitter Web App;1389130410987188224;quoted;2022-05-28 17:03:07.856810
454981027;helgelindh;1388404074110980097;"CDU nominiert #Maaßen für den Bundestag. Viele MdB der #CDU  ermutigten ihn, ""die klassischen konservativen und wirtschaftsliberalen"" Punkte zu stärken. Totalversagen gegen Rechts &amp; neurechte Hetze gegen Flüchtlinge sind also ""konservativ"". Das ist die Bankrotterklärung der Union";454981027;1388404074110980097;2021-05-01 08:05:01+00:00;;de;False;318;281;3905;35;everyone;Twitter for Android;;;2022-05-28 17:03:07.860027
454981027;helgelindh;1388089975980310530;Ärzt*innen auf der ITS haben Wichtigeres zu tun, als @JanJosefLiefers davon zu überzeugen, was COVID anrichten kann. Gut, dass der Essener #Klinikchef sich nicht für seine PR-Aktion instrumentalisieren lässt. Lassen wir die Aufmerksamkeit denen zukommen, die sie verdient haben. https://t.co/f4JYF0Iz5n;454981027;1388089975980310530;2021-04-30 11:16:54+00:00;;de;False;38;82;370;6;everyone;Twitter Web App;1388037045310926848;quoted;2022-05-28 17:03:07.864793
454981027;helgelindh;1387645571733807106;"Leute von #Querdenken wollen mich &amp; andere tot sehen. Sie verachten diese Demokratie, tragen Judensterne ""ungeimpft"" &amp; riskieren Menschenleben. #Querdenker sind für mich keine legitimen Demonstranten, sondern aktuell Staatsfeind Nr.1. Verfassungsschutz: Beobachten! Alle!";454981027;1387645571733807106;2021-04-29 05:51:00+00:00;;de;False;209;475;1431;84;everyone;Twitter for Android;;;2022-05-28 17:03:07.868408
454981027;helgelindh;1386951509620011009;RT @vorwaerts: Mit einem selbst erdachten Dialog hat der #SPD-Abgeordnete @helgelindh der #AfD im #Bundestag den Spiegel vorgehalten. Die H…;454981027;1386951509620011009;2021-04-27 07:53:02+00:00;;de;False;29;0;0;0;everyone;Twitter Web App;1386932128680714242;retweeted;2022-05-28 17:03:07.872105
454981027;helgelindh;1386737861597270030;Ein Mensch wird bedroht, getreten, gedemütigt. Alle schauen weg. Nicht nur in dieser Straßenbahn. „Angsträume“ in #Erfurt, in jeder deutschen Stadt. Rassistische Gewalt ist in 🇩🇪 für so viele Menschen alltägliche Realität. Hört auf, zu relativieren! Schaut endlich richtig hin! https://t.co/etcWmaFDhB;454981027;1386737861597270030;2021-04-26 17:44:05+00:00;;de;False;80;116;531;10;everyone;Twitter Web App;1386681545021431808;quoted;2022-05-28 17:03:07.875747
454981027;helgelindh;1385671655792463880;#allesdichtmachen ist zynisch, töricht und selbstgeil. Es ist mitnichten eine Antwort auf die prekäre Lage von Kulturschaffenden. Es verrät vielmehr die vielen Künstler*innen, die nicht privilegiert sind und um ihre Existenz ringen. https://t.co/ky2jyZLB0I;454981027;1385671655792463880;2021-04-23 19:07:21+00:00;;de;False;73;162;538;36;everyone;Twitter for Android;;;2022-05-28 17:03:07.879834
454981027;helgelindh;1385493596388868097;"Ich verstehe, dass Schauspieler*innen der Applaus fehlt. Ich verstehe nicht, dass sie sich diesen nun bei den Querschwurblern holen.
Die Pandemie sei nur Angstmache? Erzählt das mal den Angehörigen der 80.000 Toten &amp; den Ärzt*innen auf der ITS. Zynisch &amp; schäbig #allesdichtmachen";454981027;1385493596388868097;2021-04-23 07:19:49+00:00;;de;False;124;252;1352;35;everyone;Twitter Web App;;;2022-05-28 17:03:07.883551
454981027;helgelindh;1385272331036135429;"Faust vs. Mephisto - eine patriotische Deutschstunde für die #noAfD.

https://t.co/ZZIwq8sn4C";454981027;1385272331036135429;2021-04-22 16:40:35+00:00;;de;False;29;34;88;11;everyone;Twitter Web App;;;2022-05-28 17:03:07.886955
454981027;helgelindh;1385266756709720064;RT @carolin_beck: OMG! Ich sehe gerade @helgelindh im #Bundestag. Seine Adaption von #Goeth|s Faust ist so göttlich! Selten so was geniales…;454981027;1385266756709720064;2021-04-22 16:18:26+00:00;;de;False;4;0;0;0;everyone;Twitter Web App;1385260877067264003;retweeted;2022-05-28 17:03:07.890522
454981027;helgelindh;1385200429236170753;RT @phoenix_de: Ziel einer Gesetzgebung zur #Suizidhilfe sollte es sein, Organisationen überflüssig zu machen, die #Sterbehilfe gegen 💶Geld…;454981027;1385200429236170753;2021-04-22 11:54:52+00:00;;de;False;12;0;0;0;everyone;Twitter Web App;1384884733839093763;retweeted;2022-05-28 17:03:07.894068
454981027;helgelindh;1385179722959790086;"Dass ausgerechnet Personenschützer der ASE (Auslands-&amp;Spezialeinsätze) des #BKA durch Corpsgeist, Rassismus, Sexismus, Munitionsmissbrauch auffallen, schockiert. Wir haben ein strukturelles Problem bei deutschen Spezialeinheiten, wenn sie statt Sicherheit Unsicherheit produzieren";454981027;1385179722959790086;2021-04-22 10:32:36+00:00;;de;False;46;46;291;4;everyone;Twitter for Android;;;2022-05-28 17:03:07.898660
454981027;helgelindh;1383082236090667009;"Live mit NIMO (@nimo385i): Morgen um 19:00 Uhr auf Instagram

➡️ https://t.co/kYDF7iVuaC https://t.co/Sc8WDVDKdN https://t.co/UcQa37iQ7T";454981027;1383082236090667009;2021-04-16 15:37:56+00:00;;de;False;1;13;11;1;everyone;Twitter Web App;1292753712004452352;quoted;2022-05-28 17:03:07.901889
454981027;helgelindh;1383007226676326400;@FrankZobel1 Vielen Dank, lieber Frank!;454981027;1383005541438525441;2021-04-16 10:39:52+00:00;1251481396113281026;de;False;0;0;2;0;everyone;Twitter Web App;1383005541438525441;replied_to;2022-05-28 17:03:07.905659
454981027;helgelindh;1383005728416358402;@MarlonGollnisch Hi Marlon! 😉;454981027;1383003588562202624;2021-04-16 10:33:55+00:00;1133998320525938688;en;False;0;1;3;0;everyone;Twitter Web App;1383003588562202624;replied_to;2022-05-28 17:03:07.909178
454981027;helgelindh;1382992942474915841;"Hohe Inzidenzen = hohe Auslastung der Intensivmedizin = hohe Todeszahlen + viele Patienten mit Long-Covid.
Nein, Herr #Laumann, wir müssen und wir dürfen uns nicht an höhere Inzidenzen gewöhnen. Es ist Ihr Job, dass wir uns daran nicht gewöhnen müssen.
Bitte machen Sie Ihren Job! https://t.co/fNNPx9NZ91";454981027;1382992942474915841;2021-04-16 09:43:06+00:00;;de;False;107;53;580;5;everyone;Twitter Web App;1382974388979572738;quoted;2022-05-28 17:03:07.914132
454981027;helgelindh;1382377847784927245;"RT @derya_tn: @Die_Insider @FacebookDE @helgelindh @spdde Es ist so widerwärtig.
Lieber Helghe, es tut mir so leid, dass Du diesen hässlich…";454981027;1382377847784927245;2021-04-14 16:58:56+00:00;;de;False;5;0;0;0;everyone;Twitter Web App;1382367621279014913;retweeted;2022-05-28 17:03:07.917565
454981027;helgelindh;1382371016874283008;"@derya_tn @Die_Insider @FacebookDE @spdde Danke, liebe Derya! 
Bedauerlicherweise kannst Du das wohl gut nachempfinden. Aber wir lassen uns nicht unterkriegen! Dir ebenfalls viel Kraft und Solidarität! 💪";454981027;1382366605728960512;2021-04-14 16:31:48+00:00;1162689374510886912;de;False;1;10;95;0;everyone;Twitter Web App;1382367621279014913;replied_to;2022-05-28 17:03:07.921449
454981027;helgelindh;1382369726249193475;"RT @Die_Insider: Die Liste an Betroffenen ist mittlerweile so lang. 

In diesem Fall werden Morddrohungen, Todeswünsche und Gewaltphantasie…";454981027;1382369726249193475;2021-04-14 16:26:40+00:00;;de;False;46;0;0;0;everyone;Twitter Web App;1382366605728960512;retweeted;2022-05-28 17:03:07.925137
454981027;helgelindh;1382319468316069894;"Da wird von den sog. Querdenkern genau das betrieben, was sie der Regierung vorwerfen: Verschwörung &amp; Rechtsbeugung. Das besonders Perfide: die Instrumentalisierung der Kinder. Aber was ist von Leuten, die ihre Kinder auf Demos als Schutzschilder nutzen, auch anderes zu erwarten? https://t.co/E14m9aAUBn";454981027;1382319468316069894;2021-04-14 13:06:58+00:00;;de;False;17;50;107;3;everyone;Twitter Web App;1381960761904226304;quoted;2022-05-28 17:03:07.929031
454981027;helgelindh;1382001514160529413;"Das ist nur eine kleine Auswahl des Hasses, der Verachtung und der Häme der letzten Tage.
Wie unzufrieden muss man mit sich selbst sein, um andere auf diese Weise herabzuwürdigen?
Überwindet euren Selbsthass! Ihr habt mein Mitgefühl. https://t.co/2thsCjQJJn";454981027;1382001514160529413;2021-04-13 16:03:31+00:00;;de;False;22;84;207;8;everyone;Twitter Web App;;;2022-05-28 17:03:07.932791
454981027;helgelindh;1381956133120794629;"Ein Herr Krah findet mich widerlich, weil ich Ramadan-Grüße versende?
Musste ihn gerade mal googeln: Von seinen AfD-Freunden „Schampus-Max“ genannt, vertrat er als Anwalt u.a. die Männer, die 2016 vor einem Supermarkt einen Geflüchteten an einen Baum fesselten. 
Aha, verstehe! 🤷‍♂️ https://t.co/D2y2TmhWaG";454981027;1381956133120794629;2021-04-13 13:03:12+00:00;;de;False;39;104;494;6;everyone;Twitter Web App;1381910537068539907;quoted;2022-05-28 17:03:07.936397
454981027;helgelindh;1381905429937131520;"Alles Gute zum Ramadan!
hayırlı Ramazanlar
رمضان مبارك

Ich entschuldige mich dafür, dass muslimische Gemeinden verdächtigt werden, den Infektionsschutz nicht einzuhalten. Ich wünsche mir, dass Muslim*innen sich in diesem Land endlich nicht mehr erklären und rechtfertigen müssen! https://t.co/OGJMKAZmWf";454981027;1381905429937131520;2021-04-13 09:41:43+00:00;;de;False;68;986;479;263;everyone;Twitter for iPhone;;;2022-05-28 17:03:07.940460
454981027;helgelindh;1381600096186462212;Rassistisch, familienfeindlich, kinderfeindlich - das ist die #noAfD. Auf ihrem #afdbpt21 hat sie das Verbot jeglichen Familiennachzugs bei Flüchtlingen ins Programm geschrieben, auf Vorschlag von #Höcke. #Afd ist die Partei von Höckes Gnaden. Gegen Familien, gegen Kinder. Pfui.;454981027;1381600096186462212;2021-04-12 13:28:26+00:00;;de;False;49;257;380;22;everyone;Twitter for Android;;;2022-05-28 17:03:07.943809
454981027;helgelindh;1381204183857127427;Nicht zu vergessen: eine lange Tradition herausragender Verkehrsminister, herausragende Masken-Deals und ein herausragendes Verständnis von aufrechtem Parlamentarismus - einfach nur herausragend, diese CSU-Amigos! https://t.co/ddbuE6bgez;454981027;1381204183857127427;2021-04-11 11:15:13+00:00;;de;False;13;28;137;1;everyone;Twitter Web App;1381170858404745216;quoted;2022-05-28 17:03:07.948507
454981027;helgelindh;1380923345122779136;"""Deutschland. Aber normal"". Der Wahlkampfslogan der #noAfD erinnert an finsterste Zeiten. Wer bestimmt, was normal ist? Höcke? Was geschieht mit denen, die als anders gelten - oder in #AfD-Sprech: abnormal? Arbeitserziehungslager? Das ist nicht normal, das ist faschistisch.";454981027;1380923345122779136;2021-04-10 16:39:16+00:00;;de;False;141;250;894;36;everyone;Twitter for Android;;;2022-05-28 17:03:07.951822
454981027;helgelindh;1380237290010738695;"Heute am #TagderRoma feiern wir die Roma-Kultur &amp; mahnen die gravierende Diskriminierung an.
Wir brauchen eine 180-Grad-Wende im Kampf gg. Antiziganismus. Eine nationale Strategie, die diskriminierungsfreien Zugang zu Bildung, Jobs, Wohnraum &amp; Gesundheitsversorgung gewährleistet.";454981027;1380237290010738695;2021-04-08 19:13:08+00:00;;de;False;7;34;87;4;everyone;Twitter Web App;;;2022-05-28 17:03:07.955376
454981027;helgelindh;1380130749198823426;"Die Thüringer #CDU will wohl an #Maaßen als Bundestagskandidat festhalten. Dieser verbreitet auf Werte Union-Veranstaltungen die Verschwörungserzählung vom „Great Reset“.
Und von Parteichef #Laschet weiterhin Schweigen im Walde.
Wer hätte gedacht, dass wir AKK vermissen würden? https://t.co/YyTVuXtbTP";454981027;1380130749198823426;2021-04-08 12:09:46+00:00;;de;False;172;368;948;45;everyone;Twitter Web App;;;2022-05-28 17:03:07.959024
454981027;helgelindh;1379772517754224643;"Können Laschet und Söder bitte aufhören, sich wie 2. Klasse Schulhof zu benehmen?
Laschets verzweifelte Profilierungsversuche und Söders Schmutzeleien wirken angesichts der aktuellen Herausforderungen so grotesk deplatziert wie die Vorstellung eines der beiden im Kanzleramt.";454981027;1379772517754224643;2021-04-07 12:26:17+00:00;;de;False;38;32;314;6;everyone;Twitter Web App;;;2022-05-28 17:03:07.963288
454981027;helgelindh;1378994520382185472;@Bayern178281987 Was für eine intelligente, subtile Form, afrikanische Diktatoren zu kritisieren: rassistisches Blackfacing. Aus einem Land, das mit dem NS-Staat und dem SED-Staat Vorreiter in Sachen Diktatur auf die brutalstmögliche Weise war. Das ist weder Mut noch politische Analyse.;454981027;1378014812819570694;2021-04-05 08:54:48+00:00;1344944179844157440;de;False;0;3;0;0;everyone;Twitter for Android;1378988750773088258;replied_to;2022-05-28 17:03:07.966799
454981027;helgelindh;1378787475062206469;@JenBuWu @spdbt Was ist die Frage, die beantwortet werden soll?;454981027;1378778939070550018;2021-04-04 19:12:05+00:00;1941138654;de;False;0;1;4;1;everyone;Twitter for Android;1378778939070550018;replied_to;2022-05-28 17:03:07.970481
454981027;helgelindh;1378716887656321024;@Isahundedame Sie attackieren den Falschen, irgendwie auch ein beliebtes Hobby unter uns Progressiven. Es gilt, den Gestus des vermeintlichen Querdenkens zu entlarven. Ja, genau, eben. Aber trotzdem brauchen wir zu Erfassung des Phänomens auch noch die Selbstbezeichnung.;454981027;1378623325455409152;2021-04-04 14:31:35+00:00;1124303191162671104;de;False;0;5;2;0;everyone;Twitter for Android;1378686236232200195;replied_to;2022-05-28 17:03:07.974279
454981027;helgelindh;1378623325455409152;"Wenn die Polizei #Stuttgart bei #s0304 Angriffe auf Journalisten zulässt &amp; Körperverletzung durch asoziale Querdenker schützt, ist was faul im Staate Ba-Wü. #Staatsversagen &amp; #Polizeiversagen beginnt da, wo der Schutz der Allgemeinheit vor diesen Gemeingefährlichen endet.";454981027;1378623325455409152;2021-04-04 08:19:49+00:00;;de;False;201;154;1350;25;everyone;Twitter for Android;;;2022-05-28 17:03:07.978142
454981027;helgelindh;1378014812819570694;"Der #br feiert Ostern wohl die Auferstehung des puren Rassismus. Im Format ""SchleichFernsehen"" mimt der Satiriker via #blackfacing einen afrikanischen Diktator &amp; verhöhnt afrikanische Länder. Gibt es jetzt im Öffentlichen Rundfunk einen Überbietungswettbewerb in Sachen Rassismus?";454981027;1378014812819570694;2021-04-02 16:01:48+00:00;;de;False;9;88;154;6;everyone;Twitter for Android;;;2022-05-28 17:03:07.982992
454981027;helgelindh;1377591840040443907;"Kein Aprilscherz. Leider. Hiermit gründe ich offiziell die Initiativen #nomaaßen &amp; #maaßlosglücklich. Gestählt im Kampf gegen die #noafd biete ich meine Dienste zur Verhinderung von #Maaßen im Wahlkreis 196 an. Der Totengräber des Verfassungsschutzes darf nicht in den Bundestag. https://t.co/tMXrAajg42";454981027;1377591840040443907;2021-04-01 12:01:03+00:00;;de;False;156;683;959;110;everyone;Twitter for Android;1377569040177184768;quoted;2022-05-28 17:03:07.986335
454981027;helgelindh;1377377332286124037;"#nichtselbstverständlich auf Pro7 ist eine Lehrstunde für uns in der Politik. Missachtung der Pflege &amp; DRG-Fallpauschalen sind Ausdruck unseres Versagens. Menschliches Leben kennt keinen Wettbewerb. Alle, die sich an Maskendeals bereicherten, sollte aus Scham im Boden versinken";454981027;1377377332286124037;2021-03-31 21:48:41+00:00;;de;False;41;29;451;7;everyone;Twitter for Android;;;2022-05-28 17:03:07.990321
454981027;helgelindh;1377346106246393856;@TristanVeith Auf Herrn Ziemiaks Worte.;454981027;1377268215282339842;2021-03-31 19:44:36+00:00;952017205;de;False;0;0;0;0;everyone;Twitter Web App;1377309675755028484;replied_to;2022-05-28 17:03:07.993920
454981027;helgelindh;1377268215282339842;"Diese Worte können Sie sich sparen, Herr Ziemiak. Sie sind nichts wert. CDU/CSU versprachen nach Hanau und Halle, im Kampf gegen Rechtsextremismus endlich ernst zu machen. Alles nur Show!
Obwohl von Seehofer mitverhandelt, stoppen Sie das #Demokratiefördergesetz! https://t.co/JRTWVjzfHi";454981027;1377268215282339842;2021-03-31 14:35:05+00:00;;de;False;52;27;332;5;everyone;Twitter Web App;1376877139862171650;quoted;2022-05-28 17:03:07.998452
454981027;helgelindh;1376902834201968643;"Lieber @Tareq_Alaows, diejenigen, die Dich bedrohen, können nicht ertragen, dass Du in Deinen 6 Jahren in 🇩🇪 mehr aus Dir gemacht und mehr für dieses Land getan hast, als sie dazu je in der Lage sein werden.
Lass Dich nicht unterkriegen. Du hast unsere volle Solidarität. https://t.co/dmexPPOexk";454981027;1376902834201968643;2021-03-30 14:23:11+00:00;;de;False;60;114;416;13;everyone;Twitter Web App;1376831768188293122;quoted;2022-05-28 17:03:08.001933
454981027;helgelindh;1376458949134852099;@Clan_memberine Es gibt viele unheivolle Allianzen;454981027;1375703687356637184;2021-03-29 08:59:21+00:00;1135177103295619072;de;False;1;6;14;0;everyone;Twitter for Android;1375703687356637184;replied_to;2022-05-28 17:03:08.005762
454981027;helgelindh;1376452907646734336;@Clan_memberine Aber niemand überzeugt, wenn er immer wieder den Ex schönredet und zu ihm zurückkehrt oder sich nicht wirklich trennt;454981027;1373174211812982784;2021-03-29 08:35:21+00:00;1135177103295619072;de;False;0;0;0;0;everyone;Twitter for Android;1373174211812982784;replied_to;2022-05-28 17:03:08.009220
454981027;helgelindh;1375157925455495170;@leonie_stella9 @derya_tn @EskenSaskia Gerne und lieben Dank für die netten Worte! 😊;454981027;1375153467958960140;2021-03-25 18:49:33+00:00;1181327506080780288;de;False;0;0;11;0;everyone;Twitter Web App;1375153467958960140;replied_to;2022-05-28 17:03:08.014069
454981027;helgelindh;1375027942489735170;"Achtung, keine Satire. Die #AfD, die Antichristen für Deutschland, wie ihre unchristliche Politik beweist, hat ernsthaft diesen Antrag gestellt. Merkel-Bashing &amp; erbärmliche Anbiederung ans Christentum gnadenlos gescheitert. Aber auf ""Heil"" beriefen sich ja schon andere einst. https://t.co/OC3gXxbVAC";454981027;1375027942489735170;2021-03-25 10:13:02+00:00;;de;False;45;53;250;13;everyone;Twitter for Android;;;2022-05-28 17:03:08.017596
454981027;helgelindh;1374681078628286467;"Sich selbst zu reflektieren, Fehler zu korrigieren und dafür die Verantwortung zu übernehmen - das kann nicht jede/r. Bei aller berechtigten Kritik: Das unterscheidet #Merkel von männlichen selbsternannten ""Alpha-Tieren"" wie Söder und Laschet. 
Twitter-Häme daher unangebracht.";454981027;1374681078628286467;2021-03-24 11:14:44+00:00;;de;False;391;225;4213;59;everyone;Twitter for Android;;;2022-05-28 17:03:08.021463
454981027;helgelindh;1374377394753052681;"@SebastianSteirl Sebastian, genau lesen erleichtert die Meinungsbildung. Ich spreche nicht von ""der Politik"", sondern von Menschen, die sich von ""der Politik"" abwenden. Und die gibt es. Und das zur Kenntnis zu nehmen, ist meine Pflicht. Also genauer hinschauen, bitte!";454981027;1374342369231912960;2021-03-23 15:08:00+00:00;16244400;de;False;0;1;12;0;everyone;Twitter for Android;1374348609735561223;replied_to;2022-05-28 17:03:08.024987
454981027;helgelindh;1374342369231912960;"Wer nicht will, dass wir den 31.03.2021 als Superspreader-Einkaufsmittwoch in Erinnerung behalten.
Dass sich wieder um Klopapier geprügelt wird.
Dass die Menschen sich kopfschüttelnd vollends von der Politik abwenden...
der (oder die) lässt verdammt nochmal die Supermärkte offen!";454981027;1374342369231912960;2021-03-23 12:48:49+00:00;;de;False;63;203;474;36;everyone;Twitter Web App;;;2022-05-28 17:03:08.029038
454981027;helgelindh;1373363004046213122;"Alle, die auf der #QuerdenkerDemo
in Kassel ohne Abstand &amp; Maske wie in 'ner Sardinenbüchse demonstrierten, verdienen, wegen gefährlicher Körperverletzung angeklagt zu werden. Während andere sterben, marschieren sie ungestört &amp; wehleidig. #ks2003 ist eine Schande für Deutschland";454981027;1373363004046213122;2021-03-20 19:57:10+00:00;;de;False;364;746;2709;100;everyone;Twitter for Android;;;2022-05-28 17:03:08.033827
454981027;helgelindh;1373230074577702912;@hubertus_heil @spdde Grandioses Ergebnis. Für deine Leistung mehr als verdient;454981027;1373216849471676417;2021-03-20 11:08:57+00:00;15943222;de;False;0;0;21;1;everyone;Twitter for Android;1373216849471676417;replied_to;2022-05-28 17:03:08.036970
454981027;helgelindh;1373169395976056833;Hiermit erkläre ich meine Mitgliedschaft bei @seaeyeorg. Gemeinsam waren wir auf Malta, gemeinsam waren wir im Gericht bei @Georg_Pazderski vs. #SeaEye. Die perfide Äußerung, SeaEye hätte den Nizza-Attentäter nach Europa gebracht, bleibt untersagt. Rechtsstaat schlägt AfD. Danke! https://t.co/upEhy0Aimb;454981027;1373169395976056833;2021-03-20 07:07:50+00:00;;de;False;55;64;390;8;everyone;Twitter for Android;;;2022-05-28 17:03:08.040928
454981027;helgelindh;1372628730057744396;"#CDUgoesAfD ""Ohne.... Gendersprache und tendenziöser [sic] Berichterstattung"". AfD-Stimmungsmache gegen den Öffentlichen Rundfunk pur? Weit gefehlt. So spricht eine CDU-Bundestagsabgeordnete! Wer so spricht, macht die AfD überflüssig &amp; übernimmt deren Job. Einfach untragbar! https://t.co/TMqdNoDjsI";454981027;1372628730057744396;2021-03-18 19:19:26+00:00;;de;False;9;55;108;2;everyone;Twitter for Android;1372577945794064385;quoted;2022-05-28 17:03:08.044575
