twitter_id;twitter_handle;tweet_id;tweet_text;tweet_author_id;tweet_conversation_id;tweet_created_at;tweet_in_reply_to_user_id;tweet_lang;tweet_possibly_sensitive;tweet_retweet_count;tweet_reply_count;tweet_like_count;tweet_quote_count;tweet_reply_settings;tweet_source;tweet_referenced_tweet_id;tweet_referenced_tweet_type;api_call
1248662696318418950;zoe_gruene;1323731423099015169;"Ich freue mich riesig über das Votum der Landesarbeitsgemeinschaft Tierschutzpolitik der Grünen BW für die Aufstellung der Landesliste zur Bundestagswahl 2021. 
#tierrechte und #tierschutz in den Bundestag! Es gibt so viel zu tun.

🐁🐷🐮 #grüne #bundestag";1248662696318418950;1323731423099015169;2020-11-03 20:58:59+00:00;;de;False;1;0;7;0;everyone;Twitter for Android;;;2022-05-28 18:31:04.916881
1248662696318418950;zoe_gruene;1320760954213277698;"Meine Forschungsgruppe am Karlsruher Institut für Technologie (KIT). Seit letztem Jahr arbeite ich als Wirtschaftsingenieurin hier an meinem Promotionsvorhaben im Bereich ""Klimaschutz im Gebäudesektor"".
@KITKarlsruhe #Forschung #Wissenschaft #Klimaschutz https://t.co/R4fdUAZmsj";1248662696318418950;1320760954213277698;2020-10-26 16:15:24+00:00;;de;False;0;0;14;0;everyone;Twitter for Android;;;2022-05-28 18:31:04.921448
1248662696318418950;zoe_gruene;1318804879217917952;RT @beolba: “Wir haben Grüne Antworten auf die Herausforderungen unserer Zeit. Machen wir das Beste aus dem Geld, was uns 2021 noch zur Ver…;1248662696318418950;1318804879217917952;2020-10-21 06:42:40+00:00;;de;False;2;0;0;0;everyone;Twitter for Android;1318550446701711361;retweeted;2022-05-28 18:31:04.925001
1248662696318418950;zoe_gruene;1317153927289327618;Glückwunsche an Karlsruhe-Land für diesen tollen Bundestagskandidaten! https://t.co/H9Ik7g5Bml;1248662696318418950;1317153927289327618;2020-10-16 17:22:22+00:00;;de;False;0;0;3;1;everyone;Twitter for Android;1316921061691346944;quoted;2022-05-28 18:31:04.928782
1248662696318418950;zoe_gruene;1317153481250230274;@UlrikeHeiss @TWunderberg Danke 💚💚;1248662696318418950;1316626700168552448;2020-10-16 17:20:36+00:00;922794442553208832;de;False;0;0;1;0;everyone;Twitter for Android;1317102763600433155;replied_to;2022-05-28 18:31:04.932288
1248662696318418950;zoe_gruene;1317098286969507840;@Ju_Schmi Danke 💚😊;1248662696318418950;1316626700168552448;2020-10-16 13:41:16+00:00;1040210707340513280;de;False;0;0;1;0;everyone;Twitter for Android;1316681562835030016;replied_to;2022-05-28 18:31:04.936069
1248662696318418950;zoe_gruene;1317098255314976768;@micha_bloss Danke 💚;1248662696318418950;1316626700168552448;2020-10-16 13:41:09+00:00;20344328;de;False;0;0;1;0;everyone;Twitter for Android;1316657471574945792;replied_to;2022-05-28 18:31:04.940312
1248662696318418950;zoe_gruene;1316807499631255553;@ist_symbadisch Danke Dir 💚😊;1248662696318418950;1316626700168552448;2020-10-15 18:25:47+00:00;1033700446706298881;de;False;0;0;0;0;everyone;Twitter for Android;1316793083435126784;replied_to;2022-05-28 18:31:04.943989
1248662696318418950;zoe_gruene;1316760677097365505;"RT @GruneKarlsruhe: Wie geht es weiter mit den Stadtfinanzen?
Alle zwei Jahre beschließt der Karlsruher Gemeinderat, wie das städtische Gel…";1248662696318418950;1316760677097365505;2020-10-15 15:19:44+00:00;;de;False;1;0;0;0;everyone;Twitter for Android;1316671926748708870;retweeted;2022-05-28 18:31:04.947635
1248662696318418950;zoe_gruene;1316760438219169792;@SPD_Karlsruhe @ParsaMarvi Danke, Karlsruher SPD 💚❤️. Habt eine gute Veranstaltung heute Abend!;1248662696318418950;1316746766256156677;2020-10-15 15:18:47+00:00;1250473747703873537;de;False;0;0;1;0;everyone;Twitter for Android;1316746766256156677;replied_to;2022-05-28 18:31:04.951320
1248662696318418950;zoe_gruene;1316760210745196545;RT @SPD_Karlsruhe: Herzlichen Glückwunsch @ZoeMayer7 zur gestrigen Nominierung, unsere kommunale Stimmenkönigin geht nach #Berlin! Wir werd…;1248662696318418950;1316760210745196545;2020-10-15 15:17:53+00:00;;de;False;1;0;0;0;everyone;Twitter for Android;1316746766256156677;retweeted;2022-05-28 18:31:04.955080
1248662696318418950;zoe_gruene;1316760137642770433;RT @BNN_BaNeuNa: Das Bewerberfeld in Karlsruhe, was die Bundestagswahlen im Herbst 2021 angeht, füllt sich. Nun haben die @grueneka die Fra…;1248662696318418950;1316760137642770433;2020-10-15 15:17:35+00:00;;de;False;1;0;0;0;everyone;Twitter for Android;1316717758718136320;retweeted;2022-05-28 18:31:04.958829
1248662696318418950;zoe_gruene;1316626700168552448;Vielen Dank zur Wahl als Grüne Direktkandidatin zur Bundestagswahl 2021 im Wahlkreis Karlsruhe-Stadt! #Karlsruhe #Grüne #Bundestag https://t.co/agAgGAvxAc;1248662696318418950;1316626700168552448;2020-10-15 06:27:21+00:00;;de;False;6;3;66;1;everyone;Twitter for Android;;;2022-05-28 18:31:04.962718
1248662696318418950;zoe_gruene;1315322825490735107;"Am Mittwoch ist es so weit: Der Grüne Kreisverband Karlsruhe nominiert eine*n Kandidat*in für die Bundestagswahl 2021 im Wahlkreis Karlsruhe-Stadt. Ich kann es kaum erwarten mich den Mitgliedern als Bewerberin vorzustellen 🔥💚💯.
#Bundestag #Karlsruhe #Gruene";1248662696318418950;1315322825490735107;2020-10-11 16:06:13+00:00;;de;False;0;1;23;0;everyone;Twitter for Android;;;2022-05-28 18:31:04.965838
1248662696318418950;zoe_gruene;1308126145590722560;RT @ellipielhoff: Mit Tobi Bacherle und Zoe Mayer als unsere SpiKas für die Bundestagswahl sind wir als @gjbw mega gut aufgestellt - gegen…;1248662696318418950;1308126145590722560;2020-09-21 19:29:11+00:00;;de;False;3;0;0;0;everyone;Twitter for Android;1308115101665370118;retweeted;2022-05-28 18:31:04.970093
1248662696318418950;zoe_gruene;1308107209566453763;RT @SarahBHeim: Ich freue mich mega, dass wir mit @ZoeMayer7 und @TBBacherle ein Hammer Team von Spitzenkandis der @gjbw zur Landeslistenau…;1248662696318418950;1308107209566453763;2020-09-21 18:13:56+00:00;;de;False;4;0;0;0;everyone;Twitter for Android;1308099433272401921;retweeted;2022-05-28 18:31:04.974402
1248662696318418950;zoe_gruene;1307744883839504385;RT @gj_konstanz: Herzlichen Glückwunsch an unser Mitglied Sebastian Lederer (@SebastianLeder6), der diese Woche zum #Bundestag|s Direktkand…;1248662696318418950;1307744883839504385;2020-09-20 18:14:11+00:00;;de;False;6;0;0;0;everyone;Twitter for Android;1307728743528529920;retweeted;2022-05-28 18:31:04.977775
1248662696318418950;zoe_gruene;1307721271006900224;"RT @gjbw: Wir lassen uns die Zukunft nicht verbauen – jetzt wird Geschichte geschrieben.
Deshalb haben wir gestern unsere Spitzenkandidat*i…";1248662696318418950;1307721271006900224;2020-09-20 16:40:21+00:00;;de;False;4;0;0;0;everyone;Twitter for Android;1307721015573852162;retweeted;2022-05-28 18:31:04.981632
1248662696318418950;zoe_gruene;1307720111277715457;RT @gjbw: Wir wollen mitbestimmen! Es geht um unsere Zukunft! Die nächste BTW steht vor der Tür und wir wollen endlich einen Politikwechsel…;1248662696318418950;1307720111277715457;2020-09-20 16:35:45+00:00;;de;False;5;0;0;0;everyone;Twitter for Android;1307719798718164992;retweeted;2022-05-28 18:31:04.985265
1248662696318418950;zoe_gruene;1307628248046743554;RT @De_Gedik: Mit @ZoeMayer7 und @TBBacherle  hat die @gjbw 2 starke Spitzenkandidat*innen für die Aufstellung der Landesliste von @GrueneB…;1248662696318418950;1307628248046743554;2020-09-20 10:30:43+00:00;;de;False;7;0;0;0;everyone;Twitter for Android;1307573534898688000;retweeted;2022-05-28 18:31:04.990757
1248662696318418950;zoe_gruene;1305956117508431875;Danke für das einstimmige Votum der Grünen Jugend Karlsruhe für die Spitzenkandidatur der Grünen Jugend Baden-Württemberg zur Bundestagswahl! 💚 https://t.co/OX3eaXW6Nv;1248662696318418950;1305956117508431875;2020-09-15 19:46:16+00:00;;de;False;0;0;11;0;everyone;Twitter for Android;;;2022-05-28 18:31:04.993994
1248662696318418950;zoe_gruene;1305825652487204865;"RT @FFF_Karlsruhe: 🧍🧍🏽‍♀️🧍🏻‍♂️Unsere Menschenkette am 25.9. 🧍🏿‍♂️🧍🏾‍♀️🧍🏼

Endlich ist es offiziell: Am 25. September veranstalten wir eine…";1248662696318418950;1305825652487204865;2020-09-15 11:07:51+00:00;;de;False;42;0;0;0;everyone;Twitter for Android;1305564406764503041;retweeted;2022-05-28 18:31:04.997370
1248662696318418950;zoe_gruene;1305537070128078849;"RT @AnnaDeparnay: #Zivilisation zeigt sich auch an unserem Umgang mit #Tieren.
Welche Auswirkungen hat das geplante #Mercosur Abkommen auf…";1248662696318418950;1305537070128078849;2020-09-14 16:01:07+00:00;;de;False;1;0;0;0;everyone;Twitter for Android;1305520342253920256;retweeted;2022-05-28 18:31:05.001150
1248662696318418950;zoe_gruene;1305191999717474306;Glückwunsch an die Grünen NRW! Packen wir's an. 😊 https://t.co/3T0fz2lVEg;1248662696318418950;1305191999717474306;2020-09-13 17:09:56+00:00;;de;False;0;0;2;0;everyone;Twitter for Android;1305175563842224134;quoted;2022-05-28 18:31:05.005117
1248662696318418950;zoe_gruene;1304490452633243654;Nächste Woche werden die Spitzenkandidat*innen der #GJBW für die Bundestagswahl 2021 gewählt! 💚 Ich bewerbe mich und wenn ihr noch Fragen habt, dann kommt am Mittwoch unbedingt in unser Online Treffen: 😊 https://t.co/FciFSVmPRi https://t.co/8JGpiJmpxh;1248662696318418950;1304490452633243654;2020-09-11 18:42:14+00:00;;de;False;1;0;1;0;everyone;Twitter for Android;;;2022-05-28 18:31:05.009388
1248662696318418950;zoe_gruene;1303351772044562432;"Veranstaltungsankündigung: #Tierschutz in der Landwirtschaft. 🐮🐷🐰
Das Live-Gespräch mit Anton Hofreiter, dem Fraktionsvorsitzenden der #Grünen im #Bundestag, und mir. 

Zur Anmeldung geht es in wenigen Klicks: https://t.co/bLxZbvRBD5 https://t.co/jGxQTYV2is";1248662696318418950;1303351772044562432;2020-09-08 15:17:32+00:00;;de;False;1;0;4;0;everyone;Twitter for Android;;;2022-05-28 18:31:05.013572
1248662696318418950;zoe_gruene;1303300911687663620;Schade! Der Bundesparteitag der Grünen wird dieses Jahr nicht wie geplant in #Karlsruhe stattfinden wegen #Corona. Stattdessen gibt es ein digitales Event. Sicherheit geht vor und ich freue mich über die verantwortungsvolle Planung der #Gruenen.  🙂;1248662696318418950;1303300911687663620;2020-09-08 11:55:26+00:00;;de;False;0;0;4;0;everyone;Twitter for Android;;;2022-05-28 18:31:05.017080
1248662696318418950;zoe_gruene;1301500998360485888;"Unterwegs mit Jule Dalibor vom Green Office der Universität Amsterdam. 
Habe ein paar spannende Anregungen bekommen wie wir mehr Aufmerksamkeit für grüne Zukunftsfragen an Unis schaffen können. 
▶️ Mit Aktionen, die im Alltag der Studis ankommen. https://t.co/3RIzX0mZFe";1248662696318418950;1301500998360485888;2020-09-03 12:43:13+00:00;;de;False;0;0;2;0;everyone;Twitter for Android;;;2022-05-28 18:31:05.021419
1248662696318418950;zoe_gruene;1300786051594833920;Grüße vom Regenbogen aus Utrecht 🌈👋. #queerrightsarehumanrights https://t.co/x8wb2JJlAx;1248662696318418950;1300786051594833920;2020-09-01 13:22:16+00:00;;de;False;1;0;9;0;everyone;Twitter for Android;;;2022-05-28 18:31:05.025175
1248662696318418950;zoe_gruene;1300102282483302400;"Im größten Fahrradparkhaus der Welt in Utrecht mit Platz für 12.500 Räder. 🤩
In Utrecht werden 60% aller Wege im Zentrum mit dem Rad zurückgelegt. Da können wir uns in Deutschland sicher noch was abschauen. #fahrradwendejetzt #autofreieInnenstadt https://t.co/rVhgS2yuWt";1248662696318418950;1300102282483302400;2020-08-30 16:05:13+00:00;;de;False;1;1;9;0;everyone;Twitter for Android;;;2022-05-28 18:31:05.028947
1248662696318418950;zoe_gruene;1298989138935345153;@TWunderberg Bislang ist erstmal die Bewerbung raus. Das mit dem gewählt werden kommt hoffentlich noch :D;1248662696318418950;1296482898988670976;2020-08-27 14:21:59+00:00;905481796762177540;de;False;0;0;0;0;everyone;Twitter for Android;1298901921030385664;replied_to;2022-05-28 18:31:05.032292
1248662696318418950;zoe_gruene;1296482898988670976;"Heute habe ich meine Bewerbung für die Spitzenkandidatur der Grünen Jugend Baden-Württemberg (GJBW) für die Bundestagswahlen 2021 eingereicht. 🦔🌵
Ich würde mich sehr über eure Unterstützung freuen! 
#GJBW #Bundestagswahl https://t.co/Vxg9n0g0TB";1248662696318418950;1296482898988670976;2020-08-20 16:23:05+00:00;;de;False;0;1;12;0;everyone;Twitter for Android;;;2022-05-28 18:31:05.036342
1248662696318418950;zoe_gruene;1295675830031519744;RT @GruneKarlsruhe: Wir freuen uns, unsere neue Homepage zu präsentieren. Auf dieser informieren wir euch wie gewohnt über unsere Arbeit un…;1248662696318418950;1295675830031519744;2020-08-18 10:56:05+00:00;;de;False;2;0;0;0;everyone;Twitter for Android;1295664269812539394;retweeted;2022-05-28 18:31:05.040762
1248662696318418950;zoe_gruene;1295074437704933376;"Mein erstes Mal Bergwandern in den österreichischen Alpen. Freue mich auf den Muskelkater morgen. 😄
Danke an Anton Hofreiter für die Bergtour 🏞️😊. https://t.co/BO5DH4DvgZ";1248662696318418950;1295074437704933376;2020-08-16 19:06:21+00:00;;de;False;0;0;19;0;everyone;Twitter for Android;;;2022-05-28 18:31:05.044433
1248662696318418950;zoe_gruene;1291353466124804096;Die Wärmflasche hat finde ich wirklich Potenzial zum neuen Wahrzeichen des Karlsruher Instituts für Technologie (KIT). 🤔🌡️ #Karlsruhe https://t.co/Zs8dooRmyT;1248662696318418950;1291353466124804096;2020-08-06 12:40:33+00:00;;de;False;0;1;2;0;everyone;Twitter for Android;;;2022-05-28 18:31:05.047823
1248662696318418950;zoe_gruene;1288862966859943937;RT @grueneka: Wir suchen eine*n Wahlkampfassistent*in! Gerne teilen und bewerben :-) Mehr Infos unter: https://t.co/06eq0kzEx3 https://t.co…;1248662696318418950;1288862966859943937;2020-07-30 15:44:11+00:00;;de;False;2;0;0;0;everyone;Twitter for Android;1288842371820670980;retweeted;2022-05-28 18:31:05.051663
1248662696318418950;zoe_gruene;1288833646229622787;"Endlich werden in Baden-Württemberg Landstreckentiertransporte in weit entfernte Nicht-EU Staaten untersagt.

Und trotzdem bleibt das Kernproblem der Fleischwirtschaft: Muss das alles wirklich sein? Ein kurzes, unwürdiges Leben in meist konventioneller Haltung ist die Regel. 🐽";1248662696318418950;1288833646229622787;2020-07-30 13:47:41+00:00;;de;False;0;0;7;0;everyone;Twitter for Android;;;2022-05-28 18:31:05.056416
1248662696318418950;zoe_gruene;1288782934917492736;Holzbau 🌳... Aus nachhaltigem Anbau spart Holz Ressourcen und ist viel klimafreundlicher als Beton. Wir Grünen wollen mehr Holz bei städtischen Bauprojekten! Von kleinen Gebäuden bis großen Funktionsbauten ist alles möglich. (Nicht nur dieses Baumhaus, das in Rheinau steht 😄) https://t.co/RydPt7KkFf;1248662696318418950;1288782934917492736;2020-07-30 10:26:10+00:00;;de;False;1;1;4;0;everyone;Twitter for Android;;;2022-05-28 18:31:05.059957
1248662696318418950;zoe_gruene;1288113885300416513;Letzte Sitzung des Karlsruher Stadtrats vor der Sommerpause. Heute wird der Corona-Antrags-Stau abgearbeitet. #Politik #Karlsruhe https://t.co/hSgRleDfvO;1248662696318418950;1288113885300416513;2020-07-28 14:07:36+00:00;;de;False;0;1;6;0;everyone;Twitter for Android;;;2022-05-28 18:31:05.063549
1248662696318418950;zoe_gruene;1287319477424721923;@norberthense Schade, Norbert. Aber sehr toll, dass Du angetreten bist! 😊🍀;1248662696318418950;1287045765324574721;2020-07-26 09:30:55+00:00;19775104;de;False;0;0;0;0;everyone;Twitter for Android;1287045765324574721;replied_to;2022-05-28 18:31:05.067476
1248662696318418950;zoe_gruene;1286314673005002752;"Die Haltung der Elefanten in der ""Altersresidenz"" im Karlsruher Zoo wird vom direkten Kontakt auf ein geschütztes System umgestellt. Damit können künftig auch schwierige Tiere aus Zirkusbetrieben aufgenommen werden. Elefantenhaken sind nicht mehr notwendig. 🐘
#Tierschutz";1248662696318418950;1286314673005002752;2020-07-23 14:58:11+00:00;;de;False;0;0;4;0;everyone;Twitter for Android;;;2022-05-28 18:31:05.072277
1248662696318418950;zoe_gruene;1285574632045719553;Sitzung des Karlsruher Stadtrats beginnt. Heute gibt es einige Fortschritte für die Innenstadt #autofrei. Mehr Leihfahrräder und endlich eine südliche Waldstraße ohne Parkplätze und mit mehr Raum für die Gastronomie. #Klimaschutz #Karlsruhe https://t.co/PNMCpe0pGw;1248662696318418950;1285574632045719553;2020-07-21 13:57:31+00:00;;de;False;1;0;20;0;everyone;Twitter for Android;;;2022-05-28 18:31:05.075828
1248662696318418950;zoe_gruene;1284848132845699075;"Übers Wochenende am Bodensee und direkt wieder Karlsruhe gesichtet 🧐.
#Karlsruhe #Konstanz #Bodensee https://t.co/0MQairuswN";1248662696318418950;1284848132845699075;2020-07-19 13:50:40+00:00;;de;False;0;0;6;0;everyone;Twitter for Android;;;2022-05-28 18:31:05.079451
1248662696318418950;zoe_gruene;1283797279443488770;"Gleich geht's los: @Ricarda_Lang und ich reden ab 19 Uhr live in Instagram über das Thema ""Tierfabrik Deutschland"" - Bedingungen für Mensch und Tier in der Tierwirtschaft.
Folgt mir gerne unter zoe.gruene
#Toennies
#Massentierhaltung #Tierschutz";1248662696318418950;1283797279443488770;2020-07-16 16:14:57+00:00;;de;False;1;0;7;0;everyone;Twitter for Android;;;2022-05-28 18:31:05.082748
1248662696318418950;zoe_gruene;1283515246666297344;"Ins Bild gemogelt mit unseren starken Karlsruher Kandidat*innen für die Landtagswahlen 2021. 🤓
@salomon_alex,
@eIIyrch, Ute Leidig und Elisa Weintraub https://t.co/hlZfe8wtUu";1248662696318418950;1283515246666297344;2020-07-15 21:34:16+00:00;;de;False;2;1;18;1;everyone;Twitter for Android;;;2022-05-28 18:31:05.086974
1248662696318418950;zoe_gruene;1283495374913708040;Nominierung zur Landtagswahl: Im Karlsruher Westen gehen 2021 Alexander Salomon @salomon_alex und seine Ersatzkandidatin Elly Reich @eIIyrch ins Rennen. Gratulation 🔥💚 #landtagbw #grüne #grünebw #karlsruhe;1248662696318418950;1283495374913708040;2020-07-15 20:15:18+00:00;;de;False;1;0;20;1;everyone;Twitter for Android;;;2022-05-28 18:31:05.091020
1248662696318418950;zoe_gruene;1283474465930784768;Nominierung zur Landtagswahl: Im Karlsruher Osten gehen 2021 Dr. Ute Leidig und ihre Ersatzkandidatin Elisa Weintraub ins Rennen. Gratulation 🔥💚 #landtagbw #grüne #grünebw #karlsruhe;1248662696318418950;1283474465930784768;2020-07-15 18:52:13+00:00;;de;False;0;0;3;0;everyone;Twitter for Android;;;2022-05-28 18:31:05.094799
1248662696318418950;zoe_gruene;1282017910202957825;"Ich finde in Karlsruhe können wir uns echt freuen über viele wunderschöne Seen im Stadtgebiet oder in unmittelbarer Nähe. 😍
Heute im Landschaftsschutzgebiet am Oberwaldsee. Baden ist hier verboten und die Natur ist umso schöner. #Karlsruhe #NaturePhotography https://t.co/rkFLJoRngf";1248662696318418950;1282017910202957825;2020-07-11 18:24:23+00:00;;de;False;1;0;7;0;everyone;Twitter for Android;;;2022-05-28 18:31:05.098247
1248662696318418950;zoe_gruene;1280493461507051521;"Ich gehe live auf Instagram mit @Ricarda_Lang.
Thema: ""Tierfabrik Deutschland"".
Seid dabei und folgt meinem Instagram-Profil zoe.gruene. https://t.co/hKI9WVj7vy";1248662696318418950;1280493461507051521;2020-07-07 13:26:46+00:00;;de;False;0;0;3;0;everyone;Twitter for Android;;;2022-05-28 18:31:05.101827
1248662696318418950;zoe_gruene;1279816207164637185;"Danke @Memet_Kilic für die Einladung auf Deinen YouTube Channel. In unserem kurzen Interview ging es um Tierschutz, ""den Kastenstand"", Klimaschutz und was ich gerne im Bundestag verändern würde. https://t.co/FVajvJtend";1248662696318418950;1279816207164637185;2020-07-05 16:35:36+00:00;;de;False;1;0;3;0;everyone;Twitter for Android;;;2022-05-28 18:31:05.106694
1248662696318418950;zoe_gruene;1279333717576683520;Der alte Flugplatz: Frühere Generationen von Grünen im Stadtrat von Karlsruhe haben sich gegen die Bebauung des Gebiets stark gemacht. Seit 2010 ein wunderschönes Naturschutzgebiet 💚. #lieblingsorte https://t.co/mXG0gY506W;1248662696318418950;1279333717576683520;2020-07-04 08:38:21+00:00;;de;False;0;0;9;0;everyone;Twitter for Android;;;2022-05-28 18:31:05.740284
1248662696318418950;zoe_gruene;1279333184216469510;RT @Memet_Kilic: Der @bundesrat hat das Ende der #Kastenstandhaltung von Schweinen eingeleitet. Bedeutet das mehr #Tierwohl und Planungssic…;1248662696318418950;1279333184216469510;2020-07-04 08:36:14+00:00;;de;False;1;0;0;0;everyone;Twitter for Android;1279299936488652801;retweeted;2022-05-28 18:31:05.745676
1248662696318418950;zoe_gruene;1279052886266318848;@UlrikeHeiss 💚 Danke für den netten Tweet 😊;1248662696318418950;1279051984755200002;2020-07-03 14:02:26+00:00;922794442553208832;de;False;0;1;1;0;everyone;Twitter for Android;1279051984755200002;replied_to;2022-05-28 18:31:05.749521
1248662696318418950;zoe_gruene;1279048372545114114;"Die Aufzeichnung unserer online-Veranstaltung ""Kommunaler Klimaschutz - Wie kann das gelingen?"" gibt es auf Anfrage per Link 😊. Ein Format für kommunale Mandatsträger*innen und Aktive.
Danke für insgesamt rund 150 Teilnehmer*innen und das Interesse! 💚 #Klimakrise";1248662696318418950;1279048372545114114;2020-07-03 13:44:30+00:00;;de;False;0;0;2;0;everyone;Twitter for Android;;;2022-05-28 18:31:05.753798
1248662696318418950;zoe_gruene;1279034895306756097;"Deniz Gedik @De_Gedik will für Mannheim in den Landtag. Morgen ist Nominierung und ich drücke ihm beide Daumen! #teamdeniz 
Ein toller Mensch und super Politiker. 🌏💚 https://t.co/gCDK4rLXjG";1248662696318418950;1279034895306756097;2020-07-03 12:50:57+00:00;;de;False;3;0;8;0;everyone;Twitter for Android;;;2022-05-28 18:31:05.758570
1248662696318418950;zoe_gruene;1278040388125810689;@FFF_Karlsruhe Natürlich stimmt das! Twitter lässt leider keine ausführlichen Antworten zu. Wir haben ein Klimaschutzkonzept, das es vor 3 Jahren in dieser Form sicher nicht gegeben hätte. Wir haben heute 2 wichtige Punkte für den Klimaschutz beschlossen. Nur Beispiele.;1248662696318418950;1278029150633299968;2020-06-30 18:59:08+00:00;1109106628194914306;de;False;0;0;0;0;everyone;Twitter for Android;1278030938228895747;replied_to;2022-05-28 18:31:05.762402
1248662696318418950;zoe_gruene;1278029150633299968;Bei all dem Frust über den Beschluss der Hagsfeldumfahrung: Lasst uns nicht vergessen wie viel wir schon geschafft haben! Klimaschutz ist in unserer Gesellschaft angekommen. So oft gab es das Wort Klima im Stadtrat wohl selten wie in dieser Sitzung! @FFF_Karlsruhe 💚;1248662696318418950;1278029150633299968;2020-06-30 18:14:28+00:00;;de;False;0;1;9;0;everyone;Twitter for Android;;;2022-05-28 18:31:05.766158
1248662696318418950;zoe_gruene;1278017053409099776;Leider hat es nicht für eine Mehrheit im Stadtrat gegen die Umfahrung Hagsfeld gereicht @FFF_Karlsruhe. Klimaschutz geht anders. 💔🌏;1248662696318418950;1278017053409099776;2020-06-30 17:26:24+00:00;;de;False;4;0;14;1;everyone;Twitter for Android;;;2022-05-28 18:31:05.770502
1248662696318418950;zoe_gruene;1277997050978799616;Jetzt gleich geht's im Karlsruher Stadtrat los mit dem Tagesordnungspunkt: Umfahrung Hagsfeld. Wir wollen Klimaschutz und keine neuen Autostraßen für 55-70 Mio Euro! @FFF_Karlsruhe;1248662696318418950;1277997050978799616;2020-06-30 16:06:55+00:00;;de;False;0;0;2;0;everyone;Twitter for Android;;;2022-05-28 18:31:05.774808
1248662696318418950;zoe_gruene;1277994289432322049;RT @beolba: Ganz viel 💚 an die @cdu_fra_ka, die uns gerade eine „nationalistische“ Forstpolitik bescheinigt hat, weil wir uns für heimische…;1248662696318418950;1277994289432322049;2020-06-30 15:55:57+00:00;;de;False;2;0;0;0;everyone;Twitter for Android;1277986897969717250;retweeted;2022-05-28 18:31:05.778432
1248662696318418950;zoe_gruene;1277971186937290753;"Jetzt ist Sitzung des Karlsruher Stadtrats. Es gibt heute eine große Demo von @FFF_Karlsruhe. 
Wir sind gespannt, ob es bei der Abstimmung für eine Mehrheit gegen die neue Straße ""Umfahrung Hagsfeld"" reicht. https://t.co/npg5ddzK2D";1248662696318418950;1277971186937290753;2020-06-30 14:24:09+00:00;;de;False;3;1;8;1;everyone;Twitter for Android;;;2022-05-28 18:31:05.781924
1248662696318418950;zoe_gruene;1277613623142219782;RT @norberthense: Straßburg bekommt eine grüne Bürgermeisterin! 🌻💚;1248662696318418950;1277613623142219782;2020-06-29 14:43:19+00:00;;de;False;3;0;0;0;everyone;Twitter for Android;1277317923288371200;retweeted;2022-05-28 18:31:05.785971
1248662696318418950;zoe_gruene;1276083052045840387;@jonasfahrrad @grueneka @AljoschaL Wir Grüne haben im Gemeinderat leider keine Mehrheit alleine. Wir sind immer angewiesen auf Mehrheiten durch andere und Kompromisse. An manchen Stellen müssen wir mit Abstrichen leben. Auch wenn wir es uns anders wünschen.;1248662696318418950;1276074221647650816;2020-06-25 09:21:22+00:00;779708700219084800;de;False;0;0;0;0;everyone;Twitter for Android;1276074222654193664;replied_to;2022-05-28 18:31:05.790073
1248662696318418950;zoe_gruene;1276082625652948994;@jonasfahrrad @grueneka @AljoschaL Leider haben wir nicht bei allen klimarlevanten Themen volle Unterstützung im Gemeinderat. Mit Frank Mentrup haben wir allerdings einen Kandidaten, der für wichtige Klimaprojekte kämpft. Mit anderen Kandidat*innen sehen wir keine bessereren Chancen für notwendige Mehrheiten.;1248662696318418950;1276074221647650816;2020-06-25 09:19:41+00:00;779708700219084800;de;False;0;0;1;0;everyone;Twitter for Android;1276074222654193664;replied_to;2022-05-28 18:31:05.794236
1248662696318418950;zoe_gruene;1276080756562038785;"Wir wollen das Format ganz auf Eure Anliegen abstimmen. Themenwünsche zur besseren Vorbereitung bereits vorab an Zoe senden: Zoe.Mayer@Gemeinderat.karlsruhe.de.
Anmeldung mit Eurem Namen, Eurer Kommune und ggf. Eurer Funktion unter: info@gruenekarlsruhe.de";1248662696318418950;1276080306060242946;2020-06-25 09:12:15+00:00;1248662696318418950;de;False;0;0;1;0;everyone;Twitter for Android;1276080306060242946;replied_to;2022-05-28 18:31:05.797804
