twitter_id;twitter_handle;tweet_id;tweet_text;tweet_author_id;tweet_conversation_id;tweet_created_at;tweet_in_reply_to_user_id;tweet_lang;tweet_possibly_sensitive;tweet_retweet_count;tweet_reply_count;tweet_like_count;tweet_quote_count;tweet_reply_settings;tweet_source;tweet_referenced_tweet_id;tweet_referenced_tweet_type;api_call
1352627969664151553;PhilippiSpd;1385564521251627012;Der #WelttagdesBuches ist ein schöner Anlass, das Lesen zu feiern, ein Buch zur Hand zu nehmen und zu schmökern - oder gleich mal beim Buchhandel des Vertrauens vorbeizuschauen.  https://t.co/z5reSSert6;1352627969664151553;1385564521251627012;2021-04-23 12:01:39+00:00;;de;False;0;1;1;0;everyone;Twitter Web App;;;2022-05-28 18:38:54.017008
1352627969664151553;PhilippiSpd;1385564138160672768;RT @spdde: Alle reden über #allesdichtmachen – wir wollen lieber über diejenigen sprechen, die in dieser Pandemie täglich an ihre Grenzen g…;1352627969664151553;1385564138160672768;2021-04-23 12:00:07+00:00;;de;False;50;0;0;0;everyone;Twitter Web App;1385529209611763712;retweeted;2022-05-28 18:38:54.019410
1352627969664151553;PhilippiSpd;1385156286317318144;Heute ist #Zukunftstag für Mädchen und Jungen. Daran beteilige ich mich gerne aktiv. Meine Nichte Inka Philippi lernt heute das Leben als Assistentin und medizinische Fachangestellte in einer chirurgischen Praxis kennen. #verbindungschafftvertrauen https://t.co/ILUx9QbTFj;1352627969664151553;1385156286317318144;2021-04-22 08:59:28+00:00;;de;False;0;0;4;0;everyone;Twitter Web App;;;2022-05-28 18:38:54.023488
1352627969664151553;PhilippiSpd;1385118743542521856;RT @OlafScholz: Beim #Infektionsschutzgesetz geht es nicht um Einschränkungen, sondern um Perspektive und Hoffnung. Es geht nicht darum, ei…;1352627969664151553;1385118743542521856;2021-04-22 06:30:17+00:00;;de;False;40;0;0;0;everyone;Twitter Web App;1384819567436967936;retweeted;2022-05-28 18:38:54.028232
1352627969664151553;PhilippiSpd;1384425206173818882;Interessante Fotos und Kurzfilme aus dem Bratental, vom Winter an der Kirche, von Dorfaktionen und aus vergangenen Zeiten liefert der @dorfmonitor, den ich in #Roringen bewundern konnte. https://t.co/OsIla2tOLG https://t.co/lOIW8NI6lD;1352627969664151553;1384425206173818882;2021-04-20 08:34:25+00:00;;de;False;0;0;2;0;everyone;Twitter Web App;;;2022-05-28 18:38:54.034606
1352627969664151553;PhilippiSpd;1383746090407653387;Zusammen mit Göttinger Bürgerinnen und Bürgern habe ich am Gänseliesel den Corona-Toten gedacht. Wir brauchen mehr Schutz gegen Covid 19. Eine Infektion kann häufig tödlich enden. #Gedenktag https://t.co/hqMYAiqOCm;1352627969664151553;1383746090407653387;2021-04-18 11:35:51+00:00;;de;False;0;1;2;0;everyone;Twitter for Android;;;2022-05-28 18:38:54.038806
1352627969664151553;PhilippiSpd;1383456438056493069;Ab Montag gibt es in Nds. in der Landesverordnung einen neuen Passus für Geimpfte (Par. 5a (2)). Die Pflicht zur Testung nach Absatz 1 entfällt, wenn man über eine seit mindestens 15 Tagen vollständig abgeschlossene Schutzimpfung gegen Corona verfügt.;1352627969664151553;1383456438056493069;2021-04-17 16:24:52+00:00;;de;False;0;0;0;0;everyone;Twitter Web App;;;2022-05-28 18:38:54.043847
1352627969664151553;PhilippiSpd;1383352240694460417;Gemeinsames Zeitungsinserat von Oberbürgermeister Rolf-Georg Köhler und Landrat Bernhard Reuter. Wir sind bei den Angehörigen, die den Verlust eines lieben Menschen beklagen. https://t.co/tep6Q2m9Zy;1352627969664151553;1383352240694460417;2021-04-17 09:30:50+00:00;;de;False;0;0;0;0;everyone;Twitter Web App;;;2022-05-28 18:38:54.048825
1352627969664151553;PhilippiSpd;1383351616133206016;RT @ZDFheute: Attacke mit Farbeimer: Angriff auf Lauterbachs Auto https://t.co/TJEnSqrsBA;1352627969664151553;1383351616133206016;2021-04-17 09:28:21+00:00;;de;False;33;0;0;0;everyone;Twitter Web App;1383348332089667598;retweeted;2022-05-28 18:38:54.053294
1352627969664151553;PhilippiSpd;1383079348027195396;"RT @spdde: ""Es kommt auf jeden Tag an, es kommt auf jede Stunde an und es kommt auf jedes Intensivbett an"", bringt es @Karl_Lauterbach bei…";1352627969664151553;1383079348027195396;2021-04-16 15:26:27+00:00;;de;False;123;0;0;0;everyone;Twitter Web App;1382805069184303104;retweeted;2022-05-28 18:38:54.056206
1352627969664151553;PhilippiSpd;1382778369633312769;"RT @spdde: +++ 💥Der Kampf um bezahlbare Mieten ist nicht vorbei! 💥+++

Der Berliner Mietendeckel wurde heute gekippt. Wichtig ist: Das @BVe…";1352627969664151553;1382778369633312769;2021-04-15 19:30:28+00:00;;de;False;66;0;0;0;everyone;Twitter Web App;1382711554961985536;retweeted;2022-05-28 18:38:54.059930
1352627969664151553;PhilippiSpd;1382778177815199744;Heute war ich im Dorfladen Roringen. Tolles Angebot für den Ort, hoffentlich bald wieder mit Dorfcafe, dass coronabedingt schließen musste. Ich drücke dem Trägerverein die Daumen. #roringenlebt https://t.co/ZsLEYVLiLT;1352627969664151553;1382778177815199744;2021-04-15 19:29:43+00:00;;de;False;0;0;2;0;everyone;Twitter Web App;;;2022-05-28 18:38:54.065583
1352627969664151553;PhilippiSpd;1382276866074152961;Hier mein Bericht vom Gespräch mit @procitygoettingen https://t.co/KWz5QrELPe https://t.co/WjYbKOxiqB;1352627969664151553;1382276866074152961;2021-04-14 10:17:40+00:00;;de;False;0;0;0;0;everyone;Twitter Web App;;;2022-05-28 18:38:54.071598
1352627969664151553;PhilippiSpd;1382245682392748038;"RT @WDRaktuell: ""Da stehen auf einmal Kinder um einen rum. Das belastet einen deutlich mehr“, sagt Intensivmediziner Dr. Matthias Kochanek…";1352627969664151553;1382245682392748038;2021-04-14 08:13:46+00:00;;de;False;340;0;0;0;everyone;Twitter Web App;1382042878399090690;retweeted;2022-05-28 18:38:54.074729
1352627969664151553;PhilippiSpd;1382245336777953280;Diese Zahlen belegen, dass wir endlich deutlich aufholen. Weiter so! #impfenimpfenimpfen https://t.co/FxvtRYqBOB;1352627969664151553;1382245336777953280;2021-04-14 08:12:23+00:00;;de;False;0;0;1;0;everyone;Twitter Web App;1382243338196246530;quoted;2022-05-28 18:38:54.079175
1352627969664151553;PhilippiSpd;1382004702850736133;Heute durfte ich Susanne Heller und Robert Vogel von Pro City Göttingen kennenlernen. Beide zeigten sich enttäuscht von der Stadtpolitik, malten aber insgesamt kein düsteres Bild der Innenstadt. #verbindungschafftvertrauen #philippivorort https://t.co/MNebHuDzrN;1352627969664151553;1382004702850736133;2021-04-13 16:16:12+00:00;;de;False;0;0;2;0;everyone;Twitter Web App;;;2022-05-28 18:38:54.082249
1352627969664151553;PhilippiSpd;1382000662083465222;RT @spdde: Alle diskutieren über die #KFrage. Außer uns. Wir setzen sie lieber um! https://t.co/fE4SjUc3Ex;1352627969664151553;1382000662083465222;2021-04-13 16:00:08+00:00;;de;False;58;0;0;0;everyone;Twitter Web App;1381985604431396869;retweeted;2022-05-28 18:38:54.085189
1352627969664151553;PhilippiSpd;1381530137083183105;Der Innovationspreis 2021 war ein interessantes Gesprächsthema mit Marc Diedrich, Geschäftsführer der Wirtschaftsförderung Region Göttingen (WRG). Beim Klima- Innovationspreis Niedersachsen 2021 gibt es 10.000 Euro dotiert. Macht mit, bewerbt Euch beim #innovationspreis2021! https://t.co/eXjRxyWwhW;1352627969664151553;1381530137083183105;2021-04-12 08:50:26+00:00;;de;False;0;0;1;0;everyone;Twitter Web App;;;2022-05-28 18:38:54.087962
1352627969664151553;PhilippiSpd;1381314620892327939;Ich habe mich vor Ort im Jungen Theater über den Betrieb unter Corona-Bedingungen informiert. Das neue Schulprojekt macht Hoffnung. Danke an Nico Dietrich und Tobias Sosinka! #verbindungschafftvertrauen #philippivorort #kulturlebt #landinsicht https://t.co/NQmJ6z3rhc;1352627969664151553;1381314620892327939;2021-04-11 18:34:03+00:00;;de;False;0;0;2;0;everyone;Twitter Web App;;;2022-05-28 18:38:54.090737
1352627969664151553;PhilippiSpd;1380899127341559813;So ist es! Ganz besonders bei Gesundheit und Pflege. https://t.co/azBMkSZgTb;1352627969664151553;1380899127341559813;2021-04-10 15:03:02+00:00;;de;False;0;0;0;0;everyone;Twitter Web App;1380810207161368578;quoted;2022-05-28 18:38:54.093558
1352627969664151553;PhilippiSpd;1380468843508862979;Gestern gab es über 700.000 Impfungen gegen Covid-19. Ein wirklich erfreulicher Rekord. Hoffentlich geht es so weiter!;1352627969664151553;1380468843508862979;2021-04-09 10:33:14+00:00;;de;False;0;0;0;0;everyone;Twitter Web App;;;2022-05-28 18:38:54.096427
1352627969664151553;PhilippiSpd;1380465845323849731;Es kann uns alle treffen. https://t.co/QMVtz6r9JI;1352627969664151553;1380465845323849731;2021-04-09 10:21:19+00:00;;de;False;0;0;0;0;everyone;Twitter Web App;1380462663935856640;quoted;2022-05-28 18:38:54.099255
1352627969664151553;PhilippiSpd;1380160723490373645;Habe das heute mit eigenen Augen gesehen. So etwas geht gar nicht! Lasst das! https://t.co/q2Q5XxqEHX https://t.co/715qAPksF2;1352627969664151553;1380160723490373645;2021-04-08 14:08:53+00:00;;de;False;0;0;0;0;everyone;Twitter Web App;1380134358057684992;quoted;2022-05-28 18:38:54.102224
1352627969664151553;PhilippiSpd;1380150192771596303;Heute kurzer Zwischenstopp an der Bahnstation Hedemünden. Ortsbürgermeister Udo Bethke und Ratsherr Kurt Koppetsch zeigen mir die Bauarbeiten (8.5 Mio. €) und die schlechte Zuwegung. Hier muss dringend nachgearbeitet werden. https://t.co/w0v5mJ974u;1352627969664151553;1380150192771596303;2021-04-08 13:27:02+00:00;;de;False;0;0;0;1;everyone;Twitter Web App;;;2022-05-28 18:38:54.105056
1352627969664151553;PhilippiSpd;1379855886638800898;RT @spdde: TV-Tipp 📺: Unser Vorsitzender @NowaboFM ist heute Abend bei Markus Lanz im @ZDF zu sehen. Los geht’s um 23:15 Uhr. Wir freuen un…;1352627969664151553;1379855886638800898;2021-04-07 17:57:34+00:00;;de;False;5;0;0;0;everyone;Twitter for Android;1379855682837577728;retweeted;2022-05-28 18:38:54.107718
1352627969664151553;PhilippiSpd;1379685079379808256;Heute ist #Weltgesundheitstag https://t.co/g1Rw0oHKH2;1352627969664151553;1379685079379808256;2021-04-07 06:38:50+00:00;;de;False;0;0;2;0;everyone;Twitter Web App;;;2022-05-28 18:38:54.110731
1352627969664151553;PhilippiSpd;1379375030249881600;Damit die Stadt Göttingen Modellkommune für Lockerungen werden kann, muss mehr getestet werden. An der Ausbildung habe ich mich gerne beteiligt. https://t.co/ogkgMJCbBD;1352627969664151553;1379375030249881600;2021-04-06 10:06:49+00:00;;de;False;0;0;1;1;everyone;Twitter Web App;;;2022-05-28 18:38:54.113458
1352627969664151553;PhilippiSpd;1379374210259283971;Testen - Impfen - Abstand halten! https://t.co/dEiq0Hkxia;1352627969664151553;1379374210259283971;2021-04-06 10:03:33+00:00;;de;False;0;0;0;0;everyone;Twitter Web App;1379373343019831304;quoted;2022-05-28 18:38:54.116318
1352627969664151553;PhilippiSpd;1378762346655592451;Die aktuell erfreuliche Entwicklung in Portugal zeigt, dass die Einhaltung klarer Regeln zu einer spürbaren Erleichterung führt, also Lockerungen wieder möglich macht. https://t.co/tUUtch0VrH;1352627969664151553;1378762346655592451;2021-04-04 17:32:14+00:00;;de;False;0;0;0;0;everyone;Twitter Web App;1378656797041557504;quoted;2022-05-28 18:38:54.119220
1352627969664151553;PhilippiSpd;1378628966349742080;An den Altenheimen Villa Juesheide und Sieberdamm in Herzberg hat das Blasorchester Herzberg Musik zu Ostern gemacht. Danke auch an Kreisrat Marcel Riethig, der die Trompete spielte. https://t.co/lj6cHEbkVq;1352627969664151553;1378628966349742080;2021-04-04 08:42:13+00:00;;de;False;0;0;1;0;everyone;Twitter Web App;;;2022-05-28 18:38:54.122051
1352627969664151553;PhilippiSpd;1378627459504029699;"@spdde Ostern könnte ohne Covid-19 schöner sein, aber wir können hoffen, dass der ""Impf-Turbo"" jetzt Hoffnung macht auf bessere Verhältnisse.";1352627969664151553;1378606903123656706;2021-04-04 08:36:14+00:00;26458162;de;False;0;0;0;0;everyone;Twitter Web App;1378606903123656706;replied_to;2022-05-28 18:38:54.124872
1352627969664151553;PhilippiSpd;1378328780746416131;Heute war ich bei der Eröffnung des neuen Testzentrums in Osterode dabei. Die ersten Termine waren schnell vergeben. Die nächsten gibt es für den 9. und 10. April im DRK-Familienzentrum unter 05522 5053123. https://t.co/21vGh2aWsO;1352627969664151553;1378328780746416131;2021-04-03 12:49:24+00:00;;de;False;0;0;0;0;everyone;Twitter Web App;;;2022-05-28 18:38:54.128376
1352627969664151553;PhilippiSpd;1377955900221177858;Hohe Impfquote: Bundesländer lockern Corona-Regeln in Alten- und Pflegeheimen https://t.co/Bf4MX4BmMq via @RND_de;1352627969664151553;1377955900221177858;2021-04-02 12:07:42+00:00;;de;False;0;0;0;0;everyone;Twitter for iPad;;;2022-05-28 18:38:54.131295
