twitter_id;twitter_handle;tweet_id;tweet_text;tweet_author_id;tweet_conversation_id;tweet_created_at;tweet_in_reply_to_user_id;tweet_lang;tweet_possibly_sensitive;tweet_retweet_count;tweet_reply_count;tweet_like_count;tweet_quote_count;tweet_reply_settings;tweet_source;tweet_referenced_tweet_id;tweet_referenced_tweet_type;api_call
1411676203224870912;goerke_c;1450360944161398785;Zu Steuersenkungen wird geschwiegen, aber klargestellt, dass es keine Steuererhöhungen für Multimillionäre und Milliardäre geben wird.;1411676203224870912;1450360941393104897;2021-10-19 07:19:30+00:00;1411676203224870912;de;False;0;1;8;0;everyone;Twitter Web App;1450360942760448001;replied_to;2022-05-28 18:01:40.614951
1411676203224870912;goerke_c;1450360942760448001;Im Wahlkampf wollten Grüne und SPD noch kleine und mittlere Einkommen bei der Steuer entlasten und hohe Vermögen und Einkommen zur Kasse ziehen. Nun ist fast das Gegenteil im Papier festgehalten:;1411676203224870912;1450360941393104897;2021-10-19 07:19:29+00:00;1411676203224870912;de;False;0;1;8;0;everyone;Twitter Web App;1450360941393104897;replied_to;2022-05-28 18:01:40.619176
1411676203224870912;goerke_c;1450360941393104897;Das Sondierungspapier der Ampel lässt riesige finanzpolitische Leerstellen! Einerseits sind die Finanzierungswege, die jenseits der Schuldenbremse notwendig sind, total unklar und andererseits ist nicht ersichtlich für wen die Steuern gesenkt werden.;1411676203224870912;1450360941393104897;2021-10-19 07:19:29+00:00;;de;False;3;1;39;0;everyone;Twitter Web App;;;2022-05-28 18:01:40.624334
1411676203224870912;goerke_c;1446063147639525378;Die Behauptung der Juristen, die Schuldenbremse würde keine Investitionen verhindern, ist mit der Realität nicht vereinbar.;1411676203224870912;1446063144200253442;2021-10-07 10:41:35+00:00;1411676203224870912;de;False;1;0;14;0;everyone;Twitter Web App;1446063145919860737;replied_to;2022-05-28 18:01:40.628863
1411676203224870912;goerke_c;1446063145919860737;Beides wäre auch schlecht für die Wirtschaft! Wer in Staatsschulden pauschal eine Belastung künftiger Generationen sieht, zeigt ökonomische Unkenntnis! Deutschland braucht massive Klimainvestitionen, um die Klimaziele zu erreichen und die Wirtschaft auf stabile Beine zu stellen!;1411676203224870912;1446063144200253442;2021-10-07 10:41:35+00:00;1411676203224870912;de;False;1;1;19;0;everyone;Twitter Web App;1446063144200253442;replied_to;2022-05-28 18:01:40.633295
1411676203224870912;goerke_c;1446063144200253442;Die Präsidentinnen und Präsidenten der Rechnungshöfe des Bundes und der Länder plädieren für eine harte Schuldenbremse, um die Generationsgerechtigkeit zu wahren. Dabei drohen mit überstürzter Rückkehr zur Schuldenbremse Kürzungen für Sozialstaat und öffentliche Investitionen!;1411676203224870912;1446063144200253442;2021-10-07 10:41:34+00:00;;de;False;5;2;35;0;everyone;Twitter Web App;;;2022-05-28 18:01:40.638483
1411676203224870912;goerke_c;1444907979799769088;Wir brauchen mehr Transparenz, mehr internationalen Informationsaustausch, weniger Schlupflöcher im Transparenzregister und Straf- bzw. Quellensteuern auf Finanzflüsse in Steueroasen. Wie die kommende Regierung auch aussieht, hier muss dringend gehandelt werden! #PandoraPapers;1411676203224870912;1444907976595230723;2021-10-04 06:11:22+00:00;1411676203224870912;de;False;1;3;34;0;everyone;Twitter Web App;1444907976595230723;replied_to;2022-05-28 18:01:40.645130
1411676203224870912;goerke_c;1444907976595230723;Die #PandoraPapers müssen ein Weckruf sein! Steuerbetrug ist ein Brandbeschleuniger für die Ungleichheit. Der Betrug der Reichen und Mächtigen muss gestoppt werden!;1411676203224870912;1444907976595230723;2021-10-04 06:11:21+00:00;;de;False;77;30;534;5;everyone;Twitter Web App;;;2022-05-28 18:01:40.649483
1411676203224870912;goerke_c;1443952687809286150;"Wer Klimaschutz ernst meint, muss die Bahn erstklassig ausstatten. Der Güterverkehr muss von der Straße auf die Schiene. Das kostet Geld. Wenn der nächste Finanzminister Lindner heißt, werden die dringend notwendigen öffentlichen Investitionen verschlafen!
https://t.co/HVKIOt03wq";1411676203224870912;1443952687809286150;2021-10-01 14:55:22+00:00;;de;False;3;0;14;0;everyone;Twitter Web App;;;2022-05-28 18:01:40.654337
1411676203224870912;goerke_c;1443153001900822536;Uns drohen 4 Jahre des Stillstands. Verlieren werden die, die heute schon zu wenig haben.;1411676203224870912;1443152999203889155;2021-09-29 09:57:42+00:00;1411676203224870912;de;False;7;11;191;0;everyone;Twitter Web App;1443152999203889155;replied_to;2022-05-28 18:01:40.659352
1411676203224870912;goerke_c;1443152999203889155;Ob #Ampel oder #Jamaika: Deutschland droht ein Finanzminister namens Christian Lindner. Wer an der Schuldenbremse klammert und gleichzeitig Steuererhöhungen ausschließt, wird nicht genug Geld für mehr Lehrer, bessere Krankenhäuser und neue Schienen haben. So einfach ist das!;1411676203224870912;1443152999203889155;2021-09-29 09:57:42+00:00;;de;False;242;124;2255;16;everyone;Twitter Web App;;;2022-05-28 18:01:40.662978
1411676203224870912;goerke_c;1441300467565301763;Das kann sich eine zukünftige Regierung nicht leisten! Wenn SPD und Grüne ihre Programme und Wahlplakate ernst meinen, muss es nach der Wahl heißen: Linke statt Lindner!;1411676203224870912;1441300457519935488;2021-09-24 07:16:24+00:00;1411676203224870912;de;False;1;0;8;0;everyone;Twitter Web App;1441300465338122241;replied_to;2022-05-28 18:01:40.666769
1411676203224870912;goerke_c;1441300465338122241;Klar ist aber: Mit der Schuldenbremse ist eine Investitionsoffensive nicht zu machen. Die Schuldenbremse ist eine Investitionsbremse für den ökologischen Umbau. CDU und FDP halten daran fest wie der Ertrinkende am Senkblei.;1411676203224870912;1441300457519935488;2021-09-24 07:16:23+00:00;1411676203224870912;de;False;6;1;36;0;everyone;Twitter Web App;1441300463354138624;replied_to;2022-05-28 18:01:40.671981
1411676203224870912;goerke_c;1441300463354138624;Der Staat muss voran gehen und der Privatwirtschaft eine Richtung und einen Rahmen vorgeben. Nur das bringt Planungssicherheit, ermöglicht private Investitionen und auch die Schaffung vieler neuer Jobs!;1411676203224870912;1441300457519935488;2021-09-24 07:16:23+00:00;1411676203224870912;de;False;0;1;4;0;everyone;Twitter Web App;1441300460485316610;replied_to;2022-05-28 18:01:40.676543
1411676203224870912;goerke_c;1441300460485316610;Mein Kommentar: Fridays for Future legt den Finger in die Wunde. Die GroKo hat Klimaschutz jahrelang verschlafen und musste sogar vom BVerfG ermahnt werden! Wer Klimaschutz will, muss nach der Wahl schnellstmöglich eine öffentliche Investitionsoffensive von der Rampe schieben.;1411676203224870912;1441300457519935488;2021-09-24 07:16:22+00:00;1411676203224870912;de;False;0;1;3;0;everyone;Twitter Web App;1441300457519935488;replied_to;2022-05-28 18:01:40.680456
1411676203224870912;goerke_c;1441300457519935488;Klimaschutz braucht eine Investitionsoffensive. Das geht nicht mit der Schuldenbremse. CDU und FDP halten daran aber fest wie der Ertrinkende am Senkblei. Deshalb am Sonntag: Linke wählen! #FFF #FridaysForFuture;1411676203224870912;1441300457519935488;2021-09-24 07:16:21+00:00;;de;False;5;3;36;0;everyone;Twitter Web App;;;2022-05-28 18:01:40.684295
1411676203224870912;goerke_c;1440606382831534082;RT @victorperli: Um 84 Milliarden Euro haben die 7 reichsten Familien Deutschlands ihr Vermögen seit Beginn der Krise vergrößert. Natürlich…;1411676203224870912;1440606382831534082;2021-09-22 09:18:21+00:00;;de;False;181;0;0;0;following;Twitter Web App;1440565482885562378;retweeted;2022-05-28 18:01:40.689148
1411676203224870912;goerke_c;1440350684788903946;"Weil heute wegen der neuen Studie so viel über die Mindeststeuer diskutiert wurde, in meinem letzten Video habe ich die Lücken aufgezeigt und sie als Mogelpackung bezeichnet!

Zum Video:
https://t.co/YXOAQhXAG8";1411676203224870912;1440350684788903946;2021-09-21 16:22:18+00:00;;de;False;2;0;5;0;everyone;Twitter Web App;;;2022-05-28 18:01:40.693615
1411676203224870912;goerke_c;1440228130036207622;Die großen Digitalkonzerne lachen über die mickrige Mindeststeuer und vor allem die USA, wo die Konzerne ihren Muttersitz haben, halten die Taschen auf. Für Deutschland hingegen springt kaum was bei rum!;1411676203224870912;1440227869481791496;2021-09-21 08:15:19+00:00;1411676203224870912;de;False;0;1;1;0;everyone;Twitter Web App;1440227869481791496;replied_to;2022-05-28 18:01:40.697393
1411676203224870912;goerke_c;1440227869481791496;"Die Mindeststeuer ist für Deutschland eine Mogelpackung! Der große Applaus für Olaf Scholz war überzogen, wie diese Studie zeigt.
 https://t.co/qq4kbI5mLQ";1411676203224870912;1440227869481791496;2021-09-21 08:14:16+00:00;;de;False;1;1;1;0;everyone;Twitter Web App;;;2022-05-28 18:01:40.701270
1411676203224870912;goerke_c;1439905871719456772;Deshalb fordern wir den Mindestlohn auf 13€ anzuheben! Das wäre gerecht und würde zudem noch die Wirtschaft ankurbeln!;1411676203224870912;1439905869811130368;2021-09-20 10:54:46+00:00;1411676203224870912;de;False;0;1;11;0;everyone;Twitter Web App;1439905869811130368;replied_to;2022-05-28 18:01:40.706291
1411676203224870912;goerke_c;1439905869811130368;"Wer sich wie Armin Laschet gegen einen höheren Mindestlohn wehrt, verordnet Armut trotz Arbeit. Das ist unanständig! 

Berechnungen der Regierung zeigten: Der Mindestlohn müsste 12,63 Euro betragen, damit man nach 45 Arbeitsjahren eine Rente oberhalb der Grundsicherung bekommt!";1411676203224870912;1439905869811130368;2021-09-20 10:54:46+00:00;;de;False;4;2;51;1;everyone;Twitter Web App;;;2022-05-28 18:01:40.710463
1411676203224870912;goerke_c;1438878747223105536;RT @DieLinkeBrdburg: Während Innenstädte ausbluten, wird #Amazon immer mächtiger. Dabei zahlt ein Unternehmen wie Amazon in Deutschland kau…;1411676203224870912;1438878747223105536;2021-09-17 14:53:21+00:00;;de;False;2;0;0;0;everyone;Twitter Web App;1438784200681959424;retweeted;2022-05-28 18:01:40.715847
1411676203224870912;goerke_c;1438394217693388801;"Heute Abend kommt mein neues Videos zum Steuer-ABC. Diesmal geht es um die Lücken bei der Mindeststeuer. 

Spoiler: Olaf Scholz besser nicht zu früh feiern!

https://t.co/YXOAQhFZOA";1411676203224870912;1438394217693388801;2021-09-16 06:48:00+00:00;;de;False;0;0;14;0;everyone;Twitter Web App;;;2022-05-28 18:01:40.723519
1411676203224870912;goerke_c;1437692078360760323;Deutschland muss wirtschaftspolitisch aufs Gaspedal treten. Wir brauchen eine Investitionsoffensive, Vollbeschäftigungspolitik und gute Löhne!;1411676203224870912;1437692070387404802;2021-09-14 08:17:57+00:00;1411676203224870912;de;False;2;2;22;0;everyone;Twitter Web App;1437692076871847936;replied_to;2022-05-28 18:01:40.731447
1411676203224870912;goerke_c;1437692076871847936;Höhere Löhne bedeuten mehr Kaufkraft und mehr Kaufkraft kurbelt die Wirtschaft an. Dann sprudeln die Steuereinnahmen und es gibt weniger Aufstocker.;1411676203224870912;1437692070387404802;2021-09-14 08:17:56+00:00;1411676203224870912;de;False;1;1;5;1;everyone;Twitter Web App;1437692075290632192;replied_to;2022-05-28 18:01:40.737822
1411676203224870912;goerke_c;1437692075290632192;Und ich will nochmal daran erinnern: die Union hat sich damals gegen die Einführung des Mindestlohns gewehrt, weil sie Jobverluste befürchtete. Nichts davon ist eingetroffen. Die Union ist ökonomisch blank.;1411676203224870912;1437692070387404802;2021-09-14 08:17:56+00:00;1411676203224870912;de;False;0;1;1;0;everyone;Twitter Web App;1437692073747038210;replied_to;2022-05-28 18:01:40.744063
1411676203224870912;goerke_c;1437692073747038210;Die Anhebung auf 12 Euro wäre ein guter erster Schritt. Wir haben genau das jahrelang gefordert! Um Altersarmut beim gegenwärtigen Rentenniveau zu verhindern, müssen wir aber in Richtung 13€ gehen.;1411676203224870912;1437692070387404802;2021-09-14 08:17:56+00:00;1411676203224870912;de;False;0;1;1;1;everyone;Twitter Web App;1437692072165785607;replied_to;2022-05-28 18:01:40.750008
1411676203224870912;goerke_c;1437692072165785607;Mein ganzer O-Ton: Der heutige Mindestlohn von 9,60€ ist ein Armutslohn! Es darf nicht angehen, dass Menschen ihr Leben lang malochen, aber der Lohn am Ende nicht für eine anständige Rente reicht.;1411676203224870912;1437692070387404802;2021-09-14 08:17:55+00:00;1411676203224870912;de;False;0;1;1;0;everyone;Twitter Web App;1437692070387404802;replied_to;2022-05-28 18:01:40.756938
1411676203224870912;goerke_c;1437692070387404802;"Die Anhebung auf 12 Euro wäre ein guter erster Schritt. Wir haben genau das jahrelang gefordert! Um Altersarmut beim gegenwärtigen Rentenniveau zu verhindern, müssen wir aber in Richtung 13€ gehen!

https://t.co/PCeUGyLz3n";1411676203224870912;1437692070387404802;2021-09-14 08:17:55+00:00;;de;False;2;2;18;0;everyone;Twitter Web App;;;2022-05-28 18:01:40.763640
1411676203224870912;goerke_c;1437301746192289798;"Finanzpolitik für die Millionen statt die Millionäre - dafür will ich mich im Bundestag einsetzen!

https://t.co/G5TBuYPTmN";1411676203224870912;1437301746192289798;2021-09-13 06:26:54+00:00;;de;False;6;2;39;0;everyone;Twitter Web App;;;2022-05-28 18:01:40.771640
1411676203224870912;goerke_c;1435990380944805894;"Meine Videoreihe zum Steuer-ABC geht weiter! Dieses Mal geht es um die Finanztransaktionsteuer. Es ist ein Skandal, dass wir sie immer noch nicht haben, obwohl sie 2012 im Bundestag beschlossen wurde! 

Zum Video:
https://t.co/wsBksdjYbW https://t.co/NSDWrCHK9h";1411676203224870912;1435990380944805894;2021-09-09 15:36:00+00:00;;de;False;3;1;11;0;everyone;Twitter Web App;;;2022-05-28 18:01:40.778585
1411676203224870912;goerke_c;1435924497450815488;"Unsere Pläne habe ich in diesem Video erläutert: 
https://t.co/GAPOAKwOWq";1411676203224870912;1435924126896697346;2021-09-09 11:14:13+00:00;1411676203224870912;de;False;0;0;3;0;everyone;Twitter Web App;1435924129358680071;replied_to;2022-05-28 18:01:40.785813
1411676203224870912;goerke_c;1435924129358680071;Selbst das arbeitgebernahe Ifo-Institut bescheinigt unserem Steuerprogramm, dass es für Aufschwung und knapp 300.000 neue Jobs sorgen würde!;1411676203224870912;1435924126896697346;2021-09-09 11:12:45+00:00;1411676203224870912;de;False;1;1;5;0;everyone;Twitter Web App;1435924126896697346;replied_to;2022-05-28 18:01:40.793563
1411676203224870912;goerke_c;1435924126896697346;"Kein Steuerprogramm würde die Ungleichheit in Deutschland stärker korrigieren als das unsere! Steuersenkungen für die Mehrheit, Steuererhöhungen für Spitzenverdiener. Mehr Netto vom Brutto für die Mittelschicht kurbelt außerdem die Wirtschaft an! 

https://t.co/okyT06m8N0";1411676203224870912;1435924126896697346;2021-09-09 11:12:44+00:00;;de;False;2;2;12;0;everyone;Twitter Web App;;;2022-05-28 18:01:40.802590
1411676203224870912;goerke_c;1435572175545815045;"Morgen um 16 Uhr geht es weiter in meiner Reihe zum Steuer-ABC. Diesmal: Die Finanztransaktionsteuer! 

2012 wurde sie im Bundestag mit Zustimmung aller Fraktionen beschlossen. Bis heute ist nichts passiert. Geplant ist lediglich eine billige Kopie!

https://t.co/q2JSM6xDGj";1411676203224870912;1435572175545815045;2021-09-08 11:54:12+00:00;;de;False;1;0;5;0;everyone;Twitter Web App;;;2022-05-28 18:01:40.809079
1411676203224870912;goerke_c;1435166994895187970;Daneben müssen Bahn und ÖPNV dringend ausgebaut und günstiger werden! Das wäre effektiver Klimaschutz und verschont den Geldbeutel der Pendler!;1411676203224870912;1435166987190251524;2021-09-07 09:04:10+00:00;1411676203224870912;de;False;0;0;8;0;everyone;Twitter Web App;1435166992823169025;replied_to;2022-05-28 18:01:40.816315
1411676203224870912;goerke_c;1435166992823169025;Das Mobilitätsgeld kann mit der Einkommensteuer verrechnet werden oder dort, wo zu wenig Einkommensteuerschuld besteht, direkt ausgezahlt werden!;1411676203224870912;1435166987190251524;2021-09-07 09:04:09+00:00;1411676203224870912;de;False;0;1;7;0;everyone;Twitter Web App;1435166990436601856;replied_to;2022-05-28 18:01:40.824288
1411676203224870912;goerke_c;1435166990436601856;Geringverdiener, Rentner und Studenten schauen nämlich in die Röhre, während Spitzenverdiener am stärksten entlastet werden. Besser wäre ein Mobilitätsgeld, das Pendlerpauschale und Mobilitätsprämie ersetzt und unabhängig vom Einkommen bezahlt wird!;1411676203224870912;1435166987190251524;2021-09-07 09:04:09+00:00;1411676203224870912;de;False;0;1;6;0;everyone;Twitter Web App;1435166988830191618;replied_to;2022-05-28 18:01:40.834107
1411676203224870912;goerke_c;1435166988830191618;"Mit der CO2-Bepreisung wird weiter an der Preisschraube gedreht und Mobilität zum Luxusgut. Das ist ungerecht!

Die Pendlerpauschale zu erhöhen, klingt gut, greift aber zu kurz!";1411676203224870912;1435166987190251524;2021-09-07 09:04:08+00:00;1411676203224870912;de;False;0;1;3;0;everyone;Twitter Web App;1435166987190251524;replied_to;2022-05-28 18:01:40.854687
1411676203224870912;goerke_c;1435166987190251524;Wenn die Spritpreise in die Höhe schießen, frisst die Tankquittung den Monatslohn! Verantwortung für die Tankquittung tragen die Minister Scheuer und Scholz, denn der Spritpreis besteht vor allem aus Steuern und Abgaben!;1411676203224870912;1435166987190251524;2021-09-07 09:04:08+00:00;;de;False;2;1;13;0;everyone;Twitter Web App;;;2022-05-28 18:01:40.862408
1411676203224870912;goerke_c;1434795847636639745;"Die Landesregierung muss reinen Tisch machen und Tesla an der Finanzierung des 50 Millionen Euro Super-Bahnhofes beteiligen. Die eigentliche Frage ist ja, weshalb die Regierung aus der Beihilfe ein solches Geheimnis macht?

https://t.co/KNikkopwKY";1411676203224870912;1434795847636639745;2021-09-06 08:29:21+00:00;;de;False;1;0;6;0;everyone;Twitter Web App;;;2022-05-28 18:01:40.867800
1411676203224870912;goerke_c;1433765107138453504;Für eine Politik im Sinne der breiten Mehrheit braucht es eine starke Linke! https://t.co/uTVVnB5i8j;1411676203224870912;1433765107138453504;2021-09-03 12:13:34+00:00;;de;False;5;0;32;0;everyone;Twitter Web App;;;2022-05-28 18:01:40.882083
1411676203224870912;goerke_c;1433764717936402433;"RT @goerke_c: Wir wollen die Vermögensteuer wiederbeleben! Warum und wie? Darum geht's in meinem neuen Video. 

Jetzt online:
https://t.co/…";1411676203224870912;1433764717936402433;2021-09-03 12:12:01+00:00;;de;False;5;0;0;0;everyone;Twitter Web App;1433435104559439873;retweeted;2022-05-28 18:01:40.898465
1411676203224870912;goerke_c;1433435104559439873;"Wir wollen die Vermögensteuer wiederbeleben! Warum und wie? Darum geht's in meinem neuen Video. 

Jetzt online:
https://t.co/3PULcFTMVy";1411676203224870912;1433435104559439873;2021-09-02 14:22:15+00:00;;de;False;5;0;25;0;everyone;Twitter Web App;;;2022-05-28 18:01:40.945266
1411676203224870912;goerke_c;1433347025752440835;"RT @linke_sachsen: Der Grund, warum Lachet, Lindner &amp; Co. so eine Angst vor einem #Linksrutsch haben ist: Viele linke Vorhaben sind einfach…";1411676203224870912;1433347025752440835;2021-09-02 08:32:15+00:00;;de;False;185;0;0;0;everyone;Twitter Web App;1433329714891010052;retweeted;2022-05-28 18:01:40.974904
1411676203224870912;goerke_c;1433344440853274630;RT @DietmarBartsch: Die staatspolitisch verwahrloste CDU muss raus aus der Bundesregierung - Maskendeals, Aserbaidschan-Affäre, Scheuers ve…;1411676203224870912;1433344440853274630;2021-09-02 08:21:59+00:00;;de;False;206;0;0;0;everyone;Twitter Web App;1433332725105274885;retweeted;2022-05-28 18:01:41.012337
1411676203224870912;goerke_c;1432988294812479488;Die Schere zwischen Arm und Reich ist in Deutschland viel zu groß. Mit Leistung oder gerechten Chancen hat das schon lange nichts mehr zu tun. Die Vermögensteuer muss endlich wiederbelebt werden! Dazu erscheint morgen um 16 Uhr mein neues YouTube-Video: https://t.co/rIEJW4hxkz https://t.co/zOXAwrLz3b;1411676203224870912;1432988294812479488;2021-09-01 08:46:47+00:00;;de;False;4;1;16;0;everyone;Twitter Web App;;;2022-05-28 18:01:41.035200
1411676203224870912;goerke_c;1432669088564846595;"Der Verband der Familienunternehmer beklagt zu wenig Lobby in Berlin zu haben, dabei taucht Angela Merkel bei den Jahrestagungen auf. 

Wir sollten darüber reden, wer wirklich zu wenig Lobby in Berlin hat. Nämlich die Menschen, bei denen am Monatsende das Geld knapp wird!";1411676203224870912;1432669088564846595;2021-08-31 11:38:23+00:00;;de;False;7;0;41;0;everyone;Twitter Web App;;;2022-05-28 18:01:41.060838
1411676203224870912;goerke_c;1432274973968764930;Vermögen werden in Deutschland so wenig besteuert wie in kaum einem anderen Land.;1411676203224870912;1432274973968764930;2021-08-30 09:32:18+00:00;;de;False;4;0;46;0;everyone;Twitter Web App;;;2022-05-28 18:01:41.070835
1411676203224870912;goerke_c;1432271341860888579;"Auch @MFratzscher kritisiert die Studie. Wenn die Vermögensteuer den massiven Investitionsstau löst, hilft das der Wirtschaft! Zudem wird Vermögen in kaum einen anderen Land der Welt so wenig besteuert wie in Deutschland!

https://t.co/LKScUmYieu";1411676203224870912;1432271341860888579;2021-08-30 09:17:52+00:00;;de;False;2;0;10;0;everyone;Twitter Web App;;;2022-05-28 18:01:41.080132
1411676203224870912;goerke_c;1432266517232685056;Wer sich um zu hohe Belastungen sorgt, sollte sich viel mehr um die klammen Kassen in den Kommunen und dem massiven Investitionsstau sorgen. Denn marode Schulen, Lehrermangel, und sanierungsbedürftige Infrastruktur sind die wahre Belastung für Wirtschaft und Gesellschaft!;1411676203224870912;1432266513839493124;2021-08-30 08:58:42+00:00;1411676203224870912;de;False;1;0;9;0;everyone;Twitter Web App;1432266515626274816;replied_to;2022-05-28 18:01:41.267032
1411676203224870912;goerke_c;1432266515626274816;Die Stiftung Familienunternehmen macht sich Sorgen um die Vermögensteuer und lässt das wirtschaftsliberale Ifo-Institut an den Taschenrechner. Dabei sind für Betriebsvermögen ein hoher Freibetrag von 5 Mio. Euro pro Inhaber und ein progressiver Steuertarif vorgesehen.;1411676203224870912;1432266513839493124;2021-08-30 08:58:42+00:00;1411676203224870912;de;False;1;1;7;0;everyone;Twitter Web App;1432266513839493124;replied_to;2022-05-28 18:01:41.332819
1411676203224870912;goerke_c;1432266513839493124;"Wenn Vermögende nicht bereit sind, ihren fairen Beitrag an Steuern zu zahlen, und die ökonomisch unsinnige Schuldenbremse auch nicht angetastet werden soll, reißt irgendwann die Brücke in die Zukunft ab!

https://t.co/Z1tzS7Cjet";1411676203224870912;1432266513839493124;2021-08-30 08:58:41+00:00;;de;False;4;1;21;0;everyone;Twitter Web App;;;2022-05-28 18:01:41.339505
1411676203224870912;goerke_c;1431233054002098181;Drei Euro mehr Hartz IV ist bei steigenden Preisen nicht anderes als versteckter Sozialabbau. Eine Frechheit!;1411676203224870912;1431233054002098181;2021-08-27 12:32:05+00:00;;de;False;6;8;110;2;everyone;Twitter Web App;;;2022-05-28 18:01:41.390051
1411676203224870912;goerke_c;1430903764110610437;"Nach der Krise droht die Abrissbirne für Sozialstaat und Investitionen. Wir sagen: Vermögensabgabe statt Kürzungshammer. Das wäre nicht nur gerecht, sondern auch besser für die Wirtschaft!

Wie die Vermögensabgabe funktioniert, erkläre ich im neuen Video!
https://t.co/9KFHIK41YD https://t.co/D3y1OIPCvs";1411676203224870912;1430903764110610437;2021-08-26 14:43:36+00:00;;de;False;4;0;16;1;everyone;Twitter Ads;;;2022-05-28 18:01:41.416170
1411676203224870912;goerke_c;1430551377860771841;Das wäre nicht nur gerecht, sondern auch besser für die Wirtschaft! Mehr dazu morgen um 16:00 auf YouTube: https://t.co/dMi4JKigwH;1411676203224870912;1430551375709155333;2021-08-25 15:23:21+00:00;1411676203224870912;de;False;0;0;5;0;everyone;Twitter Web App;1430551375709155333;replied_to;2022-05-28 18:01:41.447928
1411676203224870912;goerke_c;1430551375709155333;Wenn nach der Corona-Krise die Schuldenbremse wieder greifen soll, droht die Abrissbirne für den Sozialstaat und die Axt an dringend benötigten öffentlichen Investitionen in Schule, Schiene und Klimaschutz. Um das zu verhindern sagen wir Linke: Vermögensabgabe für Milliardäre!;1411676203224870912;1430551375709155333;2021-08-25 15:23:20+00:00;;de;False;6;1;33;0;everyone;Twitter Web App;;;2022-05-28 18:01:41.462014
1411676203224870912;goerke_c;1430072489963573249;Wer hier kürzt, würgt die Wirtschaft ab! Zumal die Abgabelast selbst für Milliardäre nicht über 1,8 % pro Jahr liegt. Die Renditen aus ihren Vermögen sind vielfach wesentlich höher!;1411676203224870912;1430072479851106317;2021-08-24 07:40:25+00:00;1411676203224870912;de;False;3;0;17;0;everyone;Twitter Web App;1430072488172662785;replied_to;2022-05-28 18:01:41.472178
1411676203224870912;goerke_c;1430072488172662785;Wir sagen: Nicht von den Malochern, sondern von den Multimillionären und Milliardären, die sogar in der Krise noch reicher geworden sind! Andersherum wäre es wirklich wirtschaftsfeindlich, denn die Malocher tragen das Geld in den Supermarkt und zum Friseur.;1411676203224870912;1430072479851106317;2021-08-24 07:40:25+00:00;1411676203224870912;de;False;3;1;17;0;everyone;Twitter Web App;1430072486402609155;replied_to;2022-05-28 18:01:42.267334
1411676203224870912;goerke_c;1430072486402609155;Heißt: 20 Mrd. Euro mehr über Steuern aus der Wirtschaft herausziehen, als über Ausgaben in die Wirtschaft hineingegeben werden. Wo sollen diese 20 Mrd. weggenommen werden?;1411676203224870912;1430072479851106317;2021-08-24 07:40:24+00:00;1411676203224870912;de;False;0;1;11;0;everyone;Twitter Web App;1430072483626070017;replied_to;2022-05-28 18:01:42.273752
