twitter_id;twitter_handle;tweet_id;tweet_text;tweet_author_id;tweet_conversation_id;tweet_created_at;tweet_in_reply_to_user_id;tweet_lang;tweet_possibly_sensitive;tweet_retweet_count;tweet_reply_count;tweet_like_count;tweet_quote_count;tweet_reply_settings;tweet_source;tweet_referenced_tweet_id;tweet_referenced_tweet_type;api_call
730314294;Kiessling_MdB;1519261533880074241;https://t.co/5LH8QNa6BY;730314294;1519261531946598400;2022-04-27 10:25:50+00:00;730314294;und;False;1;0;0;0;everyone;Twitter for iPhone;1519261531946598400;replied_to;2022-05-28 16:57:18.440030
730314294;Kiessling_MdB;1519261531946598400;Das #BündnisbezahlbarerWohnraum startet, der versprochene Ampelaufbruch bleibt aus. Die Runde ist riesig, z.T. ideologisch geprägt und z.T. ohne Bezug zum Bau. Ergebnisse folgen im Herbst. Die #Ampel muss aber jetzt liefern. Warten schafft keinen Wohnraum! @cducsubt @csu_bt;730314294;1519261531946598400;2022-04-27 10:25:50+00:00;;de;False;3;2;1;0;everyone;Twitter for iPhone;;;2022-05-28 16:57:18.442483
730314294;Kiessling_MdB;1511379999575711745;Mit dem „Neustart“ der #KfW-Förderung EH40-Standard läuft die #Ampel sehenden Auges in den nächsten Vertrauensverlust! Halbe Fördersätze, nur noch die Kreditvariante und ein Deckel von 1 Milliarde. Klimagerechten Bau fordern und eigentlich das Gegenteil fördern! @cducsubt @csu_bt https://t.co/o3dIJKGW0h;730314294;1511379999575711745;2022-04-05 16:27:26+00:00;;de;False;11;3;26;0;everyone;Twitter for iPhone;1511310083422105604;quoted;2022-05-28 16:57:18.447388
730314294;Kiessling_MdB;1509648474534469635;RT @UlrichLange: Produktiver Austausch heute mit Staatsminister Christian #Bernreiter u. Michael @Kiessling_MdB, fachpolitischer Sprecher d…;730314294;1509648474534469635;2022-03-31 21:46:58+00:00;;de;False;3;0;0;0;everyone;Twitter for iPhone;1509535168587083777;retweeted;2022-05-28 16:57:18.451079
730314294;Kiessling_MdB;1507333380987408394;#Mogelpackung der #Ampel: Rentner, Studenten, Wirtschaft gehen beim Ampel-Paket leer aus. 300€ Energiegeld hört sich gut an, kommt bei den Bürgern so aber nicht an #Steuer. Deshalb fordern wir u.a.: Senkung d. Energieabgaben auf Kraftstoffe, Gas und Strom. @csu_bt @cducsubt https://t.co/huXl0wxNrN;730314294;1507333380987408394;2022-03-25 12:27:37+00:00;;de;False;1;3;10;0;everyone;Twitter for iPhone;;;2022-05-28 16:57:18.455888
730314294;Kiessling_MdB;1506597384754761732;RT @cducsubt: Vor mehr als 3 Wochen hat Bundeskanzler Olaf Scholz in seiner Regierungserklärung von „Zeitenwende“ gesprochen. Nun ist davon…;730314294;1506597384754761732;2022-03-23 11:43:02+00:00;;de;False;20;0;0;0;everyone;Twitter for iPhone;1506577200908230656;retweeted;2022-05-28 16:57:18.461193
730314294;Kiessling_MdB;1506025470160216067;RT @MGrosseBroemer: Herzlich Willkommen in der Realität. Die grüne Übermoral ist gescheitert! @BILD  https://t.co/WSRKJd1hdk;730314294;1506025470160216067;2022-03-21 21:50:27+00:00;;de;False;290;0;0;0;everyone;Twitter for iPhone;1505867913353433088;retweeted;2022-05-28 16:57:18.465098
730314294;Kiessling_MdB;1504381960474533895;RT @DoroBaer: Bizarres Schauspiel im Plenum. Nach der beeindruckenden Rede von @ZelenskyyUa liest @GoeringEckardt die Geburtstage vor und m…;730314294;1504381960474533895;2022-03-17 08:59:44+00:00;;de;False;366;0;0;0;everyone;Twitter for iPhone;1504374745596567552;retweeted;2022-05-28 16:57:18.468927
730314294;Kiessling_MdB;1503767943750033408;RT @smuellermdb: Nach der Rede des ukrainischen Präsidenten @ZelenskyyUa können wir am Donnerstag im #Bundestag nicht direkt 'business as u…;730314294;1503767943750033408;2022-03-15 16:19:51+00:00;;de;False;33;0;0;0;everyone;Twitter for iPhone;1503754172130279439;retweeted;2022-05-28 16:57:18.473455
730314294;Kiessling_MdB;1503453307095990277;"RT @csu_bt: Europa braucht Entschlossenheit, Geschlossenheit &amp; Wehrhaftigkeit. Dazu gehört, das 2-Prozent-Ziel bei den Verteidigungsausgabe…";730314294;1503453307095990277;2022-03-14 19:29:35+00:00;;de;False;12;0;0;0;everyone;Twitter for iPhone;1503237170210951170;retweeted;2022-05-28 16:57:18.477466
730314294;Kiessling_MdB;1503409379005054980;Klares Bild nach der Anhörung: Der #Heizkostenzuschuss der #Ampel greift zu kurz! Aufgrund steigender Energiepreise sind mehr Menschen betroffen als nur Wohngeldempfänger. Wir brauchen auch Lösungen für kleine_mittlere Einkommen_Familien. Nachsteuern - jetzt! @csu_bt @cducsubt;730314294;1503409379005054980;2022-03-14 16:35:02+00:00;;de;False;4;1;8;0;everyone;Twitter for iPhone;;;2022-05-28 16:57:18.481191
730314294;Kiessling_MdB;1501989020905136137;Zaudern und kassieren - die #Ampel kann bei den explodierenden Spritpreisen nicht tatenlos zusehen, wie der Staat durch Steuern_Abgaben zum Preistreiber wird und mitverdient. Deshalb: Runter mit den Abgaben_Steuern auf Kraftstoffe. Entlastung für alle - jetzt! @csu_bt @cducsubt https://t.co/0UWohBynhh;730314294;1501989020905136137;2022-03-10 18:31:02+00:00;;de;False;19;55;162;2;everyone;Twitter for iPhone;;;2022-05-28 16:57:18.485071
730314294;Kiessling_MdB;1488892832836472833;RT @csu_bt: Steigende Energiepreise setzen Firmen unter massiven Druck. Statt unsere Wirtschaft zu unterstützen, hüllt sich Links-Gelb in S…;730314294;1488892832836472833;2022-02-02 15:11:28+00:00;;de;False;5;0;0;0;everyone;Twitter for iPhone;1488879377270009859;retweeted;2022-05-28 16:57:18.488930
730314294;Kiessling_MdB;1488891665888776194;"Keine Sonderstellung für den Bundestag bzgl. Genesenenstatus! Zweifelt Bas (SPD) etwa an Lauterbach (SPD) und seiner Führung? #Widerspruch #Unflexibel #SPD 
Ich fordere die Verlängerung des Status auf 6 Monate für alle, wie in Europa üblich #csu #csubt 

https://t.co/t7CCOQXJ5k";730314294;1488891665888776194;2022-02-02 15:06:50+00:00;;de;False;1;2;4;0;everyone;Twitter for iPhone;;;2022-05-28 16:57:18.493914
730314294;Kiessling_MdB;1488840360658882562;Die neue EU-Gebäudeeffizienzrichtlinie ist eine klare Renovierungspflicht. Wie will die #Ampel mit Fachkräftemangel u. Rohstoffknappheit die Renovierungsquote steigern u. gleichzeitig die Baupreise abfedern? Sozialverträgliche Maßnahmen sind gefragt - und zwar jetzt! @csu_bt https://t.co/e2swZMHAfe;730314294;1488840360658882562;2022-02-02 11:42:57+00:00;;de;False;2;1;6;0;everyone;Twitter for iPhone;;;2022-05-28 16:57:18.497529
730314294;Kiessling_MdB;1488830659758116865;RT @Markus_Soeder: Wir vermissen Führung von der #Ampel. Die Union wird eine konstruktiv-progressive Opposition sein und will mit guten Ide…;730314294;1488830659758116865;2022-02-02 11:04:25+00:00;;de;False;20;0;0;0;everyone;Twitter for iPhone;1488821119129997312;retweeted;2022-05-28 16:57:18.501382
730314294;Kiessling_MdB;1488538222695178241;Die teilweise Rücknahme des desaströsen KfW-Förderstopps auch auf Druck der Union hin ist gut. Aber: Vertrauen wurde nachhaltig zerstört und Bauherren verunsichert. Jetzt ist Klarheit gefragt - keine Planlosigkeit! #AmpelstehtaufRot @csu_bt @cducsu;730314294;1488538222695178241;2022-02-01 15:42:22+00:00;;de;False;5;4;34;0;everyone;Twitter for iPhone;;;2022-05-28 16:57:18.505706
730314294;Kiessling_MdB;1485642556989968392;Der Stopp der #KfW-Förderungen für energieeffiziente Gebäude ist ein katastrophales Signal. Stellt Wohnungsunternehmen und Häuslebauer vor große Herausforderungen. Enorme Liquiditätslücken für Bauherren und fehlender, nachhaltiger Wohnraum sind die fatalen Folgen. #csubt #cducsu;730314294;1485642556989968392;2022-01-24 15:56:02+00:00;;de;False;1;1;7;0;everyone;Twitter for iPhone;;;2022-05-28 16:57:18.509659
730314294;Kiessling_MdB;1480834613417234433;Baupreise steigen so stark wie seit 51 Jahren nicht mehr: 14,4% zum Vorjahresmonat. Stille seitens der Regierun- zu hören ist nur ein Heizkostenzuschuss für Mieter, der ein anderes Problem adressiert. Bauen muss bezahlbar bleiben - wo bleiben die Vorschläge der Ministerin?#csubt;730314294;1480834613417234433;2022-01-11 09:30:59+00:00;;de;False;1;3;5;0;everyone;Twitter for iPhone;;;2022-05-28 16:57:18.513353
730314294;Kiessling_MdB;1471068842088615944;"Was meint BK Scholz wenn er von Ordnungsrecht im Gebäudebereich spricht - hohe Mehrkosten für Eigentümer/Mieter. Nachhaltigkeit bei Gebäuden erreichen wir nur durch sektorübergreifendes Denken und Betrachtung des gesamten Lebenszyklus.
Nicht nur mit Ordnungsrecht. @csu_bt #CSU";730314294;1471068842088615944;2021-12-15 10:45:17+00:00;;de;False;1;0;2;0;everyone;Twitter for iPhone;;;2022-05-28 16:57:18.517078
730314294;Kiessling_MdB;1395032896923226112;"Für die Herausforderung ""Bezahlbares Wohnen"" brauchen wir keine Ideologie, sondern Kommunen, private Bauherren, Genossenschaften und Wohnungsbauunternehmer. Einer allein kann dies nicht lösen. @csu_bt @cducsubt https://t.co/fVcUV0AE4x";730314294;1395032896923226112;2021-05-19 15:05:35+00:00;;de;False;0;3;10;0;everyone;Twitter for iPhone;;;2022-05-28 16:57:18.521169
730314294;Kiessling_MdB;1385145350126702603;Preissteigerung bei Baustoffen zeigen wie wichtig die Nutzung von Recyclingmaterialien ist. Forderung nach mehr recycelter Baustoffe auf der einen Seite und der Verschärfung von Grenzwerten eben dieser auf der anderen Seite, ist nicht zielführend. https://t.co/TmwFXVLufH #CDUCSU;730314294;1385145350126702603;2021-04-22 08:16:00+00:00;;de;False;1;1;3;0;everyone;Twitter for iPhone;;;2022-05-28 16:57:18.525388
730314294;Kiessling_MdB;1384556328077692930;"Danke @MarkusSöder für sein mutiges und couragiertes Angebot @CDU. Jetzt gilt es, geschlossen den #Wahlkampf zu führen. Dabei gibt es aber kein ""entweder oder"" - entweder #Wirtschaft o. #Umwelt. Wir vereinen beides - mit Erfahrung und guten Ideen! @csubt";730314294;1384556328077692930;2021-04-20 17:15:27+00:00;;de;False;0;1;5;0;everyone;Twitter for iPhone;;;2022-05-28 16:57:18.529081
730314294;Kiessling_MdB;1382623658779246595;Die sozialistische Seifenblase des rot-rot-grünen Senats ist geplatzt. Der #Mietendeckel hat das Problem auf dem Wohnungsmarkt nicht gelöst. Fakt ist: Es gibt weniger Mietwohnungen, weniger Investitionen dafür mehr Unsicherheit. Berlin muss mehr bauen und nicht verwalten! @csu_bt;730314294;1382623658779246595;2021-04-15 09:15:42+00:00;;de;False;2;9;26;1;everyone;Twitter for iPhone;;;2022-05-28 16:57:18.532702
730314294;Kiessling_MdB;1367817052732461060;"RT @PaulZiemiak: Der Kurs des Führungsduos @dieLinke zusammengefasst: Die eine bekennende Trotzkistin &amp; für den Radikalumbau der Gesellscha…";730314294;1367817052732461060;2021-03-05 12:39:32+00:00;;de;False;155;0;0;0;everyone;Twitter for iPhone;1366031136464510976;retweeted;2022-05-28 16:57:18.536516
730314294;Kiessling_MdB;1367084378543767552;Anhörung im Bauausschuss: Grüner und linker Klimakommunismus blendet die Nachhaltigkeit total aus und bevormundet. Wir aber brauchen kein Dogma oder vermeintlich ökologische Lösungen, sondern Technologieoffenheit und Wettbewerb um die besten Lösungen! @csubt @cducsu;730314294;1367084378543767552;2021-03-03 12:08:09+00:00;;de;False;2;5;17;0;everyone;Twitter for iPhone;;;2022-05-28 16:57:18.541123
730314294;Kiessling_MdB;1355469484153311296;"Verbotskeule der Grünen: Sie wollen Einfamilienhäuser verbieten-das kann uns in ganz Deutschland treffen. Was sie dabei vergessen, die Planungshoheit liegt bei den Kommunen, nicht beim Bund.  @csu_bt 
https://t.co/wkhTJ9ESRi";730314294;1355469484153311296;2021-01-30 10:54:43+00:00;;de;False;2;7;18;2;everyone;Twitter for iPhone;;;2022-05-28 16:57:18.544848
730314294;Kiessling_MdB;1337093729748914177;Im #Bundeshaushalt 2021 insgesamt 1,2 Mrd. Euro für die Förderung des Städtebaus! Ein klares Bekenntnis: Wir stehen zu unseren Kommunen, sorgen für lebenswerte Zentren und stärken den gesellschaftlichen Zusammenhalt. #zukunftgestalten @cducsu @csubt;730314294;1337093729748914177;2020-12-10 17:56:01+00:00;;de;False;2;1;10;1;everyone;Twitter for iPhone;;;2022-05-28 16:57:18.548490
730314294;Kiessling_MdB;1331314497290719237;"@spdbt Kostensteigerung monieren &amp; günstiges Wohnen fordern, aber Bauen über Gebühr verteuern #realitätsfern. Wo bleibt das Augenmaß bei den E-Ladesäulen? Sinnvoll: EU-Richtlinie 1:1 umsetzen für bezahlbares Bauen &amp; Wohnen &amp; E-Mobilität @csu_bt @cducsubt https://t.co/KafW18ev4R";730314294;1331314497290719237;2020-11-24 19:11:25+00:00;347792540;de;False;0;0;0;0;everyone;Twitter for iPhone;;;2022-05-28 16:57:18.552309
730314294;Kiessling_MdB;1321866361719672833;Die strikten Maßnahmen der Länder treffen Teile unserer Wirtschaft besonders hart. Daher sind die zugesagten finanziellen Hilfen zwingend notwendig. Aber auch die Solidarität unserer BürgerInnen, um die Infektionsketten zu brechen. #cducsu #csubt;730314294;1321866361719672833;2020-10-29 17:27:54+00:00;;de;False;1;0;4;0;everyone;Twitter for iPad;;;2022-05-28 16:57:18.557355
730314294;Kiessling_MdB;1314228160465121286;Wenn sich die Opposition schon mit den Federn der Strafprozessordnung im #UntersuchungsausschussMaut schmückt und zum Richter hochstilisiert, dann sollte Sie auch den Grundsatz des fairen Verfahrens berücksichtigen und sachlich bleiben! #SacharbeitanstattPolemik @csu_bt @cducsubt;730314294;1314228160465121286;2020-10-08 15:36:25+00:00;;de;False;0;0;2;0;everyone;Twitter for iPhone;;;2022-05-28 16:57:18.561418
730314294;Kiessling_MdB;1306928251454062593;🌱 Was bedeutet Nachhaltigkeit eigentlich für das Bau- und Wohnungswesen? Als Abgeordneter im #Umweltausschuss und im #Bauausschuss im #Bundestag liegt mir dieses Thema besonders am Herzen!  👇  📺 #csubt #csu_bt #cducsu #jetztzukunft  #Kießling_direkt https://t.co/kdh9sTOqnR;730314294;1306928251454062593;2020-09-18 12:09:11+00:00;;de;False;0;0;5;0;everyone;Twitter for iPhone;;;2022-05-28 16:57:18.565508
730314294;Kiessling_MdB;1305895038266888194;Nachhaltigkeit ist mehr als Umwelt- und Klimaschutz. Als Volkspartei liegt unser Anspruch darin, unsere wirtschaftliche Leistungsfähigkeit mit dem Schutz unserer natürlichen Lebensgrundlage und unserer sozialer Verantwortung zu vereinen.#csu_bt  #cducsu;730314294;1305895038266888194;2020-09-15 15:43:34+00:00;;de;False;0;0;3;0;everyone;Twitter for iPhone;;;2022-05-28 16:57:18.569782
730314294;Kiessling_MdB;1288069822438428672;Auch wenn die #Plastiksteuer der EU nicht als solche deklariert ist, greift sie in die Steuerhoheit der EU-Mitgliedstaaten ein. Wir brauchen aber keine neue Steuer, sondern eine effektive Lenkungswirkung die zu weniger Abfall führt. #csu_bt #cducsubt;730314294;1288069822438428672;2020-07-28 11:12:31+00:00;;de;False;0;0;2;0;everyone;Twitter for iPhone;;;2022-05-28 16:57:18.574836
730314294;Kiessling_MdB;1275093323380936706;#Stuttgart zeigt vor allem eines: Die Gewalt geht gegen Polizisten und nicht andersherum! Die Randale waren kein Kavaliersdelikt, sondern üble Straftaten, die aufgeklärt und bestraft werden müssen. Unsere #Solidarität gilt den Opfern und unserer Polizei. #CSU_bt;730314294;1275093323380936706;2020-06-22 15:48:33+00:00;;de;False;5;9;24;0;everyone;Twitter for iPhone;;;2022-05-28 16:57:18.580000
730314294;Kiessling_MdB;1273662071096385542;RT @cducsubt: .@kaiwegner und @Kiessling_MdB | Neues Gesetz vereint kostenbewusstes Bauen und Klimaschutz https://t.co/HmmBS3LEIm;730314294;1273662071096385542;2020-06-18 17:01:15+00:00;;de;False;2;0;0;0;everyone;Twitter for iPhone;1273652726644252672;retweeted;2022-05-28 16:57:18.584403
730314294;Kiessling_MdB;1273661879924207616;RT @cducsubt: Weiter geht´s im #Bundestag zum Thema Energie­ein­spar­recht für Gebäude. @Kiessling_MdB macht deutlich: „Wir zeigen mit dies…;730314294;1273661879924207616;2020-06-18 17:00:30+00:00;;de;False;5;0;0;0;everyone;Twitter for iPhone;1273660305869070337;retweeted;2022-05-28 16:57:18.590633
730314294;Kiessling_MdB;1268291207622524934;"RT @csu_bt: Starkes #Konjunkturpaket der #Koalition &amp; @csu_bt Chef #Dobrindt - ua doppelte Förderung für Innovationen (F&amp;E), doppelte Kaufp…";730314294;1268291207622524934;2020-06-03 21:19:22+00:00;;de;False;13;0;0;0;everyone;Twitter for iPhone;1268291110121635841;retweeted;2022-05-28 16:57:18.597683
730314294;Kiessling_MdB;1262392769034817537;Der Plan von Scholz, Kommunen zu helfen und dies mit einer Altschuldenregelung zu verbinden, schießt über das Ziel hinaus. Länder die solide wirtschaften, werden damit bestraft. Klassische SPD-Finte à la Scholz - Corona als Deckmantel für Parteipolitik. @csu_bt @cducsu;730314294;1262392769034817537;2020-05-18 14:41:04+00:00;;de;False;2;4;9;1;everyone;Twitter for iPhone;;;2022-05-28 16:57:18.603113
730314294;Kiessling_MdB;1235513939003183104;"RT @cducsubt: .@Kiessling_MdB in der Debatte zur #Digitalisierung des Planens und Bauens: ""Wir fordern, die #Bauwirtschaft zu digitalisiere…";730314294;1235513939003183104;2020-03-05 10:34:12+00:00;;de;False;2;0;0;0;everyone;Twitter for iPhone;1235513755292725248;retweeted;2022-05-28 16:57:18.609875
730314294;Kiessling_MdB;1228299172408971264;RT @kaiwegner: Lieber Volkmar Vogel, meinen herzlichsten Glückwunsch zur Ernennung zum Parlamentarischen Staatssekretär! Die AG Bau der @cd…;730314294;1228299172408971264;2020-02-14 12:45:18+00:00;;de;False;1;0;0;0;everyone;Twitter for iPhone;1228259523808374784;retweeted;2022-05-28 16:57:18.615283
730314294;Kiessling_MdB;1222817407183486976;RT @BIngKonline: #PlanenundBauen sind in D auf gutem Weg. Insbesondere d. #BIM-Kompetenzzentrum von @BMVI und @BMI soll dabei den #Wegberei…;730314294;1222817407183486976;2020-01-30 09:42:43+00:00;;de;False;4;0;0;0;everyone;Twitter for iPhone;1222540885130457089;retweeted;2022-05-28 16:57:18.620968
730314294;Kiessling_MdB;1222817281576706049;RT @cducsubt: Von der #Groko heute Nacht beschlossen: Entlastung für unseren #Mittelstand. Wer in die #Digitalisierung seines Unternehmens…;730314294;1222817281576706049;2020-01-30 09:42:13+00:00;;de;False;4;0;0;0;everyone;Twitter for iPhone;1222805546245459969;retweeted;2022-05-28 16:57:18.626712
730314294;Kiessling_MdB;1222455651491831809;Politiker dürfen sich nicht von den Bürgern entfernen! Deshalb bin ich für den Erhalt der bestehenden Wahlkreise. Eine Reduzierung ist keine Garantie dafür, dass das Parlament kleiner wird-eine Höchstgrenze dagegen schon. @csu_bt @cducsu #Wahlrechtsreform #bürgernah #Demokratie;730314294;1222455651491831809;2020-01-29 09:45:14+00:00;;de;False;1;5;10;0;everyone;Twitter for iPhone;;;2022-05-28 16:57:18.630685
730314294;Kiessling_MdB;1221884117987614720;RT @csu_bt: Das freie Bahnfahren für Soldaten in Uniform ist ein voller Erfolg - seit Jahresbeginn wurden schon 130.000 Ticket-Gutscheine a…;730314294;1221884117987614720;2020-01-27 19:54:09+00:00;;de;False;8;0;0;0;everyone;Twitter for iPhone;1221827029395480583;retweeted;2022-05-28 16:57:18.635368
730314294;Kiessling_MdB;1214233763061911552;RT @csu_bt: Klare Worte von Alexander #Dobrindt zum Auftakt unserer Klausur #seeon20. Es ist uns wieder sehr gut gelungen, Taktgeber in den…;730314294;1214233763061911552;2020-01-06 17:14:23+00:00;;de;False;4;0;0;0;everyone;Twitter for iPhone;1214198317564997634;retweeted;2022-05-28 16:57:18.641746
730314294;Kiessling_MdB;1206874449456316416;RT @csu_bt: Ab 01.01.20 gilt: Freie Bahnfahrt für Soldaten in Uniform! Auf unserer Klausur #seeon19 beschlossen, heute zwischen @akk,  @And…;730314294;1206874449456316416;2019-12-17 09:51:06+00:00;;de;False;5;0;0;0;everyone;Twitter for iPhone;1206642885547974656;retweeted;2022-05-28 16:57:18.646802
730314294;Kiessling_MdB;1200345463536455680;RT @csu_bt: Die Grünen haben im Antrag zu ihrem Parteitag deutlich gemacht, dass sie jedes Jahr 35 Milliarden Euro neue Schulden machen wol…;730314294;1200345463536455680;2019-11-29 09:27:14+00:00;;de;False;8;0;0;0;everyone;Twitter for iPhone;1200019700081659904;retweeted;2022-05-28 16:57:18.652056
730314294;Kiessling_MdB;1194182460256464896;"#Mietendeckel Sorgt nicht für mehr Wohnraum und verschärft die Angebotssituatuion. Gute Politik sieht anders aus. Wer Wohnungen schaffen will muß Hürden entfernen und das Bauen zu lassen.  @cducsubt @csu_bt 

https://t.co/OfvR1wUj8q";730314294;1194182460256464896;2019-11-12 09:17:40+00:00;;de;False;0;0;5;0;everyone;Twitter for iPhone;;;2022-05-28 16:57:18.657645
730314294;Kiessling_MdB;1193857711781400579;"#sozial &amp; #fair - wer Hilfe benötigt, dem wird geholfen. Die #Grundrente erfolgt über die Feststellung des Bedarfes: #Einkommensprüfung. 
Geld kann man nur 1x ausgeben, dann lieber an die, die es brauchen. Berücksichtigung der #Lebensleistung und damit gegen #Altersarmut! @cducsu";730314294;1193857711781400579;2019-11-11 11:47:13+00:00;;de;False;3;1;2;1;everyone;Twitter for iPhone;;;2022-05-28 16:57:18.662818
730314294;Kiessling_MdB;1186962444759027712;RT @smuellermdb: Dank unserer #Landwirtschaft profitieren wir in Deutschland von qualitativ sehr hochwertigen Lebensmitteln. Blenden das al…;730314294;1186962444759027712;2019-10-23 11:07:54+00:00;;de;False;9;0;0;0;everyone;Twitter for iPhone;1186950846690615296;retweeted;2022-05-28 16:57:18.666901
730314294;Kiessling_MdB;1186667955087650817;Mietendeckel #Berlin ist keine Lösung und ein falsches Signal an Vermieter und Investoren. Wer will da noch investieren - wo sollen die Wohnungen herkommen? #CSU_BT #stillstand #investitionsstau;730314294;1186667955087650817;2019-10-22 15:37:42+00:00;;de;False;1;0;13;0;everyone;Twitter for iPhone;;;2022-05-28 16:57:18.671606
730314294;Kiessling_MdB;1176851586955534336;RT @JM_Luczak: SPD-Forderung nach bundesweiten #Mietenstopp u Erschwerung Modernisierungen torpediert #Neubau u #Klimaschutz-neue Eingriffe…;730314294;1176851586955534336;2019-09-25 13:30:57+00:00;;de;False;11;0;0;0;everyone;Twitter for iPhone;1176500554522140673;retweeted;2022-05-28 16:57:18.677567
730314294;Kiessling_MdB;1176137156043190272;Oppermann, SPD, fordert Reduzierung der Wahlkreise = FALSCHER Ansatz. Denn größere Wahlkreise bedeuten, Politik und Politiker entfernen sich zunehmend von den Menschen vor Ort. RICHTIG: Deckelung auf 650 Bundestagsabgeordnete unter Beibehaltung der Wahlkreise. @csu_bt;730314294;1176137156043190272;2019-09-23 14:12:04+00:00;;de;False;2;1;16;0;everyone;Twitter for iPhone;;;2022-05-28 16:57:18.681994
730314294;Kiessling_MdB;1171399041567076352;RT @DerLenzMdB: Für Fliesenleger, Orgelbauer, Raumausstatter und viele weitere Gewerke wird die #Meisterpflicht wieder eingeführt! Das ist…;730314294;1171399041567076352;2019-09-10 12:24:29+00:00;;de;False;7;0;0;0;everyone;Twitter for iPhone;1171046577877790725;retweeted;2022-05-28 16:57:18.687659
730314294;Kiessling_MdB;1168903036867108870;RT @csu_bt: Das Statement von Alexander #Dobrindt zum #KickOff gibts hier! https://t.co/tQeq6hzm1j;730314294;1168903036867108870;2019-09-03 15:06:15+00:00;;de;False;1;0;0;0;everyone;Twitter for iPhone;1168866629473787906;retweeted;2022-05-28 16:57:18.693134
730314294;Kiessling_MdB;1166713016823558145;Im europäischen Vergleich haben wir sehr hohe #Unternehmenssteuern - deshalb runter mit den Steuern für Arbeitnehmer und Unternehmer. Soli abschaffen - keine #Vermögenssteuer, sondern eine #Unternehmenssteuerreform @csu_bt;730314294;1166713016823558145;2019-08-28 14:03:54+00:00;;de;False;5;3;29;1;everyone;Twitter for iPhone;;;2022-05-28 16:57:18.698767
730314294;Kiessling_MdB;1153971459930382336;RT @DaniLudwigMdB: Und los gehts! #Sondersitzung im #Bundestag mal anders. @StefingerMdB @Kiessling_MdB @cducsubt @csu_bt https://t.co/Huaz…;730314294;1153971459930382336;2019-07-24 10:13:30+00:00;;de;False;4;0;0;0;everyone;Twitter for iPhone;1153968815333609473;retweeted;2022-05-28 16:57:18.704169
730314294;Kiessling_MdB;1149354727693541377;RT @smuellermdb: Die @spdde liefert in Brüssel ein echtes Schmierentheater ab. Beharrt immer noch auf dem Prinzip des Spitzenkandidaten, wo…;730314294;1149354727693541377;2019-07-11 16:28:15+00:00;;de;False;11;0;0;0;everyone;Twitter for iPhone;1149349102582415360;retweeted;2022-05-28 16:57:18.709057
730314294;Kiessling_MdB;1148971560486785024;Das @BMI fördert mit der ersten Smart Cities-Ausschreibung die Entwicklung und Nutzung digitaler Technologien auf kommunaler Ebene. Als Jury-Mitglied freut es mich, dass die Projekte der Stadt #Haßfurt und des Landkreises #Wunsiedel ausgewählt wurden. #SmartCities #BMI #CDUCSU;730314294;1148971560486785024;2019-07-10 15:05:41+00:00;;de;False;1;1;2;0;everyone;Twitter for iPhone;;;2022-05-28 16:57:18.713350
730314294;Kiessling_MdB;1146128191658106885;RT @Das_Baugewerbe: Heute hat Staatssekretär @wanderwitz die Ergebnisse der #Baulandkommission des @BMI_Bund vorgestellt. Unsere Einschätzu…;730314294;1146128191658106885;2019-07-02 18:47:09+00:00;;de;False;3;0;0;0;everyone;Twitter for iPhone;1146024930741542919;retweeted;2022-05-28 16:57:18.718048
730314294;Kiessling_MdB;1146007639861735425;https://t.co/p3frsfN6nR;730314294;1146007638393663488;2019-07-02 10:48:07+00:00;730314294;und;False;0;0;1;0;everyone;Twitter for iPhone;1146007638393663488;replied_to;2022-05-28 16:57:18.724719
730314294;Kiessling_MdB;1146007638393663488;Die Abschaffung der #Umlagefähigkeit darf nicht zur Debatte stehen. Auch nicht durch die Hintertür! Die Leistungen der Kommune kommen nicht nur dem Grundstückseigentümer zugute, sondern allen Bürgern. Die #Grundsteuer umfasst alle Bürger und stärkt die Bindung an die Kommune.;730314294;1146007638393663488;2019-07-02 10:48:07+00:00;;de;False;0;1;3;0;everyone;Twitter for iPhone;;;2022-05-28 16:57:18.729904
730314294;Kiessling_MdB;1143451828442583040;Baulandmobilisierung hat viele Facetten - Industrie- und Gewerbeflächen bebaubar zu sanieren, entlastet uns auch beim Flächenverbrauch. https://t.co/H1NEubYDui;730314294;1143451828442583040;2019-06-25 09:32:14+00:00;;de;False;0;1;4;0;everyone;Twitter for iPhone;1143396933152772096;quoted;2022-05-28 16:57:18.735348
