twitter_id;twitter_handle;tweet_id;tweet_text;tweet_author_id;tweet_conversation_id;tweet_created_at;tweet_in_reply_to_user_id;tweet_lang;tweet_possibly_sensitive;tweet_retweet_count;tweet_reply_count;tweet_like_count;tweet_quote_count;tweet_reply_settings;tweet_source;tweet_referenced_tweet_id;tweet_referenced_tweet_type;api_call
1411676203224870912;goerke_c;1490954159642021888;Mondpreise an der Tankstelle fressen zu viel vom Monatslohn, eine spürbare Entlastung für Autofahrer ist längst überfällig. Die Pendlerpauschale zu erhöhen, klingt erstmal gut, greift aber zu kurz. https://t.co/wwucGM4hXr;1411676203224870912;1490954159642021888;2022-02-08 07:42:26+00:00;;de;False;6;8;36;0;everyone;Twitter for iPhone;;;2022-05-28 18:01:38.899141
1411676203224870912;goerke_c;1489240995309010948;RT @DietmarBartsch: Der #Heizkostenzuschuss ist richtig, aber angesichts der Kostenexplosion nur ein Tropfen auf den heißen Stein. Warum ni…;1411676203224870912;1489240995309010948;2022-02-03 14:14:56+00:00;;de;False;17;0;0;0;everyone;Twitter for iPhone;1489171120867659782;retweeted;2022-05-28 18:01:38.905485
1411676203224870912;goerke_c;1488187705750171649;"""Die Leute brauchen nicht nur Strom, sie müssen auch heizen und tanken"", erklärte der finanzpolitische Sprecher der Linken-Bundestagsfraktion. Eine Mehrwertsteuersenkung für Energie würde da ""sofort für Entlastung im Geldbeutel sorgen"". https://t.co/CwYP8yuAbk";1411676203224870912;1488187705750171649;2022-01-31 16:29:32+00:00;;de;False;5;0;32;1;everyone;Twitter Web App;;;2022-05-28 18:01:38.914025
1411676203224870912;goerke_c;1488169693940695052;"RT @Linksfraktion: Dem Fiskus beschert der #Progressionsvorbehalt 2020/21 ca. 3,5 Mrd € Mehreinnahmen an #Einkommensteuer &amp; #Solidaritätszu…";1411676203224870912;1488169693940695052;2022-01-31 15:17:58+00:00;;de;False;8;0;0;0;everyone;Twitter for iPhone;1488165133297799168;retweeted;2022-05-28 18:01:38.920237
1411676203224870912;goerke_c;1488139860770705413;Die Abschaffung der EEG-Umlage ist dringend überfällig, reicht aber nicht aus. Die Leute brauchen nicht nur Strom, sie müssen auch heizen und tanken.;1411676203224870912;1488139855955640320;2022-01-31 13:19:25+00:00;1411676203224870912;de;False;1;0;8;0;everyone;Twitter Web App;1488139859311144969;replied_to;2022-05-28 18:01:38.927225
1411676203224870912;goerke_c;1488139859311144969;Die EZB kann nichts daran machen, dass Deutschland immer noch auf teure Energieimporte angewiesen ist und die Verkehrswende verschleppt wurde.;1411676203224870912;1488139855955640320;2022-01-31 13:19:25+00:00;1411676203224870912;de;False;1;2;11;0;everyone;Twitter Web App;1488139857830584326;replied_to;2022-05-28 18:01:38.932691
1411676203224870912;goerke_c;1488139857830584326;Die Inflation ist getrieben von Energiepreisexplosionen und der Pandemie. Bei beidem scheint die Ampel die Kontrolle verloren zu haben. Finanzminister Lindner sollte nicht auf die EZB warten, sondern muss selbst tätig werden.;1411676203224870912;1488139855955640320;2022-01-31 13:19:25+00:00;1411676203224870912;de;False;1;1;12;0;everyone;Twitter Web App;1488139855955640320;replied_to;2022-05-28 18:01:38.939542
1411676203224870912;goerke_c;1488139855955640320;Tankstellen und warme Wohnungen dürfen nicht noch mehr zu Einkommensfressern werden. Warum nicht zeitweise die Mehrwertsteuer auf Energie absenken? Das würde sofort für Entlastung im Geldbeutel sorgen und die Inflationsrate senken! #Inflation https://t.co/9JOETwC4Tf;1411676203224870912;1488139855955640320;2022-01-31 13:19:24+00:00;;de;False;9;13;82;0;everyone;Twitter Web App;1488136645673168905;quoted;2022-05-28 18:01:38.945923
1411676203224870912;goerke_c;1488062184932450306;"Kurzarbeitern drohen rund 3,5 Mrd. € Steuernachzahlung. Ein Unding! Wenn die Ampel sich Gerechtigkeit auf die Fahne schreibt, dann muss sie das verhindern!

@derspiegel berichtet über meine Anfrage. 
https://t.co/ENTL27LGbF";1411676203224870912;1488062184932450306;2022-01-31 08:10:46+00:00;;de;False;24;6;76;2;everyone;Twitter for iPhone;;;2022-05-28 18:01:38.950533
1411676203224870912;goerke_c;1487024843468025856;Das wäre auch angesichts der gesenkten Wirtschaftsprognose überfällig. Christian Lindner hat schon die Anpassung der Einkommensteuer an die Inflation verpennt. Das darf nicht erneut vorkommen. Zügige Steuersenkungen wären mehr als angebracht!;1411676203224870912;1487024838464180233;2022-01-28 11:28:44+00:00;1411676203224870912;de;False;1;0;8;0;everyone;Twitter Web App;1487024841958039559;replied_to;2022-05-28 18:01:38.958316
1411676203224870912;goerke_c;1487024841958039559;Eine Senkung der Einkommensteuer für kleine und mittlere Einkommen oder eine temporäre Senkung der Mehrwertsteuer auf Energie kämen dafür in Frage. Das würde nicht nur Geringverdiener und Mittelschicht entlasten, sondern auch die Wirtschaft anschieben.;1411676203224870912;1487024838464180233;2022-01-28 11:28:44+00:00;1411676203224870912;de;False;1;1;11;0;everyone;Twitter Web App;1487024840104189961;replied_to;2022-05-28 18:01:38.965533
1411676203224870912;goerke_c;1487024840104189961;Warum nicht die Rekordsteuereinnahmen nutzen, um kleine und mittlere Einkommen zu entlasten? Jetzt wäre der richtige Zeitpunkt für Steuersenkungen!;1411676203224870912;1487024838464180233;2022-01-28 11:28:44+00:00;1411676203224870912;de;False;1;1;8;0;everyone;Twitter Web App;1487024838464180233;replied_to;2022-05-28 18:01:38.973120
1411676203224870912;goerke_c;1487024838464180233;Die Steuereinnahmen sind im zweiten Pandemiejahr um 11,5 Prozent gewachsen. Im Wahlkampf wollten alle drei Ampel-Parteien noch die Steuern für Geringverdiener und Mittelschicht senken. Was kam? Nichts.;1411676203224870912;1487024838464180233;2022-01-28 11:28:43+00:00;;de;False;9;2;60;0;everyone;Twitter Web App;;;2022-05-28 18:01:38.978720
1411676203224870912;goerke_c;1484495734028259336;Als finanzpolitischer Sprecher werde ich vor allem Christian Lindner auf die Finger schauen! Alle drei Ampel-Parteien haben Steuersenkungen für die große Mehrheit versprochen. Geliefert wurde bisher nichts, obwohl es gerade jetzt Entlastung bräuchte! https://t.co/dw9fJbopeA;1411676203224870912;1484495734028259336;2022-01-21 11:58:58+00:00;;de;False;12;8;110;0;everyone;Twitter Web App;;;2022-05-28 18:01:38.982551
1411676203224870912;goerke_c;1484104264855216128;Auch das gehört zu den Gründen für das Scheitern der Impfkampagne der GroKo. Wenn Impfen der Ausweg aus der Krise ist, dann muss die Ampel-Kampagne jetzt aber noch viel stärker auf die zugeschnitten werden, die bisher nicht erreicht wurden!;1411676203224870912;1484104261743034370;2022-01-20 10:03:24+00:00;1411676203224870912;de;False;1;0;5;0;everyone;Twitter for iPhone;1484104263546646529;replied_to;2022-05-28 18:01:38.990365
1411676203224870912;goerke_c;1484104263546646529;Mit Blick auf den Einsatz der Gelder scheint man außerdem noch nicht im 21. Jahrhundert angekommen zu sein. Für Plakate und Print wurde 2021 fast 20-mal so viel Geld ausgegeben wie für digitale und soziale Medien.;1411676203224870912;1484104261743034370;2022-01-20 10:03:24+00:00;1411676203224870912;de;False;1;1;7;1;everyone;Twitter for iPhone;1484104261743034370;replied_to;2022-05-28 18:01:38.996547
1411676203224870912;goerke_c;1484104261743034370;"Das Handelsblatt greift hier auch meine Anfrage zur Werbekampagne auf. Es war ein sträflicher Fehler der GroKo, zu Beginn der vierten Welle die Werbegelder zu kürzen! 

https://t.co/MOj0fvoiOU";1411676203224870912;1484104261743034370;2022-01-20 10:03:23+00:00;;de;False;7;5;20;0;everyone;Twitter for iPhone;;;2022-05-28 18:01:39.001867
1411676203224870912;goerke_c;1483856102118899714;RT @CarenLay: Ergebnisse der gestrigen Lausitzrunde: Die Bundesregierung muss den vermurksten #Strukturwandel überarbeiten! Unsere drei zen…;1411676203224870912;1483856102118899714;2022-01-19 17:37:18+00:00;;de;False;6;0;0;0;everyone;Twitter for iPhone;1483838892411346944;retweeted;2022-05-28 18:01:39.009447
1411676203224870912;goerke_c;1483778706535501826;RT @FabioDeMasi: Laut einer Antwort der Bundesregierung auf eine Anfrage, die ich mit @goerke_c entwickelt habe, waren aber weder Bundesreg…;1411676203224870912;1483778706535501826;2022-01-19 12:29:45+00:00;;de;False;4;0;0;0;everyone;Twitter Web App;1483442277368406016;retweeted;2022-05-28 18:01:39.013578
1411676203224870912;goerke_c;1483778663300706310;RT @CarenLay: Bei der #Lausitzrunde. Wenn der #Kohleausstieg vorgezogen wird, müssen auf die #Strukturhilfen angepasst und ausgebaut werden…;1411676203224870912;1483778663300706310;2022-01-19 12:29:35+00:00;;de;False;5;0;0;0;everyone;Twitter Web App;1483451648131407872;retweeted;2022-05-28 18:01:39.019133
1411676203224870912;goerke_c;1483072180887998465;RT @Linksfraktion: „Die weltweite Pandemie macht auf der einen Seite die Reichen noch reicher und bringt auf der anderen Seite Millionen Me…;1411676203224870912;1483072180887998465;2022-01-17 13:42:16+00:00;;de;False;9;0;0;0;everyone;Twitter Web App;1483058605263892482;retweeted;2022-05-28 18:01:39.026708
1411676203224870912;goerke_c;1483020320256966658;Nun droht aber der Mythos Kalte Progression angesichts der Inflation wahr zu werden, wenn Lindner nicht handelt. Kleine und mittlere Einkommen müssen endlich entlastet und hohe Einkommen und Vermögen zur Kasse gezogen werden!;1411676203224870912;1483020314925744128;2022-01-17 10:16:12+00:00;1411676203224870912;de;False;0;0;9;0;everyone;Twitter Web App;1483020318138589184;replied_to;2022-05-28 18:01:39.033961
1411676203224870912;goerke_c;1483020318138589184;Es braucht endlich eine Vermögensteuer für Superreiche und Steuerentlastungen für Geringverdiener und Mittelschicht. Beides wurde von den Ampel-Parteien mehrheitlich versprochen.;1411676203224870912;1483020314925744128;2022-01-17 10:16:11+00:00;1411676203224870912;de;False;0;2;17;0;everyone;Twitter Web App;1483020316557422595;replied_to;2022-05-28 18:01:39.042297
1411676203224870912;goerke_c;1483020316557422595;Auch in Deutschland ist das Vermögen der Superreichen rasant angestiegen. Dabei ist die Besteuerung von Vermögen in Deutschland so niedrig wie in kaum einem anderen Industrieland. Stattdessen wird Arbeit so hoch besteuert wie in kaum einem anderen Land.;1411676203224870912;1483020314925744128;2022-01-17 10:16:11+00:00;1411676203224870912;de;False;0;2;8;0;everyone;Twitter Web App;1483020314925744128;replied_to;2022-05-28 18:01:39.046762
1411676203224870912;goerke_c;1483020314925744128;"Das Vermögen der reichsten 10 Menschen hat sich in der Coronakrise von 700 auf 1500 Milliarden Dollar mehr als verdoppelt. Das sind 15.000 Dollar pro Sekunde und 1,3 Milliarden Dollar pro Tag! 
https://t.co/UHuvO4wmq7";1411676203224870912;1483020314925744128;2022-01-17 10:16:10+00:00;;de;False;20;9;87;2;everyone;Twitter Web App;;;2022-05-28 18:01:39.054368
1411676203224870912;goerke_c;1481298747552317448;Der Ampel hat im Koalitionsvertrag angedeutet, das Thema anzupacken. Das sollte sie schnellstmöglich machen und ganz oben auf die Agenda setzen. Ich werde ihr dabei ganz genau auf die Finger schauen.;1411676203224870912;1481298742305247234;2022-01-12 16:15:17+00:00;1411676203224870912;de;False;0;2;5;0;everyone;Twitter Web App;1481298745857822725;replied_to;2022-05-28 18:01:39.060288
1411676203224870912;goerke_c;1481298745857822725;Wir brauchen endlich einen automatisierten IT-gestützten Abgleich aller Anträge auf Erstattung von Kapitalertragssteuern und der tatsächlich entrichteten Kapitalertragssteuern.;1411676203224870912;1481298742305247234;2022-01-12 16:15:16+00:00;1411676203224870912;de;False;1;1;9;0;everyone;Twitter Web App;1481298744104701956;replied_to;2022-05-28 18:01:39.064733
1411676203224870912;goerke_c;1481298744104701956;Wer daran beteiligt war, muss jetzt auch für diesen unsäglichen Steuerbetrug geradestehen. Der Fall Warburg ist aber auch politisch. Die politische Verantwortung für den Skandal ist bis heute nicht geklärt. Außerdem sind Cum-Ex-ähnliche Gestaltungen bis heute möglich. Ein Unding!;1411676203224870912;1481298742305247234;2022-01-12 16:15:16+00:00;1411676203224870912;de;False;0;1;5;0;everyone;Twitter Web App;1481298742305247234;replied_to;2022-05-28 18:01:39.072064
1411676203224870912;goerke_c;1481298742305247234;Mit dem Geständnis ist der nächste Dominostein in der Aufklärung des Cum-Ex-Skandals gefallen. Es hat Jahre gedauert, bis die obersten Bundesrichter überhaupt klargestellt haben, dass Cum-Ex-Aktiendeals strafbar sind. https://t.co/Oa3cxGudzC;1411676203224870912;1481298742305247234;2022-01-12 16:15:16+00:00;;de;False;9;3;34;0;everyone;Twitter Web App;;;2022-05-28 18:01:39.078751
1411676203224870912;goerke_c;1481279416877658112;Damit der nun „idealerweise“ auf 2030 vorgezogene Kohlausstieg sozial verträglich gelingt, muss Finanzminister Lindner mehr Geld für die Lausitz bereitstellen! https://t.co/66OISozMvt;1411676203224870912;1481279416877658112;2022-01-12 14:58:28+00:00;;de;False;6;2;17;0;everyone;Twitter for iPhone;;;2022-05-28 18:01:39.085037
1411676203224870912;goerke_c;1479809269675573250;"RT @DEZi_Brb: Damit bewegen sich SPD und Grüne ganz in der Logik der Abschottung Europas und der Effizienz bei Abschiebungen. 
Ich hatte da…";1411676203224870912;1479809269675573250;2022-01-08 13:36:38+00:00;;de;False;10;0;0;0;everyone;Twitter for iPhone;1479792121406275584;retweeted;2022-05-28 18:01:39.091774
1411676203224870912;goerke_c;1479809245583400965;RT @DEZi_Brb: Schon deshalb wäre eine frühzeitige Information der Parlamente zwingend geboten gewesen. Stattdessen haben zwei Innenminister…;1411676203224870912;1479809245583400965;2022-01-08 13:36:32+00:00;;de;False;6;0;0;0;everyone;Twitter for iPhone;1479792119883644928;retweeted;2022-05-28 18:01:39.096111
1411676203224870912;goerke_c;1479809229275938816;RT @DEZi_Brb: Denn: das Abschiebedrehkreuz ist als #PPP geplant. Ein Investor baut (und verdient über Jahrzehnte kräftig daran), Land und B…;1411676203224870912;1479809229275938816;2022-01-08 13:36:28+00:00;;de;False;9;0;0;0;everyone;Twitter for iPhone;1479792118340239363;retweeted;2022-05-28 18:01:39.101483
1411676203224870912;goerke_c;1479809217691275270;RT @DEZi_Brb: Das Projekt wurde am #Landtag und am #Bundestag vorbei geplant. Die Parlamente wurden nicht einbezogen und haben nur durch Zu…;1411676203224870912;1479809217691275270;2022-01-08 13:36:25+00:00;;de;False;8;0;0;0;everyone;Twitter for iPhone;1479792116712853505;retweeted;2022-05-28 18:01:39.107581
1411676203224870912;goerke_c;1479809206173720579;RT @DEZi_Brb: Unserer Schätzung, dass dieses Abschiebedrehkreuz mindestens 100 Millionen kosten wird (eher sogar mehr), hat bisher zumindes…;1411676203224870912;1479809206173720579;2022-01-08 13:36:22+00:00;;de;False;5;0;0;0;everyone;Twitter for iPhone;1479792114858868740;retweeted;2022-05-28 18:01:39.112578
1411676203224870912;goerke_c;1479809196430344193;RT @DEZi_Brb: Die Planungen für das Ein- und #Ausreisezentrum sehen vor, sieben Gebäude zu errichten, u.a. #Flughafenasyl und #Ausresegewah…;1411676203224870912;1479809196430344193;2022-01-08 13:36:20+00:00;;de;False;7;0;0;0;everyone;Twitter for iPhone;1479792112535322626;retweeted;2022-05-28 18:01:39.118444
1411676203224870912;goerke_c;1479809181771350020;"RT @DEZi_Brb: Die neue Bundesregierung antwortet @PetraPauMaHe, dass der Bund an der Vereinbarung mit dem Land Brandenburg festhält.
Damit…";1411676203224870912;1479809181771350020;2022-01-08 13:36:17+00:00;;de;False;15;0;0;0;everyone;Twitter for iPhone;1479792105040105473;retweeted;2022-05-28 18:01:39.124866
1411676203224870912;goerke_c;1479809168303349771;RT @DEZi_Brb: Der Bund und #Brandenburg planen ein #Abschiebedrehkreuz am Flughafen #Schönefeld. Am Tag der Konstituierung des #Bundestag|e…;1411676203224870912;1479809168303349771;2022-01-08 13:36:13+00:00;;de;False;79;0;0;0;everyone;Twitter for iPhone;1479792089340780546;retweeted;2022-05-28 18:01:39.129064
1411676203224870912;goerke_c;1478325643440017411;"Bei MDR Aktuell sprach ich über Deutschlands Milliardengewinne beim Schuldenmachen. Die kommenden Jahre muss investiert und nicht gespart werden!

https://t.co/juRQn1uXFZ";1411676203224870912;1478325643440017411;2022-01-04 11:21:14+00:00;;de;False;8;0;46;1;everyone;Twitter Web App;;;2022-05-28 18:01:39.134338
1411676203224870912;goerke_c;1473669805286858757;"Meine Anfrage ergibt: Bund verdient kräftig beim Schuldenmachen. Deutschland hat viele Probleme, aber die Staatsfinanzierung ist keines davon. Jetzt muss massiv investiert werden!

https://t.co/ASb0AGB2RL";1411676203224870912;1473669805286858757;2021-12-22 15:00:35+00:00;;de;False;36;3;244;1;everyone;Twitter for iPhone;;;2022-05-28 18:01:39.141099
1411676203224870912;goerke_c;1471469345922588672;"Meine Anfrage deckt auf: Spahn hat mitten in der vierten Welle die Ausgaben für die Aufklärungskampagne zur Corona-Impfung drastisch gekürzt. Erst Maskendeals, dann zu wenig Impfstoff und jetzt das. Spahn übergibt das Gesundheitsministerium als Saustall!

https://t.co/cCiG3cSyaC";1411676203224870912;1471469345922588672;2021-12-16 13:16:45+00:00;;de;False;454;60;1879;74;everyone;Twitter Web App;;;2022-05-28 18:01:39.145004
1411676203224870912;goerke_c;1471464264380604427;Und auch die Lieferkettenprobleme erledigen sich damit nicht! Stattdessen werden die Märkte beunruhigt und Zinsaufschläge getrieben. Das macht den Finanzministern der Eurozone das Leben genau dann schwer, wenn sie sich gegen die Pandemie und die drohende Rezession stemmen müssten;1411676203224870912;1471464260790366211;2021-12-16 12:56:33+00:00;1411676203224870912;de;False;1;0;12;0;everyone;Twitter Web App;1471464262744920066;replied_to;2022-05-28 18:01:39.150940
1411676203224870912;goerke_c;1471464262744920066;Wir stecken in der vierten Welle und Omikron macht neue Probleme. Die EZB hätte PEPP über den März hinaus verstetigen sollen, statt sich von Inflations-Hypochondern treiben zu lassen. Wenn sie weniger Anleihen kauft, wird davon weder das Tanken noch das Heizen günstiger.;1411676203224870912;1471464260790366211;2021-12-16 12:56:33+00:00;1411676203224870912;de;False;2;1;15;0;everyone;Twitter Web App;1471464260790366211;replied_to;2022-05-28 18:01:39.156740
1411676203224870912;goerke_c;1471464260790366211;"Das Ende von PEPP ist das völlig falsche Signal. Bei Einführung des Programms hieß es noch, PEPP sei solange vorgesehen ""bis der EZB Rat die kritische Covid-Phase als abgeschlossen einschätzt"". Davon kann heute nicht die Rede sein! https://t.co/7KFHh4felO";1411676203224870912;1471464260790366211;2021-12-16 12:56:32+00:00;;de;False;4;1;29;0;everyone;Twitter Web App;;;2022-05-28 18:01:39.161297
1411676203224870912;goerke_c;1471127919556759560;Mit @Janine_Wissler zusammen werde ich die @Linksfraktion im Finanzausschuss vertreten. Alle drei Ampel-Parteien haben Steuersenkungen für die große Mehrheit versprochen. Geliefert wurde nichts. Ohne gerechte Steuern gibt es keine gerechte Politik in Deutschland! https://t.co/ifFe0334vc;1411676203224870912;1471127919556759560;2021-12-15 14:40:02+00:00;;de;False;22;10;247;1;everyone;Twitter Web App;;;2022-05-28 18:01:39.166145
1411676203224870912;goerke_c;1471021351838363648;RT @voglerk: 8,8 Mrd. € wurden bisher für die Beschaffung von #Impfstoff zur Verfügung gestellt. Ein Vertrauter von @OlafScholz wurde extra…;1411676203224870912;1471021351838363648;2021-12-15 07:36:35+00:00;;de;False;25;0;0;0;everyone;Twitter for iPad;1470874941767790596;retweeted;2022-05-28 18:01:39.172364
1411676203224870912;goerke_c;1470354166858006530;Es braucht endlich angemessene Löhne, ein Ende der Steuervermeidung und ordentliche Vermögens- und Erbschaftsbesteuerung. Nur damit können wir die massive Ungleichheit eindämmen!;1411676203224870912;1470354162005254155;2021-12-13 11:25:25+00:00;1411676203224870912;de;False;0;0;8;0;everyone;Twitter Web App;1470354165230878720;replied_to;2022-05-28 18:01:39.177283
1411676203224870912;goerke_c;1470354165230878720;Für uns ist klar: Während in der Krise ein Großteil der Bevölkerung von Einschränkungen und finanziellen Einschnitten betroffen ist, dürfen sich die Superreichen nicht noch weiter die Taschen füllen!;1411676203224870912;1470354162005254155;2021-12-13 11:25:25+00:00;1411676203224870912;de;False;1;1;7;0;everyone;Twitter Web App;1470354163590651911;replied_to;2022-05-28 18:01:39.182542
1411676203224870912;goerke_c;1470354163590651911;Viele von ihnen feiern über die Krise hinweg neue Rekorde bei Gewinn, Dividenden und Aktienkursen. Der Nettogewinn der DAX-Konzerne dürfte sich in diesem Jahr mehr als verdoppeln und die Dividenden um ein Viertel steigen!;1411676203224870912;1470354162005254155;2021-12-13 11:25:25+00:00;1411676203224870912;de;False;1;1;6;0;everyone;Twitter Web App;1470354162005254155;replied_to;2022-05-28 18:01:39.189262
1411676203224870912;goerke_c;1470354162005254155;Für Geringverdiener und Mittelschicht hat die Coronakrise finanzielle Einschnitte bedeutet. Derweil bringt die vierte Welle und das geschwächte Weihnachtsgeschäft Kleinbetriebe wieder an ihre Grenzen. Auf der anderen Seite gibt es die Großunternehmen. https://t.co/NLP1LoICQm;1411676203224870912;1470354162005254155;2021-12-13 11:25:24+00:00;;de;False;11;4;40;1;everyone;Twitter Web App;;;2022-05-28 18:01:39.193816
1411676203224870912;goerke_c;1469343873533100035;RT @SPuschner: Hört auf zu streiten, lasst uns das #Impfen versuchsweise mal mit etwas Positivem verbinden: #Impfprämie statt #Impfpflicht.…;1411676203224870912;1469343873533100035;2021-12-10 16:30:53+00:00;;de;False;7;0;0;0;everyone;Twitter Web App;1469342420936663048;retweeted;2022-05-28 18:01:39.197559
1411676203224870912;goerke_c;1469306100856115201;"Ich bezweifle, dass die sensible Kommunikation der Bundesbehörden bei der dubiosen Cyber-Firma eines Bekannten von Ex-Wirecard-Vorstand Marsalek in guten Händen ist. Offenbar bezweifelt die Regierung das auch schon selbst. Die Sache riecht streng!
https://t.co/oldLB45v8s";1411676203224870912;1469306100856115201;2021-12-10 14:00:47+00:00;;de;False;6;1;17;0;everyone;Twitter Web App;;;2022-05-28 18:01:39.203216
1411676203224870912;goerke_c;1468945706929078275;RT @DEZi_Brb: Heute fand unsere digitale #Sprechstunde zum #Impfen im #Havelland statt. Dr. Hanjo Pohle informierte @goerke_c, die anwesend…;1411676203224870912;1468945706929078275;2021-12-09 14:08:42+00:00;;de;False;4;0;0;0;everyone;Twitter Web App;1468661005135888385;retweeted;2022-05-28 18:01:39.208648
1411676203224870912;goerke_c;1468520516130594823;Stattdessen droht eine der größten Steuersenkungen für Topeinkommen, Unternehmenseigentümer und Privatiers, wenn das Bundesverfassungsgericht den Soli kippt. Wir brauchen stattdessen eine Entlastungsoffensive für die große Mehrheit – vor allem wegen den steigenden Preise!;1411676203224870912;1468520514557812737;2021-12-08 09:59:09+00:00;1411676203224870912;de;False;3;0;48;0;everyone;Twitter Web App;1468520514557812737;replied_to;2022-05-28 18:01:39.213156
1411676203224870912;goerke_c;1468520514557812737;Scholz ein wählbarer Kanzler? Wohl kaum! Große Wahlversprechen sind schon vor dem Antritt der Kanzlerschaft vom Tisch. Kleine und mittlere Einkommen sollten im Wahlkampf noch steuerlich entlastet und hohe Einkommen belastet werden. Beides fällt aus!;1411676203224870912;1468520514557812737;2021-12-08 09:59:09+00:00;;de;False;27;16;201;4;everyone;Twitter Web App;;;2022-05-28 18:01:39.218015
1411676203224870912;goerke_c;1468234973383733254;Wenn Lindner solch einen Kürzungshammer bei Deutschland ansetzt, erleben wir kein „Jahrzehnt des Aufbruchs“, sondern des Rückschritts aus!;1411676203224870912;1468234970019864587;2021-12-07 15:04:30+00:00;1411676203224870912;de;False;3;2;56;1;everyone;Twitter Web App;1468234971626233862;replied_to;2022-05-28 18:01:39.224700
1411676203224870912;goerke_c;1468234971626233862;An praktisch allen Stellschrauben wurde genau in die falsche Richtung gedreht. Die Rentenkürzungen waren falsch, der Personalabbau im öffentlichen Dienst war falsch und das Verscherbeln der Infrastruktur war genauso falsch.;1411676203224870912;1468234970019864587;2021-12-07 15:04:30+00:00;1411676203224870912;de;False;4;1;56;0;everyone;Twitter Web App;1468234970019864587;replied_to;2022-05-28 18:01:39.228669
1411676203224870912;goerke_c;1468234970019864587;Lindner nimmt Griechenlands „beeindruckende Reformpolitik“ als Vorbild für Deutschland? Das wäre die komplett falsche Richtung! In Griechenland hat das Prinzip Aderlass zu Jugendarbeitslosigkeit von fast 50 Prozent, steigender Armut und lahmender Wirtschaft geführt!;1411676203224870912;1468234970019864587;2021-12-07 15:04:29+00:00;;de;False;40;6;281;5;everyone;Twitter Web App;;;2022-05-28 18:01:39.232898
1411676203224870912;goerke_c;1466375570074349571;RT @DEZi_Brb: Es wurde deutlich,  dass die Branche wieder sehr unter der aktuellen Situation leidet: Gäste bleiben weg, Feiern werden abges…;1411676203224870912;1466375570074349571;2021-12-02 11:55:54+00:00;;de;False;1;0;0;0;everyone;Twitter for iPad;1466368630178955265;retweeted;2022-05-28 18:01:39.239143
1411676203224870912;goerke_c;1466375205253693445;RT @NiemaMovassat: Das Versagen der #Bundesregierung in Zahlen: Die tägliche PCR-Testkapazität der Stadt #Wien (1,9 Millionen Einwohner) li…;1411676203224870912;1466375205253693445;2021-12-02 11:54:27+00:00;;de;False;199;0;0;0;everyone;Twitter for iPad;1466306027838742530;retweeted;2022-05-28 18:01:39.243676
1411676203224870912;goerke_c;1465995495352983552;@MichaelCzybor Zum Anforderungsprofil gehört, dass man als Student* in eingeschriebenen ist. Mit freundlichen Grüßen;1411676203224870912;1465674531650121738;2021-12-01 10:45:37+00:00;1438014798785089536;de;False;0;0;0;0;everyone;Twitter for iPad;1465675921608880129;replied_to;2022-05-28 18:01:39.247569
