twitter_id;twitter_handle;tweet_id;tweet_text;tweet_author_id;tweet_conversation_id;tweet_created_at;tweet_in_reply_to_user_id;tweet_lang;tweet_possibly_sensitive;tweet_retweet_count;tweet_reply_count;tweet_like_count;tweet_quote_count;tweet_reply_settings;tweet_source;tweet_referenced_tweet_id;tweet_referenced_tweet_type;api_call
1248662696318418950;zoe_gruene;1463845508858982401;"[5/6] Es ist daher umgekehrt sogar ""bemerkenswert, dass sich ein so großer Teil der jungen Menschen gegen traditionelle Ernährungsmuster entscheidet"" @KlausHurrelmann @KHurrelmann @jugendforscher https://t.co/HTfvyD80xg";1248662696318418950;1463844680068698116;2021-11-25 12:22:20+00:00;1248662696318418950;de;False;0;2;4;0;everyone;Twitter for iPhone;1463844686028849161;replied_to;2022-05-28 18:31:02.301703
1248662696318418950;zoe_gruene;1463844686028849161;"[4/6] Bereits 44% der Jugendlichen erprobt alternative Ernährungsformen. Anders als @tagesschau urteilt, sind das nicht ""nur"" 26%, die sich vegetarisch &amp; 16%, die sich vegan ernähren, sondern deutlich mehr als doppelt so viele wie in der Gesamtbevölkerung. 💪 #Fleischatlas";1248662696318418950;1463844680068698116;2021-11-25 12:19:04+00:00;1248662696318418950;de;False;0;1;5;0;everyone;Twitter for iPhone;1463844684766265344;replied_to;2022-05-28 18:31:02.305898
1248662696318418950;zoe_gruene;1463844684766265344;[3/6] Wer sich aber pflanzlich ernährt, muss dabei nicht auf gesunde schmackhafte Ernährung verzichten, die auch noch weniger schädlich für Tiere, Umwelt und Klima ist.😋 zur Inspiration: https://t.co/5WMKC9RAJY @veganuary;1248662696318418950;1463844680068698116;2021-11-25 12:19:04+00:00;1248662696318418950;de;False;0;1;4;0;everyone;Twitter for iPhone;1463844683491295239;replied_to;2022-05-28 18:31:02.309416
1248662696318418950;zoe_gruene;1463844683491295239;"[2/6] es wurden auch Fragen zu Essgewohnheiten gestellt: ob man bereit sei auf tierische Produkte zu *verzichten* oder ob man ""ohne Einschränkungen"" isst 😱 Das Ergebnis wenig überraschend: niemand hat so richtig Lust auf Verzicht.";1248662696318418950;1463844680068698116;2021-11-25 12:19:04+00:00;1248662696318418950;de;False;0;1;4;0;everyone;Twitter for iPhone;1463844682220331009;replied_to;2022-05-28 18:31:02.313103
1248662696318418950;zoe_gruene;1463844682220331009;[1/6] surprise surprise: wir sind eine politisch interessierte Generation, denen die Zukunftsthemen wichtig sind, darunter an erster Stelle der Klimaschutz. ABER!;1248662696318418950;1463844680068698116;2021-11-25 12:19:03+00:00;1248662696318418950;de;False;0;1;5;0;everyone;Twitter for iPhone;1463844680068698116;replied_to;2022-05-28 18:31:02.316907
1248662696318418950;zoe_gruene;1463844680068698116;"Am Mo. wurde eine Trendstudie über Jugendliche (14- bis 29-jährige) in 🇩🇪 veröffentlicht. Neben der wissenschaftlichen Bestätigung bekannter Trends zeigt sie v.a. wie Suggestivfragen gewünschte Antworten erzeugen &amp; diese dann falsch interpretiert werden 🤦‍♀️ https://t.co/SIK9man2DH";1248662696318418950;1463844680068698116;2021-11-25 12:19:03+00:00;;de;False;1;2;14;0;everyone;Twitter for iPhone;;;2022-05-28 18:31:02.321342
1248662696318418950;zoe_gruene;1463810159751356419;Gemeinsam gegen Gewalt! #stärkeralsgewalt #gegenGewalt #schweigenbrechen #gewaltgegenfrauen https://t.co/4fxueop2vD;1248662696318418950;1463810159751356419;2021-11-25 10:01:53+00:00;;de;False;4;2;29;0;everyone;Twitter for iPhone;;;2022-05-28 18:31:02.324595
1248662696318418950;zoe_gruene;1463532798883545095;"#Ampel :
✅ 5 Kernministerien mit Gestaltungsmacht bei den Grünen
✅ Ein Schwerpunkt auf Klimapolitik mit 1,5 Grad-Fokus
✅ Viele soziale Vorhaben, z.B bei Rente und Mindestlohn
✅ Wichtige Schritte zum Ausstieg aus der Massentierhaltung
❎ Es gibt auch schmerzhafte Rückschläge";1248662696318418950;1463532798883545095;2021-11-24 15:39:45+00:00;;de;False;3;6;35;0;everyone;Twitter for Android;;;2022-05-28 18:31:02.328410
1248662696318418950;zoe_gruene;1462814134236495873;So call me maybe. #Karlsruhe https://t.co/r5Ku0u7X7b;1248662696318418950;1462814134236495873;2021-11-22 16:04:02+00:00;;en;False;3;1;34;0;everyone;Twitter for Android;;;2022-05-28 18:31:02.331729
1248662696318418950;zoe_gruene;1462719706037686272;@noosphaere @Karl_Lauterbach Noch gibt's keine Namen für irgendwelche Ministerien - Das sind ja alles Spekulationen, die veröffentlicht sind. Aber die Frage mal an die SPD richten: Lauterbach ist da nicht so beliebt. Ohne Direktmandat wäre er mit seinem schlechten Listenplatz wohl sogar aus dem BT geflogen..;1248662696318418950;1462454071596662788;2021-11-22 09:48:48+00:00;815800802;de;False;0;1;1;0;everyone;Twitter for Android;1462522315355348995;replied_to;2022-05-28 18:31:02.336646
1248662696318418950;zoe_gruene;1462454071596662788;"Sonntagsbesuch im komplett leeren #SWR #Karlsruhe Studio heute: Darum konnte ich mal so tun, als wäre ich Radiosprecherin. 😄👍

PS: An Tagen mit Personenkontakt gilt für mich 2G+ und Maske, wenn der Sicherheitsabstand nicht eingehalten werden kann. https://t.co/M8VHjZXDCq";1248662696318418950;1462454071596662788;2021-11-21 16:13:16+00:00;;de;False;0;1;54;0;everyone;Twitter for Android;;;2022-05-28 18:31:02.340135
1248662696318418950;zoe_gruene;1462015845501227012;"Glaubt noch irgendjemand, dass wir ohne eine Impfpflicht bei der langfristigen Pandemiebekämpfung auskommen? Glaubt ihr daran?
#LasstEuchImpfen";1248662696318418950;1462015845501227012;2021-11-20 11:11:55+00:00;;de;False;4;31;64;2;everyone;Twitter for Android;;;2022-05-28 18:31:02.343462
1248662696318418950;zoe_gruene;1461832727687217152;@MatthiasRehfel1 Ich gebe mir Mühe viel zu veröffentlichen. Kann das aber nicht immer garantieren :);1248662696318418950;1461600723276283905;2021-11-19 23:04:16+00:00;1297070481238102016;de;False;0;0;1;0;everyone;Twitter for Android;1461763706807857159;replied_to;2022-05-28 18:31:02.347172
1248662696318418950;zoe_gruene;1461609513014943745;@DO9XE Dazu finden Sie eine Stellungnahme auf meiner Homepage/ Link in meinem Tweet. Grüße;1248662696318418950;1461423167742910470;2021-11-19 08:17:17+00:00;2346765198;de;False;0;0;0;0;everyone;Twitter for Android;1461423167742910470;replied_to;2022-05-28 18:31:02.351521
1248662696318418950;zoe_gruene;1461600723276283905;"Meine Position zum Infektionsschutz: https://t.co/F1DifUfmyb
- Viele überfällige und gute Neuerungen für Bund und Länder.
- Wir müssen über weitergehende Maßnahmen zur Pandemiebekämpfung ergebnisoffen nachdenken können.
-&gt; Details auch auf der Seite der Grünen Bundestagsfraktion!";1248662696318418950;1461600723276283905;2021-11-19 07:42:22+00:00;;de;False;0;6;15;0;everyone;Twitter for Android;;;2022-05-28 18:31:02.355352
1248662696318418950;zoe_gruene;1460636965129359364;"Hallo, ich bin Zoe und direkt gewählte Bundestagsabgeordnete für #Karlsruhe. Ich bin doppelt geimpft und warte auf meine Drittimpfung.

Denkt an Eure Mitmenschen und übernehmt Verantwortung. Die riesigen Vorteile überwiegen den Risiken. Lasst Euch impfen! #AllesInDenArm https://t.co/tQwFj5uOqM";1248662696318418950;1460636965129359364;2021-11-16 15:52:44+00:00;;de;False;9;5;151;0;everyone;Twitter for Android;;;2022-05-28 18:31:02.358910
1248662696318418950;zoe_gruene;1460335810851524616;"Liebe Community, können wir bitte alle mal abwarten was genau im Koalitionsvertrag stehen wird bevor Panik aufkommt?

Für alle möglichen hypothetischen Ergebnisse bereits den Untergang zu prohezeihen ist nicht gerade zielführend. 🍀";1248662696318418950;1460335810851524616;2021-11-15 19:56:03+00:00;;de;False;4;14;73;1;everyone;Twitter for Android;;;2022-05-28 18:31:02.362259
1248662696318418950;zoe_gruene;1460168921764573185;@codingGarden Du kannst dir wirklich ganz sicher sein, dass wir hart verhandeln. Aber auch innerhalb der Koalition braucht man für alles Mehrheiten und am Ende zumindest Lösungen, die etwas verbessern, bevor gar nichts passiert.;1248662696318418950;1460162086710005761;2021-11-15 08:52:54+00:00;768186524160647168;de;False;0;0;1;0;everyone;Twitter for Android;1460165494074445833;replied_to;2022-05-28 18:31:02.365991
1248662696318418950;zoe_gruene;1460164355786424321;@codingGarden Wie gesagt. Verständlicher Wunsch. Gegenhalten tun wir. Aber die Position der FDP werden wir dennoch nicht ändern können. Das kann nur die FDP selbst. Ein Stück weit müssen wir in unserer Demokratie eben arbeiten mit den gewählten Mehrheiten. Nicht immer gut.;1248662696318418950;1460162086710005761;2021-11-15 08:34:45+00:00;768186524160647168;de;False;0;1;5;0;everyone;Twitter for Android;1460163563486654464;replied_to;2022-05-28 18:31:02.371136
1248662696318418950;zoe_gruene;1460163705136635905;@DerDanlas Kann den Wunsch ja verstehen. Dennoch müssen wir in einer Demokratie arbeiten mit den gewählten Mehrheiten. So funktioniert unser System auf Bundesebene. Eine Koalitionsmöglichkeit ohne FDP war nicht möglich mit den bestehenden Ergebnissen und Regierungsbereitschaften.;1248662696318418950;1460162086710005761;2021-11-15 08:32:10+00:00;2976600796;de;False;0;4;3;0;everyone;Twitter for Android;1460162559911374853;replied_to;2022-05-28 18:31:02.374899
1248662696318418950;zoe_gruene;1460162086710005761;"Können bitte mal alle, die den Wunsch an uns Grüne adressieren, die FDP für ihre Coronapolitik zurechtzuweisen direkt an die FDP schreiben? 
Und ja, ich finde die Positionen der FDP in der Pandemie weitgehend total falsch - mich und uns Grüne braucht man nicht überzeugen.";1248662696318418950;1460162086710005761;2021-11-15 08:25:44+00:00;;de;False;28;22;264;1;everyone;Twitter for Android;;;2022-05-28 18:31:02.379110
1248662696318418950;zoe_gruene;1460158424323440640;"@annberka @Die_Gruenen @grueneka Verständlich - Dennoch ist es nicht unsere Aufgabe die FDP ""in ihre Schranken zu weisen"". Das muss entweder die FDP selbst tun oder der/die Wähler*in. Wir müssen im Parlament arbeiten mit den demokratischen Mehrheiten und Meinungen, die es eben gibt.";1248662696318418950;1460144876146855940;2021-11-15 08:11:11+00:00;135993754;de;False;0;4;5;0;everyone;Twitter for Android;1460144876146855940;replied_to;2022-05-28 18:31:02.383976
1248662696318418950;zoe_gruene;1457991460763193345;"Danke #Karlsruhe, dass ich Teil dieser Karte sein darf: 
Die Liste aller Grünen Direktabgeordneten im Bundestag. 💚 https://t.co/8ZTH30Qu4a";1248662696318418950;1457991460763193345;2021-11-09 08:40:27+00:00;;de;False;2;3;65;0;everyone;Twitter for Android;;;2022-05-28 18:31:02.389120
1248662696318418950;zoe_gruene;1457650475495575552;"Heute im Gespräch mit den Tierschutzorganisationen @PROVIEH_VgtM @VIERPFOTEN @SchweitzerTiere @tierschutz_bund @tierrecht ... 🐕🐖🐄✊
Die fünf Verbände haben heute mit einer Aktion für die Reduzierung des Leids in der Tierhaltung geworben - auch im nächsten Koalitionsvertrag. https://t.co/CWYaVG74MK";1248662696318418950;1457650475495575552;2021-11-08 10:05:29+00:00;;de;False;3;1;31;0;everyone;Twitter for Android;;;2022-05-28 18:31:02.392824
1248662696318418950;zoe_gruene;1455433552259133442;@greysquirrel_de Ich glaube in den Köpfen und im Problembewusstsein schon. In den Handlungen noch nicht. Ich denke viele hoffen noch immer, das sich das Problem schon von alleine/ohne sie löst.;1248662696318418950;1455260898155810825;2021-11-02 07:16:14+00:00;1437748925826482180;de;False;0;0;0;0;everyone;Twitter for Android;1455261861763485696;replied_to;2022-05-28 18:31:02.397344
1248662696318418950;zoe_gruene;1455432565217710080;"Klar, alles zu langsam, alles zu wenig...
Aber ich freue mich heute mal über einen kleinen Erfolg der #COP26 : Mehr als 100 Staaten wollen bis 2030 die Abholzung unserer Wälder beenden. Auch ein kleiner Lichtblick für die Biodiversität.";1248662696318418950;1455432565217710080;2021-11-02 07:12:18+00:00;;de;False;2;6;19;0;everyone;Twitter for Android;;;2022-05-28 18:31:02.403049
1248662696318418950;zoe_gruene;1455260898155810825;Ich bin gespannt auf die Ergebnisse der #COP26 - nach den Pariser Klimazielen von 2015 wäre es doch jetzt wirklich mal wieder an der Zeit für einen richtig großen internationalen Schritt hin zur Klimaneutralität.;1248662696318418950;1455260898155810825;2021-11-01 19:50:10+00:00;;de;False;3;6;38;0;everyone;Twitter for Android;;;2022-05-28 18:31:02.408037
1248662696318418950;zoe_gruene;1453035151999606799;Heute war konstituierende - also die erste - Sitzung des neuen Bundestages. Bald geht die fachliche Arbeit im Parlament hoffentlich richtig los! 💪 https://t.co/BiaLk9PJU9;1248662696318418950;1453035151999606799;2021-10-26 16:25:50+00:00;;de;False;3;12;226;0;everyone;Twitter for Android;;;2022-05-28 18:31:02.412548
1248662696318418950;zoe_gruene;1451977012206260232;"RT @AxelLuessow: ""Jede Banane wird besser überwacht als ein lebendes Tier."" So könnte man die Zustände bei Tiertransporten und Schlachtung…";1248662696318418950;1451977012206260232;2021-10-23 18:21:10+00:00;;de;False;4;0;0;0;everyone;Twitter for Android;1451969638296965122;retweeted;2022-05-28 18:31:02.417477
1248662696318418950;zoe_gruene;1451520385929842690;Auf der Straße und im Parlament: Klimaschutz geht nur zusammen und mit viel Rückhalt! Danke an @FFF_Karlsruhe für die Organisation der heutigen Demo auf dem Karlsruher Marktplatz. Mir geben solche Veranstaltungen immer ganz viel Mut und Kraft. 🌍✊ https://t.co/HgjfJhDCoq;1248662696318418950;1451520385929842690;2021-10-22 12:06:42+00:00;;de;False;3;5;49;0;everyone;Twitter for Android;;;2022-05-28 18:31:02.422963
1248662696318418950;zoe_gruene;1450520483552808964;"Kleine Überraschung heute in der Gemeinderatssitzung: Kurzer Pausenbesuch von Aktivist*innen von @FFF_Karlsruhe 

Ich freue mich auf eine gute Zusammenarbeit und euren kritischen Einsatz für konsequenten Klimaschutz. Dafür stehe ich euch immer als Ansprechpartnerin zur Verfügung. https://t.co/AeHo6Bl3Kf";1248662696318418950;1450520483552808964;2021-10-19 17:53:27+00:00;;de;False;1;2;30;0;everyone;Twitter for Android;;;2022-05-28 18:31:02.427744
1248662696318418950;zoe_gruene;1450519707564523522;"Heute sentimental: nach mehr als sieben Jahren nun mein Abschied aus dem Karlsruher Gemeinderat.

Ich werde die Kommunalpolitik und all ihre Akteur*innen sehr vermissen.

Es ist mir eine Ehre diese großartige Stadt nun mit voller Kraft in Berlin vertreten zu dürfen! https://t.co/mTKxmrHmxg";1248662696318418950;1450519707564523522;2021-10-19 17:50:22+00:00;;de;False;3;5;107;0;everyone;Twitter for Android;;;2022-05-28 18:31:02.433435
1248662696318418950;zoe_gruene;1450506169743728642;@PawelBechthold @ParsaMarvi @FFF_Karlsruhe @GruneKarlsruhe @SPD_Karlsruhe @beolba @AljoschaL Wir kommen in der Pause raus :);1248662696318418950;1450497809732472833;2021-10-19 16:56:34+00:00;1263064975838453760;de;False;0;0;1;0;everyone;Twitter for Android;1450499751477133316;replied_to;2022-05-28 18:31:02.439170
1248662696318418950;zoe_gruene;1448988377286643713;Ganz ehrlich: Ich bin wahnsinnig erleichtert über das Sondierungsergebnis der Ampelgruppe. Klar ist die Ampel nicht die Wunschkoalition meiner Träume. Aber das konstruktive und vertrauensvolle Verhältnis in den Sondierungen macht Hoffnung auf eine richtig gute, stabile Regierung.;1248662696318418950;1448988377286643713;2021-10-15 12:25:24+00:00;;de;False;2;5;67;0;everyone;Twitter for Android;;;2022-05-28 18:31:02.444650
1248662696318418950;zoe_gruene;1446731411910799363;"Danke, Sylvia Kotting-Uhl, für 16 Jahre Bundestag! 

Danke für 16 Jahre Einsatz, Motivation, Durchhalten, Leidenschaft, Tatkraft und Fachwissen für Atompolitik, Klimaschutz, die Umwelt und Karlsruhe.
Du wirst uns fehlen. 

Bild: Abschiedsfeier aus dem Bundestag im KV Karlsruhe 💚 https://t.co/WcVHwbhzIR";1248662696318418950;1446731411910799363;2021-10-09 06:57:02+00:00;;de;False;3;5;84;2;everyone;Twitter for Android;;;2022-05-28 18:31:02.448278
1248662696318418950;zoe_gruene;1445489006167216138;"RT @GregorBurkhardt: Nichts aus den #Sondierungen durchgestochen und auf keine #Koalition festgelegt, aber wir wissen von @zoe_gruene &amp; @ma…";1248662696318418950;1445489006167216138;2021-10-05 20:40:09+00:00;;de;False;4;0;0;0;everyone;Twitter for Android;1445486001342664723;retweeted;2022-05-28 18:31:02.454049
1248662696318418950;zoe_gruene;1445112470704730131;Grünen-Neulinge im Bundestag: Radikaler Klimaschutz – „Wir werden wenig Kompromissbereitschaft zeigen“ https://t.co/PXudDKvH0o via @welt;1248662696318418950;1445112470704730131;2021-10-04 19:43:56+00:00;;de;False;8;13;52;1;everyone;Twitter for Android;;;2022-05-28 18:31:02.458994
1248662696318418950;zoe_gruene;1443948135752024066;"@kaimungenast Nur für Einwegfahrten. Nicht um nach Hause zu fahren :/ 
Brauche bald ein eigenes Rad..";1248662696318418950;1443663074876067841;2021-10-01 14:37:17+00:00;151224241;de;False;0;0;2;0;everyone;Twitter for Android;1443871097640964106;replied_to;2022-05-28 18:31:02.464180
1248662696318418950;zoe_gruene;1443947902238343197;@Taschenbier Bisschen Sport schadet mir nicht :);1248662696318418950;1443663074876067841;2021-10-01 14:36:21+00:00;18047112;de;False;0;0;1;0;everyone;Twitter for Android;1443799993412988931;replied_to;2022-05-28 18:31:02.470189
1248662696318418950;zoe_gruene;1443947784978239493;@Chrille_7 Nö.;1248662696318418950;1443663074876067841;2021-10-01 14:35:53+00:00;1148260524158849029;und;False;0;1;2;0;everyone;Twitter for Android;1443825681092259891;replied_to;2022-05-28 18:31:02.475126
1248662696318418950;zoe_gruene;1443688771434725383;@MostoTN Nextbike;1248662696318418950;1443663074876067841;2021-09-30 21:26:40+00:00;414853105;en;False;0;1;2;0;everyone;Twitter for Android;1443664352138219520;replied_to;2022-05-28 18:31:03.396278
1248662696318418950;zoe_gruene;1443663074876067841;"Nach einer Woche Bundestag habe ich eines auf jeden Fall gelernt: Ich weiß wie ich in Berlin ein Fahrrad ausleihe. 

Beim Rest lerne ich in den nächsten Wochen dann hoffentlich noch viel dazu. https://t.co/VIn8UYh1oC";1248662696318418950;1443663074876067841;2021-09-30 19:44:33+00:00;;de;False;1;20;388;0;everyone;Twitter for Android;;;2022-05-28 18:31:03.401062
1248662696318418950;zoe_gruene;1442442594189983744;@ReifAnnette Danke! Bin traurig, dass es für viele tolle Grüne aus BW und für dich nicht gereicht hat. Du hast einen echt starken Wahlkampf gemacht!;1248662696318418950;1442238525877882881;2021-09-27 10:54:48+00:00;1289231383823515649;de;False;0;0;1;0;everyone;Twitter for Android;1442437250193707008;replied_to;2022-05-28 18:31:03.405560
1248662696318418950;zoe_gruene;1442238525877882881;"Vielen, vielen Dank, Karlsruhe! Dieses Ergebnis ist eine riesige Ehre und ein Vertrauensvorschuss für den ich unglaublich dankbar bin. 
Danke an alle, die uns Grüne und mich in #Karlsruhe so unterstützt haben. Ihr seid die besten!";1248662696318418950;1442238525877882881;2021-09-26 21:23:54+00:00;;de;False;14;45;390;1;everyone;Twitter for Android;;;2022-05-28 18:31:03.409721
1248662696318418950;zoe_gruene;1441896006778605571;@TBBacherle Dir auch! Beide Daumen fest gedrückt für Sindelfingen, Böblingen!;1248662696318418950;1441821028867461129;2021-09-25 22:42:51+00:00;2835233692;de;False;0;0;2;0;everyone;Twitter for Android;1441859201484013572;replied_to;2022-05-28 18:31:03.413119
1248662696318418950;zoe_gruene;1441821028867461129;"Liebe Karlsruher*innen, morgen kommt's drauf an! Wenn ihr noch nicht gewählt habt, dann bitte ich Euch: 
❎ Erststimme: Zoe Mayer
❎ Zweitstimme: Grün
Für Klima, Umwelt, Menschen und Tiere. Für einen starken Zusammenhalt unserer Gesellschaft.
Vielen Dank für Euer Vertrauen. 🌍";1248662696318418950;1441821028867461129;2021-09-25 17:44:55+00:00;;de;False;11;6;89;1;everyone;Twitter for Android;;;2022-05-28 18:31:03.417270
1248662696318418950;zoe_gruene;1441724423531290627;@Querfunk_KA Hoffentlich ersatzlos gestrichen :D;1248662696318418950;1441517654934687745;2021-09-25 11:21:03+00:00;1354493587;de;False;0;0;1;0;everyone;Twitter for Android;1441549120938790913;replied_to;2022-05-28 18:31:03.422144
1248662696318418950;zoe_gruene;1441517654934687745;Großartig, Karlsruhe! 8.000 Menschen bei einer der größten Klimademos in Deutschland. Ein klares Zeichen für konsequenten Klimaschutz. ✊🌍 https://t.co/XYWLTtN6R3;1248662696318418950;1441517654934687745;2021-09-24 21:39:25+00:00;;de;False;2;2;55;0;everyone;Twitter for Android;;;2022-05-28 18:31:03.425616
1248662696318418950;zoe_gruene;1441312589615562758;Heute gibt's Klimastreik. 🌍 In #Karlsruhe um 15 Uhr am Rüppurrer Tor. Ich freue mich viele von euch dort zu treffen!;1248662696318418950;1441312589615562758;2021-09-24 08:04:34+00:00;;de;False;3;2;38;0;everyone;Twitter for Android;;;2022-05-28 18:31:03.429581
1248662696318418950;zoe_gruene;1441005792413507584;"Danke für mehr als 1.000 Menschen, die gestern mit uns auf dem Karlsruher Markplatz waren!

Und jetzt geht's für viel Grün im nächsten Bundestag noch drei Tage in den Wahlkampfendspurt. 🤩✊

#diesmalgruen 
@ABaerbock @grueneka @GJKarlsruhe https://t.co/O9pXQKQrLu";1248662696318418950;1441005792413507584;2021-09-23 11:45:28+00:00;;de;False;11;3;92;1;everyone;Twitter for Android;;;2022-05-28 18:31:03.433061
1248662696318418950;zoe_gruene;1439690877987852294;"Auch heute wieder ein starker Auftritt unserer starken Kanzlerkandidatin @ABaerbock im #Triell. 

Lasst uns kämpfen bis zum Schluss! Es lohnt sich. ✊";1248662696318418950;1439690877987852294;2021-09-19 20:40:28+00:00;;de;False;0;0;30;0;everyone;Twitter for Android;;;2022-05-28 18:31:03.437709
1248662696318418950;zoe_gruene;1439615813904916489;"Ich freue mich auf Annalena, Winfried...
... und hoffentlich euch! 
Kommt am Mittwoch auf den Karlsruher Markplatz und lernt uns kennen. 🍀 https://t.co/ZgRJW4J3TG";1248662696318418950;1439615813904916489;2021-09-19 15:42:11+00:00;;de;False;5;2;36;1;everyone;Twitter for Android;;;2022-05-28 18:31:03.441554
1248662696318418950;zoe_gruene;1438585218735165442;Tolles Podium. Tolles Team. Danke für die Einladung. Die Klimakrise wartet nicht. https://t.co/frUjPPb6U6;1248662696318418950;1438585218735165442;2021-09-16 19:26:58+00:00;;de;False;0;0;7;0;everyone;Twitter for Android;1438565786335985669;quoted;2022-05-28 18:31:03.445262
1248662696318418950;zoe_gruene;1438439171941670915;Bin dabei! 🤩 https://t.co/RgGsFfd9r7;1248662696318418950;1438439171941670915;2021-09-16 09:46:38+00:00;;de;False;0;0;7;0;everyone;Twitter for Android;1438387685752778755;quoted;2022-05-28 18:31:03.449017
1248662696318418950;zoe_gruene;1437705582597844992;"Den Link zur Teilnahme gibt's auf meiner Homepage: https://t.co/k0K2z5OqHE

#diesmalgruen #bereitweilihresseid #karlsruhe https://t.co/qTmaYhTxpS";1248662696318418950;1437705582597844992;2021-09-14 09:11:36+00:00;;de;False;0;0;5;0;everyone;Twitter for Android;;;2022-05-28 18:31:03.453321
1248662696318418950;zoe_gruene;1437508567297413127;"RT @grueneka: Grüne Termine diese Woche in Karlsruhe mit @zoe_gruene u.a @CyberForum @KITKarlsruhe @tok_tayfun 🌻
https://t.co/F1aIcxRZoK ht…";1248662696318418950;1437508567297413127;2021-09-13 20:08:44+00:00;;de;False;2;0;0;0;everyone;Twitter for Android;1437497181641056257;retweeted;2022-05-28 18:31:03.457142
1248662696318418950;zoe_gruene;1436985401344991232;"Seid ihr auch langsam genervt, wie dieser ganze Wahlkampf gefühlt nur davon lebt wer den nächsten persönlichen Shitstorm aushalten muss? 

Ich liebe Politik. Denn wir brauchen sie für alle dringenden Veränderung. Aber auf diese destruktiven Kampagnen kann ich gut verzichten.";1248662696318418950;1436985401344991232;2021-09-12 09:29:52+00:00;;de;False;1;3;57;0;everyone;Twitter for Android;;;2022-05-28 18:31:03.460926
1248662696318418950;zoe_gruene;1436648858730303488;RT @GJKarlsruhe: Heute um 18 Uhr startet der #Wahlkampfhöhepunkt der @gjbw im Tollhaus bei uns in #Karlsruhe. Gemeinsam mit unseren Spitzen…;1248662696318418950;1436648858730303488;2021-09-11 11:12:34+00:00;;de;False;6;0;0;0;everyone;Twitter for Android;1436638648804560896;retweeted;2022-05-28 18:31:03.464569
1248662696318418950;zoe_gruene;1435498640177614850;"RT @klimacamp_ka: 💥Podium
Wie soll die Verkehrs- &amp; Energiewende sozial gerecht umgesetzt werden
Mit
@michel_brandt_ @DieLinke_KA
@PatrikMah…";1248662696318418950;1435498640177614850;2021-09-08 07:02:00+00:00;;de;False;11;0;0;0;everyone;Twitter for Android;1435325350909779972;retweeted;2022-05-28 18:31:03.469378
1248662696318418950;zoe_gruene;1435228225249103880;@Coviell71459012 Auch das ist ein hervorragendes Beispiel für Desinformation.;1248662696318418950;1435221252919209988;2021-09-07 13:07:28+00:00;1412496891212976134;de;False;0;1;2;0;everyone;Twitter for Android;1435221619237076995;replied_to;2022-05-28 18:31:03.473435
1248662696318418950;zoe_gruene;1435221252919209988;"Leider wahr. Bin manchmal schon geschockt mit welchen Ängsten Menschen auf mich zukommen: Von der sofortigen Abschaffung aller Autos bis zum Gerücht, die Grünen hätten Corona erfunden, habe ich schon alles gehört...
Lasst uns bitte ehrlich bleiben! Für unsere Demokratie. https://t.co/7lazV7H8Wu";1248662696318418950;1435221252919209988;2021-09-07 12:39:46+00:00;;de;False;0;1;11;0;everyone;Twitter for Android;1435166099478298626;quoted;2022-05-28 18:31:03.477025
1248662696318418950;zoe_gruene;1435208143265488896;"Klimagerechtigkeit!
Der Wahlkampfhöhepunkt der Grünen Jugend Baden-Württemberg (GJBW) findet am Samstag in Karlsruhe statt. Schaut gerne vorbei und meldet euch an. Mehr Infos gibt's natürlich auf der Hompage der GJBW.
#diesmalgruen #zukunfterkämpfen https://t.co/9AHfq1hDoH";1248662696318418950;1435208143265488896;2021-09-07 11:47:40+00:00;;de;False;5;0;19;1;everyone;Twitter for Android;;;2022-05-28 18:31:03.481082
