twitter_id;twitter_handle;tweet_id;tweet_text;tweet_author_id;tweet_conversation_id;tweet_created_at;tweet_in_reply_to_user_id;tweet_lang;tweet_possibly_sensitive;tweet_retweet_count;tweet_reply_count;tweet_like_count;tweet_quote_count;tweet_reply_settings;tweet_source;tweet_referenced_tweet_id;tweet_referenced_tweet_type;api_call
1248662696318418950;zoe_gruene;1530108273327804421;"Jetzt hat mich Corona leider auch erwischt. Nachdem ich schon die ganze Woche leichte Erkältungssymptome hatte, bei täglichen negativen Tests, sind die Tests heute positiv. Ich hoffe sehr, dass ich niemanden angesteckt habe. Ich bleibe daheim &amp; ruhe mich aus. Bleibt gesund!";1248662696318418950;1530108273327804421;2022-05-27 08:46:55+00:00;;de;False;2;26;89;1;everyone;Twitter Web App;;;2022-05-28 18:31:02.070468
1248662696318418950;zoe_gruene;1528002997506256896;"Heute bei der Gulaschprogrammiernacht ( #gpn20 ) in #Karlsruhe. Danke an das Orga Team und Emmanouil Kampitakis für die Führung. Ein beeindruckender und riesiger Hacker Kongress des Entropia (CCC Karlsruhe).

Und: Gulasch gibt's hier übrigens nur in vegan. 😁👍
@salomon_alex https://t.co/CXK3NvotA5";1248662696318418950;1528002997506256896;2022-05-21 13:21:18+00:00;;de;False;4;4;73;0;everyone;Twitter for Android;;;2022-05-28 18:31:02.072872
1248662696318418950;zoe_gruene;1527381606930972673;@RainerRomer @Die_Gruenen @RainerRomer - eine wirklich tolle Aufnahme! :);1248662696318418950;1527242615460188161;2022-05-19 20:12:07+00:00;2943571396;de;False;1;0;10;0;everyone;Twitter for Android;1527242615460188161;replied_to;2022-05-28 18:31:02.076551
1248662696318418950;zoe_gruene;1527380698130026496;"RT @RainerRomer: Bester #Minister in #Deutschland!
#Habeck
#KlimakatastropheIstJetzt
@Die_Gruenen @zoe_gruene https://t.co/Lcbsm7V9s7";1248662696318418950;1527380698130026496;2022-05-19 20:08:30+00:00;;en;False;850;0;0;0;everyone;Twitter for Android;1527242615460188161;retweeted;2022-05-28 18:31:02.080692
1248662696318418950;zoe_gruene;1527322478363947008;"5 Millionen € für unsere #Tierheime &amp; 5 Millionen € für Tierarznei für die Ukraine. Darauf hat sich die Ampel heute verständigt. Wichtiger Erfolg. Denn die Tiere leiden &amp; die Tierheime ächzen unter der Last. Aber: Wir hätten gerne noch mehr für den #Tierschutz rausgeholt.";1248662696318418950;1527322478363947008;2022-05-19 16:17:09+00:00;;de;False;5;2;46;1;everyone;Twitter Web App;;;2022-05-28 18:31:02.085208
1248662696318418950;zoe_gruene;1526876372001509377;"RT @RenateKuenast: In der heutigen Orientierungsdebatte zur
#Sterbehilfe werde ich über die Notwendigkeit der Neuregelung und über unseren…";1248662696318418950;1526876372001509377;2022-05-18 10:44:29+00:00;;de;False;2;0;0;0;everyone;Twitter for iPhone;1526832791765532672;retweeted;2022-05-28 18:31:02.089303
1248662696318418950;zoe_gruene;1526850079809757184;"Das Recht auf selbstbestimmtes Sterben gesetzlich verankern! In der heutigen Orientierungsdebatte zur Neuregelung der #Sterbehilfe wird ein entsprechender interfraktioneller Gesetzesentwurf von @RenateKuenast @KatjaKeul &amp; Co. besprochen. Auch ich trage diesen mit!";1248662696318418950;1526850079809757184;2022-05-18 09:00:01+00:00;;de;False;2;0;37;0;everyone;Twitter Web App;;;2022-05-28 18:31:02.093015
1248662696318418950;zoe_gruene;1526841715570745346;"Wir müssen über #Massentierhaltung und Verteilungsfragen sprechen, wenn wir die Welt ernähren wollen. 
Die aktuelle Dabette zur Freigabe von ökologischen Brachflächen, die vor allem von der CDU/CSU getrieben wird, ist vollkommen am Thema vorbei und löst keine Probleme. https://t.co/WSCiN77KoH";1248662696318418950;1526841715570745346;2022-05-18 08:26:46+00:00;;de;False;27;18;165;1;everyone;Twitter for Android;1526827752195862531;quoted;2022-05-28 18:31:02.096580
1248662696318418950;zoe_gruene;1526834289715064834;"@aufstiegsheld @diegruenen Lieber @aufstiegsheld, danke für die lieben Worte. Neben den Tierrechten stehe ich selbstverständlich auch für die Menschenrechte ein &amp; ich finde es toll, dass du dich beim wichtigen Thema #Organspende engagierst. Leider fällt diese trotzdem nicht in meinen Fachbereich.";1248662696318418950;1526610929160429568;2022-05-18 07:57:16+00:00;3179459687;de;False;1;0;4;0;everyone;Twitter for iPhone;1526610929160429568;replied_to;2022-05-28 18:31:02.100907
1248662696318418950;zoe_gruene;1526694059326201856;@AnnaDeparnay @LisaMariaOtte Danke für Dein tolles Engagement, Anna. Ich freue mich dabei mit dir zusammenzuarbeiten!;1248662696318418950;1526577016463667200;2022-05-17 22:40:03+00:00;825815009041203201;de;False;1;0;2;0;everyone;Twitter for Android;1526602158203981825;replied_to;2022-05-28 18:31:02.105420
1248662696318418950;zoe_gruene;1526577016463667200;#Tierschutz kann und muss auf allen politischen Ebenen vorangebracht werden. Egal ob im #Bundestag, auf Landesebene oder in den Kommunen. Wie das gelingt? Darüber habe ich mich mit @LisaMariaOtte ausgetauscht. https://t.co/EfqPfnjtZj;1248662696318418950;1526577016463667200;2022-05-17 14:54:57+00:00;;de;False;8;4;79;1;everyone;Twitter Web App;;;2022-05-28 18:31:02.109121
1248662696318418950;zoe_gruene;1524057969968693249;"„Stoppt die Lieferungen von russischem Gas!”, fordern FFF-Aktivistinnen @DominikaLasota1, @wjedroszkowiak  &amp; #ArinaBila aus 🇺🇦 &amp; 🇵🇱.

Das unterstütze ich! Aber: der Ausstieg kann nur koordiniert, nachhaltig und gemeinsam mit unseren internationalen Partnern gelingen. https://t.co/evTObzVfNo";1248662696318418950;1524057969968693249;2022-05-10 16:05:10+00:00;;de;False;11;2;40;0;everyone;Twitter Web App;;;2022-05-28 18:31:02.113036
1248662696318418950;zoe_gruene;1523690102467497984;@bbcworldservice hat mich gefragt, welche Auswirkungen der Krieg in der #Ukraine auf die deutsche Energie- und #Klimapolitik hat. In Kürze: Wir müssen uns möglichst schnell von fossilen Brennstoffe aus Russland unabhängig machen! https://t.co/2dBwk6R1dh;1248662696318418950;1523690102467497984;2022-05-09 15:43:23+00:00;786764;de;False;1;0;0;0;everyone;Twitter for iPhone;;;2022-05-28 18:31:02.116988
1248662696318418950;zoe_gruene;1523661008069599239;@bbcworldservice hat mich gefragt, welche Auswirkungen der Krieg in der #Ukraine auf die deutsche Energie- und #Klimapolitik hat. In Kürze: Wir müssen uns möglichst schnell von fossilen Brennstoffen aus Russland unabhängig machen! https://t.co/2dBwk6R1dh;1248662696318418950;1523661008069599239;2022-05-09 13:47:47+00:00;786764;de;False;1;0;0;0;everyone;Twitter for iPhone;;;2022-05-28 18:31:02.121452
1248662696318418950;zoe_gruene;1521155763393204227;RT @PROVIEH_VgtM: PROVIEH spricht mit den zuständigen Abgeordneten des deutschen @Bundestag|s über mehr #Tierschutz – heute z.B. mit Zoe Ma…;1248662696318418950;1521155763393204227;2022-05-02 15:52:50+00:00;;de;False;5;0;0;0;everyone;Twitter for Android;1521121512685817856;retweeted;2022-05-28 18:31:02.125000
1248662696318418950;zoe_gruene;1518302837956034563;"Ich schließe mich der großen Freude für Europa und für @EmmanuelMacron an! 
Ein guter Tag. Herzlichen Glückwunsch, Frankreich! #FranceElection2022";1248662696318418950;1518302837956034563;2022-04-24 18:56:19+00:00;;de;False;2;5;40;0;everyone;Twitter for Android;;;2022-05-28 18:31:02.128684
1248662696318418950;zoe_gruene;1517896646012583936;"Erst wenn man mal vor einer Kohlegrube stand, weiß man was Landschaftsverschandelung durch Energieversorgung wirklich ist.

✊ Heute in Lützerath bei der Demo für Klimagerechtigkeit. #AlleDoerferBleiben #LuetziBleibt https://t.co/LH89BHiR5M";1248662696318418950;1517896646012583936;2022-04-23 16:02:16+00:00;;de;False;5;2;41;0;everyone;Twitter for Android;;;2022-05-28 18:31:02.132122
1248662696318418950;zoe_gruene;1517463873875501056;Wird höchste Zeit: Eine sinnvolle Entlastungsmaßnahme mit Lenkungseffekt für mehr gesundes Obst und Gemüse auf unseren Tellern. https://t.co/7pHjkkS9Z3;1248662696318418950;1517463873875501056;2022-04-22 11:22:35+00:00;;de;False;3;4;26;0;everyone;Twitter for Android;1517195688886640644;quoted;2022-05-28 18:31:02.137070
1248662696318418950;zoe_gruene;1516368480899158019;RT @BriHasselmann: Zu dieser dubiosen Stiftung müssen alle Sachen auf den Tisch. Das ist doch klar. Und zwar schnell. #NordStream2 #Schwesi…;1248662696318418950;1516368480899158019;2022-04-19 10:49:53+00:00;;de;False;264;0;0;0;everyone;Twitter for Android;1516329204438257667;retweeted;2022-05-28 18:31:02.140652
1248662696318418950;zoe_gruene;1514587726150053896;"#LisaPaus wird eine tolle Familienministerin. Sehr gut, dass auch das Familienmodell ""Alleinerziehend"" in diesem wichtigen Amt endlich eine Repräsentation bekommt.";1248662696318418950;1514587726150053896;2022-04-14 12:53:48+00:00;;de;False;2;2;20;0;everyone;Twitter for Android;;;2022-05-28 18:31:02.144118
1248662696318418950;zoe_gruene;1513912505105539078;#Tierquälerei muss Konsequenzen haben! Dafür müssen Lücken in der Nutztierhaltungsverordnung geschlossen und strafrechtliche Bestandteile aus dem #Tierschutzgesetz in das Strafgesetzbuch überführt werden. Danke @MullnFriedrich von @SOKO_Tierschutz für den Austausch. https://t.co/funiRynhMS;1248662696318418950;1513912505105539078;2022-04-12 16:10:43+00:00;;de;False;4;1;34;0;everyone;Twitter for iPhone;;;2022-05-28 18:31:02.147410
1248662696318418950;zoe_gruene;1513883862379679754;"Aus #Brandenburg kommende #Tiertransporte in die #Ukraine, Belarus sowie Russland wurden gestoppt. Der Bund muss dringend nachziehen! Die Versorgung der Tiere kann keinesfalls gewährleistet werden. 
https://t.co/BAbWIAB5Wi";1248662696318418950;1513883862379679754;2022-04-12 14:16:54+00:00;;de;False;1;1;13;0;everyone;Twitter for iPhone;;;2022-05-28 18:31:02.151860
1248662696318418950;zoe_gruene;1513619054082330625;"Ich hoffe sehr, dass der Rücktritt von #AnneSpiegel eine Diskussion über eine neue Fehlerkultur in der Politik lostritt. 

Ich wünsche mir eine Gesellschaft in der Poliker*innen (aller Parteien) ermutigt werden, offen über Fehler zu reden und daraus lernen dürfen.";1248662696318418950;1513619054082330625;2022-04-11 20:44:38+00:00;;de;False;8;10;59;0;everyone;Twitter for Android;;;2022-05-28 18:31:02.155476
1248662696318418950;zoe_gruene;1512739207520964608;"Unsere Meere befinden sich in einem katastrophalen Zustand! Fehlende Nachhaltigkeit und ein enormer Wettbewerbsdruck in der Fischerei führen zu prekären Zuständen – sowohl für die Fischer*innen, als auch für die Tiere und die Natur. 

Meine Bundestagsrede in Ausschnitten. https://t.co/LmseHWLezz";1248662696318418950;1512739207520964608;2022-04-09 10:28:27+00:00;;de;False;5;5;55;0;everyone;Twitter for iPhone;;;2022-05-28 18:31:02.158907
1248662696318418950;zoe_gruene;1512034140572598278;Ich bin enttäuscht! Der Antrag zur Schaffung der gesetzlichen Grundlage für eine #Impflicht konnte im #Bundestag keine Mehrheit erlangen. Sehr bedauerlich, denn dieser hätte Flexibilität der Impfpflicht in Bezug auf den Pandemieverlauf und Beratungspflicht für Ungeimpfte bedeutet;1248662696318418950;1512034140572598278;2022-04-07 11:46:46+00:00;;de;False;5;13;49;0;everyone;Twitter for iPhone;;;2022-05-28 18:31:02.162681
1248662696318418950;zoe_gruene;1511756406210367488;"RT @janoschdahmen: Kürzlich hieß es noch von #CDU/#CSU, man wolle eine ""konstruktive Opposition"" sein. Bei der #Impfpflicht drängt sich nun…";1248662696318418950;1511756406210367488;2022-04-06 17:23:08+00:00;;de;False;139;0;0;0;everyone;Twitter for Android;1511755136183504896;retweeted;2022-05-28 18:31:02.166146
1248662696318418950;zoe_gruene;1511646176671641600;Endlich nimmt die #Energiewende Fahrt auf! Das #Osterpaket ebnet den Weg für einen massiven Ausbau der erneuerbaren Energien und ist eine echte Solar- und Windkraftoffensive. Unser Ziel: bis 2030 80% des Stroms aus Erneuerbaren.;1248662696318418950;1511646176671641600;2022-04-06 10:05:08+00:00;;de;False;1;8;35;0;everyone;Twitter for iPhone;;;2022-05-28 18:31:02.169995
1248662696318418950;zoe_gruene;1511342134565163020;"@EU_Commission weist ausdrücklich auf die Möglichkeit hin, MwSt auf Lebensmittel zu senken um dem Anstieg der Preise entgegenzuwirken.
Bereits im Dez'21 einigten sich die Mitgliedstaaten auf eine Reform der MwSt auf EU-Ebene, die Aktuell zur Anwendung kommen könne.";1248662696318418950;1511342131708895233;2022-04-05 13:56:58+00:00;1248662696318418950;de;False;2;2;34;1;everyone;Twitter for iPhone;1511342133143298071;replied_to;2022-05-28 18:31:02.173702
1248662696318418950;zoe_gruene;1511342133143298071;"Deutschland sollte vorangehen und zwei Dinge tun:
1. pflanzliche Milch- und Fleischalternativen mit dem reduzierten MwSt-Satz von 7% belegen 🌱
2. eine temporäres Aussetzen der MwSt auf unverarbeitetes Obst, Gemüse, Nüsse, Hülsenfrüchte auf 0% 🍐🍅🥜";1248662696318418950;1511342131708895233;2022-04-05 13:56:58+00:00;1248662696318418950;de;False;2;4;49;2;everyone;Twitter for iPhone;1511342131708895233;replied_to;2022-05-28 18:31:02.177341
1248662696318418950;zoe_gruene;1511342131708895233;"Fleisch zu teuer für den kleinen Geldbeutel?
Die wahren Luxusgüter sind pflanzliche Produkte, die sich zu wenige leisten können.
Im Zeichen der Lebensmittelsicherheit muss mehr Getreide auf die Teller statt in den Trog.
Es ist Zeit für MwSt-Senkungen auf pflanzliche Produkte!";1248662696318418950;1511342131708895233;2022-04-05 13:56:58+00:00;;de;False;14;6;125;2;everyone;Twitter for iPhone;;;2022-05-28 18:31:02.180908
1248662696318418950;zoe_gruene;1509869259824025603;Endlich mal ein Minister, der Klartext spricht. Wir hinterlassen eine Spur der Verwüstung hinter uns - nicht nur in Krisensituationen. #Habeck #Lanz https://t.co/CWtxIFdIwk;1248662696318418950;1509869259824025603;2022-04-01 12:24:18+00:00;;de;False;10;3;80;1;everyone;Twitter for Android;;;2022-05-28 18:31:02.185510
1248662696318418950;zoe_gruene;1509103276222205956;„60.000 Tiere starben vor einem Jahr qualvoll im Feuer der Schweinezuchtanlage in Alt Tellin. Ursache: Mangelnder Brandschutz. Eine solche Katastrophe darf sich nicht wiederholen. Die Rechtsvorschriften zum Schutz vor Bränden müssen dringend verbessert! https://t.co/feZwyL3YLY;1248662696318418950;1509103276222205956;2022-03-30 09:40:33+00:00;;de;False;3;3;28;0;everyone;Twitter for Android;;;2022-05-28 18:31:02.189618
1248662696318418950;zoe_gruene;1507384359069831182;RT @RenateKuenast: Der oberste Tierschützer des Landes, @cem_oezdemir, hat heute Gutachten zur Reform des #Tierschutz|gesetzes entgegen gen…;1248662696318418950;1507384359069831182;2022-03-25 15:50:11+00:00;;de;False;28;0;0;0;everyone;Twitter for Android;1507367519274901510;retweeted;2022-05-28 18:31:02.192607
1248662696318418950;zoe_gruene;1504159564224151552;"Unter den Dumpingpreisen für Fleisch leiden Tiere, die Umwelt und die Erzeuger*innen!

In der heutigen Fragestunde im Bundestag habe ich die Parlamentarische Staatssekretärin des @bmel, Dr. Manuela Rottmann, dazu befragt. https://t.co/bRyKtCNeTY";1248662696318418950;1504159564224151552;2022-03-16 18:16:00+00:00;;de;False;2;1;21;0;everyone;Twitter for iPhone;;;2022-05-28 18:31:02.196307
1248662696318418950;zoe_gruene;1502747638705307648;"Die beste Strategie, um unsere Abhängigkeit von Getreide/Futtermitteln für die Tierhaltung zu reduzieren, ist übrigens die Tierbestände zu reduzieren. 
#GoVeggieForUkraine #ReduceAnimalFarmingForUkraine";1248662696318418950;1502747638705307648;2022-03-12 20:45:31+00:00;;de;False;13;29;103;3;everyone;Twitter for Android;;;2022-05-28 18:31:02.200233
1248662696318418950;zoe_gruene;1500840863387299840;"@FFF_Karlsruhe Im Haushalt ist für die Energie-, Verkehrs-, Industriewende ein Klima- und
Transformationsfonds vorgesehen. Im Vergleich zu den Plänen der alten Regierung soll dieser um ca. 90 Mrd € anwachsen. Dazu 20
Mrd Verpflichtungs-Ermächtigungen und weiteres. Mehr Infos folgen öffentlich.";1248662696318418950;1500568553837244421;2022-03-07 14:28:40+00:00;1109106628194914306;de;False;1;1;3;0;everyone;Twitter for Android;1500835236984274953;replied_to;2022-05-28 18:31:02.204648
1248662696318418950;zoe_gruene;1500568553837244421;"200.000.000.000 Euro! 

So viel investieren wir bis 2026 in die Klimawende. Ein großartiger Erfolg. Gerade dieser Tage, da uns vor Augen geführt wird, wie sehr die Abhängigkeit von fossilen Brennstoffen auch sicherheitspolitische Relevanz hat.";1248662696318418950;1500568553837244421;2022-03-06 20:26:37+00:00;;de;False;3;7;56;0;everyone;Twitter for Android;;;2022-05-28 18:31:02.208467
1248662696318418950;zoe_gruene;1497577706019504131;Gerade auf der Demo für Frieden in Karlsruhe. Ein gigantisches Zeichen der Solidarität mit der Ukraine. Die Trauer, Wut und Verzweiflung gegenüber der russischen Führung sind enorm. Wir müssen hart und zielgerichtet sanktionieren und Flüchtenden sofort helfen. #StandWithUkriane;1248662696318418950;1497577706019504131;2022-02-26 14:22:03+00:00;;de;False;7;1;52;0;everyone;Twitter for Android;;;2022-05-28 18:31:02.211731
1248662696318418950;zoe_gruene;1496792194996477956;Russland bricht mit dem Angriff auf die Ukraine das Völkerrecht. Diese Kriegshandlung verurteile ich zutiefst und stehe in Solidarität mit der Ukraine. #StandWithUkraine;1248662696318418950;1496792194996477956;2022-02-24 10:20:42+00:00;;de;False;3;5;33;0;everyone;Twitter for Android;;;2022-05-28 18:31:02.215509
1248662696318418950;zoe_gruene;1496397770323857413;Bin auch mit dabei. Spannende Veranstaltung zur geplanten Novelle des Tierschutzgesetzes! https://t.co/AdR1dWnYKF;1248662696318418950;1496397770323857413;2022-02-23 08:13:24+00:00;;de;False;3;2;15;1;everyone;Twitter for Android;1496074635087069184;quoted;2022-05-28 18:31:02.220310
1248662696318418950;zoe_gruene;1495444172760834056;Eine klare Kennzeichnung von Haltungsbedingungen für Tiere ist der erste Schritt für bessere Standards in der Landwirtschaft und den Ausstieg aus der Massentierhaltung. Schluss mit unwürdigen Haltungsformen. https://t.co/9g4lvqE8MW;1248662696318418950;1495444172760834056;2022-02-20 17:04:09+00:00;;de;False;4;5;37;0;everyone;Twitter for Android;1495367754865651712;quoted;2022-05-28 18:31:02.224818
1248662696318418950;zoe_gruene;1495055316437901317;"RT @ReifAnnette: Mein Tag startet mit einer Sitzung der Landesarbeitsgemeinschaft Tierschutz. 
Ausser dem Bericht von @zoe_gruene aus dem B…";1248662696318418950;1495055316437901317;2022-02-19 15:18:58+00:00;;de;False;3;0;0;0;everyone;Twitter for Android;1494981311521607683;retweeted;2022-05-28 18:31:02.228940
1248662696318418950;zoe_gruene;1493955340446191616;"Ich habe gestern den Antrag für eine #ImpfpflichtAb18 im Bundestag mitgezeichnet. 

In der schwierigen Abwägung von Freiheitsrechten entscheide ich mich für die vielfach geforderte Weitsicht in der Pandemie, den Schutz unseres Gesundheitssystems und Solidarität.";1248662696318418950;1493955340446191616;2022-02-16 14:28:04+00:00;;de;False;9;367;109;22;everyone;Twitter for Android;;;2022-05-28 18:31:02.232418
1248662696318418950;zoe_gruene;1492124519984730120;RT @KITKarlsruhe: #WomenInScience @ KIT: Zoe Mayer studierte #Wirtschaftsingenieurwesen am KIT und promoviert im Bereich Energiewirtschaft.…;1248662696318418950;1492124519984730120;2022-02-11 13:13:02+00:00;;de;False;8;0;0;0;everyone;Twitter for Android;1492116201362837512;retweeted;2022-05-28 18:31:02.236390
1248662696318418950;zoe_gruene;1486741568438644742;RT @GrueneBundestag: Ein Aufbruch für Landwirtschaft und Ernährung braucht mehr Tier- und Umweltschutz, eine bessere Agrarpolitik in Europa…;1248662696318418950;1486741568438644742;2022-01-27 16:43:06+00:00;;de;False;10;0;0;0;everyone;Twitter for Android;1486727602123382792;retweeted;2022-05-28 18:31:02.240338
1248662696318418950;zoe_gruene;1486698945581621249;"#WeRemember
Heute gedenken wir allen Opfern des Holocaust. Am 27. Januar 1945 wurde das Konzentrationslager Auschwitz befreit. Auch 77 Jahre später ist es unsere gesellschaftliche und politische Verantwortung, Antisemitismus zu bekämpfen. https://t.co/9w8qMymBLX";1248662696318418950;1486698945581621249;2022-01-27 13:53:44+00:00;;de;False;6;4;92;1;everyone;Twitter for Android;;;2022-05-28 18:31:02.244049
1248662696318418950;zoe_gruene;1486319641404354564;Die Orientierungsdebatte zur Einführung einer allgemeinen Impfpflicht startet heute im Deutschen Bundestag. Um Fragen aus meinem Wahlkreis zu beantworten lade ich zum Gespräch ein. Die Veranstaltung findet am 1.2. online statt und bedarf einer Anmeldung an zoe.mayer@bundestag.de. https://t.co/VdaWo0gDRp;1248662696318418950;1486319641404354564;2022-01-26 12:46:31+00:00;;de;False;7;1;33;3;everyone;Twitter for Android;;;2022-05-28 18:31:02.247628
1248662696318418950;zoe_gruene;1484210025199550476;"Zur heutigen Abstimmung im EU-Parlament zu Tiertransporten wurden einige wenige Verbesserungen des Tierschutzes gefordert, sie bleiben aber weit hinter den Erwartungen zurück.
Der Schutz von Tieren darf nicht länger ignoriert werden. @RenateKuenast https://t.co/YdEihBo8MM";1248662696318418950;1484210025199550476;2022-01-20 17:03:39+00:00;;de;False;5;2;32;0;everyone;Twitter for iPhone;;;2022-05-28 18:31:02.251585
1248662696318418950;zoe_gruene;1483068745241317376;"RT @mitdenkenKA: Wir sind zurück! Wir haben dem Treiben der Virusbefürworter und Nazis viel zu lange zugeschaut aber JETZT REICHT'S!

Am Mo…";1248662696318418950;1483068745241317376;2022-01-17 13:28:37+00:00;;de;False;163;0;0;0;everyone;Twitter for Android;1481548021536112643;retweeted;2022-05-28 18:31:02.255663
1248662696318418950;zoe_gruene;1483041075577208832;@Bhaddadda @GrueneBundestag Doch. Wollen wir :);1248662696318418950;1481941464703803397;2022-01-17 11:38:40+00:00;1339971191885475842;de;False;0;1;1;0;everyone;Twitter for Android;1481942360724541442;replied_to;2022-05-28 18:31:02.259217
1248662696318418950;zoe_gruene;1481978962439987202;RT @BriHasselmann: Der Blick auf diese Sitzungswoche im Bundestag zeigt, wie viele Projekte wir uns in der #Ampel vorgenommen. Und so viele…;1248662696318418950;1481978962439987202;2022-01-14 13:18:13+00:00;;de;False;8;0;0;0;everyone;Twitter for Android;1481974799631007744;retweeted;2022-05-28 18:31:02.262960
1248662696318418950;zoe_gruene;1481942605554499584;"RT @GrueneBundestag: Was wir ganz sicher nicht machen werden, ist die Debatte um faire Lebensmittelpreise weiter zu verschleppen. 

Das sin…";1248662696318418950;1481942605554499584;2022-01-14 10:53:44+00:00;;de;False;14;0;0;0;everyone;Twitter for iPhone;1481941464703803397;retweeted;2022-05-28 18:31:02.266673
1248662696318418950;zoe_gruene;1481220560893927426;Karlsruhe hat großes Potenzial beim Ausbau der Solarenergie und der Photovoltaik 🌞☀️🌞 Mein Statement zur Eröffnungsbilanz Klimaschutz von @roberthabeck90 findet ihr hier https://t.co/YMXMf95kJz https://t.co/LRvxuXcgGd;1248662696318418950;1481220560893927426;2022-01-12 11:04:36+00:00;;de;False;7;9;44;1;everyone;Twitter for Android;;;2022-05-28 18:31:02.271067
1248662696318418950;zoe_gruene;1471183481065644036;Die Lange in #Afghanistan ist weiterhin katastrophal. Hier findet ihr eine tolle Aktion zur Unterstützung der #Luftbrücke Kabul. ➡️ https://t.co/tp5YiUoFa7 https://t.co/2NeIrw0gJS;1248662696318418950;1471183481065644036;2021-12-15 18:20:49+00:00;;de;False;2;1;26;0;everyone;Twitter for iPhone;;;2022-05-28 18:31:02.274365
1248662696318418950;zoe_gruene;1471115217631387656;RT @RenateKuenast: Das ist das tolle MdB-Team für #Ernährung #Landwirtschaft #Tierschutz ⁦@karlbaer⁩ ⁦@zoe_gruene⁩ ⁦@cj_schroeder⁩ ⁦@AnneSp…;1248662696318418950;1471115217631387656;2021-12-15 13:49:34+00:00;;de;False;12;0;0;0;everyone;Twitter for Android;1471101641881538563;retweeted;2022-05-28 18:31:02.278149
1248662696318418950;zoe_gruene;1470774412626599944;"RT @RenateKuenast: ""Die Zeit der laschen Urteile, die nicht ernst genommen wurden, ist vorbei. Wer 🐔🐰 Tiere 🐷🐮 quält, gerade dann, wenn er…";1248662696318418950;1470774412626599944;2021-12-14 15:15:20+00:00;;de;False;33;0;0;0;everyone;Twitter for Android;1470714853748789254;retweeted;2022-05-28 18:31:02.282026
1248662696318418950;zoe_gruene;1469004441756049410;Eine starke Stimme für die Kommunalpolitik in #Karlsruhe und die Energiewende im Gebäudesektor kann ich künftig als stellvertretendes Mitglied der Grünen Bundestagsfraktion im Ausschuss für #Wohnen, #Stadtentwicklung, #Bauwesen und #Kommunen einbringen.;1248662696318418950;1469004441756049410;2021-12-09 18:02:06+00:00;;de;False;0;2;47;0;everyone;Twitter for Android;;;2022-05-28 18:31:02.286447
1248662696318418950;zoe_gruene;1469003336141660167;Ich kann's kaum erwarten mich für den #Klimaschutz stark zu machen als stellvertrendes Mitglied im Ausschuss für #Energie und #Klima der Grünen Bundestagsfraktion.;1248662696318418950;1469003336141660167;2021-12-09 17:57:42+00:00;;de;False;0;1;35;0;everyone;Twitter for Android;;;2022-05-28 18:31:02.290066
1248662696318418950;zoe_gruene;1469002549835579398;In den nächsten vier Jahren werde ich mich als Mitglied im Ausschuss für Ernährung und Landwirtschaft als Teil der Grünen Bundestagsfraktion einsetzen für #Tierschutz und #Tierrechte. Ich bin voller Tatkraft für diese neue Aufgabe!;1248662696318418950;1469002549835579398;2021-12-09 17:54:35+00:00;;de;False;9;33;373;4;everyone;Twitter for Android;;;2022-05-28 18:31:02.293581
1248662696318418950;zoe_gruene;1463845510431793152;"[6/6] ❓ Wer möchte wetten, dass die Antworten unserer Generation nochmal anders ausgesehen hätten, würde nicht nach ""Verzicht"" und ""Einschränkung"" gefragt, sondern stattdessen nach der Bereitschaft sich gesund, lecker und nachhaltig zu ernähren ohne Tieren oder Klima zu schaden?";1248662696318418950;1463844680068698116;2021-11-25 12:22:21+00:00;1248662696318418950;de;False;1;3;8;0;everyone;Twitter for iPhone;1463845508858982401;replied_to;2022-05-28 18:31:02.297032
