twitter_id;twitter_handle;tweet_id;tweet_text;tweet_author_id;tweet_conversation_id;tweet_created_at;tweet_in_reply_to_user_id;tweet_lang;tweet_possibly_sensitive;tweet_retweet_count;tweet_reply_count;tweet_like_count;tweet_quote_count;tweet_reply_settings;tweet_source;tweet_referenced_tweet_id;tweet_referenced_tweet_type;api_call
33043294;VolkmarKlein;172455730660646912;Besuch bei Bundeswehr Erndtebrück: Deutschlandweite Luftraumüberwachung sorgt für Sicherheit. Vielen Dank für Euern Einsatz!;33043294;172455730660646912;2012-02-22 23:00:24+00:00;;de;False;0;0;0;0;everyone;Twitter Web Client;;;2022-05-28 15:30:22.358335
33043294;VolkmarKlein;171366208514441217;Gauck wird gewiss ein guter Präsident. Ich hätte Klaus Töpfer bevorzugt: Er bringt internationale Erfahrung und die Brücke Ökonomie/Ökologie;33043294;171366208514441217;2012-02-19 22:51:02+00:00;;de;False;0;0;0;0;everyone;Twitter Web Client;;;2022-05-28 15:30:22.362147
33043294;VolkmarKlein;170308089160011777;Bau der Hüttentalstraße im Zeitplan. Gut, dass es uns Anfang 2010 gelungen ist, das Projekt noch in die Bauliste ab 2010 zu bekommen.;33043294;170308089160011777;2012-02-17 00:46:27+00:00;;de;False;0;0;0;0;everyone;Twitter Web Client;;;2022-05-28 15:30:22.366036
33043294;VolkmarKlein;164127926017724417;EuroGratwanderung: Wir müssen einen Crash vermeiden, aber zuviel Zusagen würden notwendigen Reformdruck reduzieren. 60 Leute eben begeistert;33043294;164127926017724417;2012-01-30 23:28:41+00:00;;de;False;0;0;0;0;everyone;Twitter Web Client;;;2022-05-28 15:30:22.369907
33043294;VolkmarKlein;159206624081358848;Frühstück mit Kosovos Aussenminister Enver Hoxhaj: Deutschland leistet wichtigen Beitrag zur befriedung mit Serbien und Entwicklung Kosovos;33043294;159206624081358848;2012-01-17 09:33:11+00:00;;de;False;0;0;0;0;everyone;Echofon;;;2022-05-28 15:30:22.373847
33043294;VolkmarKlein;158536686979125248;http://t.co/2o5ok4Vq;33043294;158536686979125248;2012-01-15 13:11:06+00:00;;und;False;0;0;0;0;everyone;Twitter Web Client;;;2022-05-28 15:30:22.377901
33043294;VolkmarKlein;158536366102294529;Eindrucksvolle Saisonabschlußfeier und Meisterehrung gestern abend beim MSC Freier Grund.;33043294;158536366102294529;2012-01-15 13:09:49+00:00;;de;False;0;0;0;0;everyone;Twitter Web Client;;;2022-05-28 15:30:22.381324
33043294;VolkmarKlein;156515771965644800;Wertschätzung für Krisenmanagement der Kanzlerin steigt, Vertrauen in Deutschland: groteskes Ergebnis: Negative Zinsen http://t.co/S7bEM8Xm;33043294;156515771965644800;2012-01-09 23:20:42+00:00;;de;False;0;0;0;0;everyone;Twitter Web Client;;;2022-05-28 15:30:22.384864
33043294;VolkmarKlein;156513875896958976;http://t.co/2o5ok4Vq;33043294;156513875896958976;2012-01-09 23:13:10+00:00;;und;False;0;0;0;0;everyone;Twitter Web Client;;;2022-05-28 15:30:22.389025
33043294;VolkmarKlein;152170016253542400;2012 wird hoffentlich für uns erfolgreich wie 2011. Chancen gut, aber Risiken da. Nicht nur wegen Euro. Die Kanzlerin kann damit umgehen.;33043294;152170016253542400;2011-12-28 23:32:13+00:00;;de;False;0;0;0;0;everyone;Twitter Web Client;;;2022-05-28 15:30:22.392370
33043294;VolkmarKlein;152167581367808000;RT @petertauber: Und noch eine gute Nachricht: der Bundesfreiwilligendienst ist ein voller Erfolg! Mehr als 25.000 Freiwillige zum Jahre ...;33043294;152167581367808000;2011-12-28 23:22:33+00:00;;de;False;3;0;0;0;everyone;Twitter Web Client;152093528477016065;retweeted;2022-05-28 15:30:22.396708
33043294;VolkmarKlein;145880561456656384;Kurzbesuch in Ghana, Gespräche mit Mikrofinanzorganisationen und Geburtstagsbesuch bei Ex-Präsident Kufour. Foto auf http://t.co/4ZiXoVcf;33043294;145880561456656384;2011-12-11 15:00:10+00:00;;de;False;0;0;0;0;everyone;Twitter Web Client;;;2022-05-28 15:30:22.400489
33043294;VolkmarKlein;142749985748955137;Mein neues Infoblatt wird gerade per Post verschickt. Ist hier schon zu lesen: http://t.co/Rj1w1yOW;33043294;142749985748955137;2011-12-02 23:40:23+00:00;;de;False;0;0;0;0;everyone;Twitter Web Client;;;2022-05-28 15:30:22.404538
33043294;VolkmarKlein;138293358643789825;Nächste Woche geht mein neues Infoblatt in Druck. Wer hat noch Themenvorschläge? Hier noch mal da jüngste Blatt: http://t.co/oaeUEM8o;33043294;138293358643789825;2011-11-20 16:31:20+00:00;;de;False;0;0;0;0;everyone;Twitter Web Client;;;2022-05-28 15:30:22.408011
33043294;VolkmarKlein;129957806810988545;Bitte facebook-Unterstützer werden:   http://t.co/2o5ok4Vq;33043294;129957806810988545;2011-10-28 16:28:50+00:00;;de;False;0;0;0;0;everyone;Twitter Web Client;;;2022-05-28 15:30:22.412185
33043294;VolkmarKlein;129955125182730240;Reformationstag statt Halloween:  http://t.co/4ZiXoVcf;33043294;129955125182730240;2011-10-28 16:18:10+00:00;;sv;False;0;0;0;0;everyone;Twitter Web Client;;;2022-05-28 15:30:22.415730
33043294;VolkmarKlein;129310340969275392;Gute Nachricht für Siegen-Wittgenstein: Bundeswehr gestärkt mit 226 mehr Dienststellen. Mehr auf http://t.co/4ZiXoVcf;33043294;129310340969275392;2011-10-26 21:36:02+00:00;;de;False;0;0;0;0;everyone;Twitter Web Client;;;2022-05-28 15:30:22.419288
33043294;VolkmarKlein;128604554764890113;Hoher Besuch: Der ghanaische Präsidentschaftskandidat Nana Akufo-Addo in meinem Berliner Büro.  http://t.co/4ZiXoVcf;33043294;128604554764890113;2011-10-24 22:51:29+00:00;;de;False;0;0;0;0;everyone;Twitter Web Client;;;2022-05-28 15:30:22.423457
33043294;VolkmarKlein;126427487818354692;Festival of Lights: Die Menschenrechte der US-Unabhängigkeitserklärung östlich des Brandenburger Tores. weiterhin toll! http://t.co/4ZiXoVcf;33043294;126427487818354692;2011-10-18 22:40:36+00:00;;de;False;0;0;0;0;everyone;Twitter Web Client;;;2022-05-28 15:30:22.427495
33043294;VolkmarKlein;124982253502734336;Wittgensteiner Besuchergruppe in Berlin: Mehr auf: http://t.co/4ZiXoVcf;33043294;124982253502734336;2011-10-14 22:57:45+00:00;;de;False;0;0;0;0;everyone;Twitter Web Client;;;2022-05-28 15:30:22.431197
33043294;VolkmarKlein;123903867514667008;4 Tage Gespäche in Quito und Yasuni: Der Regenwald Ecuadors und sein Schutz ist wichtig auch für uns. Mehr auf: http://t.co/4ZiXoVcf;33043294;123903867514667008;2011-10-11 23:32:38+00:00;;de;False;0;0;0;0;everyone;Twitter Web Client;;;2022-05-28 15:30:22.434648
33043294;VolkmarKlein;120981712661528576;Deutschen Einheit und Ende der sozialistischen Diktatur: Die Begeisterung für das freie und gemeinsame Deutschland sollten wir uns bewahren.;33043294;120981712661528576;2011-10-03 22:01:02+00:00;;de;False;1;0;0;0;everyone;Twitter Web Client;;;2022-05-28 15:30:23.033081
33043294;VolkmarKlein;115175531372220416;Mein neues Infoblatt ist erschienen: http://t.co/wzEDfKHA Hauptthema: Staatsschuldenkrisen und Risiko für Deutschland;33043294;115175531372220416;2011-09-17 21:29:21+00:00;;de;False;0;0;0;0;everyone;Twitter Web Client;;;2022-05-28 15:30:23.037913
33043294;VolkmarKlein;114487672537489408;Linker Papstboykott? Verständlich, dessen Vorgänger hat ihnen ja ihre Zukunft vermasselt mit seinem Beitrag am Einsturz der linken Diktatur.;33043294;114487672537489408;2011-09-15 23:56:02+00:00;;de;False;0;0;0;0;everyone;Twitter Web Client;;;2022-05-28 15:30:23.041827
33043294;VolkmarKlein;111584043547639808;Die Eurobonds der SPD würden die Kommunen auch in Siegen-Wittgenstein ausbluten lassen:    http://t.co/0zDb5uX;33043294;111584043547639808;2011-09-07 23:38:03+00:00;;de;False;0;0;0;0;everyone;Twitter Web Client;;;2022-05-28 15:30:23.046062
33043294;VolkmarKlein;110482992249577472;300 Jahre Stünzel: Die 66 Einwohner dieses kleines Ortes hatten ein Fest mit vielen Tausend Gästen organisiert.;33043294;110482992249577472;2011-09-04 22:42:52+00:00;;de;False;0;0;0;0;everyone;Twitter Web Client;;;2022-05-28 15:30:23.050013
33043294;VolkmarKlein;109420897726758912;Eurobonds wären genauso unverantwortlich risikoreich für Deutschland wie einfach nur zuschauen bei der Schuldenkrise: http://t.co/0zDb5uX;33043294;109420897726758912;2011-09-02 00:22:29+00:00;;de;False;0;0;0;0;everyone;Twitter Web Client;;;2022-05-28 15:30:23.053738
33043294;VolkmarKlein;97808280587468800;www.volkmarklein.de;33043294;97808280587468800;2011-07-31 23:18:05+00:00;;de;False;0;0;0;0;everyone;LinkedIn;;;2022-05-28 15:30:23.059126
33043294;VolkmarKlein;90942973117861888;Viele positive Rückmeldungen zu meinem aktuellen Infoblatt, das vor 4 Wochen an 7000 Postadressen plus mails raus ist: http://t.co/9dcDem2;33043294;90942973117861888;2011-07-13 00:37:49+00:00;;de;False;0;0;0;0;everyone;Twitter Web Client;;;2022-05-28 15:30:23.063289
33043294;VolkmarKlein;90519421818380288;"Ich kann Abgeordneter bleiben! Das sagen die Wilnsdorfer Schüler: Den ""Einbürgerungstest"" beim Schulfest habe ich mit null Fehlern bestanden";33043294;90519421818380288;2011-07-11 20:34:46+00:00;;de;False;0;0;0;0;everyone;Twitter Web Client;;;2022-05-28 15:30:23.066906
33043294;VolkmarKlein;89267666103173120;Eindrucksvolles Treffen mit Vertretern der Orientalischen Kirchen! http://t.co/TQGlzY0;33043294;89267666103173120;2011-07-08 09:40:44+00:00;;de;False;0;0;0;0;everyone;Twitter Web Client;;;2022-05-28 15:30:23.071030
33043294;VolkmarKlein;88355614241206272;Wir brauchen den Ausbau der Ruhr-Sieg-Strecke. Darüber habe ich eben mit Bahn-Chef Grube gesprochen. http://t.co/TQGlzY0;33043294;88355614241206272;2011-07-05 21:16:34+00:00;;de;False;0;0;0;0;everyone;Twitter Web Client;;;2022-05-28 15:30:23.075565
33043294;VolkmarKlein;82223251832578048;75 Jahre Feuerwehr Gernsdorf: Das ganze Dorf war auf den Beinen und der Abgeordnete natürlich auch.;33043294;82223251832578048;2011-06-18 23:08:45+00:00;;de;False;0;0;0;0;everyone;Twitter Web Client;;;2022-05-28 15:30:23.079581
33043294;VolkmarKlein;81492242069602305;Gute CDU-Veranstaltung mit Physiker Prof. Grupen in Siegen: Grundlegende Infos über Energie: Atomausstieg, aber verläßliche Energie sichern;33043294;81492242069602305;2011-06-16 22:43:59+00:00;;de;False;0;0;0;0;everyone;Twitter Web Client;;;2022-05-28 15:30:23.083239
33043294;VolkmarKlein;80614228620349441;Mein neues Infoblatt ist erschienen: http://t.co/9aRiCi2;33043294;80614228620349441;2011-06-14 12:35:04+00:00;;de;False;0;0;0;0;everyone;Twitter Web Client;;;2022-05-28 15:30:23.087070
33043294;VolkmarKlein;77167754230247424;179. Stünzelfest: Landwirtschaft unserer Region leistet weiterhin wesentlichen Beitrag zum Erhalt unserer wunderschönen Landschaft.;33043294;77167754230247424;2011-06-05 00:20:00+00:00;;de;False;0;0;0;0;everyone;Twitter Web Client;;;2022-05-28 15:30:23.091404
33043294;VolkmarKlein;76450090885197824;Kirchentag in Dresden: Viele gute Begegnungen und Gespräche.;33043294;76450090885197824;2011-06-03 00:48:16+00:00;;de;False;0;0;0;0;everyone;Twitter Web Client;;;2022-05-28 15:30:23.095575
33043294;VolkmarKlein;75866632555204608;Bin auf dem Weg zum Kirchentag. Der gibt hoffentlich über Dresden hinaus geistliche Impulse, kann unsere Gesellschaft auch gut brauchen.;33043294;75866632555204608;2011-06-01 10:09:49+00:00;;de;False;0;0;0;0;everyone;Twitter Web Client;;;2022-05-28 15:30:23.099217
33043294;VolkmarKlein;73817782529179649;"Kinderlärm kein ""störender Umwelteinfluss"" mehr. Bundes-Immissionsschutz-Gesetz geändert, Beitrag zu mehr Kinderfreundlichkeit in Deutschl.";33043294;73817782529179649;2011-05-26 18:28:25+00:00;;de;False;0;0;0;0;everyone;Echofon;;;2022-05-28 15:30:23.102974
33043294;VolkmarKlein;73651297345212416;Eindrucksvolle Regierungserklärung von Angela Merkel: Internationale Verantwortung und deutsches Interesse sind kein Widerspruch.;33043294;73651297345212416;2011-05-26 07:26:52+00:00;;de;False;0;0;0;0;everyone;Echofon;;;2022-05-28 15:30:23.107190
33043294;VolkmarKlein;73074136020299776;http://www.volkmarklein.de/;33043294;73074136020299776;2011-05-24 17:13:26+00:00;;und;False;0;0;0;0;everyone;Twitter Web Client;;;2022-05-28 15:30:23.110851
33043294;VolkmarKlein;73073871787528192;Gemeindefinanzen und Infrastruktur: Das waren die Themen beim Besuch der CDU-Fraktionsvorsitzenden aus Siegen-Wittgenstein in Berlin.;33043294;73073871787528192;2011-05-24 17:12:23+00:00;;de;False;0;0;0;0;everyone;Twitter Web Client;;;2022-05-28 15:30:23.114724
33043294;VolkmarKlein;67718652274814976;40 Stunden Kosovo, mehr auf http://www.volkmarklein.de;33043294;67718652274814976;2011-05-09 22:32:39+00:00;;de;False;0;0;0;0;everyone;Twitter Web Client;;;2022-05-28 15:30:23.118860
33043294;VolkmarKlein;65350403583246336;Gestern abend Besuch bei Rumänienhilfe Neunkirchen. Praktizierte Nächstenliebe. http://tinyurl.com/6lbnqnc;33043294;65350403583246336;2011-05-03 09:42:05+00:00;;de;False;0;0;0;0;everyone;Twitter Web Client;;;2022-05-28 15:30:23.123198
33043294;VolkmarKlein;65192988715913216;Mitgliederversammlung von ERF-Medien e.V.: Faszinierend, wie Evangeliumsrundfunk noch weiter verbreitet werden kann. http://www.erf.de/;33043294;65192988715913216;2011-05-02 23:16:34+00:00;;de;False;0;0;0;0;everyone;Twitter Web Client;;;2022-05-28 15:30:23.126785
33043294;VolkmarKlein;63356562902753280;RT @JU_SIWI: Ob Hannelore #Kraft noch weiß, mit wem sie #NRW regiert? http://bit.ly/euQ7bz @JU_NRW;33043294;63356562902753280;2011-04-27 21:39:16+00:00;;de;False;1;0;0;0;everyone;Twitter Web Client;63278009095946240;retweeted;2022-05-28 15:30:23.130584
33043294;VolkmarKlein;63355778744066048;"Der neue ""Feuerwehrführereschein"" kommt gut an!    http://tinyurl.com/3gb48n9";33043294;63355778744066048;2011-04-27 21:36:09+00:00;;de;False;0;0;0;0;everyone;Twitter Web Client;;;2022-05-28 15:30:23.134012
33043294;VolkmarKlein;60850578217111552;Der Karfreitag muss stiller Feiertag bleiben. Anderslautende Ideen der Grünen sind oster- und menschen feindlich;33043294;60850578217111552;2011-04-20 23:41:23+00:00;;de;False;0;0;0;0;everyone;Twitter Web Client;;;2022-05-28 15:30:23.137829
33043294;VolkmarKlein;60850162892943360;Schwertransporte wichtig! http://www.facebook.com/notes/volkmar-klein/schwertransporte-m%C3%BCssen-weiter-m%C3%B6glich-sein/195700693800213;33043294;60850162892943360;2011-04-20 23:39:44+00:00;;de;False;0;0;0;0;everyone;Twitter Web Client;;;2022-05-28 15:30:23.141819
33043294;VolkmarKlein;58656231006543872;Übrigens: Unterstützer werden noch auf meiner facebook-Seite gebraucht!! http://www.facebook.com/pages/Volkmar-Klein/72709330562?ref=ts;33043294;58656231006543872;2011-04-14 22:21:49+00:00;;de;False;0;0;0;0;everyone;Twitter Web Client;;;2022-05-28 15:30:23.145801
33043294;VolkmarKlein;58655984373071873;PID würde Selektion von Leben bedeuten, mehr auf meiner Abgeordnetenseite. http://www.facebook.com/pages/Volkmar-Klein/72709330562?ref=ts;33043294;58655984373071873;2011-04-14 22:20:51+00:00;;de;False;0;0;0;0;everyone;Twitter Web Client;;;2022-05-28 15:30:23.149662
33043294;VolkmarKlein;54671293731192833;Abgeordnete bekommen doch viel anonymen E-Mail-Schrott:  http://tinyurl.com/3wrlkfc;33043294;54671293731192833;2011-04-03 22:27:06+00:00;;de;False;0;0;0;0;everyone;Twitter Web Client;;;2022-05-28 15:30:23.153365
33043294;VolkmarKlein;54215877528272897;Vielen Dank!!! Meine CDU-Siegen-Wittgenstein hat mich heute in Siegen mit 96,5% Ja-Stimmen zum Kreisvorsitzenden wiedergewählt.;33043294;54215877528272897;2011-04-02 16:17:27+00:00;;de;False;1;0;0;0;everyone;Twitter Web Client;;;2022-05-28 15:30:23.157540
33043294;VolkmarKlein;53584747955359744;Heute beim ersten Spatenstich Erweiterung Verbindungstechnikfirma Osterrath in Bad Laasphe: http://www.osterrath.de/;33043294;53584747955359744;2011-03-31 22:29:34+00:00;;de;False;0;0;0;0;everyone;Twitter Web Client;;;2022-05-28 15:30:23.161202
33043294;VolkmarKlein;51664250816577537;Aktion Saubere Landschaft erfolgreich, aber traurig: Zu viele unliebsam verantwortungslose Leute werfen Müll weg. http://tinyurl.com/4hbxbhw;33043294;51664250816577537;2011-03-26 15:18:11+00:00;;de;False;0;0;0;0;everyone;Twitter Web Client;;;2022-05-28 15:30:23.164894
33043294;VolkmarKlein;50719148115894272;Deutsche Entscheidung gegen Militäreinsatz in Libyen richtig. Mehr auf http://www.volkmarklein.de;33043294;50719148115894272;2011-03-24 00:42:41+00:00;;de;False;0;0;0;0;everyone;Twitter Web Client;;;2022-05-28 15:30:23.168630
33043294;VolkmarKlein;46238168520998912;Mein neues Infoblatt ist erschienen: http://tinyurl.com/45zaq76;33043294;46238168520998912;2011-03-11 15:56:53+00:00;;de;False;0;0;0;0;everyone;Twitter Web Client;;;2022-05-28 15:30:23.173115
33043294;VolkmarKlein;41129459184701440;Kinder und Kommunen Gewinner des Hartz IV Kompromisses. http://tinyurl.com/5rh4obc;33043294;41129459184701440;2011-02-25 13:36:41+00:00;;de;False;0;0;0;0;everyone;Twitter Web Client;;;2022-05-28 15:30:23.176808
33043294;VolkmarKlein;40758326195126272;RT @walli5: das ist der unterschied: man moechte von lauterbach nie operiert und von zu guttenberg gerne regiert werden #annewill #gutte ...;33043294;40758326195126272;2011-02-24 13:01:56+00:00;;de;False;1;0;0;0;everyone;Echofon;39441920946208768;retweeted;2022-05-28 15:30:23.180589
33043294;VolkmarKlein;40198870273101824;"Kinderlärm wird künftig kein ""schädlicher Umwelteinfluss"" mehr sein. Die Koalition wird das Bundes-Immissionsschutzgesetz ändern.";33043294;40198870273101824;2011-02-22 23:58:52+00:00;;de;False;0;0;0;0;everyone;Twitter Web Client;;;2022-05-28 15:30:23.184113
33043294;VolkmarKlein;38589347108360192;Besichtigung der HTS-Baustelle: Der Bau kommt voran, die Entlastung der Anwohner der heute völlig überlasteten innerörtlichen Straße naht.;33043294;38589347108360192;2011-02-18 13:23:11+00:00;;de;False;0;0;0;0;everyone;Twitter Web Client;;;2022-05-28 15:30:23.187691
33043294;VolkmarKlein;32229026332413952;Bundesverkehrsministerium gibt grünes Licht für neue Autobahnausfahrt! Gute Nachricht für Siegen-Wittgenstein! http://tinyurl.com/5tzqecx;33043294;32229026332413952;2011-02-01 00:09:33+00:00;;de;False;0;0;0;0;everyone;Twitter Web Client;;;2022-05-28 15:30:23.191890
33043294;VolkmarKlein;30563148968763392;Würdige Gedenkstunde für die Opfer des Nationalsozialismus im Bundestag. Das heißt auch: Konsequent gegen Disktaturen eintreten.;33043294;30563148968763392;2011-01-27 09:49:57+00:00;;de;False;0;0;0;0;everyone;Twitter Web Client;;;2022-05-28 15:30:23.195734
33043294;VolkmarKlein;28612616364490752;"RT @cdu_news: CDU-Generalsekretär Hermann Gröhe zur ""Kommunismus-Sehnsucht der Linkspartei-Chefin Lötzsch"": http://bit.ly/fDjDr7";33043294;28612616364490752;2011-01-22 00:39:13+00:00;;de;False;1;0;0;0;everyone;Twitter Web Client;28438907435618304;retweeted;2022-05-28 15:30:23.199218
33043294;VolkmarKlein;28612378182553600;http://www.germanna.org/node/447;33043294;28612378182553600;2011-01-22 00:38:17+00:00;;und;False;0;0;0;0;everyone;Twitter Web Client;;;2022-05-28 15:30:23.202832
33043294;VolkmarKlein;28231231585914880;Jobwunder Deutschland schreiben die Zeitungen im Ausland. Mit 3,6% Wachstum 2010 sind wir deutlich besser aus der Krise gekommen als andere!;33043294;28231231585914880;2011-01-20 23:23:44+00:00;;de;False;0;0;0;0;everyone;Twitter Web Client;;;2022-05-28 15:30:23.207175
33043294;VolkmarKlein;25295411224776704;"Selbstverteidigung: War heute als Schirmherr zu Besuch im Mehrgenerationenhaus beim Kurs ""Senioren wehren sich"" http://www.volkmarklein.de";33043294;25295411224776704;2011-01-12 20:57:50+00:00;;de;False;0;0;0;0;everyone;Twitter Web Client;;;2022-05-28 15:30:23.210602
33043294;VolkmarKlein;24595375545384960;http://www.volkmarklein.de/index.php?option=com_content&view=article&id=1068:1012011-weckenmannaktion&catid=56:blog&Itemid=112;33043294;24595375545384960;2011-01-10 22:36:09+00:00;;und;False;0;0;0;0;everyone;Twitter Web Client;;;2022-05-28 15:30:23.214397
33043294;VolkmarKlein;24249611300380672;Brieftauben sind faszinierende Tiere. War heute Schirmherr des  Regionalverbandstags Sieg-Lahn-Dill der Brieftaubenzüchter;33043294;24249611300380672;2011-01-09 23:42:12+00:00;;de;False;0;0;0;0;everyone;Twitter Web Client;;;2022-05-28 15:30:23.217890
33043294;VolkmarKlein;22786807619911680;Mit der neuen Schuldenwelle gegen jeden Vernunft schadet die (rot)-grüne-rote Landesregierung nicht nur NRW, sondern ganz Deutschland.;33043294;22786807619911680;2011-01-05 22:49:32+00:00;;de;False;0;0;0;0;everyone;Twitter Web Client;;;2022-05-28 15:30:23.221720
33043294;VolkmarKlein;22054631928504321;Besuch in Burbachs tschechischer Partnerstadt Tanvald und zwei Tage Skifahren gleich nebenan in Harrachov: Absolut toller Schnee!!!;33043294;22054631928504321;2011-01-03 22:20:08+00:00;;de;False;0;0;0;0;everyone;Twitter Web Client;;;2022-05-28 15:30:23.225460
33043294;VolkmarKlein;20536159046205440;Für Deutschland war 2010 wirklich erfolgreich: Krise deutlich besser gemeistert als andere. Die Regierung muss gute Arbeit 2011 fortsetzen.;33043294;20536159046205440;2010-12-30 17:46:16+00:00;;de;False;0;0;0;0;everyone;Twitter Web Client;;;2022-05-28 15:30:23.229246
33043294;VolkmarKlein;17765750026534912;Tolle Weihnachtsgeschichte, ganz anders: http://www.youtube.com/watch?v=vZrf0PbAGSk;33043294;17765750026534912;2010-12-23 02:17:39+00:00;;de;False;0;0;0;0;everyone;Twitter Web Client;;;2022-05-28 15:30:23.232867
33043294;VolkmarKlein;16636931060273152;http://www.facebook.com/home.php?#!/pages/Volkmar-Klein/72709330562;33043294;16636931060273152;2010-12-19 23:32:08+00:00;;und;False;0;0;0;0;everyone;Twitter Web Client;;;2022-05-28 15:30:23.236553
33043294;VolkmarKlein;15735873488293888;Meine Abgeordnetenseite auf facebook: http://www.facebook.com/home.php?#!/pages/Volkmar-Klein/72709330562;33043294;15735873488293888;2010-12-17 11:51:39+00:00;;de;False;0;0;0;0;everyone;Twitter Web Client;;;2022-05-28 15:30:23.240718
33043294;VolkmarKlein;15537372154306560;gute Resonanz auf: http://www.volkmarklein.de/images/stories/artikel/infosausberlin/info%20aus%20berlin%204%20volkmar%20klein.pdf;33043294;15537372154306560;2010-12-16 22:42:52+00:00;;de;False;0;0;0;0;everyone;Twitter Web Client;;;2022-05-28 15:30:23.244471
33043294;VolkmarKlein;11569640215941121;Mein neues Infoblatt: http://www.volkmarklein.de/images/stories/artikel/infosausberlin/info%20aus%20berlin%204%20volkmar%20klein.pdf;33043294;11569640215941121;2010-12-05 23:56:31+00:00;;de;False;0;0;0;0;everyone;Twitter Web Client;;;2022-05-28 15:30:23.248341
33043294;VolkmarKlein;24796400228;Meine Rede in der Haushaltsdebatte im Deutschen Bundestag: http://www.facebook.com/home.php?#!/pages/Volkmar-Klein/72709330562?ref=ts;33043294;24796400228;2010-09-17 22:20:12+00:00;;de;False;0;0;0;0;everyone;Twitter Web Client;;;2022-05-28 15:30:23.251995
33043294;VolkmarKlein;24796239378;Das Verbot der Komplett-Vermummung in Frankreich ist richtig. Burka bedeutet Unfreiheit:  http://www.volkmarklein.de/;33043294;24796239378;2010-09-17 22:17:41+00:00;;de;False;0;0;0;0;everyone;Twitter Web Client;;;2022-05-28 15:30:23.256264
33043294;VolkmarKlein;22565512661;Mein neues Infoblatt ist erschienen: http://www.volkmarklein.de/images/stories/artikel/infosausberlin/info%20aus%20berlin%203.pdf;33043294;22565512661;2010-08-30 23:23:44+00:00;;de;False;0;0;0;0;everyone;Twitter Web Client;;;2022-05-28 15:30:23.259951
33043294;VolkmarKlein;22256572736;Die Hysterie bei Street View verstehe ich nicht. http://www.facebook.com/pages/Volkmar-Klein/72709330562?ref=ts;33043294;22256572736;2010-08-27 10:40:55+00:00;;de;False;0;0;0;0;everyone;Twitter Web Client;;;2022-05-28 15:30:23.263897
33043294;VolkmarKlein;20584029781;Krafttraining bei der Gartenarbeit (Andere zahlen im Fitnessstudio Geld), und dann dort gemütlich Grillen und ein Bier trinken: Urlaub;33043294;20584029781;2010-08-07 23:07:23+00:00;;de;False;0;0;0;0;everyone;Twitter Web Client;;;2022-05-28 15:30:23.267396
33043294;VolkmarKlein;20176797272;Gespräch mit dem Landwirtschaftlichen Kreisverband: Den Milchbauern geht es wieder etwas besser. Wichtig auch zur Pflege der Landschaft.;33043294;20176797272;2010-08-02 23:38:55+00:00;;de;False;0;0;0;0;everyone;Twitter Web Client;;;2022-05-28 15:30:23.271379
33043294;VolkmarKlein;19600924344;Viel mehr gibts unter:   http://www.facebook.com/pages/Volkmar-Klein/72709330562?ref=search         und   www.volkmarklein.de;33043294;19600924344;2010-07-26 20:43:53+00:00;;de;False;0;0;0;0;everyone;Twitter Web Client;;;2022-05-28 15:30:23.275240
33043294;VolkmarKlein;18536359073;"""Minderheitsregierung"" in NRW? Tatsächlich ist rot/grün angewiesen auf die Tolerierung durch die Kommunisten. Das wirft unser Land zurücK.";33043294;18536359073;2010-07-14 17:37:53+00:00;;de;False;0;0;0;0;everyone;Twitter Web Client;;;2022-05-28 15:30:23.279175
33043294;VolkmarKlein;18304352410;Ein richtiges heißes Wochenende im Wahlkreis. Und dann viele Termine: Gillersportfest, 100 Jahre Feuerwehr Dreis-Tiefenbach, AWO-Sommerdfest;33043294;18304352410;2010-07-11 21:26:22+00:00;;de;False;0;0;0;0;everyone;Twitter Web Client;;;2022-05-28 15:30:23.282809
33043294;VolkmarKlein;17745767757;4. Juli: Herzlichen Glückwunsch Amerika zum Independence Day.;33043294;17745767757;2010-07-04 21:41:11+00:00;;de;False;0;0;0;0;everyone;Twitter Web Client;;;2022-05-28 15:30:23.286457
33043294;VolkmarKlein;17524449654;Die Kreistagsfraktion aus der Heimat hier in Berlin. Heute Abend waren wir bei den Freunden der Partnerstadt Berlin-Spandau.;33043294;17524449654;2010-07-01 22:19:45+00:00;;de;False;0;0;0;0;everyone;Twitter Web Client;;;2022-05-28 15:30:23.290788
33043294;VolkmarKlein;17436293145;Jetzt ist Christian Wulf doch noch mit deutlicher Mehrheit gewaehlt: 625:495 Stimmen!! Er wird ein guter Präsident sein.;33043294;17436293145;2010-06-30 19:24:47+00:00;;de;False;0;0;0;0;everyone;Echofon;;;2022-05-28 15:30:23.294509
33043294;VolkmarKlein;16170391891;Die NRW Wähler haben die große Koalition gewählt. Ich fands zwar nicht gut. Aber jetzt macht die SPD auf Verantwortungsverweigerung.;33043294;16170391891;2010-06-14 19:22:18+00:00;;de;False;0;0;0;0;everyone;Echofon;;;2022-05-28 15:30:23.298930
