twitter_id;twitter_handle;tweet_id;tweet_text;tweet_author_id;tweet_conversation_id;tweet_created_at;tweet_in_reply_to_user_id;tweet_lang;tweet_possibly_sensitive;tweet_retweet_count;tweet_reply_count;tweet_like_count;tweet_quote_count;tweet_reply_settings;tweet_source;tweet_referenced_tweet_id;tweet_referenced_tweet_type;api_call
1411676203224870912;goerke_c;1527904947349733376;"""Chris­ti­an Gör­ke erin­ner­te in der Debat­te dar­an, dass in Deutsch­land vier Mil­lio­nen Men­schen in Alters­ar­mut leben, wäh­rend die Ener­gie­kon­zer­ne auch auf ihre Kos­ten rie­si­ge Gewin­ne ein­fah­ren.""

https://t.co/XF2nQb27sy";1411676203224870912;1527904947349733376;2022-05-21 06:51:41+00:00;;de;False;7;0;21;0;everyone;Twitter Web App;;;2022-05-28 18:01:37.295557
1411676203224870912;goerke_c;1527904348713492483;RT @ndaktuell: Die #Linke hat am Freitag im Bundestag eine #Übergewinnsteuer für Energie- und Ölkonzerne gefordert, die von #Inflation und…;1411676203224870912;1527904348713492483;2022-05-21 06:49:18+00:00;;de;False;4;0;0;0;everyone;Twitter Web App;1527681234901643269;retweeted;2022-05-28 18:01:37.297884
1411676203224870912;goerke_c;1527638977729253377;"RT @phoenix_de: #ÜbergewinnSteuer | ""Beenden Sie diese Abzocke"", fordert @chr_goerke @linksfraktion von #SPD &amp; #Grünen und wirbt dafür, #Üb…";1411676203224870912;1527638977729253377;2022-05-20 13:14:49+00:00;;de;False;7;0;0;0;everyone;Twitter Web App;1527634617443942400;retweeted;2022-05-28 18:01:37.304859
1411676203224870912;goerke_c;1527622355480084480;RT @Linksfraktion: .@goerke_c: Mondpreise an Tankstellen, fette Nachzahlungen bei Strom - hohe #Energiepreise bescheren Konzernen Gewinnexp…;1411676203224870912;1527622355480084480;2022-05-20 12:08:46+00:00;;de;False;8;0;0;0;everyone;Twitter Web App;1527621993352372224;retweeted;2022-05-28 18:01:37.310203
1411676203224870912;goerke_c;1527288648558710785;"RT @Linksfraktion: ""Steuernachzahlung für Kurzarbeiter verhindern! 

Die steuerfreien Zuschüsse zum #Kurzarbeitergeld sollten vom Progressi…";1411676203224870912;1527288648558710785;2022-05-19 14:02:44+00:00;;de;False;5;0;0;0;everyone;Twitter Web App;1527260465843388416;retweeted;2022-05-28 18:01:37.314208
1411676203224870912;goerke_c;1526171266302070786;RT @BIDeutschland: Die Linke fordert, eine Steuer auf Übergewinne der Energiekonzerne in der Ukraine-Krise einzuführen. Die Ampel ist bei d…;1411676203224870912;1526171266302070786;2022-05-16 12:02:39+00:00;;de;False;13;0;0;0;everyone;Twitter Web App;1526141776985202691;retweeted;2022-05-28 18:01:37.319076
1411676203224870912;goerke_c;1526157242982080514;"Italien hat die Übergewinnsteuer für Energiekonzerne vorgemacht. Jetzt beantragt die @Linksfraktion eine Ausgestaltung nach italienischem Vorbild. Die Grünen können zeigen, ob sie nur wolkige Pressekonferenzen halten oder Ernst machen. 

https://t.co/FHvln2z1lu";1411676203224870912;1526157242982080514;2022-05-16 11:06:56+00:00;;de;False;36;5;144;1;everyone;Twitter Web App;;;2022-05-28 18:01:37.324504
1411676203224870912;goerke_c;1525119837806247936;RT @Linksfraktion: Hohe #Spritpreise belasten alle, die auf ihr Auto angewiesen sind. Mobilität darf kein Luxusgut werden. Die #Ampel sprin…;1411676203224870912;1525119837806247936;2022-05-13 14:24:39+00:00;;de;False;6;0;0;0;everyone;Twitter Web App;1525115797173112832;retweeted;2022-05-28 18:01:37.328563
1411676203224870912;goerke_c;1525013806358970369;Zum ganzen Beitrag: https://t.co/DwOyPOrL5Z;1411676203224870912;1525013737945669633;2022-05-13 07:23:19+00:00;1411676203224870912;de;False;2;0;2;1;everyone;Twitter Web App;1525013737945669633;replied_to;2022-05-28 18:01:37.332489
1411676203224870912;goerke_c;1525013737945669633;Statt Rekordeinnahmen bei der Mehrwertsteuer wären Rekordentlastungen für die Verbraucher das Gebot der Stunde. Geld ist offensichtlich genug da! Ich fordere die Ampel auf, die Entlastungspakete dringend aufzustocken. https://t.co/VXkdaykiBu;1411676203224870912;1525013737945669633;2022-05-13 07:23:03+00:00;;de;False;5;2;25;1;everyone;Twitter Web App;;;2022-05-28 18:01:37.338116
1411676203224870912;goerke_c;1524319275674222594;Gleichzeitig sollten die Energiekonzerne, bei denen die Krise für sprudelnde Gewinne sorgt, mit einer Übergewinnsteuer in die Pflicht genommen werden. Sprudelnde Krisengewinne für die einen und leere Kühlschränke bei den anderen sind in diesem reichen Land nicht zu akzeptieren!;1411676203224870912;1524319268610920448;2022-05-11 09:23:30+00:00;1411676203224870912;de;False;2;0;4;0;everyone;Twitter Web App;1524319273958715394;replied_to;2022-05-28 18:01:37.343390
1411676203224870912;goerke_c;1524319273958715394;Außerdem sollte die Energiesteuer auf Kraftstoffe länger als nur 3 Monate gesenkt werden. Es braucht echte Entlastungen, keine Wunderkerzen, die schnell abfackeln.;1411676203224870912;1524319268610920448;2022-05-11 09:23:30+00:00;1411676203224870912;de;False;2;1;4;0;everyone;Twitter Web App;1524319272096440326;replied_to;2022-05-28 18:01:37.347493
1411676203224870912;goerke_c;1524319272096440326;Dafür muss die Ampel nachschärfen und die Energiepreispauschale auf mindestens 1.000 Euro ausweiten und an alle Haushalte auszahlen, um auch die Rentner, die Studenten und die Minijobber ins Boot zu holen.;1411676203224870912;1524319268610920448;2022-05-11 09:23:29+00:00;1411676203224870912;de;False;2;1;4;0;everyone;Twitter Web App;1524319270406082561;replied_to;2022-05-28 18:01:37.352806
1411676203224870912;goerke_c;1524319270406082561;Außerdem gibt es große Leerstellen: Die Rentner, die Studenten und die Minijobber haben Lindner, Scholz und Habeck scheinbar völlig vergessen. Der Alltag muss für alle bezahlbar bleiben.;1411676203224870912;1524319268610920448;2022-05-11 09:23:29+00:00;1411676203224870912;de;False;3;1;3;0;everyone;Twitter Web App;1524319268610920448;replied_to;2022-05-28 18:01:37.358238
1411676203224870912;goerke_c;1524319268610920448;Die Teuerungswelle ist längst auch in den Supermarktregalen angekommen. Die Inflation entwertet die Maloche der Beschäftigten und die Verdienste der Rentnerinnen und Rentner. Die Ampelpakete bringen zu spät zu wenig Entlastung.;1411676203224870912;1524319268610920448;2022-05-11 09:23:28+00:00;;de;False;11;3;38;0;everyone;Twitter Web App;;;2022-05-28 18:01:37.362502
1411676203224870912;goerke_c;1523984840588247041;"RT @DietmarBartsch: Während auf Millionen Menschen &amp; Unternehmen immer höhere #Energiepreise lasten, machen Mineralölkonzerne obszöne Profi…";1411676203224870912;1523984840588247041;2022-05-10 11:14:34+00:00;;de;False;113;0;0;0;everyone;Twitter Web App;1523975828861816835;retweeted;2022-05-28 18:01:37.367231
1411676203224870912;goerke_c;1521474267359158273;Das wäre nur konsequent! Wir finden, dass alle Großkonzerne besteuert werden sollten, die außerordentliche Gewinne in Krisen machen - von Amazon über Shell bis zu Rheinmetall. Wir haben das schon letzten Sommer im Bundestag eingebracht, da haben sich die Grünen noch enthalten!;1411676203224870912;1521474260421730306;2022-05-03 12:58:27+00:00;1411676203224870912;de;False;3;1;21;0;everyone;Twitter Web App;1521474264972636165;replied_to;2022-05-28 18:01:37.372555
1411676203224870912;goerke_c;1521474264972636165;Während Minister Habeck die Steuer lediglich auf Krisengewinne von Energieunternehmen beschränkte, schlug Grünen-Chefin Ricarda Lang eine Steuer für alle kriegsbedingte Übergewinne vor.;1411676203224870912;1521474260421730306;2022-05-03 12:58:27+00:00;1411676203224870912;de;False;1;1;20;0;everyone;Twitter Web App;1521474262707621891;replied_to;2022-05-28 18:01:37.379151
1411676203224870912;goerke_c;1521474262707621891;Während die Grünen unterschiedliche Vorschläge machen und Olaf Scholz bei der Kanzlerbefragung abblockte, schafft Draghi Tatsachen. Die angebliche Fortschrittskoalition wird vom konservativ geführten Italien in den Schatten gestellt.;1411676203224870912;1521474260421730306;2022-05-03 12:58:26+00:00;1411676203224870912;de;False;1;1;19;0;everyone;Twitter Web App;1521474260421730306;replied_to;2022-05-28 18:01:37.383118
1411676203224870912;goerke_c;1521474260421730306;Italien macht es vor: Draghi erhöht die geplante Übergewinnsteuer auf Krisengewinne von Energieunternehmen von zehn auf 25 Prozent.;1411676203224870912;1521474260421730306;2022-05-03 12:58:25+00:00;;de;False;48;9;299;1;everyone;Twitter Web App;;;2022-05-28 18:01:37.389201
1411676203224870912;goerke_c;1521032729051254784;@xfsalomonx @Linksfraktion @BusinessInsider Das zu versteuernde Einkommen wird um 660€ reduziert. Gutverdiener hätten darauf sonst 42% Steuern gezahlt, Geringverdiener deutlich weniger.  Wer Teilzeit arbeitet und im Jahr nur 9T€ verdient, zahlt ja gar keine Einkommensteuer und kann die Pendlerpauschale gar nicht nutzen.;1411676203224870912;1519951435953233920;2022-05-02 07:43:56+00:00;1464952315878817803;de;False;1;0;0;0;everyone;Twitter for iPhone;1520049387107504129;replied_to;2022-05-28 18:01:37.393602
1411676203224870912;goerke_c;1520037543571599366;@xfsalomonx @Linksfraktion @BusinessInsider Die Pendlerpauschale reduziert die Steuerlast. Wer viel verdient und viele Steuern zahlt, bekommt durch die Pauschale mehr zurück als derjenige, der so wenig verdient, dass kaum Steuern gezahlt werden.;1411676203224870912;1519951435953233920;2022-04-29 13:49:25+00:00;1464952315878817803;de;False;1;1;0;1;everyone;Twitter for iPhone;1519979467095121920;replied_to;2022-05-28 18:01:37.397677
1411676203224870912;goerke_c;1519951435953233920;"Die Pendlerpauschale hat einen Konstruktionsfehler. Besserverdiener werden bevorteilt. @BusinessInsider berichtet über meine Anfrage und unseren Vorschlag für ein Mobilitätsgeld, das Pendler unabhängig vom Einkommen entlastet.

https://t.co/L7dsUPobcs";1411676203224870912;1519951435953233920;2022-04-29 08:07:16+00:00;;de;False;5;2;10;0;everyone;Twitter Web App;;;2022-05-28 18:01:37.402489
1411676203224870912;goerke_c;1519651081734795264;Damit der Alltag für alle bezahlbar bleibt, muss die drohende Teuerungswelle in den Supermärkten gestoppt werden. Dafür müssen alle Optionen auf den Tisch.;1411676203224870912;1519651078664507393;2022-04-28 12:13:46+00:00;1411676203224870912;de;False;1;1;5;0;everyone;Twitter for iPhone;1519651080254197761;replied_to;2022-05-28 18:01:37.407486
1411676203224870912;goerke_c;1519651080254197761;Ein unsäglicher Zustand für so ein reiches Land wie Deutschland. Die Entlastungspakete der Ampel haben zu viele Leerstellen. Zu wenig zu spät ist das Motto. Die Ampel muss nachsitzen und die Pakete schnell aufstocken.;1411676203224870912;1519651078664507393;2022-04-28 12:13:45+00:00;1411676203224870912;de;False;2;1;7;0;everyone;Twitter for iPhone;1519651078664507393;replied_to;2022-05-28 18:01:37.412254
1411676203224870912;goerke_c;1519651078664507393;Teure Energie treibt die Preise. Löhne und Renten verlieren längst nicht mehr nur noch an der Zapfsäule an Wert, sondern zunehmend auch im Supermarkt. Teure Energie heißt teure Lebensmittel und damit für Millionen Menschen leider auch leere Geldbeutel und leere Kühlschränke. https://t.co/4uK486uZao;1411676203224870912;1519651078664507393;2022-04-28 12:13:45+00:00;;de;False;6;2;22;1;everyone;Twitter for iPhone;1519649355359264768;quoted;2022-05-28 18:01:37.416425
1411676203224870912;goerke_c;1519643329755029510;"RT @Linksfraktion: ""Statt der Interessen von Megakonzernen mit hunderten Mitarbeitern in der Steuerabteilung sollten die Interessen der vie…";1411676203224870912;1519643329755029510;2022-04-28 11:42:58+00:00;;de;False;4;0;0;0;everyone;Twitter Web App;1519372817527103491;retweeted;2022-05-28 18:01:37.422142
1411676203224870912;goerke_c;1519612137399857153;@lisapaus Herzlichen Glückwunsch, Frau Ministerin! Viel Erfolg und Duchhaltevermögen🙋‍♂️;1411676203224870912;1519285625958109184;2022-04-28 09:39:01+00:00;569166756;de;False;1;0;0;0;everyone;Twitter for iPhone;1519285625958109184;replied_to;2022-05-28 18:01:37.427530
1411676203224870912;goerke_c;1517149582936788993;Die Zeit berichtet über meine Anfrage: https://t.co/P6by063xpA;1411676203224870912;1517147653355700230;2022-04-21 14:33:42+00:00;1411676203224870912;de;False;1;0;4;0;everyone;Twitter for iPhone;1517147653355700230;replied_to;2022-05-28 18:01:37.431981
1411676203224870912;goerke_c;1517147653355700230;"Meine Anfrage ergibt:
Rückgang der stationären Einrichtung der #post in Brandenburg seit 2017 um mehr als 5%. #Uckermark sogar 19%. Die Post muss ihren Auftrag erfüllen und nicht Profite erzielen! https://t.co/3oAFXn8vwY";1411676203224870912;1517147653355700230;2022-04-21 14:26:02+00:00;;de;False;7;5;43;0;everyone;Twitter for iPhone;;;2022-05-28 18:01:37.437695
1411676203224870912;goerke_c;1517093403611512833;Es ist den Menschen, die den Laden hier am Laufen halten, nicht mehr zu vermitteln, dass mittelständische Betriebe deutlich höhere Steuern zahlen als dieser Megakonzern! Amazon muss endlich zur Kasse gezogen werden!;1411676203224870912;1517093394178359296;2022-04-21 10:50:28+00:00;1411676203224870912;de;False;1;2;20;0;everyone;Twitter Web App;1517093400968839168;replied_to;2022-05-28 18:01:37.442803
1411676203224870912;goerke_c;1517093400968839168;Solch eine Steuer hat selbst die EU-Kommission vorgeschlagen und eine Übergewinsnteuer, die auch Amazon träfe wurde vom Internationalen Währungsfonds gefordert.;1411676203224870912;1517093394178359296;2022-04-21 10:50:27+00:00;1411676203224870912;de;False;1;1;16;0;everyone;Twitter Web App;1517093399186268165;replied_to;2022-05-28 18:01:37.446824
1411676203224870912;goerke_c;1517093399186268165;Selbst eine Übergewinnsteuer auf die explodierenden Gewinne von Mineralölkonzernen lehnt Scholz in seiner Antwort auf meine Frage in der Regierungsbefragung ab.;1411676203224870912;1517093394178359296;2022-04-21 10:50:27+00:00;1411676203224870912;de;False;1;1;13;0;everyone;Twitter Web App;1517093397571543040;replied_to;2022-05-28 18:01:37.451206
1411676203224870912;goerke_c;1517093397571543040;Um die Marktmacht der Krisengewinner zu bremsen, müssen übermäßige Krisenprofite, die es ohne Corona nicht gegeben hätte, mit einer Übergewinnsteuer abgeschöpft werden.;1411676203224870912;1517093394178359296;2022-04-21 10:50:26+00:00;1411676203224870912;de;False;1;1;15;0;everyone;Twitter Web App;1517093396040630272;replied_to;2022-05-28 18:01:37.457639
1411676203224870912;goerke_c;1517093396040630272;Der Trick: Gewinne verschieben und in der EU Verluste melden. Auch hat auch Corona hat die Wettbewerbssituation zu Gunsten von Amazon nachhaltig verzerrt.;1411676203224870912;1517093394178359296;2022-04-21 10:50:26+00:00;1411676203224870912;de;False;1;2;16;0;everyone;Twitter Web App;1517093394178359296;replied_to;2022-05-28 18:01:37.461667
1411676203224870912;goerke_c;1517093394178359296;"Amazon hat trotz 55 Milliarden Dollar Umsatz in der EU 2021 keine Steuern gezahlt. Es ist noch verrückter: Sie haben sogar eine Milliarden Euro Steuererstattung bekommen. Das ist hochproblematisch, da Amazon so immer mächtiger wird!

https://t.co/xtZx0vTbTf";1411676203224870912;1517093394178359296;2022-04-21 10:50:26+00:00;;de;False;39;12;180;6;everyone;Twitter Web App;;;2022-05-28 18:01:37.465766
1411676203224870912;goerke_c;1514148782971269122;"Meine Anfrage deckt auf: „Dass nur rund 150 Anträge zur Besteuerung nach dem Optionsmodell eingegangen sind, zeigt: Die Reform war ein Steuergeschenk für einige Großunternehmen“, sagt Linkspartei-Finanzpolitiker Görke. 
https://t.co/ZC9GdNcvDS";1411676203224870912;1514148782971269122;2022-04-13 07:49:36+00:00;;de;False;10;1;35;1;everyone;Twitter Web App;;;2022-05-28 18:01:37.471135
1411676203224870912;goerke_c;1514148572215848961;RT @DEZi_Brb: Heute nahmen @goerke_c und ich in den Havelland Kliniken von Geschäftsführer, Herrn Grigoleit, dringend benötigte Medikamente…;1411676203224870912;1514148572215848961;2022-04-13 07:48:45+00:00;;de;False;6;0;0;0;everyone;Twitter Web App;1513575177652682756;retweeted;2022-05-28 18:01:37.478155
1411676203224870912;goerke_c;1512350920490770434;RT @phoenix_de: #Bundestag: phoenix-Korrespondent @ErhardScherfer im #bundestagsgespräch mit @HerbrandMarkus (FDP, Finanzpolitischer Sprech…;1411676203224870912;1512350920490770434;2022-04-08 08:45:32+00:00;;de;False;5;0;0;0;everyone;Twitter for iPhone;1512320775134621696;retweeted;2022-05-28 18:01:37.485811
1411676203224870912;goerke_c;1512123440462970887;"Wer während der Corona-Krise in Kurzarbeit musste, hat ohnehin schon schmerzhafte Einkommenseinbußen hinnehmen müssen. Für viele könnten aber obendrauf noch Steuernachzahlungen drohen. Das wollen wir verhindern!

Meine Rede im Bundestag:
https://t.co/qs039GXw6O";1411676203224870912;1512123440462970887;2022-04-07 17:41:36+00:00;;de;False;3;1;18;1;everyone;Twitter Web App;;;2022-05-28 18:01:37.493081
1411676203224870912;goerke_c;1511703032660176900;Die zweite Antwort von Scholz gibt es auf YouTube: https://t.co/R6xB5tj1mF;1411676203224870912;1511702895133089795;2022-04-06 13:51:03+00:00;1411676203224870912;de;False;1;0;3;0;everyone;Twitter Web App;1511702895133089795;replied_to;2022-05-28 18:01:37.497993
1411676203224870912;goerke_c;1511702895133089795;"Egal ob Scholz, Lindner oder Habeck: Alle drei Antworten nicht auf meine Fragen zur Übergewinnsteuer. 

Offensichtlich plant die Ampel hier gar nichts! Obwohl selbst konservative Politiker wie Mario Draghi eine solche Steuer planen - und zwar mit Milliardenaufkommen! https://t.co/16h4BsgDrt";1411676203224870912;1511702895133089795;2022-04-06 13:50:30+00:00;;de;False;2;1;13;1;everyone;Twitter Web App;;;2022-05-28 18:01:37.505302
1411676203224870912;goerke_c;1511656234021277697;Bei den Finanzsanktionen gegen Putins Oligarchen sollte zeitnah nachgeschärft werden. Dafür müssen endlich auch konsequent Steuerschlupflöcher geschlossen und Steueroasen ausgetrocknet werden. Die ziehen das Vermögen der Oligarchen nämlich an wie das Licht die Mücken.;1411676203224870912;1511656228858089478;2022-04-06 10:45:06+00:00;1411676203224870912;de;False;1;0;6;0;everyone;Twitter Web App;1511656232590917638;replied_to;2022-05-28 18:01:37.511864
1411676203224870912;goerke_c;1511656232590917638;Durch den zwischenzeitlich Kursverfall des Rubels, die Delle an den Aktienmärkten und die übrigen Finanzsanktionen haben allein die sechs reichsten russischen Oligarchen mehr als 60 Milliarden US-Dollar Vermögen verloren. Steinreich und mächtig sind sie aber immer noch.;1411676203224870912;1511656228858089478;2022-04-06 10:45:05+00:00;1411676203224870912;de;False;1;1;7;0;everyone;Twitter Web App;1511656231047516163;replied_to;2022-05-28 18:01:37.520136
1411676203224870912;goerke_c;1511656231047516163;Mit Leistungsprinzip und Aufstiegsversprechen hat die extreme Ungleichheit nichts mehr zu tun. Es ist mehr als überfällig, die Vermögen der Superreichen angemessen zu besteuern und kleine und mittlere Einkommen steuerlich zu entlasten.;1411676203224870912;1511656228858089478;2022-04-06 10:45:05+00:00;1411676203224870912;de;False;1;1;6;0;everyone;Twitter Web App;1511656228858089478;replied_to;2022-05-28 18:01:37.528086
1411676203224870912;goerke_c;1511656228858089478;"Die Forbes-Liste der Superreichen ist jedes Mal ein Schlag ins Gesicht der vielen fleißigen Menschen. Die haben die Super-Vermögen von Musk, Bezos und Co. nämlich mit harter, ehrlicher Arbeit erwirtschaftet, bekommen davon aber häufig viel zu wenig ab.

https://t.co/Cj0dqgeNLn";1411676203224870912;1511656228858089478;2022-04-06 10:45:04+00:00;;de;False;13;9;50;0;everyone;Twitter Web App;;;2022-05-28 18:01:37.533066
1411676203224870912;goerke_c;1511609952988811264;"Übergewinne der Mineralölkonzerne abschöpfen? Auch hier pennt die Ampel wohl. Das zeigt eine Anfrage von mir und @SusanneHennig.

Selbst konservative Politiker wie Mario Draghi planen in Italien eine solche Steuer mit und zwar mit Milliardenaufkommen!

https://t.co/mtPnuvWB8D";1411676203224870912;1511609952988811264;2022-04-06 07:41:11+00:00;;de;False;9;0;26;1;everyone;Twitter Web App;;;2022-05-28 18:01:37.539714
1411676203224870912;goerke_c;1509199307790065669;"RT @pascalmeiser: Die Bundesregierung zögert &amp; mauert bei der Umsetzung der #Sanktionen gegen russische #Oligarchen. Auf meine Anfrage gibt…";1411676203224870912;1509199307790065669;2022-03-30 16:02:09+00:00;;de;False;9;0;0;0;everyone;Twitter for iPad;1509127256345620488;retweeted;2022-05-28 18:01:37.544881
1411676203224870912;goerke_c;1508749357012688898;Um den politischen Druck zu vervielfachen, sollte auch die sofortige Besteuerung von Oligarchen-Vermögen und die dauerhafte Vermögensentziehung bei illegaler Quelle geprüft werden!;1411676203224870912;1508749348930310144;2022-03-29 10:14:12+00:00;1411676203224870912;de;False;1;2;5;1;everyone;Twitter Web App;1508749355469180929;replied_to;2022-05-28 18:01:37.551062
1411676203224870912;goerke_c;1508749355469180929;Stattdessen müssen endlich die Spielräume der Sanktionen gegen russischer Oligarchen genutzt werden. Dafür muss die Sanktionsliste massiv ausgeweitet werden und die Kapazitäten zur Umsetzung erhöht werden.;1411676203224870912;1508749348930310144;2022-03-29 10:14:12+00:00;1411676203224870912;de;False;1;1;4;0;everyone;Twitter Web App;1508749353866997763;replied_to;2022-05-28 18:01:37.558891
1411676203224870912;goerke_c;1508749353866997763;Sanktionen sind nicht durchzuhalten, wenn in Deutschland Hunderttausende arbeitslos werden und Preise explodieren. Ich erwarte von Kanzler Scholz und Minister Habeck, dass sie ein Embargo abwenden!;1411676203224870912;1508749348930310144;2022-03-29 10:14:11+00:00;1411676203224870912;de;False;1;1;7;1;everyone;Twitter Web App;1508749352373735424;replied_to;2022-05-28 18:01:37.563793
1411676203224870912;goerke_c;1508749352373735424;Für ein mögliches Gasembargo liefert das IMK alarmierende Zahlen. Ein Embargo bedeutete eine Wirtschaftskrise, die schlimmer und komplexer wäre als die Krise durch die Corona-Pandemie.;1411676203224870912;1508749348930310144;2022-03-29 10:14:11+00:00;1411676203224870912;de;False;1;1;5;0;everyone;Twitter Web App;1508749350679334915;replied_to;2022-05-28 18:01:37.572213
1411676203224870912;goerke_c;1508749350679334915;Hinter schlechten Konjunkturprognosen stehen Menschen, die arbeitslos bleiben oder werden. Der fürchterliche Ukraine-Krieg ist schon heute eine enorme Belastung für die Menschen angesichts der explodierenden Energiepreise und für die deutsche Wirtschaft, gerade in Brandenburg.;1411676203224870912;1508749348930310144;2022-03-29 10:14:11+00:00;1411676203224870912;de;False;1;1;4;0;everyone;Twitter Web App;1508749348930310144;replied_to;2022-05-28 18:01:37.580495
1411676203224870912;goerke_c;1508749348930310144;"Alarmierende Zahlen des IMK. Ich erwarte von Kanzler Scholz und Minister Habeck, dass sie ein Embargo abwenden!

Thread 👇
https://t.co/1bFbMqFVLp";1411676203224870912;1508749348930310144;2022-03-29 10:14:10+00:00;;de;False;6;10;25;1;everyone;Twitter Web App;;;2022-05-28 18:01:37.586339
1411676203224870912;goerke_c;1506262622248869896;"Der Haushalt der Ampel ist eine Mogelpackung. Von den versprochenen Klimainvestitionen und den Entlastungen für die Bürger bleibt bei genauem Hinsehen nicht viel übrig. 

Statt die Schuldenbremse unehrlich zu umgehen, sollte sie geändert werden! https://t.co/2bRVarZsdo";1411676203224870912;1506262622248869896;2022-03-22 13:32:48+00:00;;de;False;6;1;47;0;everyone;Twitter Web App;;;2022-05-28 18:01:37.593036
1411676203224870912;goerke_c;1506248175992123395;RT @Linksfraktion: Der Haushalt der Ampel ist eine Mogelpackung. Klotzen bei der Bundeswehr, Kleckern bei Investitionen und Entlastungen? D…;1411676203224870912;1506248175992123395;2022-03-22 12:35:24+00:00;;de;False;9;0;0;0;everyone;Twitter Web App;1506239762214105094;retweeted;2022-05-28 18:01:37.598132
1411676203224870912;goerke_c;1506204110000951296;Und: Wo bleibt das zweite Entlastungspaket? Die 100 Bundeswehrmilliarden waren über Nacht beschlossen, die Entlastung der Verbraucher aber wird zur Hängepartie. Und das obwohl der Finanzminister Rekordsteuereinnahmen verzeichnet. Ein Unding!;1411676203224870912;1506204102669254665;2022-03-22 09:40:18+00:00;1411676203224870912;de;False;2;0;19;0;everyone;Twitter for iPhone;1506204108843323398;replied_to;2022-05-28 18:01:37.603044
1411676203224870912;goerke_c;1506204108843323398;Aus dem „Jahrzehnt der Investitionen“ ist ein grün angestrichener und aufgeblasener Marketinggag geworden!;1411676203224870912;1506204102669254665;2022-03-22 09:40:18+00:00;1411676203224870912;de;False;2;1;19;0;everyone;Twitter for iPhone;1506204107543093252;replied_to;2022-05-28 18:01:37.610324
1411676203224870912;goerke_c;1506204107543093252;Etwas mager dafür, dass die Steuereinnahmen boomen, Lindner allein 2022 durch den Verkauf von Staatsanleihen wieder mit Zinsgewinnen in Höhe von 6 Milliarden plant und die Einnahmen aus CO2-Zertifikaten deutlich höher ausfallen werden.;1411676203224870912;1506204102669254665;2022-03-22 09:40:17+00:00;1411676203224870912;de;False;1;1;14;0;everyone;Twitter for iPhone;1506204106343559173;replied_to;2022-05-28 18:01:37.615322
1411676203224870912;goerke_c;1506204106343559173;Für die Ampel-Legislatur beschränkt sich der Neuigkeitswert also auf gerade einmal 9 Milliarden pro Jahr.;1411676203224870912;1506204102669254665;2022-03-22 09:40:17+00:00;1411676203224870912;de;False;1;1;15;0;everyone;Twitter for iPhone;1506204105043324929;replied_to;2022-05-28 18:01:37.622378
