twitter_id;twitter_handle;tweet_id;tweet_text;tweet_author_id;tweet_conversation_id;tweet_created_at;tweet_in_reply_to_user_id;tweet_lang;tweet_possibly_sensitive;tweet_retweet_count;tweet_reply_count;tweet_like_count;tweet_quote_count;tweet_reply_settings;tweet_source;tweet_referenced_tweet_id;tweet_referenced_tweet_type;api_call
454981027;helgelindh;1227907258014629888;"RT @spdbt: Müssen wir über die ""Ausbreitung des Islamismus in Deutschland"" reden? @helgelindh findet klare Worte zum #AfD-Antrag: ""Ihnen is…";454981027;1227907258014629888;2020-02-13 10:47:58+00:00;;de;False;114;0;0;0;everyone;Twitter Web App;1227905452400357376;retweeted;2022-05-28 17:03:12.019324
454981027;helgelindh;1227677177237381121;In der AG Demokratie der @spdbt gibt es nicht nur leckeres Knabberzeug, sondern auch eine spannende Diskussion zu #Thüringen. Eines steht fest: Fundamentalopposition gegen Faschisten kennt weder Fraktions- noch Parteigrenzen. Wir stehen geeint. https://t.co/asB8X1imbt;454981027;1227677177237381121;2020-02-12 19:33:42+00:00;;de;False;4;3;43;1;everyone;Twitter Web App;;;2022-05-28 17:03:12.023092
454981027;helgelindh;1227672910049009665;RT @ChristianHelms: Die Glitzerwelt der AG Demokratie. https://t.co/YYNbPDTc51;454981027;1227672910049009665;2020-02-12 19:16:45+00:00;;de;False;1;0;0;0;everyone;Twitter Web App;1227653653135269890;retweeted;2022-05-28 17:03:12.026572
454981027;helgelindh;1227672025961050112;RT @MV_AM: @helgelindh spendiert heute eine Runde Schokobons und Chips ... #Bundestag #AGDemokratie https://t.co/nfwWO8ZTP0;454981027;1227672025961050112;2020-02-12 19:13:14+00:00;;de;False;1;0;0;0;everyone;Twitter Web App;1227654075761778689;retweeted;2022-05-28 17:03:12.030334
454981027;helgelindh;1226793667098292224;"Als Demokrat hoffe ich, dass in der #CDU nun jemand den Laden übernimmt, der keinerlei Zweifel an einer strikten Abgrenzung zum Rechtsextremismus &amp; Faschismus lässt. Und das in dieser Partei auch durchsetzen kann. Es steht gerade zu viel auf dem Spiel in D. #AKKRücktritt #AKK https://t.co/gg0VxQGkkL";454981027;1226793667098292224;2020-02-10 09:02:57+00:00;;de;False;29;35;267;1;everyone;Twitter Web App;1226786821918646273;quoted;2022-05-28 17:03:12.034784
454981027;helgelindh;1226587843717468160;"#Lindner wirft der AfD vor, eine ""Strategie der konstruktiv-destruktiven Oppositionsarbeit“ zu betreiben. Zurecht!
Aber was genau macht er eigentlich, wenn er wiederholt versucht, einen verdienten und beliebten Ministerpräsidenten wie @bodoramelow zu beschädigen? @c_lindner";454981027;1226587843717468160;2020-02-09 19:25:05+00:00;;de;False;7;3;53;0;everyone;Twitter Web App;;;2022-05-28 17:03:12.038343
454981027;helgelindh;1226581565205073921;"Herr #Lindner, bitte ein bisschen Demut! Verschonen Sie uns in dieser „extrem empfindlichen Situation“, die Sie selbst verschuldet haben, mit Ihren hanebüchenen Ratschlägen.
Sie behaupten, in die Falle der AfD getappt zu sein. Wie lange wollen Sie in dieser Falle noch verweilen? https://t.co/kqJOwWEIgw";454981027;1226581565205073921;2020-02-09 19:00:08+00:00;;de;False;13;4;60;1;everyone;Twitter Web App;1226512400746209283;quoted;2022-05-28 17:03:12.042258
454981027;helgelindh;1226476708620128257;"@bodoramelow @KemmerichThL @HPFriedrichCSU mit deutlichem Vorsprung sein Vertrauen ausgesprochen. 
Weder Höcke noch Mohring hatten den Mumm, sich selbst zur Wahl zu stellen. Sie schickten einen 5%-Mann vor und führten den Willen des Souveräns endgültig ad absurdum. Aber glücklicherweise ist die Demokratie in D. wehrhaft!";454981027;1226280817594380288;2020-02-09 12:03:28+00:00;454981027;de;False;1;3;12;0;everyone;Twitter Web App;1226280817594380288;replied_to;2022-05-28 17:03:12.046819
454981027;helgelindh;1226476620325801984;@bodoramelow @KemmerichThL @HPFriedrichCSU Für alle, die meinen, im Grundkurs Politik ganz besonders gut aufgepasst zu haben: Bitte richtig lesen! Ich habe zu keinem Zeitpunkt von einer Regierungsmehrheit gesprochen. Ramelow hat mit seiner Partei die mit Abstand meisten Stimmen geholt (Mehrheit). Der Souverän hat ihm...;454981027;1226280817594380288;2020-02-09 12:03:07+00:00;454981027;de;False;0;2;7;0;everyone;Twitter Web App;1226280817594380288;replied_to;2022-05-28 17:03:12.051018
454981027;helgelindh;1226280817594380288;"Nur zur Erinnerung: Die Mehrheit in #Thüringen hat entschieden. Sie hat mit 31 % @bodoramelow gewählt. @KemmerichThL hat sagenhaft ministerpräsidiale 5 % auf sich vereinen können.
Bundestagsvizepräsident @HPFriedrichCSU hat ein wirklich interessantes Verständnis von Demokratie. https://t.co/lDivBisY7H";454981027;1226280817594380288;2020-02-08 23:05:04+00:00;;de;False;50;38;362;4;everyone;Twitter Web App;;;2022-05-28 17:03:12.054847
454981027;helgelindh;1226264537218912261;"@Silke123456781 @KuehniKev @Dzienus @c_lindner @KemmerichThL Trotzdem kann ich doch sagen, dass es unzulässig ist, @KuehniKev &amp; @Dzienus die Verantwortung dafür zuzuschieben. Menschen wie Ihnen ist es zu verdanken, dass ausreichend öffentl. Druck ausgeübt wurde, damit Thüringen nicht von einem MP von Höckes Gnaden regiert wird.";454981027;1226254058014617600;2020-02-08 22:00:23+00:00;810958106867957760;de;False;0;1;3;0;everyone;Twitter Web App;1226259240102350848;replied_to;2022-05-28 17:03:12.058410
454981027;helgelindh;1226263489540509704;@Silke123456781 @KuehniKev @Dzienus @c_lindner @KemmerichThL Entschuldige bitte, aber wo habe ich Gewalt entschuldigt? Selbstverständlich verurteile ich den Angriff auf das arme Kind aufs Schärfste! Genau wie alle anderen Akte der Gewalt - immer und egal, gegen wen sie sich richten. Das steht doch völlig außer Zweifel!;454981027;1226254058014617600;2020-02-08 21:56:13+00:00;810958106867957760;de;False;0;1;10;0;everyone;Twitter Web App;1226258755416813568;replied_to;2022-05-28 17:03:12.062365
454981027;helgelindh;1226254058014617600;"Lieber Hr. Kuhle, die Verantwortung für die aufgeheizte Stimmung in diesem Land tragen nicht @KuehniKev &amp; @Dzienus. Richten Sie Ihren Appell an die richtige Adresse: @c_lindner &amp; @KemmerichThL. Stehen Sie endlich für Ihre Fehler gerade, statt die Schuld bei anderen zu suchen. https://t.co/99gRkw4BEd";454981027;1226254058014617600;2020-02-08 21:18:44+00:00;;de;False;17;8;123;2;everyone;Twitter Web App;1226222435667791872;quoted;2022-05-28 17:03:12.066336
454981027;helgelindh;1225755708702035968;"Und hat #AKK gerade wirklich gesagt, dass der erste Fehler bzgl. der Gesamtsituation in #Thüringen bei Linken, SPD &amp; Grünen liegt, weil sie es wagten, #Ramelow, der mit 31% der Stimmen gewählt wurde, als MP zu unterstützen?
Frau Kramp-Karrenbauer, Sie haben gar nichts verstanden!";454981027;1225755708702035968;2020-02-07 12:18:29+00:00;;de;False;50;14;313;2;everyone;Twitter Web App;;;2022-05-28 17:03:12.070258
454981027;helgelindh;1225753845088899074;Hat #AKK in ihrer PK gerade wirklich SPD, Linke und Grüne die Verantwortung dafür zugeschoben, dass sie sich als Parteivorsitzende der CDU bei ihren thüringischen Parteifreunden mit ihrer Forderung nach Neuwahlen nicht durchsetzen konnte? #Thüringen;454981027;1225753845088899074;2020-02-07 12:11:04+00:00;;de;False;22;8;126;2;everyone;Twitter Web App;;;2022-05-28 17:03:12.073907
454981027;helgelindh;1225397884213977094;"Lindner, #Kubicki, Merz u.a. besaßen nach der MP-Wahl in #Thüringen die Chuzpe, Linke, SPD &amp; Grüne zur Zusammenarbeit mit Kemmerich aufzufordern &amp; ihnen #Fundamentalopposition vorzuwerfen.
Die SPD wird immer in Fundamentalopposition zu jeglicher Kooperation mit Faschisten stehen.";454981027;1225397884213977094;2020-02-06 12:36:37+00:00;;de;False;12;3;62;0;everyone;Twitter Web App;;;2022-05-28 17:03:12.077667
454981027;helgelindh;1225185546621915137;"CDU, wo steuerst du nur hin? In #Thüringen verhilfst du Faschisten zur politischen Macht. Ein #Dammbruch, auf den deine #WerteUnion um HG Maaßen schon lange hinarbeitet.
Wie entgleist muss man sein, um es ausgerechnet heute zu wagen, die Linke eine „Mauermörderpartei“ zu nennen? https://t.co/wlt86eF56w";454981027;1225185546621915137;2020-02-05 22:32:51+00:00;;de;False;7;3;61;0;everyone;Twitter Web App;1225165001360662530;quoted;2022-05-28 17:03:12.081454
454981027;helgelindh;1225046932000837632;"5 %-Kemmerich lässt sich von Faschisten zum Ministerpräsidenten wählen.
Die AfD feiert die „politische Wende“. 
#FDP &amp; #CDU kooperieren mit Höcke.
Das ist kein Tabubruch, das ist eine unverzeihliche Schande.
Demokrat*innen in Deutschland, merkt euch diesen Tag.
#Thüringen";454981027;1225046932000837632;2020-02-05 13:22:03+00:00;;de;False;19;8;116;0;everyone;Twitter Web App;;;2022-05-28 17:03:12.085667
454981027;helgelindh;1224684224378212353;#Teilhabechancen-Gesetz. Sperriger Titel – großer Erfolg. Mehr Menschen als gedacht haben in Wuppertal unter widrigen Voraussetzungen neue Arbeit gefunden. Vorbildlicher Einsatz des Jobcenters. Unter Berücksichtigung von Mindest- und Tariflöhnen. @WRundschau @wzwuppertal;454981027;1224684224378212353;2020-02-04 13:20:47+00:00;;de;False;0;2;9;0;everyone;Twitter Web App;;;2022-05-28 17:03:12.089040
454981027;helgelindh;1221030550103826434;Es gibt nicht ein Deutschland der „Deutschen mit Migrationshintergrund“ und ein Deutschland der „Nachfahren der Deutschen, die das NS-Regime miterlebt“ haben. Es gibt ein Deutschland. Und für dieses Deutschland hat BPr #Steinmeier bei der Gedenkfeier in Yad Vashem gesprochen. https://t.co/0t2Op7zmcg;454981027;1221030550103826434;2020-01-25 11:22:23+00:00;;de;False;13;33;164;5;everyone;Twitter Web App;1220601978574770181;quoted;2022-05-28 17:03:12.092927
454981027;helgelindh;1220465522917113860;"Das Unsagbare soll wieder sagbar, Antisemitismus salonfähig gemacht werden. Es ist unser aller Aufgabe, dies zu verhindern.
Oder wie BPr Steinmeier es heute gesagt hat:
„Unsere deutsche Verantwortung vergeht nicht. Ihr wollen wir gerecht werden. An ihr sollt ihr uns messen.“";454981027;1220465522917113860;2020-01-23 21:57:10+00:00;;de;False;1;0;33;0;everyone;Twitter Web App;;;2022-05-28 17:03:12.097887
454981027;helgelindh;1220465434371207168;"Wir können nicht akzeptieren, dass sich Jüdinnen &amp; Juden in Deutschland wieder verstecken müssen. Es ist beschämend, dass sie sich davor fürchten müssen, ihre Kippa auf offener Straße zu tragen.
Was sich unter unser aller Augen vollzieht, ist ein tiefgreifender, fataler Umbruch.";454981027;1220465434371207168;2020-01-23 21:56:49+00:00;;de;False;7;3;91;0;everyone;Twitter Web App;;;2022-05-28 17:03:12.102024
454981027;helgelindh;1220456083824816134;Wir vergessen nicht, wir stehen zusammen gegen den Hass.;454981027;1220456081345957889;2020-01-23 21:19:40+00:00;454981027;de;False;2;1;43;0;everyone;Twitter for Android;1220456082612477952;replied_to;2022-05-28 17:03:12.106716
454981027;helgelindh;1220456082612477952;"Karamba, wir stellen uns schützend vor dich, im übertragenen wie buchstäblichen Sinne. Nicht allein Bekenntnisse, sondern die gesamte Konsequenz des Gesetzes muss jetzt greifen. Der Ernstfall für Solidarität ist da.
Unser Erinnern verbietet Schweigen und Zuschauen.";454981027;1220456081345957889;2020-01-23 21:19:39+00:00;454981027;de;False;1;1;58;0;everyone;Twitter for Android;1220456081345957889;replied_to;2022-05-28 17:03:12.110569
454981027;helgelindh;1220456081345957889;"#wirsindkaramba
Erst Schüsse ins Büro, nun Morddrohungen - Unterschrieben mit ""Heil Hitler"". Ausgerechnet an dem Tag, an dem Bundespräsident Steinmeier eine historische Rede in Yad Vashem hält, stockt der Atem angesichts des offenen Hasses mitten in Deutschland.";454981027;1220456081345957889;2020-01-23 21:19:39+00:00;;de;False;24;4;117;3;everyone;Twitter for Android;;;2022-05-28 17:03:12.114196
454981027;helgelindh;1218197464471212033;"AfD versuchte wieder Geflüchtete zu verunglimpfen, indem sie nach der Verwertbarkeit der Menschen fragte. Dabei sollte AfD lieber die Folgekosten aller rassistischen &amp; antisemitischen Straftaten berechnen, die nicht zuletzt durch ihre Hetze befeuert werden
https://t.co/n4uxDRLIVm";454981027;1218197464471212033;2020-01-17 15:44:43+00:00;;de;False;30;43;187;10;everyone;Twitter Web App;;;2022-05-28 17:03:12.118763
454981027;helgelindh;1217455939734921216;Ich hoffe, dass die Ermittlungen schnell zur Erfassung der Täter führen.;454981027;1217455934567481344;2020-01-15 14:38:09+00:00;454981027;de;False;0;3;11;1;everyone;Twitter Web App;1217455937704861697;replied_to;2022-05-28 17:03:12.122198
454981027;helgelindh;1217455937704861697;Wenn der Schutz von Amts- und Mandatsträgern keine Selbstverständlichkeit mehr ist, egal ob in den Kommunen, Land oder Bund, ist unser friedliches demokratisches Zusammenleben ernsthaft in Gefahr. Karamba, du hast meine volle Solidarität.;454981027;1217455934567481344;2020-01-15 14:38:09+00:00;454981027;de;False;1;2;14;1;everyone;Twitter Web App;1217455934567481344;replied_to;2022-05-28 17:03:12.125907
454981027;helgelindh;1217455934567481344;Egal vor welchem Hintergrund: Einschusslöcher in Wahlkreisbüros eines jeden Abgeordneten sind Einschusslöcher in unsere Demokratie. https://t.co/au3BvcSKFX;454981027;1217455934567481344;2020-01-15 14:38:08+00:00;;de;False;9;5;103;1;everyone;Twitter Web App;1217446518954823682;quoted;2022-05-28 17:03:12.129758
454981027;helgelindh;1217067340342472705;"Unglaubwürdig macht sich die CDU vor allem mit spalterischen Bewegungen wie der #WerteUnion. Mitsch, Maaßen &amp; Co. schwächen durch ihre Attacken die eigene Partei und bereiten der AfD den Weg zur politischen Macht. https://t.co/SeRXytaJxm";454981027;1217067340342472705;2020-01-14 12:54:00+00:00;;de;False;1;2;18;0;everyone;Twitter Web App;1216784128420589568;quoted;2022-05-28 17:03:12.134201
454981027;helgelindh;1214487944612007936;Ich bedanke mich bei den Betreuern und Helfern für Ihren aufopferungsvollen Einsatz.;454981027;1214487936802205696;2020-01-07 10:04:24+00:00;454981027;de;False;0;0;10;0;everyone;Twitter Web App;1214487942686806017;replied_to;2022-05-28 17:03:12.957894
454981027;helgelindh;1214487942686806017;Ich wünsche Ihnen, dass sie in dieser Not von guten Mächten wunderbar geborgen sein mögen und spreche Ihnen in diesen so schweren, dunklen Stunden mein tief empfundenes Beileid aus. Wissend, dass dieser Versuch des Trostes den Schmerz nicht im Ansatz zu heilen vermag.;454981027;1214487936802205696;2020-01-07 10:04:24+00:00;454981027;de;False;0;1;11;0;everyone;Twitter Web App;1214487940585414656;replied_to;2022-05-28 17:03:12.962457
454981027;helgelindh;1214487940585414656;Mögen sie ganz bald genesen und das Geschehene mit viel Unterstützung verarbeiten können. In meinen Gedanken bin ich bei den Angehörigen der Opfer. Ihr Leben hat sich auf entsetzliche Weise unwiderruflich verändert.;454981027;1214487936802205696;2020-01-07 10:04:23+00:00;454981027;de;False;0;1;7;0;everyone;Twitter Web App;1214487938781863936;replied_to;2022-05-28 17:03:12.966617
454981027;helgelindh;1214487938781863936;Dieser schreckliche Unfall in Südtirol hat mich zutiefst erschüttert. Es macht mich fassungslos, wie die jungen Studierenden jäh aus dem Leben gerissen wurden. Ich trauere um die Verstorbenen und bange um das Schicksal der Verletzten.;454981027;1214487936802205696;2020-01-07 10:04:23+00:00;454981027;de;False;0;1;7;0;everyone;Twitter Web App;1214487936802205696;replied_to;2022-05-28 17:03:12.970948
454981027;helgelindh;1214487936802205696;Namenloser Schrecken und Schmerz hat mehrere Wuppertaler Familien getroffen. Drei Wuppertalerinnen sind infolge eines Autounfalls unter massivem Alkoholeinfluss des Fahrers, der in die Menschenmenge raste, gestorben. Sie waren gerade einem Reisebus entstiegen.;454981027;1214487936802205696;2020-01-07 10:04:22+00:00;;de;False;0;1;28;0;everyone;Twitter Web App;;;2022-05-28 17:03:12.974525
454981027;helgelindh;1208373661083848706;"Hass macht nicht satt, Hass schafft keine Wohnungen.
Wer die soziale Frage des Wohnens und der Obdachlosigkeit instrumentalisiert, um das Asylrecht aushebeln zu wollen, der verhöhnt nicht nur die Geflüchteten, sondern auch die Obdachlosen.(2)";454981027;1208373661083848706;2019-12-21 13:08:25+00:00;;de;False;33;59;203;3;everyone;Twitter Web App;;;2022-05-28 17:03:12.978527
454981027;helgelindh;1208372975000530944;"Kurz vor Weihnachten versucht die AfD in besonders niederträchtiger Weise, die Schutzbedürftigsten in dieser Gesellschaft gegeneinander auszuspielen: Obdachlose gegen Geflüchtete.
Menschen brauchen Wohnungen, Stabilität, Essen. Was bietet die AfD? Hass.(1)
https://t.co/ZT93HgBz3M";454981027;1208372975000530944;2019-12-21 13:05:42+00:00;;de;False;19;59;94;3;everyone;Twitter Web App;;;2022-05-28 17:03:12.981839
454981027;helgelindh;1207695727486537728;"RT @spdbt: ""Bis heute erleben #Sinti und #Roma in ihrem Alltag Diskriminierung"", berichten @MartinRabanus und @helgelindh zum heutigen Tag…";454981027;1207695727486537728;2019-12-19 16:14:33+00:00;;de;False;3;0;0;0;everyone;Twitter Web App;1207591052598743043;retweeted;2022-05-28 17:03:12.986149
454981027;helgelindh;1207064720185933824;Wer Maaßen bei #Lanz zusieht, den kann es nur schütteln, dass dieser Mann 6 Jahre lang der oberste Verfassungshüter dieses Landes war. Noch fassungsloser als seine Verschwörungstheorien macht nur die Tatsache, dass die Union sich von diesem Mann noch immer nicht distanziert hat.;454981027;1207064720185933824;2019-12-17 22:27:10+00:00;;de;False;146;72;1127;9;everyone;Twitter Web App;;;2022-05-28 17:03:12.989618
454981027;helgelindh;1206942220366098432;"Wenn der Präsident des @FeuerwehrDFV #Ziebs bedroht &amp; aus seinem Amt gedrängt wird, weil er vor rechtsnationalen Tendenzen innerhalb der Feuerwehr warnt, müssen bei allen Demokrat*innen in diesem Land die Alarmglocken schrillen. Meine vollste Solidarität &amp; Dank für Ihre Haltung! https://t.co/BOOSBmJ1bX";454981027;1206942220366098432;2019-12-17 14:20:23+00:00;;de;False;18;10;101;1;everyone;Twitter Web App;1205895833591394304;quoted;2022-05-28 17:03:12.993126
454981027;helgelindh;1205249573192642561;"Erneut will die AfD im #Bundestag die freie Presse diskreditieren. Unbequeme Journalisten werden bedroht und als „Zersetzungsagenten“ diffamiert. Dabei ist klar: Die eigentlichen „Zersetzungsagenten“ in diesem Land sitzen auf den Bänken der AfD-Fraktion.

https://t.co/GQ4e6MvX6g";454981027;1205249573192642561;2019-12-12 22:14:25+00:00;;de;False;19;8;54;1;everyone;Twitter Web App;;;2022-05-28 17:03:12.996734
454981027;helgelindh;1205139888678539265;RT @NetzwerkSPD: @helgelindh: Entwaffnung von Verfassungsfeinden und Verlässlichkeit für Verfassungsfreunde! https://t.co/n9xbgKfT2O;454981027;1205139888678539265;2019-12-12 14:58:34+00:00;;de;False;5;0;0;0;everyone;Twitter Web App;1204774100486504448;retweeted;2022-05-28 17:03:13.000743
454981027;helgelindh;1202204655826153472;Erpressung ist immer unredlich. Wer aber auch noch die #Grundrente als Druckmittel instrumentalisiert und damit Millionen armutsgefährdeter #Rentner in Geiselhaft nimmt, entlarvt sein Verständnis von Regierungsarbeit. Regieren ist kein Selbstzweck, Regieren ist Gestaltung, @akk.;454981027;1202204655826153472;2019-12-04 12:35:00+00:00;;de;False;13;9;102;2;everyone;Twitter Web App;;;2022-05-28 17:03:13.006824
454981027;helgelindh;1201449704313237504;Der einzige, der Opposition gewählt hat, war Christian Lindner. Aus Angst, falsch zu regieren. Und ohne die Basis der FDP zu fragen. Lieber Herr #Lindner, auch wenn es Sie „völlig baff“ macht, Demokratie ist in der #SPD nun einmal keine One-Man-Show wie in der FDP. @c_lindner https://t.co/WPy0txjTMj;454981027;1201449704313237504;2019-12-02 10:35:06+00:00;;de;False;65;14;597;5;everyone;Twitter Web App;1201424469492977664;quoted;2022-05-28 17:03:13.011485
454981027;helgelindh;1200411398989340673;Wer die AfD wählt, wählt nicht nur eine in weiten Teilen rechtsextreme und rassistische Partei, er/sie wählt auch eine neoliberale Partei. (3);454981027;1200411398989340673;2019-11-29 13:49:14+00:00;;de;False;2;8;30;0;everyone;Twitter Web App;;;2022-05-28 17:03:13.016440
454981027;helgelindh;1200411322678218763;Der AfD-Vorsitzende Meuthen hat diese Woche verkündet, dass er den Spitzensteuersatz senken, die Erbschaftssteuer sowie den Soli für die reichsten 10 % abschaffen und den Mindestlohn sowie die Hartz IV-Regelsätze nicht erhöhen wolle. (2);454981027;1200411322678218763;2019-11-29 13:48:56+00:00;;de;False;9;8;41;1;everyone;Twitter Web App;;;2022-05-28 17:03:13.020108
454981027;helgelindh;1200411218084876290;Wer die AfD unterstützt, weil er/sie sich davon erhofft, dadurch in sozialer Hinsicht besser dazustehen, dem/der empfehle ich einen Blick in das sozialpolitische Programm dieser Partei: Sie hat keins! Die AfD hat auch 6 1/2 Jahre nach ihrer Entstehung kein Rentenprogramm. (1);454981027;1200411218084876290;2019-11-29 13:48:31+00:00;;de;False;47;16;224;4;everyone;Twitter Web App;;;2022-05-28 17:03:13.023575
454981027;helgelindh;1198918813951111168;Ich bin bestürzt über den Einbruch in #Dresdens Schatzkammer #GrünesGewölbe. Ein Raub von Kunstgegenständen wäre ein großer Verlust für unser kulturelles Erbe. Drücke der Polizei die Daumen für eine schnelle Aufklärung.;454981027;1198918813951111168;2019-11-25 10:58:14+00:00;;de;False;1;0;20;0;everyone;Twitter Web App;;;2022-05-28 17:03:13.027525
454981027;helgelindh;1192369853795053568;RT @spdbt: Ob beim Klima oder bei TV-Sendungen: Die #AfD hat offensichtlich Angst vor Kindern. Warum? Ganz einfach: #LogoErklärtRichtig. @h…;454981027;1192369853795053568;2019-11-07 09:15:00+00:00;;de;False;51;0;0;0;everyone;Twitter Web App;1192351896754892800;retweeted;2022-05-28 17:03:13.031083
454981027;helgelindh;1192201721004646400;"Die AfD beantragt eine Aktuelle Stunde im Bundestag, weil KiKa in „logo erklärt“ über Rechtspopulismus &amp; das Programm der AfD aufklärt. Wie groß muss die Angst der AfD vor aufgeklärten, gut informierten 8- bis 13-Jährigen sein? #LogoErklärtRichtig #noafd

https://t.co/RNTCGDM3Bt";454981027;1192201721004646400;2019-11-06 22:06:54+00:00;;de;False;248;50;1246;25;everyone;Twitter Web App;;;2022-05-28 17:03:13.035710
454981027;helgelindh;1192185331988254721;RT @DrGrandMal: Ich liebe @helgelindh gerade dafür, dass er im Bundestag den Hashtag #LogoErklärtRichtig in Social Media fordert, unter dem…;454981027;1192185331988254721;2019-11-06 21:01:47+00:00;;de;False;59;0;0;0;everyone;Twitter Web App;1192104136302616582;retweeted;2022-05-28 17:03:13.039080
454981027;helgelindh;1191668538832039939;Was sich in #Thüringen zusammenbraut, muss alle Demokrat*innen in diesem Land tief besorgen. Führende Funktionsträger der #CDU sind bereit, mit Faschisten zusammenzuarbeiten oder ihnen sogar zu Regierungsverantwortung zu verhelfen. Das ist eine Schande für Deutschland! #noafd;454981027;1191668538832039939;2019-11-05 10:48:14+00:00;;de;False;96;22;461;7;everyone;Twitter Web App;;;2022-05-28 17:03:13.042937
454981027;helgelindh;1190566024254574592;"1. AfD behauptet, gegen Antisemitismus zu kämpfen.
2. Stephan Brandner nennt das Bundesverdienstkreuz für Udo Lindenberg einen ""Judaslohn"".
Frage: Wo ist der Fehler?
#anJudasSeite
#wirsindLindenberg";454981027;1190566024254574592;2019-11-02 09:47:14+00:00;;de;False;7;10;65;4;everyone;Twitter for iPhone;;;2022-05-28 17:03:13.046546
454981027;helgelindh;1186985897776111616;#Lucke #deMaiziere #Lindner - diese Fälle haben nur bedingt etwas miteinander tun. Tut sich die FDP einen Gefallen damit, hier ein Muster zu stricken? Oder spielt sie nur der AfD in die Hände? Mehr dazu von mir heute ab 15.35 Uhr in der Aktuellen Stunde zur #Meinungsfreiheit.;454981027;1186985897776111616;2019-10-23 12:41:05+00:00;;de;False;5;5;49;2;everyone;Twitter Web App;;;2022-05-28 17:03:13.051650
454981027;helgelindh;1186646617593712643;"@rotsdauw 4. (...) solche Initiative in die Länderkammer einbringen. Das alles ist nicht geschehen.
Einem kalkulierten Schaufensterantrag, wie er in der letzen Woche von den Grünen eingebracht wurde, habe ich daher nicht zugestimmt.";454981027;1185152456843550720;2019-10-22 14:12:55+00:00;519281559;de;False;0;1;0;0;everyone;Twitter Web App;1185152456843550720;replied_to;2022-05-28 17:03:13.054997
454981027;helgelindh;1186646454309478402;@rotsdauw 3. Wenn es den Grünen um die Sache ginge, würden sie in den von ihnen regierten oder mitregierten Ländern Tempolimits durchsetzen. Außerdem könnten sie einen entsprechenden Antrag über den Bundesrat stellen: Baden-Württemberg, Hessen oder Schleswig-Holstein könnten eine (...);454981027;1185152456843550720;2019-10-22 14:12:16+00:00;519281559;de;False;0;0;1;0;everyone;Twitter Web App;1185152456843550720;replied_to;2022-05-28 17:03:13.058804
454981027;helgelindh;1186645943451607050;"@rotsdauw 2. Als Abgeordneter bin ich Vertreter des Volkes. Zu diesem Thema gibt es jedoch keinen gesellschaftlichen Konsens. Auch in der Regierungskoalition besteht hierzu keine Einigkeit.
Das ist auch das Kalkül der Grünen:";454981027;1185152456843550720;2019-10-22 14:10:14+00:00;519281559;de;False;0;0;0;0;everyone;Twitter Web App;1185152456843550720;replied_to;2022-05-28 17:03:13.062427
454981027;helgelindh;1186645789294186497;"@rotsdauw 1. Ich persönlich fahre kein Auto und habe auch nichts gegen ein Tempolimit. Auch wenn ich es nur für ein Instrument unter vielen halte.
Meine persönliche Meinung kann aber nicht der alleinige Maßstab in Bezug auf mein Abstimmungsverhalten im Deutschen Bundestag sein.";454981027;1185152456843550720;2019-10-22 14:09:37+00:00;519281559;de;False;0;1;0;0;everyone;Twitter Web App;1185152456843550720;replied_to;2022-05-28 17:03:13.066464
