twitter_id;twitter_handle;tweet_id;tweet_text;tweet_author_id;tweet_conversation_id;tweet_created_at;tweet_in_reply_to_user_id;tweet_lang;tweet_possibly_sensitive;tweet_retweet_count;tweet_reply_count;tweet_like_count;tweet_quote_count;tweet_reply_settings;tweet_source;tweet_referenced_tweet_id;tweet_referenced_tweet_type;api_call
454981027;helgelindh;1530049950935048192;"Wählerstimmen statt Menschenleben. Diese zynische Priorisierung von 50 Senatoren, die eine Reform des US-Waffenrechts blockieren, hat @SteveKerr nach #Uvalde unmissverständlich benannt. Zugang zu Waffen muss scharf &amp; genau reguliert sein, in den USA &amp; in D, denken wir an #Hanau https://t.co/oZVCFG9cf6";454981027;1530049950935048192;2022-05-27 04:55:09+00:00;;de;False;7;16;40;1;everyone;Twitter for Android;1529246789290934272;quoted;2022-05-28 17:03:04.944772
454981027;helgelindh;1529004369936523265;"""Ein Gulag für Muslime"" (DER SPIEGEL). Recherchen beweisen den Horror in Folterlagern Chinas. Das ist antimuslimischer Rassismus in seiner brutalsten Form. Das Leiden der Uiguren geht uns alle an. Muslim*innen in Deutschland hatten uns schon lange gewarnt.
https://t.co/uIxr0w1wCy";454981027;1529004369936523265;2022-05-24 07:40:23+00:00;;de;False;19;14;55;4;everyone;Twitter for Android;;;2022-05-28 17:03:04.947439
454981027;helgelindh;1523261013516292098;"An die Deutschen, die bei der Gedenkstunde der ukrainischen Botschaft am Sowjet. Ehrenmal ""@MelnykAndrij raus, Nazis raus"" brüllen: Entnazifiziert euch selbst. Habt ihr mal von Babyn Jar &amp; dem deutschen Massenmord an Ukrainern gehört? Ihr seid eine Schande! Haltet euer Schandmaul";454981027;1523261013516292098;2022-05-08 11:18:21+00:00;;de;False;80;489;621;57;everyone;Twitter for Android;;;2022-05-28 17:03:04.951554
454981027;helgelindh;1519655397870686209;"#CDU lost. C. de Vries/CDU nennt meine Rede gegen einen AfD-Abschiebungsantrag ""Philosophie &amp; Sinnlosigkeit"": Ich verteidige Altkanzlerin Merkel gegen Anfeindungen der #AfD, er nennt eine Rückführungsoffensive hilfreich für die Ukraine-Aufnahme. - Lieber Philosophie als AfD light";454981027;1519655397870686209;2022-04-28 12:30:55+00:00;;de;False;12;25;73;3;everyone;Twitter for Android;;;2022-05-28 17:03:04.955244
454981027;helgelindh;1518263624443305984;"Wenn bei der Demo ""gegen die israelische Aggression in Jerusalem"" ""Scheiß Juden"", ""Ihr dreckigen Juden"", ""Drecksjude"" gebrüllt, Journalisten attackiert werden, ist das blanker Antisemitismus &amp; Volksverhetzung. Dass die Veranstalter das ermöglicht haben, ist so eine Schande.#b2304";454981027;1518263624443305984;2022-04-24 16:20:30+00:00;;de;False;114;557;929;38;everyone;Twitter for Android;;;2022-05-28 17:03:04.958880
454981027;helgelindh;1514874613561544706;"Dass die 🇺🇦 im Überlebenskampf mehr Waffen &amp; Embargos fordert, ist absolut legitim, verständlich. Dem müssen wir uns stellen. #Hofreiter &amp; #StrackZimmermann müssen sich indes der Frage stellen, ob es ihnen um die 🇺🇦 geht oder um wohlfeile Selbstinszenierung auf Kosten Dritter.";454981027;1514874613561544706;2022-04-15 07:53:47+00:00;;de;False;71;1134;604;185;everyone;Twitter for Android;;;2022-05-28 17:03:04.965106
454981027;helgelindh;1512419525223981056;RT @spdbt: Den #NoAfD-Antrag über den weiteren Umgang mit Geflüchteten nennt @helgelindh einen zusammengefriemelten Katalog des Rechtsbruch…;454981027;1512419525223981056;2022-04-08 13:18:08+00:00;;de;False;18;0;0;0;everyone;Twitter for iPhone;1512385535100260363;retweeted;2022-05-28 17:03:04.969331
454981027;helgelindh;1511778276175396869;"Butscha, Borodjanka, Mariupol - wir sehen Bilder, die in ihrer Grausamkeit nicht zu ertragen sind.
Es sind nicht nur Bilder. Wir sehen, was Menschen angetan wird. Mit dieser Bestialität dürfen wir uns nicht abfinden. Wir dürfen sie nicht „einpreisen“. Wir dürfen nicht abstumpfen.";454981027;1511778276175396869;2022-04-06 18:50:03+00:00;;de;False;23;63;183;6;everyone;Twitter for iPhone;;;2022-05-28 17:03:04.973054
454981027;helgelindh;1510965475810942979;@Susanne45217800 Sehr richtig und unbedingt zu ahnden.;454981027;1510928910611095552;2022-04-04 13:00:16+00:00;1092302848946331650;de;False;1;0;0;0;everyone;Twitter for iPhone;1510963760776765444;replied_to;2022-05-28 17:03:04.976548
454981027;helgelindh;1510963664102305796;RT @Hamza_Kurtovic: In Erinnerung und Gedenken an Hamza Kurtović. Heute wäre er 25 Jahre alt geworden. #HamzaKurtović https://t.co/Eyyk5jwu…;454981027;1510963664102305796;2022-04-04 12:53:04+00:00;;de;False;365;0;0;0;everyone;Twitter for iPhone;1510912297937649671;retweeted;2022-05-28 17:03:04.981757
454981027;helgelindh;1510928910611095552;"Auch wenn diese „Kundgebung“ eine absolute Schande angesichts der entsetzlichen Kriegsverbrechen in der Ukraine ist:
Meinungsfreiheit, Versammlungsfreiheit.
Das muss die Russ. Botschaft wundern, wo doch in 🇷🇺 jeder eingesperrt wird, der auch nur ein leeres Blatt Papier hochhält. https://t.co/mMOpeRvhD5";454981027;1510928910611095552;2022-04-04 10:34:58+00:00;;de;False;8;26;72;2;everyone;Twitter for iPhone;1510918910547304452;quoted;2022-05-28 17:03:04.985272
454981027;helgelindh;1510686826520092676;"Als Jugendlicher saß ich vor meinen Geschichtsbüchern und fragte mich angesichts der Gräuel des 2. Weltkrieges:
Wie konnte die Welt das zulassen?
Nun weiß ich es.
Ich schäme mich für jedes leichtfertig dahergesagtes „Nie Wieder“.
Es war nichts wert. #Bucha";454981027;1510686826520092676;2022-04-03 18:33:01+00:00;;de;False;228;314;1628;28;everyone;Twitter for iPhone;;;2022-05-28 17:03:04.989103
454981027;helgelindh;1508129905770389507;Krieg in Europa - die falsche Zeit für Spekulationen. #Bayer darf als Global Player für Gesundheit und Agrar nicht zum Spielball für asiatische Investoren werden. Auch der Standort in #Wuppertal käme dann unter die Räder. https://t.co/tfK33KjZqa;454981027;1508129905770389507;2022-03-27 17:12:43+00:00;;de;False;4;6;20;0;everyone;Twitter for iPhone;1507744976628817924;quoted;2022-05-28 17:03:04.992786
454981027;helgelindh;1507336942001737729;@DuezenTekkal Das darf nicht sein! Liebe Frau Tekkal, können wir hierzu telefonieren?;454981027;1507304081227931663;2022-03-25 12:41:46+00:00;2803260811;de;False;12;10;531;3;everyone;Twitter for iPhone;1507304081227931663;replied_to;2022-05-28 17:03:04.998000
454981027;helgelindh;1506632924665417730;"Die #noAfD lässt auch heute im Deutschen Bundestag keinen Zweifel daran: Sie ist Putins Handlanger-Partei und würde 🇩🇪 für einen Appel und ein Ei an den russischen Kriegsverbrecher verkaufen.
Verrat am angeblich so innig geliebten Vaterland - das ist der Patriotismus der #noAfD.";454981027;1506632924665417730;2022-03-23 14:04:15+00:00;;de;False;52;477;366;39;everyone;Twitter for iPhone;;;2022-05-28 17:03:05.001431
454981027;helgelindh;1505985949024624645;"Rassismus gehört zum Alltag so vieler Menschen in diesem Land.
#Rassismus bereitet den Boden für Gewalt und Terror. Rassismus macht diese Gesellschaft kaputt.
Rassismus erfordert energischen Widerspruch - in allen Situationen &amp; Lebenslagen.
Jeder Tag ist ein Tag gegen Rassismus.";454981027;1505985949024624645;2022-03-21 19:13:24+00:00;;de;False;14;31;89;4;everyone;Twitter for iPhone;;;2022-05-28 17:03:05.005045
454981027;helgelindh;1505178270043676676;"Man muss Putin nur zuhören. Er erkennt die ukrainische Kultur nicht an, er will sie zerstören. Wir fragen uns, was wir für die Ukraine tun können, ohne direkt in den Krieg einzugreifen.
Wir können &amp; müssen die Ukrainer*innen bei der Bewahrung &amp; Stärkung ihrer Kultur unterstützen. https://t.co/Za9VnH3Jc8";454981027;1505178270043676676;2022-03-19 13:43:59+00:00;;de;False;6;22;30;0;everyone;Twitter for iPhone;1503740809782476800;quoted;2022-05-28 17:03:05.008709
454981027;helgelindh;1504854808557146116;@KamilaSchroe @JannikMeyenburg Herzlich willkommen im Team, lieber Jannik!;454981027;1504852042170478596;2022-03-18 16:18:39+00:00;1100871985846980614;de;False;1;0;3;0;everyone;Twitter for iPhone;1504854379093966853;replied_to;2022-05-28 17:03:05.014408
454981027;helgelindh;1500865770242428928;"RT @ZwischenrufMdB: —@PetraPauMaHe (VPräs.): »Kollege Lindh, gestatten Sie eine Frage des Abgeordneten Brandner?«
—@helgelindh (SPD): »Selb…";454981027;1500865770242428928;2022-03-07 16:07:39+00:00;;de;False;19;0;0;0;everyone;Twitter for iPhone;1499386360486051842;retweeted;2022-05-28 17:03:05.018493
454981027;helgelindh;1500578475232555009;"Barbarisch ist Putins Angriffskrieg gegen die Zivilbevölkerung der Ukraine.
Barbarisch ist es, wenn Putin Flüchtende, Krankenhäuser, Wohngebiete bombardieren lässt.
Barbarisch sind Putins Kriegsverbrechen.
Wir sehen genau, was in der Ukraine passiert und wir werden nie vergessen. https://t.co/XKc2IQlGJ3";454981027;1500578475232555009;2022-03-06 21:06:02+00:00;;de;False;8;18;112;1;everyone;Twitter for iPhone;1500468102550724612;quoted;2022-05-28 17:03:05.021990
454981027;helgelindh;1499405210883661824;"will.
Vor diesem Hintergrund halte ich das europaweite Verbot von Sputnik &amp; Russia Today in der Abwägung für konsequent und richtig.
Mit Verboten allein werden wir in Putins Informationskrieg jedoch nicht bestehen.
Wir dürfen nie vergessen: Unsere stärkste Waffe ist die Freiheit.";454981027;1499405208408903682;2022-03-03 15:23:54+00:00;454981027;de;False;2;18;94;0;everyone;Twitter for iPhone;1499405208408903682;replied_to;2022-05-28 17:03:05.025902
454981027;helgelindh;1499405208408903682;"Putins Desinformationskampagne will Demokratien spalten &amp; destabilisieren.
Propaganda &amp; Lüge sind in Kriegszeiten tödlich. Gezielte Desinformation hat mit Journalismus nichts zu tun.
Eine freie Gesellschaft muss das nicht aushalten. Sie muss wehrhaft sein, wenn sie frei bleiben https://t.co/qfahQQ7JBT";454981027;1499405208408903682;2022-03-03 15:23:53+00:00;;de;False;22;25;174;0;everyone;Twitter for iPhone;;;2022-05-28 17:03:05.030941
454981027;helgelindh;1498972424469204999;RT @NancyFaeser: Wir helfen schnell und unbürokratisch. Geflüchtete aus der #Ukraine müssen kein Asylverfahren durchlaufen. Sie erhalten so…;454981027;1498972424469204999;2022-03-02 10:44:10+00:00;;de;False;330;0;0;0;everyone;Twitter for iPhone;1498910272043552769;retweeted;2022-05-28 17:03:05.034561
454981027;helgelindh;1498313515953709056;RT @RadioWuppertal: Die ersten Kriegsflüchtlinge aus der Ukraine sind in #Wuppertal eingetroffen. MdB @helgelindh sagt: Dank vieler hilfsbe…;454981027;1498313515953709056;2022-02-28 15:05:54+00:00;;de;False;9;0;0;0;everyone;Twitter for iPhone;1498313402669748224;retweeted;2022-05-28 17:03:05.038202
454981027;helgelindh;1497957739351318530;Dear people of Ukraine, Berlin stands with you - today, tomorrow and in the future. This is the power of democracy. This is a turning point in European history. #b2702 https://t.co/HxQrzbhhCb;454981027;1497957739351318530;2022-02-27 15:32:10+00:00;;en;False;50;32;467;3;everyone;Twitter for iPhone;;;2022-05-28 17:03:05.041781
454981027;helgelindh;1497892395328942085;"Wir können froh sein, dass der Bundeskanzler dieses Landes @OlafScholz und nicht @_FriedrichMerz heißt. 
Merz sagt keine Parteipolitik &amp; betreibt sie selbst kleinstkariert. Abwertung der Moral, persönliche Eitelkeiten, Effekthascherei - das ist der aktuellen Situation unwürdig.";454981027;1497892395328942085;2022-02-27 11:12:31+00:00;;de;False;22;62;243;2;everyone;Twitter for iPhone;;;2022-05-28 17:03:05.046617
454981027;helgelindh;1497882757313314820;Wer tatsächlich noch Zweifel hatte, kann sich gerade live davon überzeugen: Dieser @Bundeskanzler meint es ernst! Er meint es ernst bei der Bekämpfung von Putins Kriegsterror, bei der Unterstützung der Ukraine, bei der Verteidigung Europas und unserer demokratischen Werte! DANKE!;454981027;1497882757313314820;2022-02-27 10:34:13+00:00;;de;False;13;37;138;6;everyone;Twitter for iPhone;;;2022-05-28 17:03:05.050249
454981027;helgelindh;1497881562695802880;"Deutschland, schau Dir das Gebahren der AfD live im Bundestag an.
Ausbleibender Applaus bei der Rede von BK #Scholz, bei der Verurteilung von Putins Angriffskrieg, den Solidaritätsbekundungen gegenüber der Ukraine, beim Bekenntnis, Freiheit &amp; Demokratie in Europa zu verteidigen.";454981027;1497881562695802880;2022-02-27 10:29:28+00:00;;de;False;53;35;331;3;everyone;Twitter for iPhone;;;2022-05-28 17:03:05.053684
454981027;helgelindh;1497633982057353218;"Wir werden nicht verhindern können, dass die Sanktionen auch uns weh tun. 
Die tapferen Ukrainer*innen wehren sich mit allem, was sie haben. Wir müssen sie unterstützen. Es ist gut, dass nun Waffenlieferungen + SWIFT-Ban ermöglicht werden. Aber es muss jetzt sehr schnell gehen. https://t.co/wcdNsNu5UQ";454981027;1497633982057353218;2022-02-26 18:05:40+00:00;;de;False;13;23;99;5;everyone;Twitter for iPhone;1497626659415105538;quoted;2022-05-28 17:03:05.057264
454981027;helgelindh;1497298386093019141;"Wir haben die Ukrainer*innen militärisch im Stich gelassen.
Das Mindeste, das wir tun können, ist, den Geflüchteten Schutz &amp; Sicherheit in unserem Land zu bieten.
Wichtig zu wissen: Der Fluchtweg steht den Ukrainer*innen offen. Es gilt Visafreiheit,es braucht keine Registrierung. https://t.co/qmy7wC4bi7";454981027;1497298386093019141;2022-02-25 19:52:08+00:00;;de;False;10;24;62;2;everyone;Twitter for iPhone;1497268198873309185;quoted;2022-05-28 17:03:05.061527
454981027;helgelindh;1497276371080519683;"Zwei Präsidenten, die sich im Krieg befinden, sprechen zum Volk des jeweils anderen Staates.
Aus dem russischen Präsidenten spricht der blanke Hass.
Der ukrainische Präsident appelliert an die Menschlichkeit. https://t.co/lkcx2PidhE";454981027;1497276371080519683;2022-02-25 18:24:39+00:00;;de;False;49;19;219;2;everyone;Twitter for iPhone;;;2022-05-28 17:03:05.067012
454981027;helgelindh;1497227116638871559;"Ein deutscher Rechtsextremist bezieht sich auf die perfide Lügenpropaganda des Kriegsverbrechers Putin und fordert die Entnazifizierung der Ukraine.
Dümmer, dreister und verkommener geht es wirklich nicht mehr. #noAfD https://t.co/0ksMIEJXjS";454981027;1497227116638871559;2022-02-25 15:08:56+00:00;;de;False;66;71;468;11;everyone;Twitter for iPhone;;;2022-05-28 17:03:05.071269
454981027;helgelindh;1497113831486677006;"Es heißt: „Als erstes stirbt im Krieg die Wahrheit.“ Nein, es sterben gerade Menschen in der #Ukraine. Die Wahrheit ist schon längst gestorben. In Putins Krieg der Unterdrückung, Desinformation und Lüge. 
Wir können die Wahrheit aber aufleben lassen, gemeinsam für sie aufstehen. https://t.co/dufHOOR0W6";454981027;1497113831486677006;2022-02-25 07:38:47+00:00;;de;False;14;60;216;3;everyone;Twitter for iPhone;;;2022-05-28 17:03:05.075114
454981027;helgelindh;1496815550831509507;"die Demokratie.
Das Streben nach #Demokratie in der Ukraine, Belarus &amp; im eigenen Land. 
Das ist es, wovor Putin Angst hat. Das ist, wogegen er in den Krieg zieht. Diesen Krieg wird er nicht gewinnen. Er hat ihn schon verloren &amp; wird den Preis für seine Wahnsinnstaten zahlen. (4)";454981027;1496815546708500490;2022-02-24 11:53:31+00:00;454981027;de;False;4;20;89;0;everyone;Twitter for iPhone;1496815549397053448;replied_to;2022-05-28 17:03:05.079809
454981027;helgelindh;1496815549397053448;"wiederhergestellt hat, sondern als wahnsinniger Kriegsverbrecher &amp; Mörder, der die #Ukraine &amp; sein eigenes Land ins Unglück gestürzt hat.
Nie war die Formulierung „Angriff auf die Demokratie“ zutreffender. Putins Bomben treffen die Ukraine, sein eigentliches Angriffsziel ist (3)";454981027;1496815546708500490;2022-02-24 11:53:31+00:00;454981027;de;False;6;4;90;0;everyone;Twitter for iPhone;1496815548105211915;replied_to;2022-05-28 17:03:05.083828
454981027;helgelindh;1496815548105211915;"Nicht indem er #Russland modernisiert und die Wirtschaft in seinem Land stärkt. Darin hat er bitterlich versagt. Sondern indem er ein souveränes Land überfällt.
Putin wird in die Geschichtsbücher eingehen. Aber nicht als ruhmreicher Feldherr, der das Große Russische Reich… (2)";454981027;1496815546708500490;2022-02-24 11:53:30+00:00;454981027;de;False;4;4;79;1;everyone;Twitter for iPhone;1496815546708500490;replied_to;2022-05-28 17:03:05.087490
454981027;helgelindh;1496815546708500490;"Wir schauen mit Tränen in den Augen zu, wie die Panzer durch die Ukraine rollen. Die Ukrainer*innen sind militärisch auf sich selbst gestellt. Ihr Schicksal bricht einem das Herz. 
Die eigene Hilflosigkeit schmerzt, sie beschämt.
Präsident #Putin will sich ein Denkmal setzen. (1)";454981027;1496815546708500490;2022-02-24 11:53:30+00:00;;de;False;23;269;247;19;everyone;Twitter for iPhone;;;2022-05-28 17:03:05.091313
454981027;helgelindh;1496590098724495360;"Soll noch mal einer sagen, die CDU-Führung tue sich mit Abgrenzung schwer.
Wenn es um Klimaschutz geht, fällt die Distanzierung ganz leicht. 
Bei WerteUnion und Maaßen warten wir bis heute vergeblich auf ein klares Statement. https://t.co/8hlsOOBY5p";454981027;1496590098724495360;2022-02-23 20:57:39+00:00;;de;False;21;29;241;1;everyone;Twitter for iPhone;;;2022-05-28 17:03:05.095586
454981027;helgelindh;1496171623845711875;"Herzlich willkommen in einer neuen Welt, in der wir uns von mafiös agierenden Autokratien nicht mehr erpressen lassen.

@Bundeskanzler Scholz hat offensichtlich eine Sprache gefunden, die Putin und Konsorten sprechen. https://t.co/LUHOcEWPBF";454981027;1496171623845711875;2022-02-22 17:14:47+00:00;;de;False;8;25;65;3;everyone;Twitter for iPhone;1496112512915361798;quoted;2022-05-28 17:03:05.099584
454981027;helgelindh;1496128322253770755;"Putin ist ein lupenreiner Antidemokrat und imperialer Kriegstreiber. Daran gibt es spätestens seit seiner gestrigen Kriegsrede keinen Zweifel mehr.
Wer Putin verklärt, Verständnis für ihn äußert, äußert Verständnis für eine imperialistische, kriegerische Außenpolitik. #PutinsWar";454981027;1496128322253770755;2022-02-22 14:22:43+00:00;;de;False;108;554;1036;46;everyone;Twitter for iPhone;;;2022-05-28 17:03:05.102973
454981027;helgelindh;1495163891411832836;"Empathie, Menschlichkeit, Respekt - das hat der Politik dieses Landes so lange gefehlt.
Diese Geste braucht keine Worte mehr. Sie ist ein Zeichen der Solidarität. Sie ist Verpflichtung für die Zukunft.
Danke @NancyFaeser. 🖤 #Hanau https://t.co/ZSc2XLRM7p";454981027;1495163891411832836;2022-02-19 22:30:25+00:00;;de;False;28;46;287;4;everyone;Twitter for iPhone;1495022447678136324;quoted;2022-05-28 17:03:05.106723
454981027;helgelindh;1495076180831223815;"Ihre Menschlichkeit wirkt schier übermenschlich in Anbetracht ihres Leidens. 
Mit dem Hamza-Kurtović-Preis und der Bildungsinitiative FERHAT UNVAR haben sie ihren ermordeten Kindern ein lebendiges Denkmal gesetzt - mit dem Ziel andere Familien vor ihrem Schicksal zu bewahren. (2)";454981027;1495076177878339586;2022-02-19 16:41:53+00:00;454981027;de;False;6;1;41;0;everyone;Twitter for iPhone;1495076177878339586;replied_to;2022-05-28 17:03:05.110484
454981027;helgelindh;1495076177878339586;Armin Kurtović und Serpil Unvar zu begegnen ist unvergesslich. Ihre Kinder wurden in #Hanau ermordet. Sie hätten jeden Grund, diesem Staat nicht mehr zu vertrauen. Stattdessen kämpfen sie für Gerechtigkeit und gegen Strukturen des Rassismus, der Verschleierung, der Ignoranz. (1) https://t.co/hvMWdnjACT;454981027;1495076177878339586;2022-02-19 16:41:52+00:00;;de;False;13;12;108;0;everyone;Twitter for iPhone;;;2022-05-28 17:03:05.115142
454981027;helgelindh;1494625827018969091;RT @spdbt: Die Union habe die Debatte zu #Hanau missbraucht, um ein Ablenkungsmanöver mit dem typischen Reizreflex gegen Linksextremisten z…;454981027;1494625827018969091;2022-02-18 10:52:20+00:00;;de;False;41;0;0;0;everyone;Twitter for iPhone;1494603340814209026;retweeted;2022-05-28 17:03:05.118636
454981027;helgelindh;1494612983938490396;"RT @spdbt: ""Wir haben nicht ein #Antifa-Problem in diesem Land"", sagt @helgelindh. ""Nein, wir haben ein Faschismusproblem in diesem Land!""…";454981027;1494612983938490396;2022-02-18 10:01:18+00:00;;de;False;502;0;0;0;everyone;Twitter for iPhone;1494605648079822850;retweeted;2022-05-28 17:03:05.122198
454981027;helgelindh;1494419116735844360;RT @StefanAdamski1: Es spricht nun Genosse @helgelindh. Er bescheinigt der #CDUCSU ein Ablenkungsmanöver vom Gedenktag von #Hanau und #Trum…;454981027;1494419116735844360;2022-02-17 21:10:57+00:00;;de;False;14;0;0;0;everyone;Twitter for iPhone;1494413434552819714;retweeted;2022-05-28 17:03:05.125843
454981027;helgelindh;1494380585997029379;Die Verteilung der Rollen bleibt dann mal euch überlassen… https://t.co/cY54mdzX3R;454981027;1494380585997029379;2022-02-17 18:37:50+00:00;;de;False;3;9;24;0;everyone;Twitter for iPhone;1494365390109036545;quoted;2022-05-28 17:03:05.130720
454981027;helgelindh;1494262769327218695;"Die Union will uns heute i.S. Rechtsstaatlichkeit belehren. Sie stimmt dabei in die Diffamierungskampagne der AfD gegen Innenministerin Faeser ein &amp; schwingt die Linksextremismus-Keule.
Zeit, dieser Union den Spiegel vorzuhalten. Heute, 20 Uhr, in der Aktuellen Stunde im Plenum.";454981027;1494262769327218695;2022-02-17 10:49:40+00:00;;de;False;33;157;443;18;everyone;Twitter for iPhone;;;2022-05-28 17:03:05.134129
454981027;helgelindh;1492528646300606467;"Dieser Fall wie auch der in Wuppertal haben eine klare Botschaft. 1. Wir brauchen dringend den neuen Chancen-Aufenthalt &amp; das neue Bleiberecht, um diesen Irrsinn zu stoppen. 2. Mit Erlassen &amp; Rundbriefen müssen wir die Betroffenen schützen bis zur Verabschiedung der neuen Gesetze https://t.co/2hV4tUJ3jJ";454981027;1492528646300606467;2022-02-12 15:58:53+00:00;;de;False;14;19;85;1;everyone;Twitter for Android;;;2022-05-28 17:03:05.137482
454981027;helgelindh;1492499236533018632;„Ich bin überparteilich, aber ich werde nie neutral sein, wenn es um die Sache der Demokratie geht“ - Frank-Walter Steinmeier, mein Präsident. #meinpraesident https://t.co/oV05E81FWd;454981027;1492499236533018632;2022-02-12 14:02:01+00:00;;de;False;61;497;727;41;everyone;Twitter for iPhone;;;2022-05-28 17:03:05.141030
454981027;helgelindh;1492496558478307333;"Fälle wie dieser führen uns vor Augen, dass wir asyl- &amp; migrationspolitisch auf dem Irrweg waren.
Wir müssen der betroffenen Familie helfen + die Vereinbarungen aus dem KoaV umsetzen, damit sich Fr. Muradis Schicksal nicht wiederholt. Es gibt einen humanitären &amp; pragmatischen Weg https://t.co/2hV4tUJ3jJ";454981027;1492496558478307333;2022-02-12 13:51:23+00:00;;de;False;9;8;69;0;everyone;Twitter for iPhone;;;2022-05-28 17:03:05.144512
454981027;helgelindh;1492487373313253383;"@originalbrecht Das liest sich wahrlich grausam. Selbstverständlich helfe ich. Ich übersende Dir gleich meine Handynummer per DM. Lass uns gern telefonieren.
Vorab meinen herzlichsten Dank, dass Du auf diesen Fall aufmerksam gemacht hast.";454981027;1492240354476986368;2022-02-12 13:14:53+00:00;1309118599064412164;de;False;1;1;31;0;everyone;Twitter for iPhone;1492277815420628993;replied_to;2022-05-28 17:03:05.148746
454981027;helgelindh;1490298227232579587;Shame on you, CDU. Ich protestierte gestern mit dem @vvn_bda gegen Missbrauch der Shoah auf Querdenker-Demos. @NancyFaeser wird von der #CDU wegen eines Interviews zu Rechtsextremen im Magazin des VVN-BdA verhetzt. Wer mit Maaßen im Glashaus wohnt, sollte nicht mit Steinen werfen https://t.co/2KSWq8ss8x;454981027;1490298227232579587;2022-02-06 12:16:00+00:00;;de;False;132;301;1133;37;everyone;Twitter for Android;;;2022-05-28 17:03:05.152718
454981027;helgelindh;1489480424774672384;Es lebe der freie, unabhängige Journalismus. Ich kann als Betroffener bezeugen, wie sehr sich  die desinformative Stimmungsmache von #RTDeutsch zu Covid-19 von der Berichterstattung der @DeutscheWelle unterscheidet. Medienpolitik darf nicht zum vorgezogenen Schlachtfeld werden.;454981027;1489480424774672384;2022-02-04 06:06:21+00:00;;de;False;47;354;340;31;everyone;Twitter for Android;;;2022-05-28 17:03:05.156733
454981027;helgelindh;1488948052861886470;"Stoppt die Politik der Vergleiche.#Amnesty muss reagieren. Die Sprache gegenüber Israel, der Begriff der Apartheid sind historisch falsch &amp; bedienen alte &amp; neue antisemitische Stereotype. So schwächt Amnesty im Ergebnis seinen Einsatz für die Lage der Palästinenser*innen massiv";454981027;1488948052861886470;2022-02-02 18:50:53+00:00;;de;False;16;35;124;2;everyone;Twitter for Android;;;2022-05-28 17:03:05.160808
454981027;helgelindh;1487042179453313025;RT @NurderK: @helgelindh on Fire. https://t.co/zWPdgBHTX4;454981027;1487042179453313025;2022-01-28 12:37:38+00:00;;en;False;73;0;0;0;everyone;Twitter for iPhone;1487034209701175297;retweeted;2022-05-28 17:03:05.166479
454981027;helgelindh;1487041630347710468;"RT @spdbt: Die #noAfD wirft Frank-Walter #Steinmeier im #Bundestag ""Unprofessionalität"" und einen ""Hang zum Linksextremismus"" vor. Für @hel…";454981027;1487041630347710468;2022-01-28 12:35:27+00:00;;de;False;23;0;0;0;everyone;Twitter for iPhone;1487035523076087810;retweeted;2022-05-28 17:03:05.170501
454981027;helgelindh;1486392835872014341;RT @phoenix_de: MdB @helgelindh @spdbt plädiert für eine #FehlerKultur in der Diskussion zur #ImpfPflicht im #Bundestag. Es brauche eine mo…;454981027;1486392835872014341;2022-01-26 17:37:22+00:00;;de;False;16;0;0;0;everyone;Twitter for iPhone;1486390837147836423;retweeted;2022-05-28 17:03:05.175830
454981027;helgelindh;1486388100901351426;RT @spdbt: Weil sich die Opposition gerade am Vorwurf ergötzt, der Kanzler führe in der #Impfpflicht-Frage zu wenig, hilft @helgelindh gern…;454981027;1486388100901351426;2022-01-26 17:18:33+00:00;;de;False;6;0;0;0;everyone;Twitter for iPhone;1486386471032561666;retweeted;2022-05-28 17:03:05.183567
