twitter_id;twitter_handle;tweet_id;tweet_text;tweet_author_id;tweet_conversation_id;tweet_created_at;tweet_in_reply_to_user_id;tweet_lang;tweet_possibly_sensitive;tweet_retweet_count;tweet_reply_count;tweet_like_count;tweet_quote_count;tweet_reply_settings;tweet_source;tweet_referenced_tweet_id;tweet_referenced_tweet_type;api_call
1411676203224870912;goerke_c;1465674531650121738;Ab Februar gibt es bei mir im Bundestagsbüro einen Praktikumsplatz. Wer die Arbeit im Bundestag kennenlernen möchte und sich für Finanzpolitik interessiert, kann sich gerne bewerben: https://t.co/KT5uZcMTsg;1411676203224870912;1465674531650121738;2021-11-30 13:30:13+00:00;;de;False;6;1;59;0;everyone;Twitter Web App;;;2022-05-28 18:01:39.251589
1411676203224870912;goerke_c;1465358239319666690;Die neue Koalition muss endlich einen Plan vorlegen, wie kleine Einkommen den absehbar teuren Winter überstehen sollen!;1411676203224870912;1465358232768192512;2021-11-29 16:33:23+00:00;1411676203224870912;de;False;0;0;15;0;everyone;Twitter Web App;1465358237713276943;replied_to;2022-05-28 18:01:39.259180
1411676203224870912;goerke_c;1465358237713276943;Auch die notwendige Reform der Pendlerpauschale wird nicht angegangen. Neben einer gerechten Steuerreform braucht es eine Einmalzahlung für alle, die von Armut gefährdet sind. Auch die Impfprämie hätte den Preisschock teilweise kompensieren können.;1411676203224870912;1465358232768192512;2021-11-29 16:33:23+00:00;1411676203224870912;de;False;0;1;13;0;everyone;Twitter Web App;1465358235964260365;replied_to;2022-05-28 18:01:39.263099
1411676203224870912;goerke_c;1465358235964260365;Pendler, Malocher und Geringverdiener müssen endlich entlastet werden. Alle drei Ampel-Parteien sich im Wahlkampf noch als große Steuersenker gegeben, im Koalitionsvertrag wurde das Kapitel aber scheinbar vergessen.;1411676203224870912;1465358232768192512;2021-11-29 16:33:23+00:00;1411676203224870912;de;False;0;1;10;0;everyone;Twitter Web App;1465358234290728969;replied_to;2022-05-28 18:01:39.267419
1411676203224870912;goerke_c;1465358234290728969;Der Steuereffekt verschwindet im Januar und die Lieferketten werden nach der Pandemie wieder laufen, was aber ist mit den Energiepreisen? Wie sollen kleine Einkommen den teuren Winter überstehen? Die Ampel hat hier keine Antworten!;1411676203224870912;1465358232768192512;2021-11-29 16:33:22+00:00;1411676203224870912;de;False;0;1;12;0;everyone;Twitter Web App;1465358232768192512;replied_to;2022-05-28 18:01:39.273229
1411676203224870912;goerke_c;1465358232768192512;Die höheren Preise treffen kleine Geldbeutel hart. Das Inflationsgespenst ist aber nicht aus der Flasche. Die höhere Inflationsrate kommt von der temporären Mehrwertsteuersenkung, den gebrochenen Lieferketten und den hohen Energiepreisen.;1411676203224870912;1465358232768192512;2021-11-29 16:33:22+00:00;;de;False;13;4;72;0;everyone;Twitter Web App;;;2022-05-28 18:01:39.277893
1411676203224870912;goerke_c;1464560121170776069;RT @katjakipping: Ist das #Bürgergeld das Ende von #HartzIV oder reine PR für die #Ampel? Worte allein füllen keinen Kühlschrank - deshalb…;1411676203224870912;1464560121170776069;2021-11-27 11:41:57+00:00;;de;False;47;0;0;0;everyone;Twitter for iPhone;1464213530706690050;retweeted;2022-05-28 18:01:39.282024
1411676203224870912;goerke_c;1463543143417143299;"Auch bei Investitionen muss ein Fragezeichen gemacht werden. Wie viel Geld investiert wird, verrät die Ampel nicht. Es gleicht einer Rosstäuscherei. Es ist leichtfertig, dass SPD &amp; Grüne keine Summen festgelegt haben, aber Christian Lindner mit zugenähten Taschen ins BMF lassen.";1411676203224870912;1463542578687709185;2021-11-24 16:20:51+00:00;1411676203224870912;de;False;3;0;36;0;everyone;Twitter Web App;1463542578687709185;replied_to;2022-05-28 18:01:39.287039
1411676203224870912;goerke_c;1463542578687709185;Der Koalitionsvertrag ist ein steuerpolitischer Offenbarungseid. Alle drei Ampel-Parteien haben im Wahlkampf die steuerliche Entlastung von Geringverdienern und Mittelschicht gefordert. Herausgekommen ist eine Niete. Das Steuerkapitel ist EINE jämmerliche DIN-A4 Seite lang.;1411676203224870912;1463542578687709185;2021-11-24 16:18:36+00:00;;de;False;26;4;223;2;everyone;Twitter Web App;;;2022-05-28 18:01:39.293049
1411676203224870912;goerke_c;1463537633867489285;RT @andreaspetzold: Stecknadel-Moment: Ein holländischer Journalisten-Kollege zerbröselt die Euphorie in der PK zum #Koalitionsvertrag. Er…;1411676203224870912;1463537633867489285;2021-11-24 15:58:57+00:00;;de;False;66;0;0;0;everyone;Twitter for iPad;1463523289981202437;retweeted;2022-05-28 18:01:39.297485
1411676203224870912;goerke_c;1461606425843675137;Um weitere Corona-Wellen zu vermeiden, braucht es einen Impfturbo. Mein Vorschlag: eine Impfprämie für alle, die heute schon geimpft sind, und für die, die es bis Jahresende nachholen. Nichts ist teurer für Wirtschaft und Gesellschaft als die Notwendigkeit weiterer Lockdowns!;1411676203224870912;1461606422341369862;2021-11-19 08:05:01+00:00;1411676203224870912;de;False;0;0;13;0;everyone;Twitter Web App;1461606424161759233;replied_to;2022-05-28 18:01:39.301815
1411676203224870912;goerke_c;1461606424161759233;Soloselbstständige, Kleinunternehmer und Freiberufler fallen durch das Hilfenraster. Warum? Weil sie sich keine eigenen Gehälter zahlen und den Lebensunterhalt aus ihrem Betrieb zahlen. Dafür gibt es bis heute keinen Ersatz! Deshalb: fiktiver Unternehmerlohn von 1.200€!;1411676203224870912;1461606422341369862;2021-11-19 08:05:01+00:00;1411676203224870912;de;False;0;1;12;0;everyone;Twitter Web App;1461606422341369862;replied_to;2022-05-28 18:01:39.309112
1411676203224870912;goerke_c;1461606422341369862;Unsicherheit ist Gift für die Wirtschaft. Gut, dass die Hilfen für Betriebe verlängert wurden. Damit die Winterhilfen nicht wieder erst zu Ostern kommen, müssen direkte Anträge ohne Steuerberater ermöglicht werden. Außerdem sind die Hilfen immer noch zu löchrig!;1411676203224870912;1461606422341369862;2021-11-19 08:05:01+00:00;;de;False;9;2;70;0;everyone;Twitter Web App;;;2022-05-28 18:01:39.313329
1411676203224870912;goerke_c;1461362503150047246;Im Wahlkampf war die FDP noch konsequent gegen höhere Steuern, jetzt trägt sie noch vor dem Koalitionsvertrag die erste Steuererhöhung durch die Hintertür mit und greift den Pauschallandwirten in die Kasse! https://t.co/OhyhjvunMH;1411676203224870912;1461362503150047246;2021-11-18 15:55:46+00:00;;de;False;10;3;50;0;everyone;Twitter Web App;;;2022-05-28 18:01:39.317184
1411676203224870912;goerke_c;1460963140582137864;RT @goerke_c: Die Lage erfordert ein Umdenken. Zeit für Pragmatismus. Deshalb: Impfprämie! 300€ für den vollständigen Schutz, 200€ für den…;1411676203224870912;1460963140582137864;2021-11-17 13:28:50+00:00;;de;False;194;0;0;0;everyone;Twitter Web App;1460869060401324037;retweeted;2022-05-28 18:01:39.323397
1411676203224870912;goerke_c;1460939799834021893;RT @FabioDeMasi: Große Aufregung, aber sinnvoll! Ich habe diesen Vorschlag bereits einmal vor Monaten gemacht. Würde uns Debatte zu Impfpfl…;1411676203224870912;1460939799834021893;2021-11-17 11:56:05+00:00;;de;False;30;0;0;0;everyone;Twitter Web App;1460938752206024710;retweeted;2022-05-28 18:01:39.327811
1411676203224870912;goerke_c;1460932036194095104;RT @Eva0112: Steigende Inzidenzen, überlastete Intensivstationen und politische Planlosigkeit einer nur noch geschäftsführenden Bundesregie…;1411676203224870912;1460932036194095104;2021-11-17 11:25:14+00:00;;de;False;21;0;0;0;everyone;Twitter Web App;1460927736260792321;retweeted;2022-05-28 18:01:39.331568
1411676203224870912;goerke_c;1460921795402518531;Auch die Berliner Zeitung hat den Vorschlag bereits aufgegriffen: https://t.co/gHqoVHxEXV;1411676203224870912;1460921782324633600;2021-11-17 10:44:33+00:00;1411676203224870912;de;False;0;0;13;0;everyone;Twitter Web App;1460921794068635652;replied_to;2022-05-28 18:01:39.336593
1411676203224870912;goerke_c;1460921794068635652;Mit @tonline habe ich über den Vorschlag schon gesprochen: https://t.co/tksbCAIx3N;1411676203224870912;1460921782324633600;2021-11-17 10:44:32+00:00;1411676203224870912;de;False;0;1;10;0;everyone;Twitter Web App;1460921792361648130;replied_to;2022-05-28 18:01:39.341448
1411676203224870912;goerke_c;1460921792361648130;Die Kosten der Pandemie und der dadurch notwendigen Einschränkungen schaden der Wirtschaft und dem gesellschaftlichen Zusammenhalt um ein Vielfaches!;1411676203224870912;1460921782324633600;2021-11-17 10:44:32+00:00;1411676203224870912;de;False;0;1;9;0;everyone;Twitter Web App;1460921791048785923;replied_to;2022-05-28 18:01:39.345259
1411676203224870912;goerke_c;1460921791048785923;Für den Haushalt ist die Nettobelastung problemlos verkraftbar. Deutschland kann sich immer noch zu negativen Renditen verschulden. Außerdem kurbelt die Prämie auch die Wirtschaft an und sorgt so für steigende Steuereinnahmen.;1411676203224870912;1460921782324633600;2021-11-17 10:44:32+00:00;1411676203224870912;de;False;0;1;14;0;everyone;Twitter Web App;1460921789652127749;replied_to;2022-05-28 18:01:39.349391
1411676203224870912;goerke_c;1460921789652127749;Vor allem Kleinbetriebe, Geringverdiener und Mittelschicht wurden von der Corona-Wellen hart getroffen und können die Prämie gut gebrauchen. Ein neuer Lockdown oder neue Einschränkungen wären für die Wirtschaft und den Staat viel teurer.;1411676203224870912;1460921782324633600;2021-11-17 10:44:31+00:00;1411676203224870912;de;False;0;2;11;0;everyone;Twitter Web App;1460921788288966659;replied_to;2022-05-28 18:01:40.041412
1411676203224870912;goerke_c;1460921788288966659;Damit setzen wir nicht nur den so wichtigen positiven Anreiz zum Impfen, sondern stärken auch den Zusammenhalt der Gesellschaft, der unter der bisherigen Corona-Politik stark gelitten hat.;1411676203224870912;1460921782324633600;2021-11-17 10:44:31+00:00;1411676203224870912;de;False;0;1;8;0;everyone;Twitter Web App;1460921786858713090;replied_to;2022-05-28 18:01:40.049004
1411676203224870912;goerke_c;1460921786858713090;Die Prämie gibt es selbstverständlich auch für alle rückwirkend, die bereits geimpft oder genesen sind. Macht 500€ steuerfreie Impfprämie für alle! Sie muss schnellstmöglich ausgezahlt werden, um das Weihnachtsgeschäft anzukurbeln.;1411676203224870912;1460921782324633600;2021-11-17 10:44:31+00:00;1411676203224870912;de;False;0;2;12;0;everyone;Twitter Web App;1460921785352966146;replied_to;2022-05-28 18:01:40.057857
1411676203224870912;goerke_c;1460921785352966146;Meinem Vorschlag nach bekommen alle, die bis Weihnachten vollständig geimpft sind, eine Prämie von 300€ und bei der Booster-Impfung (in angemessenem Abstand zur Erstimpfung) nochmal 200 € Prämie obendrauf!;1411676203224870912;1460921782324633600;2021-11-17 10:44:30+00:00;1411676203224870912;de;False;0;1;8;0;everyone;Twitter Web App;1460921783796776961;replied_to;2022-05-28 18:01:40.066755
1411676203224870912;goerke_c;1460921783796776961;Es braucht jetzt pragmatische Maßnahmen, die schnell die Impfquote erhöhen, die Intensivstationen entlasten und die Gesellschaft nicht weiter spalten. Private Unternehmen zahlen teilweise ein Vielfaches als Prämie.;1411676203224870912;1460921782324633600;2021-11-17 10:44:30+00:00;1411676203224870912;de;False;0;1;9;0;everyone;Twitter Web App;1460921782324633600;replied_to;2022-05-28 18:01:40.214781
1411676203224870912;goerke_c;1460921782324633600;Warum wehrt die Bundesregierung sich immer noch gegen ökonomische Anreize wie eine Impfprämie gegen die Impfmüdigkeit? Mein Vorschlag: 500€ steuerfreie Impfprämie!;1411676203224870912;1460921782324633600;2021-11-17 10:44:30+00:00;;de;False;10;11;166;1;everyone;Twitter Web App;;;2022-05-28 18:01:40.221788
1411676203224870912;goerke_c;1460917874785140743;RT @berlinerzeitung: Der Abgeordnete @goerke_c regt an, über 37 Milliarden Euro aus dem Bundeshaushalt zur Verfügung zu stellen, um #Impfan…;1411676203224870912;1460917874785140743;2021-11-17 10:28:58+00:00;;de;False;8;0;0;0;everyone;Twitter Web App;1460916921990356992;retweeted;2022-05-28 18:01:40.239391
1411676203224870912;goerke_c;1460869060401324037;"Die Lage erfordert ein Umdenken. Zeit für Pragmatismus. Deshalb: Impfprämie! 300€ für den vollständigen Schutz, 200€ für den Booster. Auch rückwirkend für die, die heute schon geimpft sind. Gut für die Pandemie, den Geldbeutel und die Wirtschaft!
https://t.co/dPh0ivecnD";1411676203224870912;1460869060401324037;2021-11-17 07:15:00+00:00;;de;False;194;148;1220;80;everyone;Twitter Web App;;;2022-05-28 18:01:40.249435
1411676203224870912;goerke_c;1460182174653730821;Mit der Impfprämie können Menschenleben, das Weihnachtsfest und das Geschäft für viele Betriebe gerettet werden!;1411676203224870912;1460182169427578880;2021-11-15 09:45:33+00:00;1411676203224870912;de;False;0;1;13;0;everyone;Twitter Web App;1460182173063995397;replied_to;2022-05-28 18:01:40.265899
1411676203224870912;goerke_c;1460182173063995397;Wenn Kanzleramtschef Helge Braun 20 Mio. Booster-Impfungen bis Weihnachten fordert, warum nicht mit 200€ Impfprämie für das Weihnachtsfest belohnen? Jeder Euro gegen die Pandemie ist ein gut investierter Euro!;1411676203224870912;1460182169427578880;2021-11-15 09:45:33+00:00;1411676203224870912;de;False;1;2;13;0;everyone;Twitter Web App;1460182171310772224;replied_to;2022-05-28 18:01:40.277648
1411676203224870912;goerke_c;1460182171310772224;Immer mehr Betriebe arbeiten schon mit Impfprämien! Die Verhaltensökonomin Nora Szech empfiehlt dies schon seit dem Sommer. Wo stünden wir heute, wenn jeder vollständige Impfschutz prämiert worden wäre?;1411676203224870912;1460182169427578880;2021-11-15 09:45:33+00:00;1411676203224870912;de;False;1;2;10;0;everyone;Twitter Web App;1460182169427578880;replied_to;2022-05-28 18:01:40.291348
1411676203224870912;goerke_c;1460182169427578880;Es braucht jetzt pragmatische Lösungen, die schnell die Impfquote erhöhen, die Intensivstationen entlasten und die Gesellschaft nicht weiter spalten. Warum wehrt die Bundesregierung sich immer noch gegen ökonomische Anreize wie eine Impfprämie?;1411676203224870912;1460182169427578880;2021-11-15 09:45:32+00:00;;de;False;9;14;97;0;everyone;Twitter Web App;;;2022-05-28 18:01:40.333809
1411676203224870912;goerke_c;1459172892462227462;"Das Impfdebakel hätte es wohl nicht gegeben, wenn schon ab Sommer mit großzügiger Impfprämie, vernünftiger Kommunikation und vielen mobilen Impfteams agiert worden wäre.

Die Impfprämie sollte jetzt vor Weihnachten nachgeholt werden.";1411676203224870912;1459172892462227462;2021-11-12 14:55:02+00:00;;de;False;3;10;48;3;everyone;Twitter Web App;;;2022-05-28 18:01:40.349474
1411676203224870912;goerke_c;1458810235821432837;Die Steuerreform für Landwirte ist symptomatisch für die Schlafwagenpolitik der letzten Jahre. Der Gesetzentwurf stellt vor allem Kleinbetriebe schlechter und geht an Lebensrealität der hart schuftenden Landwirte vorbei! https://t.co/MAPEgVhnK7;1411676203224870912;1458810235821432837;2021-11-11 14:53:58+00:00;;de;False;3;3;39;0;everyone;Twitter Web App;;;2022-05-28 18:01:40.364312
1411676203224870912;goerke_c;1458431758794432514;Der Bundesrechungshof will den Kürzungshammer für den Sozialstaat. Im Vergleich mit den internationalen Debatten scheint man finanzpolitisch nicht auf der Höhe der Zeit zu sein.;1411676203224870912;1458431758794432514;2021-11-10 13:50:02+00:00;;de;False;3;1;38;0;everyone;Twitter Web App;;;2022-05-28 18:01:40.369318
1411676203224870912;goerke_c;1458403822338990086;Die Eurozone braucht die deutsche Bereitschaft zum ökonomischen Kurswechsel. Ansonsten verliert die Eurozone auch international den Anschluss!;1411676203224870912;1458403817893027842;2021-11-10 11:59:01+00:00;1411676203224870912;de;False;0;1;12;0;everyone;Twitter Web App;1458403820908826626;replied_to;2022-05-28 18:01:40.374903
1411676203224870912;goerke_c;1458403820908826626;Das gleiche gilt auch für die europäischen Regeln. Die 60%-Schuldengrenze und die harte Einschränkung für die Neuverschuldung sind weltfremd und müssen auf den OP-Tisch. Wenn die Ampel in Brüssel blockiert, kommt die europäische Wirtschaft nicht wieder auf die Beine.;1411676203224870912;1458403817893027842;2021-11-10 11:59:01+00:00;1411676203224870912;de;False;0;2;10;0;everyone;Twitter Web App;1458403819457556483;replied_to;2022-05-28 18:01:40.378643
1411676203224870912;goerke_c;1458403819457556483;Deutschland lebt seit Jahren auf Kosten der Infrastruktur. Das merkt man bei der Bahn, bei den Schulen und beim Bürgeramt. Mit einer harten Schuldenbremse werden die notwendigen Klimaschutz-Investitionen kaum zu realisieren sein.;1411676203224870912;1458403817893027842;2021-11-10 11:59:01+00:00;1411676203224870912;de;False;1;1;8;0;everyone;Twitter Web App;1458403817893027842;replied_to;2022-05-28 18:01:40.382571
1411676203224870912;goerke_c;1458403817893027842;"Das Gutachten der Wirtschaftsweisen sollte nicht als Ratschlag für eine mögliche Ampel-Regierung verstanden werden. Das Patt der Sachverständige in der Frage der Schuldenbremse ist fatal. 

Wir brauchen eine Investitionsoffensive statt neuem Sparkurs!";1411676203224870912;1458403817893027842;2021-11-10 11:59:00+00:00;;de;False;5;3;61;0;everyone;Twitter Web App;;;2022-05-28 18:01:40.387557
1411676203224870912;goerke_c;1457699307881222144;Die Pendlerpauschale geht an Geringverdienern vorbei, pämpert dafür aber Manager, denen der Benzinpreis egal ist. Wie die Verbraucherschützer fordern auch wir ein Mobilitätsgeld, das unabhängig vom Einkommen ist!;1411676203224870912;1457699305767284737;2021-11-08 13:19:32+00:00;1411676203224870912;de;False;0;0;14;0;everyone;Twitter Web App;1457699305767284737;replied_to;2022-05-28 18:01:40.392508
1411676203224870912;goerke_c;1457699305767284737;Mondpreise an Tankstellen sind ohne Alternativen kein vernünftiger Klimaschutz - ganz im Gegenteil! Wenn die Zapfsäule so viel vom Monatslohn frisst, dass an anderer Stelle gespart werden muss, verliert Klimaschutz an Akzeptanz!;1411676203224870912;1457699305767284737;2021-11-08 13:19:31+00:00;;de;False;4;4;40;0;everyone;Twitter Web App;;;2022-05-28 18:01:40.396425
1411676203224870912;goerke_c;1457636543489888258;"Die Zapfsäule darf nicht zum Lohnfresser werden!

https://t.co/HvRd1A2tip";1411676203224870912;1457636543489888258;2021-11-08 09:10:08+00:00;;de;False;5;1;34;2;everyone;Twitter Web App;;;2022-05-28 18:01:40.400677
1411676203224870912;goerke_c;1456625395495804929;"Riesige Vermögensberge sind ein Klimakiller! Vermögen endlich richtig besteuern!

https://t.co/hUK2jN9tk7";1411676203224870912;1456625395495804929;2021-11-05 14:12:11+00:00;;de;False;5;4;51;1;everyone;Twitter Web App;;;2022-05-28 18:01:40.405895
1411676203224870912;goerke_c;1456602493916491782;Mehr Geld für Bus und Bahn. Viel mehr Geld!;1411676203224870912;1456602493916491782;2021-11-05 12:41:11+00:00;;de;False;1;0;24;0;everyone;Twitter Web App;;;2022-05-28 18:01:40.410214
1411676203224870912;goerke_c;1456351490851983369;Die Verkehrswende wird mit erstklassiger öffentlicher Bahn gelingen oder sie wird NICHT gelingen. Die Ampel ist auf Abwegen!;1411676203224870912;1456351490851983369;2021-11-04 20:03:47+00:00;;de;False;38;22;516;1;everyone;Twitter Web App;;;2022-05-28 18:01:40.413926
1411676203224870912;goerke_c;1456273996031291407;In Deutschland wird Arbeit im Vergleich zu anderen Ländern sehr hoch und Vermögen sehr wenig besteuert. Da ist eindeutig etwas schief!;1411676203224870912;1456273996031291407;2021-11-04 14:55:51+00:00;;de;False;98;22;1250;9;everyone;Twitter Web App;;;2022-05-28 18:01:40.417770
1411676203224870912;goerke_c;1456204834206535681;Entscheidend sind massive staatliche Investitionen in Bus und Bahn sowie ein Stopp des Mietwuchers!;1411676203224870912;1456204831169916930;2021-11-04 10:21:02+00:00;1411676203224870912;de;False;1;1;11;0;everyone;Twitter Web App;1456204832696676355;replied_to;2022-05-28 18:01:40.424943
1411676203224870912;goerke_c;1456204832696676355;Wer sich die steigenden Mieten in den Innenstädten nicht leisten kann, pendelt nicht freiwillig und wird auch nicht seine Wege reduzieren, wenn man ihn mit höheren Spritpreisen bestraft. Das ist weltfremd!;1411676203224870912;1456204831169916930;2021-11-04 10:21:01+00:00;1411676203224870912;de;False;1;1;7;0;everyone;Twitter Web App;1456204831169916930;replied_to;2022-05-28 18:01:40.429360
1411676203224870912;goerke_c;1456204831169916930;"Die Mondpreise an Tankstellen sind kein vernünftiger Beitrag zum Klimaschutz. Im Gegenteil: Sie verspielen die Akzeptanz der Menschen! 

https://t.co/8fVf4Yzl30";1411676203224870912;1456204831169916930;2021-11-04 10:21:01+00:00;;de;False;5;8;22;0;everyone;Twitter Web App;;;2022-05-28 18:01:40.434025
1411676203224870912;goerke_c;1456200538773770242;Entweder als Senkung ihrer Einkommensteuerschuld oder als direkte Auszahlung, wenn keine oder zu wenig Einkommensteuerschuld besteht!;1411676203224870912;1456200532922716161;2021-11-04 10:03:57+00:00;1411676203224870912;de;False;0;1;11;0;everyone;Twitter Web App;1456200536513040387;replied_to;2022-05-28 18:01:40.442299
1411676203224870912;goerke_c;1456200536513040387;Wer so wenig verdient, dass er kaum Einkommensteuer zahlt, guckt fast stärker in die Röhre! Die Pendlerpauschale muss durch ein Mobilitätsgeld ersetzt werden, dass alle Beschäftigte als einen festen Betrag pro Entfernungskilometer erhalten.;1411676203224870912;1456200532922716161;2021-11-04 10:03:57+00:00;1411676203224870912;de;False;1;2;18;0;everyone;Twitter Web App;1456200534646472704;replied_to;2022-05-28 18:01:40.456510
1411676203224870912;goerke_c;1456200534646472704;Das muss sogar Prof. Clemens Fuest vom Ifo-Institut zugeben. Da die Pauschale das zu versteuernde Einkommen senkt, bekommt der Konzernmanager eine größere Steuerentlastung pro Kilometer als der Facharbeiter.;1411676203224870912;1456200532922716161;2021-11-04 10:03:57+00:00;1411676203224870912;de;False;0;1;15;0;everyone;Twitter Web App;1456200532922716161;replied_to;2022-05-28 18:01:40.549998
1411676203224870912;goerke_c;1456200532922716161;"Pendler entlasten, aber richtig!

Die hohen Spritpreise fressen die Löhne der Mittelschicht auf. Um für Entlastung zu sorgen, muss man an die Pendlerpauschale ran. Die hat einen schweren Konstruktionsfehler und ist ungerecht!";1411676203224870912;1456200532922716161;2021-11-04 10:03:56+00:00;;de;False;7;10;75;1;everyone;Twitter Web App;;;2022-05-28 18:01:40.561924
1411676203224870912;goerke_c;1455864613984219136;Man sollte die Ampel daran messen, ob sie die versprochene Steuerentlastung für die große Mehrheit umsetzt und eine Investitionsoffensive einläutet. Ich habe daran große Zweifel!;1411676203224870912;1455864613984219136;2021-11-03 11:49:07+00:00;;de;False;15;6;197;6;everyone;Twitter Web App;;;2022-05-28 18:01:40.571411
1411676203224870912;goerke_c;1451170959680057351;Hier müsste die Ampel anpacken, doch stattdessen schweigt sie im Sondierungspapier auch zum größten Steuerskandal der Geschichte!;1411676203224870912;1451170955565408257;2021-10-21 12:58:12+00:00;1411676203224870912;de;False;2;0;4;0;everyone;Twitter Web App;1451170957511598081;replied_to;2022-05-28 18:01:40.577213
1411676203224870912;goerke_c;1451170957511598081;Es braucht endlich einen automatisierten IT-gestützten Abgleich aller Erstattungsanträge mit den tatsächlich gezahlten Kapitalertragssteuern, internationalen Austausch der Expertise und eine personelle Aufstockung von deutschen Finanzverwaltungen.;1411676203224870912;1451170955565408257;2021-10-21 12:58:12+00:00;1411676203224870912;de;False;3;1;9;0;everyone;Twitter Web App;1451170955565408257;replied_to;2022-05-28 18:01:40.581899
1411676203224870912;goerke_c;1451170955565408257;Die neuen CumEx-Enthüllungen zeigen wieder das riesige Ausmaß des Betrugs. Dabei hat der mögliche Kanzler Olaf Scholz dem Steuerbetrug keinen Riegel vorgeschoben und verdächtige Erinnerungslücken bis heute nicht aufklären können.;1411676203224870912;1451170955565408257;2021-10-21 12:58:11+00:00;;de;False;7;1;19;0;everyone;Twitter Web App;;;2022-05-28 18:01:40.586462
1411676203224870912;goerke_c;1450738597309603844;Sie nimmt mit ihrem Anti-Russland-Kurs billigend in Kauf, dass die Energiepreise weiter steigen. Das wäre fatal für die Menschen, die jetzt schon kaum wissen, wie sie ihre oftmals saftigen Nachzahlungen begleichen sollen.;1411676203224870912;1450738595501850624;2021-10-20 08:20:09+00:00;1411676203224870912;de;False;5;0;34;0;everyone;Twitter Web App;1450738595501850624;replied_to;2022-05-28 18:01:40.593998
1411676203224870912;goerke_c;1450738595501850624;Nord Stream 2 nicht in Betrieb zu nehmen, wäre Irrsinn. Dass wir russisches Gas nicht brauchen, ist eine Märchenstunde aus dem Hause Baerbock und ganz klar außenpolitisch und nicht energiepolitisch motiviert.;1411676203224870912;1450738595501850624;2021-10-20 08:20:09+00:00;;de;False;28;10;117;4;everyone;Twitter Web App;;;2022-05-28 18:01:40.599504
1411676203224870912;goerke_c;1450360947005067266;Genau das Gegenteil von Lindners Politik ist notwendig: Steuersenkungen für die große Mehrheit, Steuererhöhungen für Superreiche und weitreichende Spielräume jenseits der Schuldenbremse!;1411676203224870912;1450360941393104897;2021-10-19 07:19:30+00:00;1411676203224870912;de;False;0;0;9;0;everyone;Twitter Web App;1450360945537077250;replied_to;2022-05-28 18:01:40.605697
1411676203224870912;goerke_c;1450360945537077250;Anscheinend hat Lindner die großen finanzpolitischen Themen blockiert. Wenn er nun Finanzminister wird, droht eine harte Schuldenbremse und Steuererleichterungen für die, die es nicht brauchen!;1411676203224870912;1450360941393104897;2021-10-19 07:19:30+00:00;1411676203224870912;de;False;1;2;10;0;everyone;Twitter Web App;1450360944161398785;replied_to;2022-05-28 18:01:40.609748
