twitter_id;twitter_handle;tweet_id;tweet_text;tweet_author_id;tweet_conversation_id;tweet_created_at;tweet_in_reply_to_user_id;tweet_lang;tweet_possibly_sensitive;tweet_retweet_count;tweet_reply_count;tweet_like_count;tweet_quote_count;tweet_reply_settings;tweet_source;tweet_referenced_tweet_id;tweet_referenced_tweet_type;api_call
454981027;helgelindh;1302939891760758791;"@OlafScholz hat sich Samstag in der @noz_de dafür ausgesprochen, dass Kommunen in Europa zusätzlich Menschen aus #Moria &amp; den griechischen Lagern aufnehmen können. DANKE. Es ist sinnvoll und und gibt der Aufnahme von Flüchtlingen eine noch stärkere Legitimation von der Basis.";454981027;1302939891760758791;2020-09-07 12:00:52+00:00;38150247;de;False;3;5;16;0;everyone;Twitter for Android;;;2022-05-28 17:03:10.380442
454981027;helgelindh;1302693680806010882;RT @NowaboFM: Auf Kommunalwahlkampftour in NRW. Heute wo wohl u.a.? Der SPD-OB heißt Andreas Mucke macht nen Superjob für diese Stadt! ⁦Ebe…;454981027;1302693680806010882;2020-09-06 19:42:31+00:00;;de;False;12;0;0;0;everyone;Twitter for Android;1302556911578099712;retweeted;2022-05-28 17:03:10.385743
454981027;helgelindh;1301525467841916928;#Solingen, wir trauern mit dir. Wir trauern um fünf junge Menschen, die viel zu früh aus d. Leben gerissen wurden. Diese Tat, sie macht fassungslos. Unser Beileid gilt d. Hinterbliebenen und unser Dank den Ersthelfer*innen, ersten Berichten zufolge auch d. Großmutter d. Getöteten;454981027;1301525467841916928;2020-09-03 14:20:27+00:00;;de;False;13;10;173;3;everyone;Twitter for Android;;;2022-05-28 17:03:10.390566
454981027;helgelindh;1301516315656679426;@JoschaDavidMohs Sehr unfair, Dein Kommentar. Und ohne Sinn für strategische Kommunikation. Bedauerlich;454981027;1301230609726144513;2020-09-03 13:44:05+00:00;2923578417;de;False;0;1;0;0;everyone;Twitter for Android;1301464028993200130;replied_to;2022-05-28 17:03:10.395032
454981027;helgelindh;1301516125252079616;@JoschaDavidMohs Die Unterstellung von Dir ist auch ungewohnt schwach und billig. Mir Vernachlässigung nichtdeutscher Muslime daraus zu unterstellen ist zutiefst perfide und absolut unredlich!! Aber der anitmuslimische Rassismus in D - s. Studien - lebt von der Logik muslimisch vs. deutsch;454981027;1301230609726144513;2020-09-03 13:43:19+00:00;2923578417;de;False;0;4;1;0;everyone;Twitter for Android;1301241666070773762;replied_to;2022-05-28 17:03:10.399671
454981027;helgelindh;1301230609726144513;Warum ein Unabhängiger Expert*innenkreis #Muslimfeindlichkeit? Ganz einfach. Patriotismus. Wir müssen Deutschenfeindlichkeit bekämpfen. So viele Deutsche sind heutzutage muslimisch, werden aber nicht wie Deutsche behandelt: #Muslimfeindlichkeit ist Deutschenfeindlichkeit.;454981027;1301230609726144513;2020-09-02 18:48:47+00:00;;de;False;89;773;795;183;everyone;Twitter for Android;;;2022-05-28 17:03:10.403651
454981027;helgelindh;1300060930542391296;@Tinimaus1110 @snoopy120364 Wenn Reichskriegsflaggen geschwenkt werden, ist das keine Demo, auf der wir weiter mitgehen.;454981027;1299959439001300993;2020-08-30 13:20:54+00:00;758670622654337025;de;False;0;2;1;0;everyone;Twitter for Android;1300059712860426243;replied_to;2022-05-28 17:03:10.407354
454981027;helgelindh;1299962757010333697;@Tinimaus1110 Wer mit Regenbogenflaggen auftritt, die oder der kann sich nicht mit Rechtsextremisten, Hildmann und Reichsbürgern und Reichsflaggernschwenkern in einer Demo gemein machen. Ganz einfach;454981027;1299959439001300993;2020-08-30 06:50:48+00:00;758670622654337025;de;False;2;51;29;3;everyone;Twitter for Android;1299961801107529731;replied_to;2022-05-28 17:03:10.411484
454981027;helgelindh;1299959439001300993;Ihr Verräter unserer Großeltern: Die sind mit Maske und wenig Freiheit im Heim und froh, das Reich und die Reichsflaggen hinter sich zu haben. Ihr Corona-Rebellen stürmt in Freiheit ohne Maske und mit Reichsflaggen den Bundestag. Aus dem Scheiß-Reich habt Ihr: #nixgelernt #b2908;454981027;1299959439001300993;2020-08-30 06:37:36+00:00;;de;False;148;435;906;63;everyone;Twitter for Android;;;2022-05-28 17:03:10.415120
454981027;helgelindh;1299770975538548736;"Wer mit Rechtsradikalen &amp; umweht von Reichskriegsflaggen demonstriert, der demonstriert nicht gegen eine vermeintliche #coronadiktatur"", sondern der marschiert für eine ganz andere Diktatur, die braun stinkt und völkisch aussieht. Danke an die Polizei für den Einsatz #Berlin2908";454981027;1299770975538548736;2020-08-29 18:08:43+00:00;;de;False;62;91;447;7;everyone;Twitter for Android;;;2022-05-28 17:03:10.419632
454981027;helgelindh;1299088162942222341;@ThiloSc Aus Mitgefühl mit dummen Kommentatoren, die sich für witzig halten, zünde ich ein Kerzlein an;454981027;1299035673928830976;2020-08-27 20:55:28+00:00;2293097778;de;False;0;3;12;0;everyone;Twitter for Android;1299053636429979649;replied_to;2022-05-28 17:03:10.423320
454981027;helgelindh;1299035673928830976;"Das #Bundesarbeitsgericht hat entschieden: Das Berliner #Neutralitätsgesetz rechtfertigt kein #Kopftuchverbot für Lehrerinnen. Kluges Urteil! Politik muss Frauen mit &amp; ohne #Kopftuch in ihrer Selbstverwirklichung vor Diskriminierung schützen, statt sie selbst zu diskriminieren.";454981027;1299035673928830976;2020-08-27 17:26:54+00:00;;de;False;45;74;255;5;everyone;Twitter for Android;;;2022-05-28 17:03:10.428025
454981027;helgelindh;1297120917970132993;Wir verlieren auf Dauer Glaubwürdigkeit und jedes Vertrauen der Angehörigen der Opfer, wenn Corona-Leugner ohne Masken und Abstand aufmarschieren, Corona-Partys stattfinden, S-Bahnen aus allen Nähten platzen, aber die Gedenkdemo von #Hanau abgesagt wird. #NiemalsVergessen;454981027;1297120917970132993;2020-08-22 10:38:20+00:00;;de;False;337;365;1980;56;everyone;Twitter for Android;;;2022-05-28 17:03:10.432387
454981027;helgelindh;1295241858709323783;"#Polizeigewalt ein amerikanisches Problem? George #Floyd in Deutschland undenkbar? Nein. Knie auf Kopf &amp; Nacken e. Jugendlichen mitten in Düsseldorf. Nicht Generalverdacht, sondern Video. Wenn wir jetzt nicht schonungslos aufarbeiten, wann denn dann? Eine Frage der Selbstachtung";454981027;1295241858709323783;2020-08-17 06:11:38+00:00;;de;False;131;64;706;6;everyone;Twitter for Android;;;2022-05-28 17:03:10.437543
454981027;helgelindh;1293876626409902083;Ich wünsche mir Friedrich #Merz als Kanzlerkandidaten. Wie im Lehrbuch führt er die Unsitte der Instrumentalisierung des Schreckens für eigene Zwecke vor. Am Jahrestag des #Mauerbau|s fällt ihm nichts Besseres als SPD-Bashing und Beschwörung der #SED-Nachfolgepartei ein. Ärmlich. https://t.co/7yz7Sqpzme;454981027;1293876626409902083;2020-08-13 11:46:41+00:00;;de;False;35;52;300;7;everyone;Twitter for Android;;;2022-05-28 17:03:10.442369
454981027;helgelindh;1292849810274488321;"Die Kraft der Sozialdemokratie war immer Einheit &amp; Achtung über soziale &amp; weltanschauliche Differenzen hinweg. Dass @EskenSaskia &amp; @NowaboFM ihrem Konkurrenten um den Parteivorsitz @OlafScholz die Kanzlerkandidatur geebnet haben, ist Ausdruck dieser Kraft. Ich bin stolz auf Euch.";454981027;1292849810274488321;2020-08-10 15:46:29+00:00;;de;False;8;26;82;4;everyone;Twitter for Android;;;2022-05-28 17:03:10.446659
454981027;helgelindh;1291319106935885826;Der Beitrag von @dieternuhr ist wieder auf #fürdasWissen der @dfg_public. Recht so. Ich hab mich immer sehr über Nuhrs Äußerungen zum Islam aufgeregt, ich kritisiere seine Bewertungen der Klimadebatte. Aber ich muss einen Nuhr aushalten. Das ist Demokratie, und das muss sein.;454981027;1291319106935885826;2020-08-06 10:24:01+00:00;;de;False;7;21;69;2;everyone;Twitter for Android;;;2022-05-28 17:03:10.451816
454981027;helgelindh;1291065819829620745;@leonmwalter Ich hab als MdB in der Bundestagsdebatte zu @b_riexinger / Kassel die Instrumentalisierung durch andere Parteien heftig kritisiert, viel schärfer als die Parteivorsitzende der @dieLinke in ihrer Rede selbst. Bei allen Differenzen in Sachfragen: Es geht doch - ohne Verbitterung.;454981027;1290396636875808771;2020-08-05 17:37:32+00:00;2857704532;de;False;0;1;7;0;everyone;Twitter for Android;1290396636875808771;replied_to;2022-05-28 17:03:10.455817
454981027;helgelindh;1289876683546337281;"Am Gedenktag des #Porajmos, des deutschen Genozids an den #Sinti und #Roma, stelle ich mit Scham und Wut fest: Bemerkungen über ""Zigeuner"", der rassistische Alltagsblick auf einwandernde #Roma gehören für viele noch zum ""guten Ton"". Wann wachen wir endlich auf? @ZR_SintiRoma";454981027;1289876683546337281;2020-08-02 10:52:20+00:00;;de;False;37;22;148;2;everyone;Twitter for Android;;;2022-05-28 17:03:10.459822
454981027;helgelindh;1289205775617781760;"Es gibt einen Gott.;) Zu Beginn des #Opferfest fliegt Thilo #Sarrazin aus der @spdde. Endlich. 2010 hatte ich auf der LaKo der @nrwjusos 25 min lang ""Deutschland schafft sich ab"" zerrissen. Es hat sich verspätet gelohnt. Rassismus und Islamhass haben in der #SPD nichts zu suchen.";454981027;1289205775617781760;2020-07-31 14:26:23+00:00;;de;False;135;872;1363;162;everyone;Twitter for Android;;;2022-05-28 17:03:10.463605
454981027;helgelindh;1289122520663298050;"https://t.co/S2eLymdHDF
Mein Appell im @tagesspiegel z. #Opferfest: Kaum starten wir, ernst über Islamfeindlichkeit zu reden, fallen wir von Rechts bis Links im Fall #Soykan in Muster v. double standards, Kontaktschuld, Kultur des Verdachts. Betroffene spüren diese Bevormundung";454981027;1289122520663298050;2020-07-31 08:55:34+00:00;;de;False;17;36;52;14;everyone;Twitter for Android;;;2022-05-28 17:03:10.468880
454981027;helgelindh;1288901316031451136;@goldi https://t.co/0EW8YilbmD Hier mein Statement dazu, das die Kultur des Verdachts, doppelte Standards und Kontaktschuld problematisiert.;454981027;1288835846800650241;2020-07-30 18:16:35+00:00;870020082;de;False;13;4;27;3;everyone;Twitter for Android;1288835846800650241;replied_to;2022-05-28 17:03:10.472800
454981027;helgelindh;1288861739380084737;"@danielreitzig Genosse Daniel Reitzig nennt mein Statement bezeichnend für die Haltung Vieler, die von der SPD leben. Das finde ich sehr interessant. &amp; populistisch. Ich wüsste nicht, dass die SPD mich bezahlt. Wir alle leben intellektuell und emotional von der SPD, wie die SPD von uns allen.";454981027;1288802337633468416;2020-07-30 15:39:19+00:00;246977872;de;False;0;2;2;0;everyone;Twitter for Android;1288802337633468416;replied_to;2022-05-28 17:03:10.477539
454981027;helgelindh;1288574171090432006;@gallenkamp @spdde Es ist schon heftig, einem Menschen Haltungslosigkeit zu attestieren. Komisch: Viele Nicht-Deutsche verschiedener weltanschaulicher Lager haben mir vorm Hintergrund der Erfahrungen im Ausland den Respekt vor der Haltung von @OlafScholz in der Krise bekundet.;454981027;1288565046352793605;2020-07-29 20:36:37+00:00;24688297;de;False;0;17;11;1;everyone;Twitter for Android;1288570005181865984;replied_to;2022-05-28 17:03:10.483495
454981027;helgelindh;1288565046352793605;"Shame on you. Wenn Genoss*innen mit denen, die die @spdde mehr hassen als die #noafd, die Aktion #NOlaf starten, ist das würdelos.
Die @spdde wurde aus Respekt vorm Menschen geboren, nicht aus Häme &amp; Selbstgerechtigkeit Wer so mit Menschen umgeht, rede nie wieder von Anstand!";454981027;1288565046352793605;2020-07-29 20:00:22+00:00;;de;False;21;90;237;12;everyone;Twitter for Android;;;2022-05-28 17:03:10.487530
454981027;helgelindh;1288022206786789376;"#Lampedusa &amp; #PortoEmpedocle dürfen kein zweites #Moria werden. Deutschland &amp; EU müssen Italien beistehen. (K)eine Frage der Moral &amp; der Vernunft! Jede Asylreform muss unwürdige Camps verhindern, Pushbacks ahnden, pragmatisch Verteilung durch Koalition der Willigen ermöglichen.";454981027;1288022206786789376;2020-07-28 08:03:19+00:00;;de;False;7;23;51;4;everyone;Twitter for Android;;;2022-05-28 17:03:10.491119
454981027;helgelindh;1287384509684514820;"Haltung, Würde, Anstand, er hatte all das, was in der Ära des Populismus Mangelware wurde. #HansJochenVogel lehrte uns, dass Antifaschismus &amp; Sozialdemokratie keine Attitüde &amp; keine Monstranz sind, sondern der Substanz &amp; der Streitbarkeit bedürfen. Er war nie gefällig. Er fehlt. https://t.co/VvzNOG0jPr";454981027;1287384509684514820;2020-07-26 13:49:20+00:00;;de;False;17;20;116;2;everyone;Twitter for Android;;;2022-05-28 17:03:10.495480
454981027;helgelindh;1286718616763805698;Wenn Drittstaatler schon nicht wählen dürfen, lasst sie wenigstens lieben. Ich zähle zu den Erstunterzeichnern einer Initiative, die fordert: unverzügliche Einreiseerlaubnis für Partner*innen von deutschen Staatsbürger*innen aus Drittstaaten. #LoveIsEssential #LoveIsNotTourism https://t.co/48o3MC94YS;454981027;1286718616763805698;2020-07-24 17:43:18+00:00;;de;False;69;85;278;22;everyone;Twitter for Android;;;2022-05-28 17:03:10.499997
454981027;helgelindh;1286300201087635456;Wenn der Verantwortliche für Social Media zur Personalgewinnung der #Bundeswehr öffentlich mit den #Identitären sympathisiert, dann hat die Bundeswehr ein ernstes Identitätsproblem. Es geht weder um Generalverdacht noch um Generalamnestie. Es geht darum, dass so was nicht geht.;454981027;1286300201087635456;2020-07-23 14:00:40+00:00;;de;False;59;62;304;8;everyone;Twitter for Android;;;2022-05-28 17:03:10.503756
454981027;helgelindh;1284796469778710528;Beschäftigen wir uns weniger mit uns, also mit mehr oder weniger gelungenen, gut gemeinten und vielleicht schlecht gemachten oder impulsiven und weniger impulsiven Auseinandersetzungen mit der AfD und dafür mehr mit denen, die die AfD durch ihre Hetze primär zu Opfern macht.;454981027;1284796468507955202;2020-07-19 10:25:23+00:00;454981027;de;False;3;3;34;0;everyone;Twitter for Android;1284796468507955202;replied_to;2022-05-28 17:03:10.507584
454981027;helgelindh;1284796468507955202;"Liebe @bodoramelow, @WTiefensee, @KuehniKev, 1. AfD ist nicht nur Faschismus, aber auch Rassismus, Extremismus der Mitte. 2. Der größte Bärendienst bleibt jede Normalisierung der u. jede Gewöhnung an die AfD. 3. #Stinkefinger &amp; #Drecksack sind keine Heldentaten des Widerstands";454981027;1284796468507955202;2020-07-19 10:25:23+00:00;;de;False;6;22;54;1;everyone;Twitter for Android;;;2022-05-28 17:03:10.512154
454981027;helgelindh;1284596030235869190;@Deprifrei Dieser Kommentar ist nur eines: peinlich und beschämend. Sie diskreditieren sich selbst - wie mit Ihrem Auftritt bei einer Rede von mir gegen AfD-Bundestagsabgeordnete, die Sie mit Ihrem Auftritt boykottiert haben. Aber offensichtlich bin ich für Sie der Gegner, nicht die Rechten;454981027;1284404443455410176;2020-07-18 21:08:54+00:00;337111971;de;False;0;1;5;0;everyone;Twitter for Android;1284461548849770496;replied_to;2022-05-28 17:03:10.516555
454981027;helgelindh;1284409535139057664;@Admiral55133937 Was für ein erbärmliches Argument. Wer den Hasser in den Social Media sogar noch anonymisiert, obwohl er mit Namen schreibt, und den Inhalt darstellt, ist ein Verpetzer.....Sie sind der Beleg für meine These.;454981027;1284404443455410176;2020-07-18 08:47:51+00:00;1168974102343966721;de;False;0;3;6;0;everyone;Twitter for Android;1284405662521470976;replied_to;2022-05-28 17:03:10.520159
454981027;helgelindh;1284404443455410176;Das ist nicht Hate Speech, das ist Hate-Porn. Ich muss zeigen, wie jeder Anstand untereinander, jedes Gefühl dafür, was sich gehört, verloren gegangen ist. Lest und denkt nach. So ist die buchstäbliche Banalität des Bösen vor unserer Haustür in ihrer nackten Hässlichkeit.#noafd https://t.co/5fcMXciYgE;454981027;1284404443455410176;2020-07-18 08:27:37+00:00;;de;False;70;109;376;21;everyone;Twitter for Android;;;2022-05-28 17:03:10.523979
454981027;helgelindh;1283451317244108806;"Zugbegl.: ""Ich will Ihre Personalien, kann sein, dass Sie Strafe zahlen müssen. Sie sind beim Einstieg in der Tür steckengeblieben. Daher verspäten wir uns."" Ich hab Jahre meines Lebens an Verspätungen der #DB verloren, 15 Mrd.+ für die Bahn im #BT mitbeschlossen. Mir reicht's";454981027;1283451317244108806;2020-07-15 17:20:14+00:00;;de;False;18;36;215;7;everyone;Twitter for Android;;;2022-05-28 17:03:10.528398
454981027;helgelindh;1281901067417071621;Als jemand, zu dessen Mord samt Kopfgeld aufgerufen wurde, gezeichnet von #NSU20, Elysium, Staatsstreichorchester, sage ich: Es ist die verdammte Pflicht von Innenministerien, diese braunen Sümpfe auszutrocknen. Ein starker Staat muss im Umgang mit sich selbst unerbittlich sein.;454981027;1281901067417071621;2020-07-11 10:40:05+00:00;;de;False;102;22;589;5;everyone;Twitter for Android;;;2022-05-28 17:03:10.532873
454981027;helgelindh;1280535411824234502;55 Strafanzeigen wegen Beleidigung, Bedrohung, Verleumdung erstattet. Das ist nur der Bruchteil eines Aufkommens von 1-2 Tagen. Danke an den Staatsschutz und die Wuppertaler Polizei @polizei_nrw_w für die Arbeit, die große Geduld und den Einsatz für meine Sicherheit.;454981027;1280535411824234502;2020-07-07 16:13:28+00:00;;de;False;53;38;657;7;everyone;Twitter for Android;;;2022-05-28 17:03:10.536462
454981027;helgelindh;1279324260499161088;"AUFWACHEN. Die #OceanViking von @SOSMedGermany hat nach Suizidversuchen Geretteter den Notstand ausgerufen. Liebe EU-Staaten &amp; Bundesregierung, so geht es nicht. Die Geflüchteten müssen an Land, wir brauchen eine Aufnahmezusage &amp; ein Abkommen #Seenotrettung mit Italien und Malta.";454981027;1279324260499161088;2020-07-04 08:00:47+00:00;;de;False;164;366;584;64;everyone;Twitter for Android;;;2022-05-28 17:03:10.540099
454981027;helgelindh;1277658881481748481;"@HGMaassen &amp; die @WerteUnion echaufffieren sich über Trittbretter und Ideologie. Wer wenn nicht @HGMaassen &amp; die @WerteUnion sind die Trittbrettfahrer und Chefideologen par excellence, die die Rassismusdebatte und #Stuttgart für ihren Kreuzzug gegen die bunte Gesellschaft nutzen? https://t.co/cT414ARAeb";454981027;1277658881481748481;2020-06-29 17:43:09+00:00;843210563190771713;de;False;1;4;1;0;everyone;Twitter for Android;;;2022-05-28 17:03:10.543989
454981027;helgelindh;1276199400159629312;"Migranten haben in Deutschland ein Problem mit Leuten wie @smuellermdb, die Sätze wie ""Wir haben in Deutschland ein Problem mit Migranten, die..."" sagen. Wir haben in Deutschland ein Problem, wenn MdB auf küchenpsychologischem Niveau #Stuttgart aus der #Rassismus-Debatte ableiten https://t.co/GEmEdGHyfN";454981027;1276199400159629312;2020-06-25 17:03:42+00:00;;de;False;23;69;196;6;everyone;Twitter for Android;;;2022-05-28 17:03:10.547479
454981027;helgelindh;1275076500480339970;"@7dietsch Es reicht nicht, dass ""wir"" was machen. Und wer ist ""wir""? Jede sicherheitspolitische Maßnahme ist unzureichend ohne gesamtgesellschaftliche Strategie. Politik ist nicht ""die da oben"", sondern zwingend ein Gemeinschaftswerk.";454981027;1275058531553759232;2020-06-22 14:41:42+00:00;922036375922397184;de;False;0;4;3;0;everyone;Twitter for Android;1275060850919763969;replied_to;2022-05-28 17:03:10.552035
454981027;helgelindh;1275058531553759232;Wie widerlich ist der tägliche #Rassismus, den wir erst nach dem Mord an #GeorgeFloyd begreifen! Wie erbärmlich die Gewaltorgien gegen Polizei und Ladenbesitzer in #StuttgartRiots. Wie dumm und kurzsichtig ist, beides gegeneinander für schnellen politischen Benefit zu verrechnen.;454981027;1275058531553759232;2020-06-22 13:30:18+00:00;;de;False;27;51;262;4;everyone;Twitter for Android;;;2022-05-28 17:03:10.555671
454981027;helgelindh;1274036900056137728;"Die Zerstörung der @AfD. Dazu braucht es nicht @rezomusik. Das schafft die #AfD selbst ganz allein. In ihrem Schrei nach #AntifaVerbot leidet sie an Antifantasmus &amp; einer AntiFata Morgana &amp; macht ungewollt noch Werbung für die #Antifa. Beweisführung hier: https://t.co/xancE0hpec https://t.co/IW5dGFozGv";454981027;1274036900056137728;2020-06-19 17:50:42+00:00;;de;False;37;51;215;11;everyone;Twitter for Android;;;2022-05-28 17:03:10.559007
454981027;helgelindh;1273679543468011522;"#Corona beim Großschlachter #Tönnies. @ArminLaschet: „Das sagt überhaupt nichts aus, weil Rumänen u. Bulgaren da eingereist sind und da das Virus herkommt."" Wie nennt man so was?
Den #Rüttgers machen. Tritt bei NRW-Männern im Mittelalter auf. Rüttgers einst: ""Kinder statt Inder"".";454981027;1273679543468011522;2020-06-18 18:10:41+00:00;;de;False;22;10;126;0;everyone;Twitter for Android;;;2022-05-28 17:03:10.563029
454981027;helgelindh;1273296510000738312;"Solange wir nicht mit den Augen der Opfer sehen, haben wir nichts verstanden. Das #Grundgesetz enthält ein klares Bekenntnis gegen den #Rassismus. Aber es ist auch ein Kind seiner Zeit. Heute ist das Wort ""#Rasse"" eine Ohrfeige für jedes Opfer von Rassismus. Das ist der Maßstab. https://t.co/wQklSiiLPj";454981027;1273296510000738312;2020-06-17 16:48:39+00:00;;de;False;13;24;68;2;everyone;Twitter for Android;;;2022-05-28 17:03:10.567430
454981027;helgelindh;1272876657846738944;"Heute begann der Prozess im Mordfall Walter #Lübcke. Markus H. steht wegen Beihilfe zum Mord vor Gericht. Er galt als ""zuverlässig"" im Sinne des Waffenrechts. Wie konnte das geschehen? Für rechtsextreme Waffenbesitzer kann nur eines gelten: Sie dürfen niemals Waffenbesitzer sein.";454981027;1272876657846738944;2020-06-16 13:00:18+00:00;;de;False;13;20;109;1;everyone;Twitter for Android;;;2022-05-28 17:03:10.570671
454981027;helgelindh;1271464460289544193;"Neue Rechte wie @ainyrockstar &amp; Co. nutzen politisch motiviert öffentliches #bodyshaming (s. Bild). Sie regen sich auf, wenn man die öffentliche Demütigung öffentlich dokumentiert. An alle, die man so bloßstellt: Macht es bekannt. Ihr seid wertvoll und schön, so wie ihr seid. https://t.co/ecrObJA43b";454981027;1271464460289544193;2020-06-12 15:28:44+00:00;;de;False;142;168;1105;24;everyone;Twitter for Android;;;2022-05-28 17:03:10.574429
454981027;helgelindh;1270825223038865417;@schokosahnewal Wo sehen Sie da Einkaufstüten? Die weißen Tüten tragen das IOM-Logo und sind wahrscheinlich voll mit Unterlagen aus dem  Registrierungsprozesses. Die orangefarbigen Papiertüten sind aus dem Athener Benaki-Museum - die Kinder haben vermutlich ein Andenken oder ein Buch bekommen.;454981027;1270759441093328896;2020-06-10 21:08:38+00:00;839752818;de;False;0;9;4;0;everyone;Twitter for iPad;1270778461616037890;replied_to;2022-05-28 17:03:10.578491
454981027;helgelindh;1270759441093328896;"DE nimmt 243 kranke Kinder aus GR auf. Überfällige Umsetzung von längst Beschlossenem. Mehr nicht. Wir brauchen ein europäisches Evakuierungskonzept an der Seite von #Griechenland.
Solidarische, humane, funktionierende #Asylpolitik der Willigen in Europa ist dringender denn je.";454981027;1270759441093328896;2020-06-10 16:47:14+00:00;;de;False;31;69;250;8;everyone;Twitter for Android;;;2022-05-28 17:03:10.582037
454981027;helgelindh;1270382918733647872;"Dringender Klärungsbedarf. Diese Verordnungen sind zu prüfen. Sicherheitsauflagen dürfen nicht durch die Hintertür die zivile Seenotrettung stoppen.
Organisationen müssen retten dürfen, erst recht solange es keine gemeinsame europäische #Seenotrettung gibt https://t.co/snss3NCI53";454981027;1270382918733647872;2020-06-09 15:51:05+00:00;;de;False;16;12;49;1;everyone;Twitter for iPhone;1270226069665329152;quoted;2022-05-28 17:03:10.586506
454981027;helgelindh;1270372641057247232;"@cronhill Und mal Antwort auf anderen Tweet lesen, statt populistische Sprüche wie ""Taten, statt Wort"" klopfen. Solche Sprüche haben eine sehr problematische Begriffsgeschichte!";454981027;1270316421763956737;2020-06-09 15:10:14+00:00;21743530;de;False;0;2;0;0;everyone;Twitter for Android;1270316421763956737;replied_to;2022-05-28 17:03:10.590642
454981027;helgelindh;1270372145869266945;@cronhill Das beruht offensichtlich auf eine Verordnung aus dem März. Die Folgen hat SeaWatch jetzt vorgebracht.Thema Seenot war, soweit heute zu ermitteln, angeblich nicht Thema bei den Verhandlungen im Verkehrsbereich. Wenn das BMVI bewusst gegen die Retter agierte, muss das Folgen haben;454981027;1270263945983655936;2020-06-09 15:08:16+00:00;21743530;de;False;0;0;1;0;everyone;Twitter for Android;1270263945983655936;replied_to;2022-05-28 17:03:10.594237
454981027;helgelindh;1268867220718878720;"Unter dem widerlichen #GeorgeFloydChallenge posten Personen - Menschen zu sagen fällt mir schwer - Imitationen der mörderischen Tat an #GeorgeFloyd. Wer so was tut, hat jeden Anstand verloren &amp; macht sich zum Komplizen. Hier seht Ihr, was #Alltagsrassismus anrichtet. Shame on U. https://t.co/iMmT8aokTa";454981027;1268867220718878720;2020-06-05 11:28:14+00:00;;de;False;104;77;426;25;everyone;Twitter for Android;;;2022-05-28 17:03:10.598677
454981027;helgelindh;1268473679178014723;"Die Lage fordert nicht Ideologie, sondern Handeln. Die Senkung der 
#Mehrwertsteuer ist pragmatisch, sozial &amp; demokratisch. Lebenshaltungskosten belasten insbesondere Menschen mit geringen Einkommen. Nicht Lobbyinteressen, sondern Menschen im Mittelpunkt: Das ist #Konjunkturpaket";454981027;1268473679178014723;2020-06-04 09:24:26+00:00;;de;False;4;29;66;0;everyone;Twitter for Android;;;2022-05-28 17:03:10.602473
454981027;helgelindh;1267889353134616577;1 Jahr Mord an Walter #Lübcke. Neben dem Schützen hatten noch viele andere die Hand am Abzug: All die, die auf einer Bürgerversammlung und im Netz die Hetzjagd auf einen aufrechten Demokraten eröffneten. So wird der Druck auf die Tastatur zum Druck auf den Knopf zur Vernichtung.;454981027;1267889353134616577;2020-06-02 18:42:32+00:00;;de;False;13;16;86;1;everyone;Twitter for Android;;;2022-05-28 17:03:10.606245
